titles,authors,date,source,descriptions,citations
Interactive augmented reality storytelling guided by scene semantics,"Changyang Li, Wanwan Li, Haikun Huang, Lap-Fai Yu",2022/7/22,Journal ACM Transactions on Graphics (TOG),"We present a novel interactive augmented reality (AR) storytelling approach guided by indoor scene semantics. Our approach automatically populates virtual contents in real-world environments to deliver AR stories, which match both the story plots and scene semantics. During the storytelling process, a player can participate as a character in the story. Meanwhile, the behaviors of the virtual characters and the placement of the virtual items adapt to the player's actions. An input raw story is represented as a sequence of events, which contain high-level descriptions of the characters' states, and is converted into a graph representation with automatically supplemented low-level spatial details. Our hierarchical story sampling approach samples realistic character behaviors that fit the story contexts through optimizations; and an animator, which estimates and prioritizes the player's actions, animates the virtual characters …",
Identifying Individuals Who Currently Report Feelings of Anxiety Using Walking Gait and Quiet Balance: An Exploratory Study Using Machine Learning,"Maggie Stark, Haikun Huang, Lap-Fai Yu, Rebecca Martin, Ryan McCarthy, Emily Locke, Chelsea Yager, Ahmed Ali Torad, Ahmed Mahmoud Kadry, Mostafa Ali Elwan, Matthew Lee Smith, Dylan Bradley, Ali Boolani",2022/4/20,Journal Sensors,"Literature suggests that anxiety affects gait and balance among young adults. However, previous studies using machine learning (ML) have only used gait to identify individuals who report feeling anxious. Therefore, the purpose of this study was to identify individuals who report feeling anxious at that time using a combination of gait and quiet balance ML. Using a cross-sectional design, participants (n = 88) completed the Profile of Mood Survey-Short Form (POMS-SF) to measure current feelings of anxiety and were then asked to complete a modified Clinical Test for Sensory Interaction in Balance (mCTSIB) and a two-minute walk around a 6 m track while wearing nine APDM mobility sensors. Results from our study finds that Random Forest classifiers had the highest median accuracy rate (75%) and the five top features for identifying anxious individuals were all gait parameters (turn angles, variance in neck, lumbar rotation, lumbar movement in the sagittal plane, and arm movement). Post-hoc analyses suggest that individuals who reported feeling anxious also walked using gait patterns most similar to older individuals who are fearful of falling. Additionally, we find that individuals who are anxious also had less postural stability when they had visual input; however, these individuals had less movement during postural sway when visual input was removed.",
Mood-Driven Colorization of Virtual Indoor Scenes,"Michael Solah, Haikun Huang, Jiachuan Sheng, Tian Feng, Marc Pomplun, Lap-Fai Yu",2022/2/15,Journal IEEE Transactions on Visualization and Computer Graphics,"One of the challenging tasks in virtual scene design for Virtual Reality (VR) is causing it to invoke a particular mood in viewers. The subjective nature of moods brings uncertainty to the purpose. We propose a novel approach to automatic adjustment of the colors of textures for objects in a virtual indoor scene, enabling it to match a target mood. A dataset of 25,000 images, including building/home interiors, was used to train a classifier with the features extracted via deep learning. It contributes to an optimization process that colorizes virtual scenes automatically according to the target mood. Our approach was tested on four different indoor scenes, and we conducted a user study demonstrating its efficacy through statistical analysis with the focus on the impact of the scenes experienced with a VR headset.",
Association between Self-Reported Prior Nights’ Sleep and Single-Task Gait in Healthy Young Adults: An Exploratory Study Using Machine Learning,"Billal Siddiq, Ali Boolani, Haikun Huang, Lap-Fai Yu, Maggie Stark, Zachary Grin, Chelsea C Yager, Seema Teymouri, Dylan Bradley, Rebecca Martin, Joel Martin, Andreas Stamatis",2022,Journal International Journal of Exercise Science: Conference Proceedings,"Failure to obtain 7-9 hours of sleep has been associated with decreased gait speed in young adults. While Machine Learning (ML) has been used to identify sleep quality in young adults, there are no current studies that have used ML to identify prior night’s sleep in a sample of young adults. PURPOSE: To use ML to identify prior night’s sleep in healthy young adults using single-task walking gait. METHODS: Participants (n= 126, age 24.3±4.0 yrs; 65% female) completed a survey on their prior night’s sleep and performed a 2-minute walk around a 6m track. Gait data were collected using inertial sensors. Participants were split into 2 groups (< 7hs or> 9hs: poor sleepers; 7-9hs: good sleepers) and gait characteristics were used to classify participants into each group using ML models via a 10-fold cross validation. A post-hoc ANCOVA was used to assess gait differences. RESULTS: Using Random Forest Classifiers (RFC), top 9 features were extracted. Classification results suggest a 0.79 correlation between gait parameters and prior night’s sleep. The RFC models had a 65.03% mean classification accuracy rate. Top 0.3% of the models had 100% classification accuracy rate. The top 9 features were primarily characteristics that measured variance between lower limb movements. Post-hoc analyses suggest significantly greater variances between lower limb characteristics. CONCLUSION: Good sleepers had more asymmetrical gait patterns (faster gait speed, less trunk motion). Poor sleepers had trouble maintaining gait speed (increased variance in cadence, larger stride lengths, and less time spent in single leg support time). Although the …",
"Building a Motion-Aware, Networked Do-It-Yourself Holographic Display","Amilcar Gomez Samayoa, Javier Talavera, Siem G Sium, Biao Xie, Haikun Huang, Lap-Fai Yu",2021/5/12,Conference 2021 IEEE International Conference on Intelligent Reality (ICIR),"The COVID-19 pandemic has motivated a shift from physical interaction, approaches, or procedures due to social distancing. More people are at home using digital displays for real-time communication and engagement. With recent innovations in computational hardware for spatial applications, such as extended reality technologies, entry barriers for hosting intimate, interpersonal, virtual events continue to fall. The barrier falls at such a rate that the production or manufacturing of an extended reality system for different and simultaneous, practical scenarios may be built to solve communication issues resulting from COVID-19. This paper aims to describe a low-cost networked holographic system that can be used for various purposes such as communication, education, and gaming. We created three different applications to show the cross-compatibility, effectiveness, and usability of our system.",
Interactive Design of Gallery Walls via Mixed Reality,"Haikun Huang, Yuxuan Zhang, Tomer Weiss, Rebecca W Perry, Lap-Fai Yu",2020/12/14,Conference 2020 IEEE International Conference on Artificial Intelligence and Virtual Reality (AIVR),"We present a novel interactive design tool that allows users to create and visualize gallery walls via a mixed reality device. To use our tool, a user selects a wall to decorate and chooses a focal art item. Our tool then helps the user complete their design by optionally recommending additional art items or automatically completing both the selection and placement of additional art items. Our tool holistically considers common design criteria such as alignment, color, and style compatibility in the synthesis of a gallery wall. Through a mixed reality device, such as a Magic Leap One headset, the user can instantly visualize the gallery wall design in situ and can interactively modify the design in collaboration with our tool's suggestion engine. We describe the suggestion engine and its adaptability to users with different design goals. We also evaluate our mixed-reality-based tool for creating gallery wall designs and …",
Exertion-Aware Path Generation (Supplementary Material),"WANWAN LI, BIAO XIE, ZHANG YONGQI, WALTER MEISS, HAIKUN HUANG, YU LAP-FAI",2020,"Description Here is one more example of forbidden zone design. In this case, during optimization, paths will avoid the manually specified obstacle-Armadillo standing in the center of the terrain. Users can specify any bounding area around the Armadillo as the forbidden zone as shown in Figure 1.","Here is one more example of forbidden zone design. In this case, during optimization, paths will avoid the manually specified obstacle-Armadillo standing in the center of the terrain. Users can specify any bounding area around the Armadillo as the forbidden zone as shown in Figure 1.",
AI-Driven Computational Design Tools for Synthesizing Human-Centric Design,Haikun Huang,2020,Institution University of Massachusetts Boston,"In the view of the industry, the modeling design process is an overwhelming, non-trivial, and time-consuming task. As a result, creating such a design can take days, months, even several years. In this thesis, we investigate how human designers use human-centric computational-aided modeling design tools to assist the modeling design processes.",
FEASIBILITY AND ACCEPTABILITY OF AN EXERGAMING INTERVENTION FOR OLDER ADULTS AT RISK FOR FALLS,"Elisa F Ogawa, Haikun Huang, Lap-Fai Yu, Philimon N Gona, Richard K Fleming, Jonathan F Bean, Suzanne G Leveille, Tongjian You",2019/11,Journal Innovation in Aging,"This study examined the feasibility and acceptability of an exergaming program that utilized custom exergames, and compared it to a traditional physical exercise (control) program in older adults at risk for falls. A quasi-experimental study was conducted in older adults who lived in senior living communities. Participants enrolled in either program offered twice weekly for 8 weeks based on their residential site. Thirty-five participants enrolled in the study (mean age 77±7y) and 29 (82%) completed the follow-up assessment (exergaming: 93%; control: 73%). Overall attendance was 73%(exergaming: 79%; control: 68%), and 22 participants returned their program satisfaction form. There were no significant between-group differences in ratings of overall quality, enjoyment, instructors, peers, and facility of their assigned exercise programs. The exergaming intervention was well received and perceived as enjoyable. This …",
Effects Of Exergaming On Cognition And Dual-task Mobility In Older Adults At Risk For Falling: 2259 Board# 6 May 31 9: 30 AM-11: 30 AM,"Elisa F Ogawa, Haikun Huang, Lap-Fai Yu, Philimon N Gona, Richard K Fleming, Suzanne G Leveille, Tongjian You",2019/6/1,Journal Medicine & Science in Sports & Exercise,"OGAWA, EF, H. HUANG, L. YU, PN GONA, RK FLEMING, SG LEVEILLE, and T. YOU. Effects of Exergaming on Cognition and Gait in Older Adults at Risk for Falling. Med. Sci. Sports Exerc., Vol. 52, No. 3, pp. 754–761, 2020. Purpose: To test whether an 8-wk exergaming (EG) program would improve cognition and gait characteristics compared with a traditional physical exercise (TPE) program in older adults at risk for falling. Methods: A pilot quasi-experimental study was conducted in adults age≥ 65 yr at risk for falls, living in senior communities. Participants enrolled (n= 35) in either exercise program offered twice weekly for 8 wk. Cognition and single-task and dual-task gait characteristics were measured before and after the 8-wk exercise intervention. For each outcome, a repeated-measures ANCOVA adjusted for age, gender, and exercise intensity (ratings of perceived exertion, RPE) was used to examine the group–time interaction. Results: Twentynine participants (age, 77±7 yr) completed either the EG program (n= 15) or the TPE program (n= 14). Statistically significant group–time interactions were observed in Trail Making Test Part A (P< 0.05) and single-task gait speed, stride length, swing time percentage, and double support percentage (all P< 0.05), and marginal group differences were observed in Mini-Mental State Examination (P= 0.07), all favoring the EG program. There were no statistically significant group differences in dual-task gait measurements except for swing time percentage and double support percentage, favoring the EG program. Conclusions: An 8-wk EG program for older adults at risk for falls contributed to modest …",
"Safety, Enjoyment, And Physiological Responses Of Kinect-based Exergames In Older Adults At Risk For Falls: 410 Board# 251 May 30 11: 00 AM-12: 30 PM","Elisa F Ogawa, Haikun Huang, Lap-Fai Yu, Tongjian You",2018/5/1,Journal Medicine & Science in Sports & Exercise,"METHODS: Community-dwelling older adults who reported current mobility difficulties or falling in the past year were included in the study. Participants played three newly developed exergames (Double Decision, Target Trackers, and Visual Sweeps, 5 minutes each) in random order. Heart rate (HR) was measured during each exergame, and blood pressure (BP), rating of perceived exertion (RPE) and rating of the Physical Activity Enjoyment Scale were recorded immediately after each exergame. Student t-tests were used to examine the differences in variables at resting state and during/after exercise. Repeated measure analyses of variance were used to examine the differences in variables among the three exergames.",
