titles,authors,date,source,descriptions,citations
A review on virtual reality skill training applications,"Biao Xie, Huimin Liu, Rawan Alghofaili, Yongqi Zhang, Yeling Jiang, Flavio Destri Lobo, Changyang Li, Wanwan Li, Haikun Huang, Mesut Akdere, Christos Mousas, Lap-Fai Yu",2021/4/30,Source Frontiers in Virtual Reality,"This study aimed to discuss the research efforts in developing virtual reality (VR) technology for different training applications. To begin with, we describe how VR training experiences are typically created and delivered using the current software and hardware. We then discuss the challenges and solutions of applying VR training to different application domains, such as first responder training, medical training, military training, workforce training, and education. Furthermore, we discuss the common assessment tests and evaluation methods used to validate VR training effectiveness. We conclude the article by discussing possible future directions to leverage VR technology advances for developing novel training experiences.",62
Deep trail-following robotic guide dog in pedestrian environments for people who are blind and visually impaired-learning from virtual and real worlds,"Tzu-Kuan Chuang, Ni-Ching Lin, Jih-Shi Chen, Chen-Hao Hung, Yi-Wei Huang, Chunchih Teng, Haikun Huang, Lap-Fai Yu, Laura Giarré, Hsueh-Cheng Wang",2018/5/21,Conference 2018 IEEE International Conference on Robotics and Automation (ICRA),"Navigation in pedestrian environments is critical to enabling independent mobility for the blind and visually impaired (BVI) in their daily lives. White canes have been commonly used to obtain contact feedback for following walls, curbs, or man-made trails, whereas guide dogs can assist in avoiding physical contact with obstacles or other pedestrians. However, the infrastructures of tactile trails or guide dogs are expensive to maintain. Inspired by the autonomous lane following of self-driving cars, we wished to combine the capabilities of existing navigation solutions for BVI users. We proposed an autonomous, trail-following robotic guide dog that would be robust to variances of background textures, illuminations, and interclass trail variations. A deep convolutional neural network (CNN) is trained from both the virtual and realworld environments. Our work included major contributions: 1) conducting experiments to …",44
Pose-guided level design,"Yongqi Zhang, Biao Xie, Haikun Huang, Elisa Ogawa, Tongjian You, Lap-Fai Yu",2019/5/2,Book Proceedings of the 2019 CHI Conference on Human Factors in Computing Systems,"Player's physical experience is a critical factor to consider in designing motion-based games that are played through motion sensor gaming consoles or virtual reality devices. However, adjusting the physical challenge involved in a motion-based game is difficult and tedious, as it is typically done manually by level designers on a trial-and-error basis. In this paper, we propose a novel approach for automatically synthesizing levels for motion-based games that can achieve desired physical movement goals. By formulating the level design problem as a trans-dimensional optimization problem which is solved by a reversible-jump Markov chain Monte Carlo technique, we show that our approach can automatically synthesize a variety of game levels, each carrying the desired physical movement properties. To demonstrate the generality of our approach, we synthesize game levels for two different types of motion-based …",36
Exercise intensity-driven level design,"Biao Xie, Yongqi Zhang, Haikun Huang, Elisa Ogawa, Tongjian You, Lap-Fai Yu",2018/1/17,Journal IEEE transactions on visualization and computer graphics,"Games and experiences designed for virtual or augmented reality usually require the player to move physically to play. This poses substantial challenge for level designers because the player's physical experience in a level will need to be considered, otherwise the level may turn out to be too exhausting or not challenging enough. This paper presents a novel approach to optimize level designs by considering the physical challenge imposed upon the player in completing a level of motion-based games. A game level is represented as an assembly of chunks characterized by the exercise intensity levels they impose on players. We formulate game level synthesis as an optimization problem, where the chunks are assembled in a way to achieve an optimized level of intensity. To allow the synthesis of game levels of varying lengths, we solve the trans-dimensional optimization problem with a Reversible-jump Markov …",27
Automatic optimization of wayfinding design,"Haikun Huang, Ni-Ching Lin, Lorenzo Barrett, Darian Springer, Hsueh-Cheng Wang, Marc Pomplun, Lap-Fai Yu",2017/10/10,Journal IEEE transactions on visualization and computer graphics,"Wayfinding signs play an important role in guiding users to navigate in a virtual environment and in helping pedestrians to find their ways in a real-world architectural site. Conventionally, the wayfinding design of a virtual environment is created manually, so as the wayfinding design of a real-world architectural site. The many possible navigation scenarios, as well as the interplay between signs and human navigation, can make the manual design process overwhelming and non-trivial. As a result, creating a wayfinding design for a typical layout can take months to several years. In this paper, we introduce the Way to Go! approach for automatically generating a wayfinding design for a given layout. The designer simply has to specify some navigation scenarios; our approach will automatically generate an optimized wayfinding design with signs properly placed considering human agents' visibility and possibility of …",27
Lost in style: Gaze-driven adaptive aid for vr navigation,"Rawan Alghofaili, Yasuhito Sawahata, Haikun Huang, Hsueh-Cheng Wang, Takaaki Shiratori, Lap-Fai Yu",2019/5/2,Book Proceedings of the 2019 CHI conference on human factors in computing systems,"A key challenge for virtual reality level designers is striking a balance between maintaining the immersiveness of VR and providing users with on-screen aids after designing a virtual experience. These aids are often necessary for wayfinding in virtual environments with complex paths. We introduce a novel adaptive aid that maintains the effectiveness of traditional aids, while equipping designers and users with the controls of how often help is displayed. Our adaptive aid uses gaze patterns in predicting user's need for navigation aid in VR and displays mini-maps or arrows accordingly. Using a dataset of gaze angle sequences of users navigating a VR environment and markers of when users requested aid, we trained an LSTM to classify user's gaze sequences as needing navigation help and display an aid. We validated the efficacy of the adaptive aid for wayfinding compared to other commonly-used wayfinding …",26
Audible panorama: Automatic spatial audio generation for panorama imagery,"Haikun Huang, Michael Solah, Dingzeyu Li, Lap-Fai Yu",2019/5/2,Book Proceedings of the 2019 CHI conference on human factors in computing systems,"As 360 deg cameras and virtual reality headsets become more popular, panorama images have become increasingly ubiquitous. While sounds are essential in delivering immersive and interactive user experiences, most panorama images, however, do not come with native audio. In this paper, we propose an automatic algorithm to augment static panorama images through realistic audio assignment. We accomplish this goal through object detection, scene classification, object depth estimation, and audio source placement. We built an audio file database composed of over  audio files to facilitate this process. We designed and conducted a user study to verify the efficacy of various components in our pipeline. We run our method on a large variety of panorama images of indoor and outdoor scenes. By analyzing the statistics, we learned the relative importance of these components, which can be used in …",20
Optimizing visual element placement via visual attention analysis,"Rawan Alghofaili, Michael S Solah, Haikun Huang, Yasuhito Sawahata, Marc Pomplun, Lap-Fai Yu",2019/3/23,Conference 2019 IEEE Conference on Virtual Reality and 3D User Interfaces (VR),"Eye-tracking enables researchers to conduct complex analysis on human behavior. With the recent introduction of eye-tracking into consumer-grade virtual reality headsets, the barrier of entry to visual attention analysis in virtual environments has been lowered significantly. Whether for arranging artwork in a virtual museum, posting banners for virtual events or placing advertisements in virtual worlds, analyzing visual attention patterns provides a powerful means for guiding visual element placement. In this work, we propose a novel data-driven optimization approach for automatically analyzing visual attention and placing visual elements in 3D virtual environments. Using an eye-tracking virtual reality headset, we collect eye-tracking data which we use to train a regression model for predicting gaze duration. We then use the predicted gaze duration output of our regressors to optimize the placement of visual …",17
Toward automatic audio description generation for accessible videos,"Yujia Wang, Wei Liang, Haikun Huang, Yongqi Zhang, Dingzeyu Li, Lap-Fai Yu",2021/5/6,Book Proceedings of the 2021 CHI Conference on Human Factors in Computing Systems," Video accessibility is essential for people with visual impairments. Audio descriptions describe what is happening on-screen, e.g., physical actions, facial expressions, and scene changes. Generating high-quality audio descriptions requires a lot of manual description generation [50]. To address this accessibility obstacle, we built a system that analyzes the audiovisual contents of a video and generates the audio descriptions. The system consisted of three modules: AD insertion time prediction, AD generation, and AD optimization. We evaluated the quality of our system on five types of videos by conducting qualitative studies with 20 sighted users and 12 users who were blind or visually impaired. Our findings revealed how audio description preferences varied with user types and video types. Based on our study’s analysis, we provided recommendations for the development of future audio description generation …",12
Effects of exergaming on cognition and gait in older adults at risk for falling,"Elisa F Ogawa, Haikun Huang, Lap-Fai Yu, Philimon N Gona, Richard K Fleming, Suzanne G Leveille, Tongjian You",2020/3/1,Journal Medicine & Science in Sports & Exercise,"OGAWA, EF, H. HUANG, L. YU, PN GONA, RK FLEMING, SG LEVEILLE, and T. YOU. Effects of Exergaming on Cognition and Gait in Older Adults at Risk for Falling. Med. Sci. Sports Exerc., Vol. 52, No. 3, pp. 754–761, 2020. Purpose: To test whether an 8-wk exergaming (EG) program would improve cognition and gait characteristics compared with a traditional physical exercise (TPE) program in older adults at risk for falling. Methods: A pilot quasi-experimental study was conducted in adults age≥ 65 yr at risk for falls, living in senior communities. Participants enrolled (n= 35) in either exercise program offered twice weekly for 8 wk. Cognition and single-task and dual-task gait characteristics were measured before and after the 8-wk exercise intervention. For each outcome, a repeated-measures ANCOVA adjusted for age, gender, and exercise intensity (ratings of perceived exertion, RPE) was used to examine the group–time interaction. Results: Twentynine participants (age, 77±7 yr) completed either the EG program (n= 15) or the TPE program (n= 14). Statistically significant group–time interactions were observed in Trail Making Test Part A (P< 0.05) and single-task gait speed, stride length, swing time percentage, and double support percentage (all P< 0.05), and marginal group differences were observed in Mini-Mental State Examination (P= 0.07), all favoring the EG program. There were no statistically significant group differences in dual-task gait measurements except for swing time percentage and double support percentage, favoring the EG program. Conclusions: An 8-wk EG program for older adults at risk for falls contributed to modest …",10
Analyzing visual attention via virtual environments,"Haikun Huang, Ni-Ching Lin, Lorenzo Barrett, Darian Springer, Hsueh-Cheng Wang, Marc Pomplun, Lap-Fai Yu",2016/11/28,Book SIGGRAPH ASIA 2016 Virtual Reality meets Physical Reality: Modelling and Simulating Virtual Humans and Environments,"The widespread popularity of consumer-grade virtual reality devices such as the Oculus Rift and the HTC Vive provides new, exciting opportunities for visual attention research in virtual environments. Via these devices, users can navigate in and interact with virtual environments naturally, and their responses to different dynamic events can be closely tracked. In this paper, we explore the possibility of using virtual environments to study how directional signage may guide human navigation in an unfamiliar environment.",10
Physiological responses and enjoyment of Kinect-based exergames in older adults at risk for falls: a feasibility study,"Elisa Ogawa, Haikun Huang, Lap-Fai Yu, Tongjian You",2019/1/1,Journal Technology and health care,BACKGROUND:,9
Exertion-aware path generation.,"Wanwan Li, Biao Xie, Yongqi Zhang, Walter Meiss, Haikun Huang, Lap-Fai Yu",2020/7/1,Journal ACM Trans. Graph.,"“The ultimate display would, of course, be a room within which the computer can control the existence of matter. A chair displayed in such a room would be good enough to sit in. Handcuffs displayed in such a room would be confining, and a bullet displayed in such a room would be fatal.”—Ivan Sutherland, 1965 Ivan Sutherland, inventor of the first virtual reality (VR) headmounted display, envisioned that the ultimate display would deliver virtual contents that are highly realistic in terms of visuals and haptics. The tremendous efforts of computer graphics researchers have led to the invention of generative models and procedural modeling algorithms capable of synthesizing visually stunning virtual contents such as streets [Chen et al. 2008], roads [Beneš et al. 2014; Galin et al. 2010; Nishida et al. 2016], terrains [Cordonnier et al. 2018; Guérin et al. 2017], cities [Parish and Müller 2001; Vanegas",8
Synthesizing scene-aware virtual reality teleport graphs,"Changyang Li, Haikun Huang, Jyh-Ming Lien, Lap-Fai Yu",2021/12/10,Journal ACM Transactions on Graphics (TOG),"We present a novel approach for synthesizing scene-aware virtual reality teleport graphs, which facilitate navigation in indoor virtual environments by suggesting desirable teleport positions. Our approach analyzes panoramic views at candidate teleport positions by extracting scene perception graphs, which encode scene perception relationships between the observer and the surrounding objects, and predict how desirable the views at these positions are. We train a graph convolutional model to predict the scene perception scores of different teleport positions. Based on such predictions, we apply an optimization approach to sample a set of desirable teleport positions while considering other navigation properties such as coverage and connectivity to synthesize a teleport graph. Using teleport graphs, users can navigate virtual environments efficaciously. We demonstrate our approach for synthesizing teleport …",5
Synthesizing personalized construction safety training scenarios for VR training,"Wanwan Li, Haikun Huang, Tomay Solomon, Behzad Esmaeili, Lap-Fai Yu",2022/2/15,Journal IEEE Transactions on Visualization and Computer Graphics,"Construction industry has the largest number of preventable fatal injuries, providing effective safety training practices can play a significant role in reducing the number of fatalities. Building on recent advancements in virtual reality-based training, we devised a novel approach to synthesize construction safety training scenarios to train users on how to proficiently inspect the potential hazards on construction sites in virtual reality. Given the training specifications such as individual training preferences and target training time, we synthesize personalized VR training scenarios through an optimization approach. We validated our approach by conducting user studies where users went through our personalized guidance VR training, free exploration VR training, or slides training. Results suggest that personalized guidance VR training approach can more effectively improve users' construction hazard inspection skills.",4
Way to Go! Automatic Optimization of Wayfinding Design,"Haikun Huang, Ni-Ching Lin, Lorenzo Barrett, Darian Springer, Hsueh-Cheng Wang, Marc Pomplun, Lap-Fai Yu",2017/6/27,Journal arXiv preprint arXiv:1706.08891,"Wayfinding signs play an important role in guiding users to navigate in a virtual environment and in helping pedestrians to find their ways in a real-world architectural site. Conventionally, the wayfinding design of a virtual environment is created manually, so as the wayfinding design of a real-world architectural site. The many possible navigation scenarios, as well as the interplay between signs and human navigation, can make the manual design process overwhelming and non-trivial. As a result, creating a wayfinding design for a typical layout can take months to several years. In this paper, we introduce the Way to Go! approach for automatically generating a wayfinding design for a given layout. The designer simply has to specify some navigation scenarios; our approach will automatically generate an optimized wayfinding design with signs properly placed considering human agents' visibility and possibility of making mistakes during a navigation. We demonstrate the effectiveness of our approach in generating wayfinding designs for different layouts such as a train station, a downtown and a canyon. We evaluate our results by comparing different wayfinding designs and show that our optimized wayfinding design can guide pedestrians to their destinations effectively and efficiently. Our approach can also help the designer visualize the accessibility of a destination from different locations, and correct any ""blind zone"" with additional signs.",2
WFH-VR: Teleoperating a Robot Arm to set a Dining Table across the Globe via Virtual Reality,"Lai Sum Yim, Quang TN Vo, Ching-I Huang, Chi-Ruei Wang, Wren McQueary, Hsueh-Cheng Wang, Haikun Huang, Lap-Fai Yu",2022/10/23,Conference 2022 IEEE/RSJ International Conference on Intelligent Robots and Systems (IROS),"This paper presents an easy-to-deploy, virtual reality-based teleoperation system for controlling a robot arm. The proposed system is based on a consumer-grade virtual reality device (Oculus Quest 2) with a low-cost robot arm (a LoCoBot) to allow easy replication and set up. The proposed Work-from-Home Virtual Reality (WFH-VR) system allows the user to feel an intimate connection with the real remote robot arm. Virtual representations of the robot and objects to be manipulated in the real-world are presented in VR by streaming data pertaining to orientation and poses. The user studies suggest that 1) the proposed telerobotic system is effective under conditions both with and without network latency, whereas a method that simply streams video does not. This design enables the system implemented at an arbitrary distance from the actual work site. 2) The proposed system allows novices to perform manipulation …",1
Joint computational design of workspaces and workplans,"Yongqi Zhang, Haikun Huang, Erion Plaku, Lap-Fai Yu",2021/12/10,Journal ACM Transactions on Graphics (TOG),"Humans assume different production roles in a workspace. On one hand, humans design workplans to complete tasks as efficiently as possible in order to improve productivity. On the other hand, a nice workspace is essential to facilitate teamwork. In this way, workspace design and workplan design complement each other. Inspired by such observations, we propose an automatic approach to jointly design a workspace and a workplan. Taking staff properties, a space, and work equipment as input, our approach jointly optimizes a workspace and a workplan, considering performance factors such as time efficiency and congestion avoidance, as well as workload factors such as walk effort, turn effort, and workload balances. To enable exploration of design trade-offs, our approach generates a set of Pareto-optimal design solutions with strengths on different objectives, which can be adopted for different work scenarios …",1
"Association between Self-Reported Prior Night’s Sleep and Single-Task Gait in Healthy, Young Adults: A Study Using Machine Learning","Ali Boolani, Joel Martin, Haikun Huang, Lap-Fai Yu, Maggie Stark, Zachary Grin, Marissa Roy, Chelsea Yager, Seema Teymouri, Dylan Bradley, Rebecca Martin, George Fulk, Rumit Singh Kakar",2022/9/29,Journal Sensors,"Failure to obtain the recommended 7–9 h of sleep has been associated with injuries in youth and adults. However, most research on the influence of prior night’s sleep and gait has been conducted on older adults and clinical populations. Therefore, the objective of this study was to identify individuals who experience partial sleep deprivation and/or sleep extension the prior night using single task gait. Participants (n = 123, age 24.3 ± 4.0 years; 65% female) agreed to participate in this study. Self-reported sleep duration of the night prior to testing was collected. Gait data was collected with inertial sensors during a 2 min walk test. Group differences (<7 h and >9 h, poor sleepers; 7–9 h, good sleepers) in gait characteristics were assessed using machine learning and a post-hoc ANCOVA. Results indicated a correlation (r = 0.79) between gait parameters and prior night’s sleep. The most accurate machine learning model was a Random Forest Classifier using the top 9 features, which had a mean accuracy of 65.03%. Our findings suggest that good sleepers had more asymmetrical gait patterns and were better at maintaining gait speed than poor sleepers. Further research with larger subject sizes is needed to develop more accurate machine learning models to identify prior night’s sleep using single-task gait.",
Association Between Self-Reported Sleep Quality And Gait In Young Adults: A Study Using Machine Learning: 782,"Ali Boolani, Haikun Huang, Ronald Johnson, Lap-Fai Yu, Erica Jansen, Rebecca Martin, Chelsea C Yager, Bert Jacobson, Joel Martin",2022/9/1,Journal Medicine & Science in Sports & Exercise,"Purpose: The purpose of this study was to find biomechanical correlates of single-task gait and self-reported sleep quality in a healthy, young population by replicating a recently published study by Liu and colleagues.",
Manifestations Of Anxiety In Gait: 781,"Maggie Stark, Haikun Huang, Lap-Fui Yu, Rebecca Martin, Ryan McCarthy, Emily Locke, Chelsea Yager, Matthew Lee Smith, Bert Jacobson, Ali Boolani",2022/9/1,Journal Medicine & Science in Sports & Exercise,PURPOSE: The purpose of this study was to employ machine learning (ML) in order to identify individuals who currently report feelings of anxiety using self-paced walking gait and balance assessments.,
"Do Healthy, Young Adults With Current Feelings Of Anxiety Have Impaired Balance? An Exploratory Study: 1705","Dalton Dowd, Maggie Stark, Haikun Huang, Lap-Fai Yu, Rebecca Martin, Ryan McCarthy, Emily Locke, Chelsea Yager, Matthew Lee Smith, Bert Jacobson, Ali Boolani",2022/9/1,Journal Medicine & Science in Sports & Exercise,PURPOSE: The purpose of this study was to determine differences in balance between individuals with self-reported anxiousness compared to those with no self-reported anxiousness as assessed by the Profile of Mood States-Short Form (POMS-SF),
Human vision-empowered 3D scene analysis tools,"Lap-Fai Yu, Haikun Huang",2022/8/23,Patent office US,"Aspects and embodiments disclosed herein include a computational approach to automatically generate a wayfinding design for a given environment. To use aspects and embodiments of the disclosed computational approach, a designer specifies all the navigation scenarios likely to be taken by the users. A wayfinding design is then generated to accommodate the needs of all the scenarios while considering a number of desirable factors relevant to the navigation experience and management convenience. Through agent-based simulations, the locations of the wayfinding signs are further refined by considering visibility and robustness with respect to the possible mistakes made by the users throughout their navigation. After generating a wayfinding design, the designer can gain further insights of the design by visualizing the accessibility of a destination from any other locations in the environment and remove any …",
