titles,authors,date,source,descriptions,citations
Broadening Participation of Women and Minorities,"Janis Terpenny, Kate Fu",2013/11/1,Journal Mechanical Engineering-CIME,""" It is not lack of talent, but unintentional biases and outmoded institutional structures that are hindering the access and advancement of women [and minorities). Neither our academic institutions nor our nation can afford such underuse of precious human capital in science and engineering. The time to take action is now.""(2007 NAE Report: Beyond Bias and Barriers)",
Broadening Participation: A Report on a Series of Workshops Aimed at Building Community and Increasing the Number of Women and Minorities in Engineering Design,"Janis Terpenny, Katherine Fu, Tahira Reid, Judy Vance, Deborah Thurston, Susan Finger, Gloria Wiens, Kazem Kazerounian, Janet Allen, Kathy Jacobson",2013/6/1,"Description Despite some progress in increasing the numbers of women and minorities in engineering over the past 30 years, their full participation in the discipline has yet to be achieved, particularly in engineering academia. One cause is the"" leaky pipeline""; even after women and minorities choose to major in engineering, they drop out at rates higher than their counterparts along all career stages (undergraduate school, graduate school, tenure-track, etc.). Their small numbers creates isolation that has the unfortunate risks of struggle, less professional success, less sense of personal belonging, and less retention. Our hypothesis is that building a community that provides networking and support, opportunities for collaboration, and professional development, will lead to greater career success, personal fulfillment and professional happiness, retention, and greater participation/contribution from women and minorities. The …","Despite some progress in increasing the numbers of women and minorities in engineering over the past 30 years, their full participation in the discipline has yet to be achieved, particularly in engineering academia. One cause is the"" leaky pipeline""; even after women and minorities choose to major in engineering, they drop out at rates higher than their counterparts along all career stages (undergraduate school, graduate school, tenure-track, etc.). Their small numbers creates isolation that has the unfortunate risks of struggle, less professional success, less sense of personal belonging, and less retention. Our hypothesis is that building a community that provides networking and support, opportunities for collaboration, and professional development, will lead to greater career success, personal fulfillment and professional happiness, retention, and greater participation/contribution from women and minorities. The …",
Simplifying for savings: University-corporate collaboration develops tool that helped reduce tire product complexity at Goodyear,"Nihal Orfi, Asli Sahin-Sariisik, Janis Terpenny",2012/4/1,"Description University-corporate collaboration develops tool that helped reduce tire product complexity at Goodyear. Today, companies are faced with pressure to increase variety in product offerings. While increasing variety and choices pleases customers and increases market share, the costs of doing so can be significant. Managing a diverse mix of products and associated components becomes complex, with impacts on performance requirements and production processes. Goodyear collaborated with the Center for e-Design to develop the fundamentals and tools to manage complexity. The center is a National Science Foundation industry or university cooperative research center. It was established in 2003 and now has six university sites and more than 30 industry members. The advantages for companies using product family or platform strategies can be significant. They enable efficient derivation of product variants to meet different market segment demands by keeping development costs and time cycles low.","University-corporate collaboration develops tool that helped reduce tire product complexity at Goodyear. Today, companies are faced with pressure to increase variety in product offerings. While increasing variety and choices pleases customers and increases market share, the costs of doing so can be significant. Managing a diverse mix of products and associated components becomes complex, with impacts on performance requirements and production processes. Goodyear collaborated with the Center for e-Design to develop the fundamentals and tools to manage complexity. The center is a National Science Foundation industry or university cooperative research center. It was established in 2003 and now has six university sites and more than 30 industry members. The advantages for companies using product family or platform strategies can be significant. They enable efficient derivation of product variants to meet different market segment demands by keeping development costs and time cycles low.",
A mini-workshop on how people learn,"Louis Everett, Susan Finger, Don Millard, Russell Pimmel, Janis Terpenny, John Yu, Maura Borrego, Guy-Alain Amoussou",2011/10/1,Conference 2011 Frontiers in Education Conference (FIE),"At the present time, the research of qualitative spatial relationships primary base on first-order predicate logic, but its shortcoming becomes obvious. Description logic is a formal knowledge representation language, and it has strong expression and reasoning ability. This paper band the description logic together with the qualitative spatial topology relationship representation and reasoning. Also, it gives the description of qualitative spatial topology relationships concrete domain, the topology relationship aggregation, and an algorithm of consistency determination.",
Workshop—Evaluation of education development projects,"Louis Everett, Susan Finger, Don Millard, Russell Pimmel, Janis Terpenny, John Yu, Maura Borrego, Guy-Alain Amoussou",2011/10/1,Conference 2011 Frontiers in Education Conference (FIE),"Evaluation is an old concept and, at least implicitly, all faculty members do it. So why should you attend a workshop on the subject? Here are a few reasons:(1) More NSF reviewers expect to see an evaluation plan in a proposal.(2) To ensure educational research progresses, we must know what works and how well it works.(3) Properly done, formative evaluation can direct you to more effective teaching.(4) Defendable data can help administrators make fair and quantifiable performance appraisals. This workshop will not make you an evaluation expert but it will enable you to collaborate more effectively with evaluation experts. You will be able to apply evaluation methods in your classroom and you will be able to read and comprehend evaluation plans for projects. After the session, you will be able to recognize basic terminology, list the importance of goals, outcomes and questions and describe how they comprise …",
Employing engineering design tools for designing/redesigning of courses,"Zeshan Hyder, Zulfiqar Ali, Janis P Terpenny, Richard M Goff",2011/6/26,Conference 2011 ASEE Annual Conference & Exposition,"Employing Engineering Design Tools for Designing/Redesigning of CoursesThe design tools, common in engineering design applications, can be very helpful for designingand/or redesigning new or old courses. The design and planning tools like SWOT (Strengths, Weaknesses, Opportunities, Threats) analysis, House of Quality, Gantt Chart and DecisionMatrices have been very helpful in engineering design processes. The idea of this work is toimplement these tools to facilitate course design procedures. Gantt chart helps in scheduling and defining dependency relationships between differentactivities. It helps keep track of allotted and used time for certain tasks and can show currentschedule status using percent complete shadings. Decision Matrix is a decision-support toolallowing decision makers to solve their problem by evaluating, rating, and comparing differentalternatives. SWOT analysis is helpful in stipulating the strengths and opportunities a course canpossess while keeping an eye on potential student learning opportunities. It can help specifyingwhat strategies can be laid down to overcome weakness and threats faced by a certain course orcourses. House of Quality can help in defining objectives and evaluating strategies in the coursedesign process to attain the defined learning objectives of the course. A case problem approach is provided to support the description and demonstration ofapplication of these tools to the course update scheme. The procedures presented in this papermay be useful for anyone, who intends to design/upgrade courses, that has not taught in recentyears or whose teaching methods have become …",
What Constitutes a Good Design Education Research Paper That Would be Suitable for JMD?,JP Terpenny,2011/3/1,Volume 133,"Have you heard? Did you know? The Journal of Mechanical Design (JMD) has been accepting and publishing quality design education research papers for the last 2 years. As the associate editor handling this area, I am all too often surprised. First, I am surprised that the word has not spread widely and that there are not more design education submissions to JMD. Clearly, there is a tremendous surge in the interest of engineering educators nationwide to increase student learning and skills through design projects, often with genuine experiences and with the participation from industry, the community, or individual “customers” working with student design teams. Design education seems to be the new focus of how engineering educators are going to fix what is perceived to have been broken for many years: a content focused curriculum, lacking in the context of real problems that would motivate and engage …",
Ontology-Based Knowledge Representation for Product Life Cycle Concepts and Obsolescence Forecasting,"Liyu Zheng, Janis Terpenny, Raymond Nelson III, Peter Sandborn",2011,Journal IIE Annual Conference. Proceedings,"The impact and pervasiveness of product obsolescence are increasing due to rapidly advancing technologies which shorten the lives of high-technology components. For long field-life systems, this has led to an increasing disparity in the life cycle of components as compared to the life cycle of the overall system. This disparity is challenging since obsolescence dates of components are important to product life cycle planning. While proposed obsolescence forecasting methods have demonstrated some effectiveness, obsolescence management is a continuing challenge since current methods are very difficult to integrate with other tools and lack clear, complete, and consistent information representation. This paper presents a framework to support the needs of knowledge representation for obsolescence forecasting. Product life cycle models are represented using the logic of ontological constructs. The forecasted …",
International Journal of Engineering Education: Guest editorial,"Clive L Dym, Janis P Terpenny",2010,Journal International Journal of Engineering Education,,
Updating an old course: What does it take?,"Zeshan Hyder, Zulfiqar Aly, Janis Terpenny, Richard Goff",2010,Publisher American Society of Engineering Education,,
Special Issue Sustaining Sustainable Design,"Clive L Dym, Janis P Terpenny",2010/1/1,Source INTERNATIONAL JOURNAL OF ENGINEERING EDUCATION,,
Student Needs Identification and Prioritization Framework: Incorporating Multiple Customers' Perspectives,"Tracee Walker Gilbert, Janis P Terpenny",2010,Journal IIE Annual Conference. Proceedings,"This paper describes a framework that integrates a collection of influential student success theories with the customer needs identification method that is core to good engineering design. The Student Needs Identification and Prioritization Framework is presented to provide: a method for translating the voice of the customers (ie, students, university faculty, industry, and society) into actionable statements that identify student success needs; the Analytical Hierarchy Process (AHP) to prioritize these needs from multiple customer perspectives; and the tools to implement this framework. An example application is used to illustrate how this framework can be applied in engineering education.[PUBLICATION ABSTRACT]",
Redesigning A Junior Level Materials Processing Laboratory Course To Aid Students In Applying Theory To Practice,"Diane Folz, Christine Burgoyne, Janis Terpenny, Richard Goff",2009/6/14,Conference 2009 Annual Conference & Exposition,"A junior-level materials engineering laboratory course has been re-designed to broaden the experiences of undergraduates in areas such as teaming and collaboration, written and oral communication skills, problem solving and the engineering design process. The re-design also incorporates more modern ceramic engineering processing methods. It is anticipated that the redesigned course will better prepare students to succeed; the premise being that providing such learning opportunities sooner and more often will improve student knowledge and confidence in applying theory to practice. This paper reports on the re-designed course and its effectiveness in meeting the learning outcomes.",
Empowering women as leaders: ADVANCE leadership programs at a doctoral STEM-dominant university,"Ane Johnson, Margaret Layne, Janis Terpenny",2009,"Journal ASEE Annual Conference and Exposition, Conference Proceedings",,
Empowering Women as Leaders: ADVANCE,"Ane Johnson, Margaret Layne, Janis Terpenny",2009,Journal American Society for Engineering Education,"Leadership Programs at a Doctoral STEM-Dominant University STEM-dominant universities have been historically dominated by men and by traditions that, by their nature, have excluded women. 1 For example, women make up only 6. 9% of all full professors in engineering, nationwide. 2 Women faculty members note disparities in numbers, salary, opportunities, resource allocation, and job satisfaction in general, and in the sciences and engineering more specifically. 3 The lack of women in leadership positions has left many women junior faculty and graduate students feeling isolated and without the necessary support to build successful academic careers. 4 Yet women faculty have indicated high levels of interest in leadership positions. 5 With NSF ADVANCE support, Virginia Tech, a STEM-dominant university, has sought to empower women faculty to overcome the barriers to leadership.",
Context Based Problems and Exercises For Teaching Engineering Economy,"Rajkamal Kesharwani, Xiaomeng Chang, Janis Terpenny",2008/6/22,Conference 2008 Annual Conference & Exposition,"Traditionally, methods of teaching engineering economy draw on resources such as textbooks 1-5, websites 6 and papers 7. Often, engineering economy courses follow the ‘given this, find that’style of exercises to introduce and reinforce basic concepts. Developing examples and exercises that are interesting, engaging, and provide context is a challenging problem for courses with students enrolled from a variety of majors. Yet, we know that without proper context to their discipline, students will not find relevance or understand why they should care to learn engineering economy. To students it may be just another course to check off the requirements list. Further, students from disciplines other than industrial engineering (IE) often learn engineering economy as part of another required course within their discipline. For example, mechanical engineers will be introduced to engineering economy concepts in an introductory or senior course in engineering design. For this situation, non-IE students typically do not purchase a textbook in engineering economy, but rely on instructor provided materials.",
"Small Interventions, Big Impacts: How Modification Of Delivery Process Of In Class Activities For Freshmen Can Dramatically Improve Learning","Aly Tawfik, Janis Terpenny, Richard Goff",2008/6/22,Conference 2008 Annual Conference & Exposition,"This paper discusses the impact of using informed instructional design and subsequent delivery processes of classroom activities on learning outcomes in first-year engineering classes. The paper shows how minor additions or changes done by the instructor can lead to noticeably better learning outcomes, and higher student satisfaction and perception. In this study, learning outcomes are evaluated by the instructor, while students’ satisfaction and perception is measured using direct surveys. Four previously tested and two suggested example hands-on activities are discussed in the paper. In addition to the activities, the paper also addresses how instructor delivery of the activities influences learning outcomes in a typical classroom environment. The paper demonstrates the powerful influence of an instructor’s teaching style and approach on class behavior and response, and hence, suggests careful and detailed design of the process of instructional delivery.",
Social Entrepreneurship and Sustainable Design-Preparing Globally and Socially-conscious Engineers: International and Human-centred Design Projects and Activities in the First Year,"JP Terpenny, RM Goff, WK Lohani, J Mullin, J Lo",2008,Journal International Journal of Engineering Education,,
Preparing for an Academic Job Search,"Nancy L Ross, Janis P Terpenny",2007/10/4,Publisher Virginia Tech,"Overview of Academic Job Search  Begin by determining personal and institutional ""fit""  - Develop dossier (CV, cover letter, etc.) based on your chosen career path and institutional type  - Look over job ads in your field, making sure to research institutions thoroughly and tailor your materials to a specific institution  - Prepare for the academic job interview  - Consider how to negotiate if and when the job offer is made",
Preparing for an Academic Job Search: Application Materials,Janis P Terpenny,2007/10/4,Publisher Virginia Tech,Basic Guidelines for Preparing for an Academic Job Search: • Read announcements carefully • Follow instructions closely • Taylor materials to each application • Present a professional package • Keep a status file for each application • Follow-up!,
Mentoring First Lego League: Challenges And Rewards Of Working With Youth,"David Richter, Kurt Johnson, Janis Terpenny, Richard Goff",2007/6/24,Conference 2007 Annual Conference & Exposition,"The FIRST LEGO League (FLL) organizes friendly competitions between students, ages 9-to 14-years-old. The competition focuses on engineering challenges addressing a theme in science and technology. For 2006, FLL chose nanotechnology as the central theme. The youth used a semi-autonomous robot constructed from LEGO® brand building blocks to perform tasks related to current themes in nanotechnology research. In addition to the robot competition, the students researched and presented on a current topic in the field of nanotechnology. To facilitate the project, FLL relies on volunteers from the community including coaches and mentors. This paper explores the experience of two graduate engineering students from Virginia Polytechnic Institute and State University (Virginia Tech) as they mentor the Kipps Elementary School FLL team.",
Undergraduate Learning Experiences Through Research In Emerging Areas Of Engineering Design: Product Platform Planning And Design For Managing Product Obsolescence,"Rahul Rai, Asli Sahin, Ashley Studd, Janis Terpenny",2007/6/24,Conference 2007 Annual Conference & Exposition,"In this paper, we present the learning experiences of six undergraduates who worked on research projects in the areas of product family and product obsolescence. These areas represent emerging fields in product design. Product platforms enable the planned development and deployment of families of related products whereas traditional design processes optimize on a single design. Design for Managing Product Obsolescence (DfMPO) helps in mitigating and preventing obsolescence of products due to rapid change in technology, thus promoting sustainability. Both product platform and DfMPO place an increased emphasis on management of information due to the reuse of design knowledge. The REU program gave the six students the opportunity to discover design principles and knowledge related to platform design and DfMPO. The students spent a semester applying novel design knowledge representation and visualization techniques to plan product platforms and design principles to prevent product obsolescence. The students worked closely with a faculty, a post-doctoral researcher, and graduate students in the research group. The six students include three freshmen, one junior, and two seniors. Five of the students are women and one is a man. The group represents a variety of engineering disciplines with majors in aerospace, mechanical and industrial engineering. This paper provides an overview of the research conducted by the REU students, the structure of the REU program, and the students’ overall experience including the effects on student interest in graduate school.",
"Ryan S. Hutcheson, Robert L. Jordan Jr., Robert B. Stone","Janis P Terpenny, Xiaomeng Chang",2006,Journal Proceedings of the... ASME Design Engineering Technical Conferences,"This paper outlines a framework for applying a genetic algorithm to the selection of component variants between the conceptual and detailed design stages of product development. A genetic algorithm (GA) is defined for the problem and an example is presented that demonstrates its application and usefulness. Functional modeling techniques are used to formulate the design problem and generate the chromosomes that are evaluated with the algorithm. In the presented example, suitable GA parameters and the break-even point where the GA surpassed an enumerated search of the same solution space were found. Recommend uses of the GA along with limitations of the method and future work are presented as well.",
Application of a genetic algorithm to concept variant selection,"Ryan S Hutcheson, Robert L Jordan Jr, Robert B Stone, Janis P Terpenny, Xiaomeng Chang",2006/1/1,Conference International Design Engineering Technical Conferences and Computers and Information in Engineering Conference,"This paper outlines a framework for applying a genetic algorithm to the selection of component variants between the conceptual and detailed design stages of product development. A genetic algorithm (GA) is defined for the problem and an example is presented that demonstrates its application and usefulness. Functional modeling techniques are used to formulate the design problem and generate the chromosomes that are evaluated with the algorithm. In the presented example, suitable GA parameters and the break-even point where the GA surpassed an enumerated search of the same solution space were found. Recommend uses of the GA along with limitations of the method and future work are presented as well.",18
Evaluating relative instructional effectiveness and efficiencies of design activities for product platform planning,"Asli Sahin, Janis Terpenny, Steven B Shooter, Robert B Stone, Timothy W Simpson",2006/1/1,Conference International Design Engineering Technical Conferences and Computers and Information in Engineering Conference,"Product Platform Planning is markedly different from the traditional product development process and a relatively new development in engineering design. To present the basic principles of this new and different engineering design topic as well as current research on planning and architecting families of products, in our previous study, we developed an online resource. The tool includes a set of three cases, a tutorial, and a glossary in a multimedia format hosted on the Internet. The cases are based on a family of product power tools. They present information in the form of function diagrams, assembly diagrams, customer needs and market-segment data. In addition, they have been designed to provide different product platform assignments at an increasing level of complexity. This paper presents two preliminary quantitative methods to evaluate the instructional effectiveness and efficiencies of the learning tool. Also …",
A Conceptual Method to Evaluate Relative Instructional Efficiencies of Case Studies in Product Platform Planning,"Asli Sahin, Janis P Terpenny, Steven B Shooter, Robert B Stone, Timothy W Simpson",2006,Journal IIE Annual Conference. Proceedings,"Considering the relevance of planning product families in today's industry, it is important to incorporate it in the education system. Therefore, in our previous work, we developed an online resource including a set of three cases, a tutorial, and glossary to present the principles of product family planning. The cases present information in the form of function diagrams, assembly diagrams, customer needs and market-segment data. In addition, they have been designed to provide different product platform assignments at an increasing level of complexity. This paper presents a conceptual methodology to evaluate the instructional efficiencies of the case studies. It involves users' overall experience with the learning tool. Particularly, the characteristics that could impact the tool total efficiency, such as assignment appropriateness, presentation clarity and effectiveness, are included. A Data Envelopment Analysis (DEA …",
