titles,authors,date,source,descriptions,citations
A proposed learner-centered mechatronics engineering instructional program,"Patrick N Currier, Richard Goff, Janis Terpenny",2010,"Description This paper examines the need and requirements for a mechatronics degree program. The results of a survey of the few existing programs in this field are provided. Then, using a case study example for Virginia Tech, a proposed mechatronics curriculum based on a learner-centered paradigm is described. The curriculum combines existing courses in mechanical, electrical, and computer engineering with new, hands-on courses to provide students with a chance to practice and explore the subject matter in ways consistent with the demands of both industry and accreditation. This program, if implemented, could provide a university with a unique offering to attract top students by better preparing them for the types of problems they will encounter in the modern world.","This paper examines the need and requirements for a mechatronics degree program. The results of a survey of the few existing programs in this field are provided. Then, using a case study example for Virginia Tech, a proposed mechatronics curriculum based on a learner-centered paradigm is described. The curriculum combines existing courses in mechanical, electrical, and computer engineering with new, hands-on courses to provide students with a chance to practice and explore the subject matter in ways consistent with the demands of both industry and accreditation. This program, if implemented, could provide a university with a unique offering to attract top students by better preparing them for the types of problems they will encounter in the modern world.",4
GPBG: A framework for evolutionary design of multi-domain engineering systems using genetic programming and bond graphs,"Jianjun Hu, Zhun Fan, Jiachuan Wang, Shaobo Li, Kisung Seo, Xiangdong Peng, Janis Terpenny, Ronald Rosenberg, Erik Goodman",2008,Journal Design by Evolution: Advances in Evolutionary Design,"Current engineering design is a multi-step process proceeding from conceptual design to detailed design and to evaluation and testing. It is estimated that 60–70% of design decisions and most innovation occur in the conceptual design stage, which may include conceptual design of function, operating principles, lavout, shape, and structure. However, few computational tools are available to help designers to explore the design space and stimulate the product innovation process. As a result, product innovation is strongly constrained by the designer’s ingenuity and experience, and a systmatic approach to product innovation is strongly needed.",4
Design in Engineering Education and Practice,"Janis Terpenny, Richard Goff",2005/6/12,Conference 2005 Annual Conference,"This paper reports on a new core graduate course that has been developed for the recently established Department of Engineering Education at Virginia Polytechnic Institute and State University (Virginia Tech). The course is focused on preparing future engineering faculty members and practitioners to teach engineering design as well as how to function more effectively in industry design environments. Material related to theories of student learning and appropriate pedagogical approaches to teaching an open-ended subject such as engineering design are included. Having successfully completed this course, students are able to describe engineering design process and compare and contrast design across engineering and nonengineering disciplines. Students develop a syllabus for a design course in their own discipline, including assignments and projects. They also learn about effective project management and are able to characterize and demonstrate effective means of teaching/coaching/mentoring of various design projects. As future educators, students are able to describe the ABET (Accreditation Board for Engineering and Technology) requirements for design courses (Capstone, etc.), describe and demonstrate various theories of learning and pedagogy, and are able to navigate the course design and approval process. Descriptions of student mentoring of K-12 design teams in the FIRST LEGO® League competition are also provided.",4
A web-based environment for managing product knowledge,"Akshaye Sikand, Janis Terpenny",2004,"Journal International Symposium on Collaborative Technologies and Systems (CTSO 4), San Diego, CA","Akshaye Sikand and Janis Terpenny* Department of Mechanical and Industrial Engineering University of Massachusetts Amherst Amherst, Massachusetts 01003-9265* Direct all correspondence to terpenny@ ecs. umass. edu",4
A virtual classroom experiment for teaching the economic principles of engineering design,"William G Sullivan, Janis P Terpenny",2001/10/10,Conference 31st Annual Frontiers in Education Conference. Impact on Engineering and Science Education. Conference Proceedings (Cat. No. 01CH37193),"The objective of this project was to conduct and report on experiments to determine whether industrial case studies, web-based course materials, and communication enhanced by the Internet can improve the proficiency of student learning in engineering economy.",4
An integrated system for functional modeling and configuration in conceptual design,Janis P Terpenny,1997/6/25,"Book Flexible Automation and Intelligent Manufacturing, 1997: Proceedings of the Seventh International FAIM Conference","Concurrent engineering has brought much attention in recent years to engineering design and its impact on issues such as costs, cycle-time, and quality. These issues, coupled with global markets and rapid technology advancements, have created significant need for improved methods and supporting tools for engineering design. To date, advances have focused predominantly on tasks that are well into the latter stages of product development. Advances for early design have been limited. In general, methodologies have taken either a top-down or a bottom-up approach to design, and as such, have virtually guaranteed the continued separation of abstraction and detail during conceptualization. This paper presents an integrated conceptual modeling system that supports a blended methodology from the earliest stages of engineering design. Modeling, synthesis, integration, knowledge capture, and reuse are …",4
Constructing robust and reliable health indices and improving the accuracy of remaining useful life prediction,"Yupeng Wei, Dazhong Wu, Janis Terpenny",2022/5/1,"Journal Journal of Nondestructive Evaluation, Diagnostics and Prognostics of Engineering Systems","A system health index is a measurement of the health condition of complex systems. However, most of the health indices are developed based on strong assumptions. Consequently, existing health indices are not capable of measuring the actual deterioration behaviors with high accuracy. To address this issue, we introduce a probabilistic graphical model to examine the probabilistic relationships among sensor signals, remaining useful life (RUL), and health indices. Based on the graphical model, three types of conditional probabilistic autoencoders are combined to develop the health indices of a complex aero-propulsion system. The proposed method is demonstrated on an engine dataset. The experimental results have shown that the proposed method is capable of constructing robust health indices as well as improving the accuracy of RUL prediction.",3
Receiver operating characteristic analysis for forecasting obsolescence risk,"Connor Jennings, Dazhong Wu, Janis Terpenny",2017,Journal IIE Annual Conference. Proceedings,"In today’s world of rapidly advancing technologies, the impacts and costs of change on products and systems are dramatic. As new products are introduced into the market, manufacturers cease production of older products. These products that are no longer procurable have become obsolete. Planning ahead for when products become obsolete requires accurate and dependable forecasting methods as well as methods to assess costs associated with obsolescence. Currently, obsolescence risk forecasting models assign statuses of procurable or discontinued to parts to denote the part’s availability. As with any forecast, some parts will be mislabeled, ie, a procurable part may be labeled as discontinued or vice versa. Typically, it is assumed the cost of a type I and type II errors are equal. However, a procurable part labeled as discontinued may trigger a premature redesign and potentially worse, a discontinued part labeled as procurable could cause a starved manufacturing line or even production shutdowns. The objective of this paper is to present a new method that has been developed to avoid significant errors in cost calculations and resultant decisions. The method makes use of Receiver Operating Characteristic (ROC) analysis that makes it possible to account for asymmetric costs when parts are misclassified. A case study of the digital camera market is presented to demonstrate the method. When a new optimal risk cut-off threshold is calculated using ROC analysis, an average reduction of 26.4% in cost per prediction in the camera market is demonstrated.",3
"Networked, Real Time Translation of 3D Mesh Data to Immersive Virtual Reality Environments","Kevin Lesniak, Conrad S Tucker, Sven Bilen, Janis Terpenny, Chimay Anumba",2016/8/21,Conference International Design Engineering Technical Conferences and Computers and Information in Engineering Conference,"Immersive virtual reality systems have the potential to transform the manner in which designers create prototypes and collaborate in teams. Using technologies such as the Oculus Rift or the HTC Vive, a designer can attain a sense of “presence” and “immersion” typically not experienced by traditional CAD-based platforms. However, one of the fundamental challenges of creating a high quality immersive virtual reality experience is actually creating the immersive virtual reality environment itself. Typically, designers spend a considerable amount of time manually designing virtual models that replicate physical, real world artifacts. While there exists the ability to import standard 3D models into these immersive virtual reality environments, these models are typically generic in nature and do not represent the designer’s intent. To mitigate these challenges, the authors of this work propose the real time translation of …",3
"Immersive Distributed Design through Real-Time Capture, Translation and Rendering of 3D Mesh Data1","K Lesniak, J Terpenny, CS Tucker, C Anumba, SG Bilén",2016,Journal Journal of Computing and Information Science in Engineering,,3
Performance evaluation of cloud-based high performance computing for finite element analysis,"Dazhong Wu, Xi Liu, Steve Hebert, Wolfgang Gentzsch, Janis Terpenny",2015/8/2,Conference International Design Engineering Technical Conferences and Computers and Information in Engineering Conference,"Cloud computing is an innovative computing paradigm that can potentially bridge the gap between increasing computing demands in computer aided engineering (CAE) applications and limited scalability, flexibility, and agility in traditional computing paradigms. In light of the benefits of cloud computing, high performance computing (HPC) in the cloud has the potential to enable users to not only accelerate computationally expensive CAE simulations (e.g., finite element analysis), but also to reduce costs by utilizing on-demand and scalable cloud computing resources. The objective of this research is to evaluate the performance of running a large finite element simulation in a public cloud. Specifically, an experiment is performed to identify individual and interactive effects of several factors (e.g., CPU core count, memory size, solver computational rate, and input/output rate) on run time using statistical methods. Our …",3
Introducing undergraduates to load calculations: A course designed around ASCE-7,"Lori Koch, Richard Goff, Janis Terpenny",2010,"Journal Proc., ASEE South East Section Annual Conf","More often than not, undergraduate students in structural engineering programs are only briefly exposed to ASCE-7 (Minimum Design Loads for Buildings and Other Structures), usually in the introduction of concrete or steel design courses. In junior-level design courses, the loads on a structure are usually presented as a “Given” to the students, but the importance of understanding how to determine design loads on a structure is seldom emphasized. To be most effective, students need to be introduced to design load calculations prior to their senior-level courses when some level of competence is needed to apply these concepts and methods in design projects and capstone courses.",3
Towards a knowledge support system for product family design,"Seung Ki Moon, Xiaomeng Chang, Janis Terpenny, Timothy W Simpson, Soundar RT Kumara",2010,Book Handbook of Research in Mass Customization and Personalization: (In 2 Volumes),"This chapter describes research toward creating a knowledge support system (KSS) that consists of knowledge representation, knowledge discovery, and recommendation for product family design. For the proposed KSS, we use an ontology to represent products as functional-based hierarchical structures and describe cost information related to product design. Fuzzy clustering is employed to partition product functions into subsets for identifying a platform and modules in a given product family. Rules related to design knowledge among products are developed using association rule mining. A reasoning tool is used to inference knowledge represented by an ontology and obtain design solutions. We present a prototype system to demonstrate the KSS using a case study involving a family of power tools.",3
Designing a service-learning design project for a first-year engineering course,"Christopher B Williams, Janis P Terpenny, Richard M Goff",2009/1/1,Conference International Design Engineering Technical Conferences and Computers and Information in Engineering Conference,"The creation of an appropriate, meaningful design experience for a first-year engineering design course is challenging as the instructor must balance resource constraints with broad learning objectives and a diverse, and often very large, enrollment. In this paper, the authors present the task of developing a design project for a first-year engineering course as a problem of design. Following a structured design process, the authors articulate the requirements for a successful first-year design project including: learning objectives that are appropriate for a multi-disciplinary group of first-year students and common budgetary and time constraints. Several project alternatives are generated and evaluated in a conceptual design phase. In their description of the embodiment and detail design phases, the authors present the implementation of the selected project concept: ROXIE (“Real Outreach eXperiences In Engineering …",3
Designing and implementing graduate programs in engineering education,"O Hayden Griffin, Alex Aning, Vinod K Lohani, Jean Kampe, Richard Goff, Marie Paretti, Michael P Alley, Jenny Lo, Janis P Terpenny, Thomas Walker, Hassan Aref, Susan Magliaro, Mark Sanders",2005/1/1,"Journal ASEE Annual Conference and Exposition, Conference Proceedings",The design and implementation of graduate programs in engineering education is discussed. It is important to devise innovative ways to attract a broad range of students to pursue engineering careers. One of the main engineering education degree programs is the Thesis Master of Science in Engineering Education focusing on current issues in engineering education and basic research methods. The other most important is the Non-thesis Master of Engineering Education to supplement doctoral work in a traditional engineering discipline or provide advanced study licensed K-12 teachers and postsecondary teachers.,10
An Inter University Collaborative Undergraduate Research Learning Experience For Product Platform Planning,"Timothy Simpson, Robert Stone, Steve Shooter, Janis Terpenny, Soundar Kumara",2005/6/12,Conference 2005 Annual Conference,"Product Platform Planning is an emerging philosophy that calls for the planned development and deployment of families of related products. It is markedly different from the traditional product development process, which focuses on optimized designs for individual products. Product family planning places a much higher demand on management of information of multiple types and from multiple sources. In response, researchers at four universities are collaborating on the development of an information technology infrastructure to support product platform planning. This is a relatively new development in engineering design that is typically not part of the undergraduate education; therefore, we see an intrinsic relationship between the need for integrating the development of research directly with educational enhancements to teach students about these concepts. This paper describes an undergraduate research/learning experience where students from each of the participating institutions worked collaboratively in support of the overall research project. To enhance the students’ education, they spent several weeks in a focused experience at two of the universities with visits to the others. The intent was to broaden their perspectives on the operations at different schools and promote interest in graduate school while learning about product platform planning. We describe the structure of the program along with the activities undertaken by the students. We also include an assessment of the program by the students and plans for improving our future offering of this program.",3
The engineering economics of energy use and capital investment,"Janis Terpenny, Lawrence Ambs, John Dixon, Julia Sullivan, William Sullivan",2003/6/22,Conference 2003 Annual Conference,"A potential capital investment involving energy use or energy conservation is always in competition with other possible uses of the same available capital. The competition may come from other energy related projects, or from proposals for, say new production equipment. The situation of “Pay Now-Save Later” is common for energy related decision problems. The comparison of competing energy-related projects is often complicated with unequal useful lives and typically includes substantial initial investments and a variety of recurring costs. Methods of comparison that are frequently used include payback period, return on investment (ROI), and net present value. Further, unit costing methods are needed to account for unit costs of electricity and steam, and are used to determine incremental change in the busbar price of electricity that is sold to consumers (ie, the price of electricity from the plant excluding outside factors such as transmission lines or local distribution services). Clearly, energy use and energy related capital investment decisions require good skills in economic analysis. They also provide intuitive and rich examples for teaching the basics of engineering economics. This paper provides a primer that can be used to teach the basic principles of economic analysis necessary to understand and evaluate energy-related alternatives. The paper includes an introduction to the concepts of time value of money, present worth, effects of escalating energy costs, levelized cash flows, project life, depreciation, taxes, and interest rates. Methods used to rationally compare alternatives such as simple payback period, discounted payback period …",3
"Design, layout, and tools for effective web-based instruction","Kimberly Sward, Janis P Terpenny, William G Sullivan",2002/11/6,Conference 32nd Annual Frontiers in Education,"Many universities are rushing to be active participants or leaders in online instruction. The effectiveness of materials and the time and effort for the initial development of web-based course materials are significant factors affecting the success of these efforts. Recently, a variety of software tools have emerged to meet the demand for the development and maintenance of web-based course materials. Tools are varied in terms of ease of use, skills needed, time requirements, course support features, initial costs, and licensing fees for users. This paper provides a brief overview of several tools for web-based educational needs. A summary of features, strengths, and limitations is provided Clarity of information for Internet users will be emphasized, including factors and display problems to keep in mind during design and development of online materials. An example based on an existing ""virtual"" classroom for the …",3
A Virtual Classroom For Teaching The Economics Of Engineering Design,"Janis Terpenny, Kimberly Sward, William Sullivan",2001/6/24,Conference 2001 Annual Conference,"As decision-makers, engineers must be knowledgeable and competent in multiple aspects of design. Engineering is more than a problem solving activity focusing on simply the expected performance of designed artifacts. Consideration must also be given to the economic consequences of design decisions on life-cycle issues. A major challenge to undergraduate engineering education is to increase student competency in the economic elements that are such a critical part of the engineering process. Many believe that success in this endeavor requires new methods and materials that actively engage students in learning, are more closely aligned with engineering decision-making, and include real-world problems with industry involvement. The objective of this paper is to report on an experiment that has been conducted to determine whether a virtual classroom environment, developed to address these needs, will improve student proficiency in the economic principles of engineering design.",3
An ontological model and method for obsolescence resolution and management,"Liyu Zheng, Peter A Sandborn, Janis Terpenny, Nihal Orfi",2014,"Publisher DEStech Publications, Inc.","With today's rapid advancement in technologies, commercial high tech components are rendered obsolete more frequently. Such components are often parts of long-life products. Hence, technology obsolescence can make design changes for systems expensive and result in high life-cycle costs. Several tools have been developed to support obsolescence management. While these tools provide benefits and serve as focal points for information related to components, these tools are limited in many respects due to data conflicts, incompleteness and inconsistency. Further, the lack of communication between these tools compounds the limitations making the proactive management of obsolescence even more challenging. This paper addresses gaps in existing tools, by providing a framework capable of integrating heterogeneous sources of information and knowledge that are required to resolve and manage obsolescence. This is implemented through an obsolescence resolution ontological model developed using the ontology editor Protégé. A reasoning method is used to query obsolescence information and resolution strategies to support decision-making. This paper includes two case studies describing results from the application of the ontological model and method and how these facilitate sharing and exchange of knowledge critical to obsolescence management.",2
Ontology-enabled data inquiry for cost analysis and obsolescence mitigation,"Xiaomeng Chang, Liyu Zheng, Janis Terpenny",2013/8/4,Conference International Design Engineering Technical Conferences and Computers and Information in Engineering Conference,"Cost analysis is essential to enterprises developing plans to deal with product obsolescence. Indeed, cost analysis drives the optimization behind obsolescence mitigation planning and the maintenance of long field life sustainment-dominated systems. There are many different obsolescence mitigation solutions. Determining the optimum plan requires inputs from multiple departments within the enterprise such as maintenance, manufacturing, inventory, marketing, purchasing, etc. Moreover, proper analysis requires system records over a long period. As one might expect, these needs present challenges since proper data comes from different sources across multiple departments. In recent years, ontological models have been shown to be good at relation representation and knowledge management. Ontologies have been used to help with data integration and decision-making. This paper puts forward an ontology …",2
Ontology development and optimization for data integration and knowledge management,"Liyu Zheng, Xiaomeng Chang, Janis Terpenny",2013,Journal IIE Annual Conference. Proceedings,"In recent years, ontologies and ontology-based information systems have become widely used in knowledge management and data integration. While the benefits and capabilities are clear, the rapid growth and adoption of such systems have brought challenges to the efficient development, management and optimization of ontologies. For example, ontology development requires a significant amount of repeated steps. And, once developed, ontologies need to be completely, consistently and correctly described in a hierarchy. Further, ontologies also need to be maintained regularly to keep them consistent with changes in domain knowledge and data sources. Facing these challenges, this paper puts forward a method to automatically develop and maintain ontologies, and a method to optimize these ontologies through identifying potential relationships among distributed ontologies. By using these methods …",2
