titles,authors,date,source,descriptions,citations
A comparative study on machine learning algorithms for smart manufacturing: tool wear prediction using random forests,"Dazhong Wu, Connor Jennings, Janis Terpenny, Robert X Gao, Soundar Kumara",2017/7/1,Journal Journal of Manufacturing Science and Engineering,"Manufacturers have faced an increasing need for the development of predictive models that predict mechanical failures and the remaining useful life (RUL) of manufacturing systems or components. Classical model-based or physics-based prognostics often require an in-depth physical understanding of the system of interest to develop closed-form mathematical models. However, prior knowledge of system behavior is not always available, especially for complex manufacturing systems and processes. To complement model-based prognostics, data-driven methods have been increasingly applied to machinery prognostics and maintenance management, transforming legacy manufacturing systems into smart manufacturing systems with artificial intelligence. While previous research has demonstrated the effectiveness of data-driven methods, most of these prognostic methods are based on classical machine learning …",458
A fog computing-based framework for process monitoring and prognosis in cyber-manufacturing,"Dazhong Wu, Shaopeng Liu, Li Zhang, Janis Terpenny, Robert X Gao, Thomas Kurfess, Judith A Guzzo",2017/4/1,Journal Journal of Manufacturing Systems,"Small- and medium-sized manufacturers, as well as large original equipment manufacturers (OEMs), have faced an increasing need for the development of intelligent manufacturing machines with affordable sensing technologies and data-driven intelligence. Existing monitoring systems and prognostics approaches are not capable of collecting the large volumes of real-time data or building large-scale predictive models that are essential to achieving significant advances in cyber-manufacturing. The objective of this paper is to introduce a new computational framework that enables remote real-time sensing, monitoring, and scalable high performance computing for diagnosis and prognosis. This framework utilizes wireless sensor networks, cloud computing, and machine learning. A proof-of-concept prototype is developed to demonstrate how the framework can enable manufacturers to monitor machine health …",269
An ensemble learning-based prognostic approach with degradation-dependent weights for remaining useful life prediction,"Zhixiong Li, Dazhong Wu, Chao Hu, Janis Terpenny",2019/4/1,Journal Reliability Engineering & System Safety,"Remaining useful life (RUL) prediction is crucial for the implementation of predictive maintenance strategies. While significant research has been conducted in model-based and data-driven prognostics, there has been little research reported on the RUL prediction using an ensemble learning method that combines prediction results from multiple learning algorithms. The objective of this research is to introduce a new ensemble prognostics method that takes into account the effects of degradation on the accuracy of RUL prediction. Specifically, this method assigns an optimized, degradation-dependent weight to each learner (i.e., learning algorithm) such that the weighted sum of the prediction results from all the learners predicts the RULs of engineered systems with better accuracy. The ensemble prognostics method is demonstrated using two case studies. One case study is to predict the RULs of aircraft bearings …",122
Harnessing product complexity: step 1—establishing product complexity dimensions and indicators,"Nihal Orfi, Janis Terpenny, Asli Sahin-Sariisik",2011/2/28,Journal The Engineering Economist,"With today's level of market competition and demand for diverse product offerings, more companies are now pressured to increase product variety as a strategy to maintain and increase market share. In addition to its associated direct costs, variety is considered the main source of product complexity, which has been proven to negatively impact product development time, productivity, costs, and customer satisfaction.",109
Cybersecurity for digital manufacturing,"Dazhong Wu, Anqi Ren, Wenhui Zhang, Feifei Fan, Peng Liu, Xinwen Fu, Janis Terpenny",2018/7/1,Journal Journal of manufacturing systems,"Digital manufacturing aims to create highly customizable products with higher quality and lower costs by integrating Industrial Internet of Things, big data analytics, cloud computing, and advanced robots into manufacturing plants. As manufacturing machines are increasingly retrofitted with sensors as well as connected via wireless networks or wired Ethernet, digital manufacturing systems are becoming more accessible than ever. While advancement in sensing, artificial intelligence, and wireless technologies enables a paradigm shift in manufacturing, cyber-attacks pose significant threats to the manufacturing sector. This paper presents a review of cybersecurity in digital manufacturing systems from system characterization, threat and vulnerability identification, control, and risk determination aspects as well as identifies challenges and future work.",96
Design for adaptability (DFAD)—a new concept for achieving sustainable design,"Mary E Kasarda, Janis P Terpenny, Dan Inman, Karl R Precoda, John Jelesko, Asli Sahin, Jaeil Park",2007/12/1,Journal Robotics and Computer-Integrated Manufacturing,"This paper discusses the concepts associated with a new methodology, design for adaptation (DFAD), under development for achieving advanced sustainable designs. The DFAD methodology concept is based on the hypothesis that product life ends because a product is unable to adapt to change. A product may be retired for myriad reasons including that it is broken, out of style, or has become inefficient due to technology obsolescence. In these cases, the product was not able to adapt to change—it was unable to self-heal, it could not modify or reconfigure to meet changing fashion needs, or it could not be upgraded, for physical or economic reasons, to utilize new technology. To address these and similar issues, we are developing the DFAD methodology. DFAD is based on classical control theory and products are conceptualized and modeled as dynamic systems with feedback control strategies to respond, or …",94
Cloud-based machine learning for predictive analytics: Tool wear prediction in milling,"Dazhong Wu, Connor Jennings, Janis Terpenny, Soundar Kumara",2016/12/5,Conference 2016 IEEE International Conference on Big Data (Big Data),"The proliferation of real-time monitoring systems and the advent of Industrial Internet of Things (IIoT) over the past few years necessitates the development of scalable and parallel algorithms that help predict mechanical failures and remaining useful life of a manufacturing system or system components. Classical model-based prognostics require an in-depth physical understanding of the system of interest and oftentimes assume certain stochastic or random processes. To overcome the limitations of model-based methods, data-driven methods such as machine learning have been increasingly applied to prognostics and health management (PHM). While machine learning algorithms are able to build accurate predictive models, large volumes of training data are required. Consequently, machine learning techniques are not computationally efficient for data-driven PHM. The objective of this research is to create a …",75
Development and utilization of ontologies in design for manufacturing,"Xiaomeng Chang, Rahul Rai, Janis Terpenny",2010/2/1,Journal Journal of Mechanical Design,"There are many challenges associated with the design and realization of fast changing highly customized products. One promising approach is to implement design for manufacturing (DFM) strategies aimed at reducing production costs without compromising product quality. For manufacturers doing business in a globally distributed market place, effective reuse and sharing of the DFM knowledge in a collaborative environment is essential. In recent years, ontologies are increasingly used for knowledge management in engineering. Here, ontology is defined as a formal specification of domain knowledge that can be used to define a set of data and structure that enables experts to share information in a domain of interest, to aid information reasoning, and to manage and reuse data. The primary goal of this paper is to put forward the process of ontology development and utilization for DFM and to study the most …",72
Forecasting obsolescence risk and product life cycle with machine learning,"Connor Jennings, Dazhong Wu, Janis Terpenny",2016/8/15,"Journal IEEE Transactions on Components, Packaging and Manufacturing Technology","Rapid changes in technology have led to an increasingly fast pace of product introductions. For long-life systems (e.g., planes, ships, and nuclear power plants), rapid changes help sustain useful life, but at the same time, present significant challenges associated with obsolescence management. Over the years, many approaches for forecasting obsolescence risk and product life cycle have been developed. However, gathering inputs required for forecasting is often subjective and laborious, causing inconsistencies in predictions. To address these issues, the objective of this research is to develop a machine learning-based methodology capable of forecasting obsolescence risk and product life cycle accurately while minimizing maintenance and upkeep of the forecasting system. Specifically, this new methodology enables prediction of both the obsolescence risk level and the date when a part becomes obsolete. A …",68
An ontology-based support for product conceptual design,"Xiaomeng Chang, Asli Sahin, Janis Terpenny",2008/12/1,Journal Robotics and computer-integrated manufacturing,"The research presented in this paper is a follow-up of our prior work involving the development of a graphical modeling tool to support designers at the conceptual design stage. To close the loop for supporting designers in generating design concepts flexibly, fast, and easily, an ontology-based approach for knowledge management that works along with the graphical modeling tool is discussed. Ontology and databases for the tool are developed to promote the systematic capture of design knowledge and efficient reuse of the design knowledge selection. In order to locate the proper information and query the data from the databases, the relationship between the ontology and databases, the data analysis process, ontology enrichment, and the ontology-based query engine are built to offer users multiple design results according to users’ requirements. A tire design example is presented to demonstrate the proposed …",68
Interactive evolutionary solution synthesis in fuzzy set-based preliminary engineering design,"Jiachuan Wang, Janis Terpenny",2003/4,Journal Journal of intelligent manufacturing,"This paper describes an interactive evolutionary approach to synthesize component-based preliminary engineering design problems. This approach is intended to address preliminary engineering design as an evolutionary synthesis process, with the needs for human-computer interaction in a changing environment caused by uncertainty and imprecision inherent in the early design stages. It combines an agent-based hierarchical design representation, set-based design generation, fuzzy design trade-off strategy and interactive design adaptation into evolutionary synthesis to gradually refine and reduce the search space while maintaining solution diversity to accommodate future changes. The fitness function of solutions employed is not fixed but adapted according to elicited human value judgment and constraint change. It incorporates multi-criteria evaluation as well as constraint satisfaction. This new …",65
Component obsolescence risk assessment,"Craig Josias, Janis P Terpenny, Kenneth J McLean",2004,Journal IIE Annual Conference. Proceedings,"Custom low volume products and systems, such as those utilized by military and avionics applications; often make use of commercial high-tech components. In the past decade, technology has advanced very rapidly causing such components to have a shortened life span. Newer and better technologies are being introduced frequently, rendering components obsolete. Yet, custom low volume products and systems such as ships, submarines and aircraft can be in use for decades. Being proactive about obsolescence is critical to maintaining fully capable products and systems and satisfied customers. This paper presents an obsolescence risk measurement tool that is being developed to better predict and manage component obsolescence. Critical variables in this assessment that are precursors to a component becoming obsolete are described. A multiple regression model developed for forecasting obsolescence is presented. An industrial case study with Kollmorgen, an international manufacturer of motion control systems, is also presented.",64
Knowledge interaction with genetic programming in mechatronic systems design using bond graphs,"Jiachuan Wang, Zhun Fan, Janis P Terpenny, Erik D Goodman",2005/4/25,"Journal IEEE Transactions on Systems, Man, and Cybernetics, Part C (Applications and Reviews)","This paper describes a unified network synthesis approach for the conceptual stage of mechatronic systems design using bond graphs. It facilitates knowledge interaction with evolutionary computation significantly by encoding the structure of a bond graph in a genetic programming tree representation. On the one hand, since bond graphs provide a succinct set of basic design primitives for mechatronic systems modeling, it is possible to extract useful modular design knowledge discovered during the evolutionary process for design creativity and reusability. On the other hand, design knowledge gained from experience can be incorporated into the evolutionary process to improve the topologically open-ended search capability of genetic programming for enhanced search efficiency and design feasibility. This integrated knowledge-based design approach is demonstrated in a quarter-car suspension control system …",60
Digital design and manufacturing on the cloud: A review of software and services—RETRACTED,"Dazhong Wu, Janis Terpenny, Dirk Schaefer",2017/2,Source AI EDAM,"This paper (Wu 2016), which was published in AI EDAM online on August 22, 2016, has been retracted by Cambridge University Press as it is very similar in content to a published ASME Conference Proceedings paper. The article in question and the ASME Conference Proceedings paper were submitted for review with AI EDAM and the ASME at similar times, but copyright was assigned to ASME before the paper was accepted in AI EDAM and therefore the article in AI EDAM is being retracted. (In recent years, industrial nations around the globe have invested heavily in new technologies, software, and services to advance digital design and manufacturing using cyber-physical systems, data analytics, and high-performance computing. Many of these initiatives, such as cloud-based design and manufacturing, fall under the umbrella of what has become known as Industry 4.0 or Industrial Internet and are often hailed …",59
Predictive modelling of surface roughness in fused deposition modelling using data fusion,"Dazhong Wu, Yupeng Wei, Janis Terpenny",2019/6/18,Journal International Journal of Production Research,"To realise high quality, additively manufactured parts, real-time process monitoring and advanced predictive modelling tools are crucial for accelerating quality assurance in additive manufacturing. While previous research has demonstrated the effectiveness of physics- and model-based diagnosis and prognosis for additive manufacturing, very little research has been reported on real-time monitoring and predictive modelling of the surface roughness of additively manufactured parts. This paper presents a data fusion approach to predicting surface roughness in fused deposition modelling (FDM) processes. The predictive models are trained using random forests (RFs), support vector regression (SVR), ridge regression (RR), and least absolute shrinkage and selection operator (LASSO). A real-time monitoring system is developed to monitor the health condition of a FDM machine in real-time using multiple sensors …",55
Cloud-based parallel machine learning for tool wear prediction,"Dazhong Wu, Connor Jennings, Janis Terpenny, Soundar Kumara, Robert X Gao",2018/4/1,Journal Journal of Manufacturing Science and Engineering,"The emergence of cloud computing, industrial internet of things (IIoT), and new machine learning techniques have shown the potential to advance prognostics and health management (PHM) in smart manufacturing. While model-based PHM techniques provide insight into the progression of faults in mechanical components, certain assumptions on the underlying physical mechanisms for fault development are required to develop predictive models. In situations where there is a lack of adequate prior knowledge of the underlying physics, data-driven PHM techniques have been increasingly applied in the field of smart manufacturing. One of the limitations of current data-driven methods is that large volumes of training data are required to make accurate predictions. Consequently, computational efficiency remains a primary challenge, especially when large volumes of sensor-generated data need to be processed in …",53
Ontology-based data integration and decision support for product e-Design,"Xiaomeng Chang, Janis Terpenny",2009/12/1,Journal Robotics and Computer-Integrated Manufacturing,"Currently, computer-based support tools are widely used to facilitate the design process and have the potential to reduce design time, decrease product cost and enhance product quality. Although there are promising information systems to manage product lifecycle and product-related data, including product data management (PDM) and product lifecycle management (PLM), significant limitations still exist, where information required to make decisions may not be available, may be lacking consistency, and may not be expressed in a general way for sharing between systems. Moreover, there remains little support for decision making that considers multiple complex technical and economical criteria, relations, and objectives in product design. To address these problems, this paper presents a framework for an ontology-based data integration and decision support environment for e-Design. The framework can guide …",49
Toward a multi-agent information management infrastructure for product family planning and mass customisation,"Steven B Shooter, Timothy W Simpson, Soundar RT Kumara, Robert B Stone, Janis P Terpenny",2005/1/1,Journal International Journal of Mass Customisation,"Development of complex new products requires numerous decisions by many individuals and groups, which are often geographically and temporally distributed. There is a need to share and coordinate distributed resources and synchronise decisions. Recent advances in information technology (IT) pose an untapped potential in assisting the capture, storage, retrieval, and facilitated use of product development information. By sharing assets such as components, processes, and knowledge across a family of products, companies can efficiently develop differentiated products and increase the flexibility and responsiveness of their product realisation process. This paper describes a recent effort in realising an information management infrastructure for product family planning and platform customisation. Particular focus is on current research thrusts: an evolutionary approach to product platforming; a bottom-up …",49
Principles for managing technological product obsolescence,"Rahul Rai, Janis Terpenny",2008/11/25,Journal IEEE Transactions on components and packaging technologies,"Products evolve to accommodate competitive market pressures, rapid rates of technology change, and constant improvements in performance and functionality. While adding functionality and value, the fast moving technologies also make products obsolete quickly. One of the primary reasons for product obsolescence is technological obsolescence which results when consumers are attracted to functions in newer models of products that are more technologically advanced. One way to deal with problem is ldquopiggybacking,rdquo a strategy that enables renewed functionality of a technologically obsolete product through the integration or add-on of a secondary device or component. Not to be confused with upgrading strategies, piggybacking requires a device that fits adjacent to, upon, or within the existing product architecture. Piggybacking is an attractive strategy for consumer electronic products that are …",46
Utilizing assistive technology design projects and interdisciplinary teams to foster inquiry and learning in engineering design,"Janis Terpenny, Richard Goff, Mitzi Vernon, William Green",2006/1/1,"Description In industry, successful products and systems usually require a collaborative design process with a multitude of participating stakeholders (customers, sales/marketing, industrial designers, engineering designers from various engineering disciplines, manufacturing, distribution, etc.). Addressing this future work environment, interdisciplinary teaming has become an important element of student design projects. For the last several years at Virginia Tech, interdisciplinary design projects have been created with teams of students from the first year Exploration of Engineering Design course in the College of Engineering and students from the second year Industrial Design Program in the College of Architecture and Urban Studies. While students and faculty alike have appeared to enjoy the exchange of different perspectives and insights that interdisciplinary collaboration appears to offer, there has heretofore been no effort …","In industry, successful products and systems usually require a collaborative design process with a multitude of participating stakeholders (customers, sales/marketing, industrial designers, engineering designers from various engineering disciplines, manufacturing, distribution, etc.). Addressing this future work environment, interdisciplinary teaming has become an important element of student design projects. For the last several years at Virginia Tech, interdisciplinary design projects have been created with teams of students from the first year Exploration of Engineering Design course in the College of Engineering and students from the second year Industrial Design Program in the College of Architecture and Urban Studies. While students and faculty alike have appeared to enjoy the exchange of different perspectives and insights that interdisciplinary collaboration appears to offer, there has heretofore been no effort …",37
Design refresh planning models for managing obsolescence,"Liyu Zheng, Janis Terpenny, Peter Sandborn",2015/12/2,Journal Iie Transactions,"Fast moving technologies cause high-tech components to have shortened life cycles, rendering them quickly obsolete. Obsolescence is a significant problem for systems whose operational and support life is much longer than the procurement lifetimes of their constituent components. Long field-life systems such as aircraft, ships, and other systems require many updates of components and technology over their life to remain in manufacture and supportable. Design refresh planning is a strategic way of managing obsolescence. In this article, efficient mathematical models based on Integer Programming for design refresh planning are developed to determine the plan that minimizes the total obsolescence management costs. Decisions are made on when to execute design refreshes (dates) and what obsolete/non-obsolete system components should be replaced at a specific design refresh. Data uncertainty is also …",36
Toward an information management infrastructure for product family planning and platform customization,"SB Shooter, TW Simpson, SRT Kumara, RB Stone, JP Terpenny",2005,Journal International Journal of Mass Customization,,34
"RETRACTED: Cloud-Based Design, Engineering Analysis, and Manufacturing: A Cost-Benefit Analysis","Dazhong Wu, Janis Terpenny, Wolfgang Gentzsch",2015/1/1,Source Procedia manufacturing,"Our policy states that “Submission of an article implies that the work described has not been published previously (except in the form of an abstract or as part of a published lecture or academic thesis or as an electronic preprint, see http://www. elsevier. com/postingpolicy), that it is not under consideration for publication elsewhere, that its publication is approved by all authors and tacitly or explicitly by the responsible authorities where the work was carried out, and that, if accepted, it will not be published elsewhere in the same form, in English or in any other language, including electronically without the written consent of the copyright-holder”. As such this article represents a violation of the journal's publishing policies.",31
