titles,authors,date,source,descriptions,citations
Hydraulic conductivity of geosynthetic clay liners to low-level radioactive waste leachate,"Kuo Tian, Craig H Benson, William J Likos",2016/8/1,Journal Journal of Geotechnical and Geoenvironmental Engineering,"Hydraulic conductivity was evaluated for eight commercially available geosynthetic clay liners (GCLs) permeated with leachate characteristic of low-level radioactive waste (LLW) disposal facilities operated by the U.S. Department of Energy (DOE). Two of the GCLs (CS and GS) contained conventional sodium bentonite (Na-B). The others contained a bentonite–polymer mixture (CPL, CPH, GPL1, GPL2, and GPH) or bentonite–polymer composite (BPC). All GCLs (except GPL2 and GPH) were permeated directly with two synthetic LLW leachates that are essentially identical, except one has no radionuclides (nonradioactive synthetic leachate, or NSL) and the other has radionuclides (radioactive synthetic leachate, or RSL). Hydraulic conductivities to RSL and NSL were identical. For the CS and GS GCLs, the hydraulic conductivity gradually increased by a factor of 5–25 because divalent cations in the leachate replaced …",96
Polymer elution and hydraulic conductivity of bentonite–polymer composite geosynthetic clay liners,"Kuo Tian, William J Likos, Craig H Benson",2019/10/1,Journal Journal of Geotechnical and Geoenvironmental Engineering,Hydraulic conductivity tests were conducted on two commercially available bentonite–polymer composite (BPC) geosynthetic clay liners (GCLs) containing the same dry blend of sodium bentonite (NaB) and polymer sandwiched between two nonwoven geotextiles (GTs) bound by needlepunching: a bentonite–polymer GCL (BP GCL) and bentonite–polymer GCL with silt film (BPS GCL). The GCLs were essentially identical except that the BPS GCL contained a woven slit-film GT to constrain polymer elution. The slit-film GT was located inside the GCL adjacent to the downstream nonwoven GT. The test liquids were deionized (DI) water and 20–500 mM  representing dilute to high-concentration permeant solutions. Effluent from the hydraulic conductivity tests was analyzed for total organic carbon (TOC) to quantify polymer elution. Scanning electron microscopy (SEM) was used to capture how the solution chemistry …,55
Effect of ammonium on the hydraulic conductivity of geosynthetic clay liners,"Melissa C Setz, Kuo Tian, Craig H Benson, Sabrina L Bradshaw",2017/12/1,Journal Geotextiles and Geomembranes,"Hydraulic conductivity and swell index tests were conducted on a conventional geosynthetic clay liner (GCL) containing sodium-bentonite (Na-B) using 5, 50, 100, 500, and 1000 mM ammonium acetate (NH4OAc) solutions to investigate how NH4+ accumulation in leachates in bioreactor and recirculation landfills may affect GCLs. Control tests were conducted with deionized (DI) water. Swell index of the Na-B was 27.7 mL/2 g in 5 mM NH4+ solution and decreased to 5.0 mL/2 g in 1000 mM NH4+ solution, whereas the swell index of Na-B in DI water was 28.0 mL/2 g. Hydraulic conductivity of the Na-B GCL to 5, 50, and 100 mM NH4+ was low, ranging from 1.6–5.9 × 10−11 m/s, which is comparable to the hydraulic conductivity to DI water (2.1 × 10−11 m/s). Hydraulic conductivities of the Na-B GCL permeated with 500 and 1000 mM NH4+ solutions were much higher (e.g., 1.6–5.2 × 10−6 m/s) due to suppression of …",44
Antioxidant depletion and service life prediction for HDPE geomembranes exposed to low-level radioactive waste leachate,"Kuo Tian, Craig H Benson, James M Tinjum, Tuncer B Edil",2017/6/1,Journal Journal of Geotechnical and Geoenvironmental Engineering,"Antioxidant depletion was evaluated in high-density polyethylene (HDPE) geomembrane (GM) coupons immersed in radioactive synthetic leachate (RSL) representative of leachate in low-level radioactive waste (LLW) disposal facilities operated by the U.S. Department of Energy’s environmental restoration programs. Depletion was assessed at four temperatures (25, 50, 70, and 90°C). Comparative tests were conducted with nonradioactive synthetic leachate (NSL) having the same chemistry as RSL, except radionuclides were excluded. Control tests were conducted with deionized (DI) water. One-sided exposure tests were also conducted with the HDPE GM in RSL at 70 and 90°C. Specimens were removed periodically and tested to determine antioxidant depletion, melt flow index (MFI), crystallinity, and stress crack resistance. Standard and high-pressure oxidative induction time (OIT) tests were conducted to …",27
Effect of an anion ratio on the hydraulic conductivity of a bentonite-polymer geosynthetic clay liner,"Kuo Tian, Craig H Benson, William J Likos",2017,Book Geotechnical Frontiers 2017,"Hydraulic conductivity and swell index tests were conducted on a commercially available geosynthetic clay liner (GCL) containing a dry-blended bentonite-polymer (B-P) mixture using solutions with a single monovalent cation (Na+) and varying anion ratio, R, defined as the molar concentration ratio of Cl- to SO42-. Na+ solutions with pure Cl- or SO42- and with anion ratios of 5 and 20 were used as permeant liquids. Swell index of the B-P in 300 mM Na+ solutions was independent of anion ratio (SI ≈ 22.5 mL/2 g for all solutions). However, hydraulic conductivity of the B-P GCL permeated with NaCl was approximately three orders of magnitude greater than the hydraulic conductivity to Na2SO4. Comparative tests were conducted on a conventional GCL with sodium-bentonite (Na-B) with 100 and 300 mM Na+ solutions with pure SO42- and pure Cl- as anions. Hydraulic conductivity of the Na-B GCL was unaffected …",27
Geochemical characteristics and toxic elements in alumina refining wastes and leachates from management facilities,"Chunwei Sun, Jiannan Chen, Kuo Tian, Daoping Peng, Xin Liao, Xiyong Wu",2019/4,Journal International Journal of Environmental Research and Public Health,"A nationwide investigation was carried out to evaluate the geochemical characteristics and environmental impacts of red mud and leachates from the major alumina plants in China. The chemical and mineralogical compositions of red mud were investigated, and major, minor, and trace elements in the leachates were analyzed. The mineral and chemical compositions of red mud vary over refining processes (i.e., Bayer, sintering, and combined methods) and parental bauxites. The main minerals in the red mud are quartz, calcite, dolomite, hematite, hibschite, sodalite, anhydrite, cancrinite, and gibbsite. The major chemical compositions of red mud are Al, Fe, Si, Ca, Ti, and hydroxides. The associated red mud leachate is hyperalkaline (pH > 12), which can be toxic to aquatic life. The concentrations of Al, Cl−, F−, Na, NO32−, and SO42− in the leachate exceed the recommended groundwater quality standard of China by up to 6637 times. These ions are likely to increase the salinization of the soil and groundwater. The minor elements in red mud leachate include As, B, Ba, Cr, Cu, Fe, Ni, Mn, Mo, Ti, V, and Zn, and the trace elements in red mud leachate include Ag, Be, Cd, Co, Hg, Li, Pb, Sb, Se, Sr, and Tl. Some of these elements have the concentration up to 272 times higher than those of the groundwater quality standard and are toxic to the environment and human health. Therefore, scientific guidance is needed for red mud management, especially for the design of the containment system of the facilities.",26
Pore-scale imaging of polymer-modified bentonite in saline solutions,"Kuo Tian, William J Likos, Craig H Benson",2016,Book Geo-Chicago 2016,"Bentonite-polymer mixtures (B-P) used in geosynthetic clay liners (GCLs) have been shown to maintain low hydraulic conductivity in aggressive (e.g., high ionic strength) permeant solutions detrimental to untreated sodium-bentonite (Na-B). While a number of hypotheses have been proposed, the underlying physical and chemical mechanisms for improved chemical compatibility and low hydraulic conductivity of B-P GCL remain poorly understood. This paper describes a suite of scanning electronic microscopy (SEM) analyses conducted to observe pore-scale structure of B-P hydrated with deionized water and saline solutions. Polymer observed in B-P exposed to deionized water had a remnant three-dimensional network structure, with polymer chains forming bridges among clay clusters and filling large voids in the inter-cluster pore space. Polymer observed in specimens exposed to 20 and 200 mM CaCl2 …",22
Effect of specimen preparation on the swell index of bentonite-polymer GCLs,"Christian Wireko, Binte Zainab, Kuo Tian, Tarek Abichou",2020/12/1,Journal Geotextiles and Geomembranes,"Experiments were conducted to investigate how specimen preparation (crushing and sieving) affects the swell index (SI) of bentonite-polymer (B–P) composites and the relationship between SI and hydraulic conductivity of B–P GCLs. Seven B–P and one Na–B GCLs were used in this study. Tests were conducted using DI water and synthetic municipal solid waste incineration ash leachates. Specimens were prepared using the ASTM D5890 and two alternative methods prior to SI testing. For both Na–B and B–P composites, <100% of the specimen passed through the #100 sieve regardless of the amount of crushing performed using a mortar and pestle. SIs and loss on ignitions (LOI) of the portion of the B–P composites passing #100 sieve were comparable to the Na–B, whereas the B–P specimen retained on #100 sieve had very high SIs and LOIs. These observations indicate that crushing and sieving of the B–P …",16
Radiation dose and antioxidant depletion in a HDPE geomembrane,"Kuo Tian, Craig H Benson, Youming Yang, James M Tinjum",2018/8/1,Journal Geotextiles and Geomembranes,"The impact of α and β radiation on antioxidant depletion in smooth high-density polyethylene (HDPE) geomembranes (GMs) is described. Smooth HDPE GMs having different thickness (0.04-mm, 0.1-mm, 0.2-mm) were created by mechanically pulverizing sections of 2-mm-thick smooth HDPE GM and extruding the polymer at different thicknesses using a film blowing machine. The 2-mm-thick smooth HDPE GM was also used in the experiments. HDPE GM specimens were exposed to sealed sources of 241Am and 99Tc for 1–50 h to simulate the impact of α and β radiation from U and 99Tc in low-level radioactive waste (LLW) leachate. Standard oxidative induction time (OIT) tests were conducted to determine antioxidant depletion. No change in OIT occurred in the 2-mm-thick HDPE GM after exposure to sealed sources of 241Am and 99Tc for 50 h. In much thinner GMs (e.g., 0.04 mm), however, significant …",16
Hydraulic conductivity of bentonite-polymer geosynthetic clay liners to coal combustion product leachates,"Binte Zainab, Christian Wireko, Dong Li, Kuo Tian, Tarek Abichou",2021/10/1,Journal Geotextiles and Geomembranes,"Hydraulic conductivity of seven geosynthetic clay liners (GCLs) to synthetic coal combustion product (CCP) leachates were evaluated in this study. The leachates are chemically representative of typical and worst scenarios observed in CCP landfills. The ionic strength (I) of the synthetic CCP leachates ranged from 50 mM to 4676 mM (TCCP-50, LRMD-96, TFGDS-473, LR-2577, HI-3179 and HR-4676). One of the GCLs contained conventional sodium bentonite (Na–B) and the other six contained bentonite-polymer (B–P) mixture with polymer loadings ranging from 0.5% to 12.7%. Hydraulic conductivity tests were conducted at an effective confining stress of 20 kPa. The hydraulic conductivity of the Na–B GCLs were >1 × 10−10 m/s when permeated with all six CCP leachates, whereas the B–P GCLs with sufficient polymer loading maintained low hydraulic conductivity to synthetic CCP leachates. All the B–P GCLs …",15
Effect of polymer amendment on hydraulic conductivity of bentonite in calcium chloride solutions,"Yan-Jun Du, Sheng-Qiang Shen, Kuo Tian, Yu-Ling Yang",2021/2/1,Journal Journal of Materials in Civil Engineering,"Hydraulic conductivity of polyanionic cellulose (PAC)–amended bentonite (PB) in calcium chloride () solutions was investigated to access its chemical compatibility in vertical cutoff walls application. PB was synthesized by mixing conventional bentonite (CB) powder with PAC (2% dry weight). The specific gravity (), liquid limit (), pH, swell index (SI), and cation exchange capacity (CEC) of CB and PB were measured, and hydraulic conductivities and microstructures of the PB and CB filter cakes were evaluated by performing modified fluid loss (MFL) tests and scanning electron microscopy–energy dispersive spectroscopy (SEM-EDS) analyses, respectively. The results showed that PB had higher , SI, and CEC but lower  and pH than CB; in particular, PB possessed higher SI in  solution as compared to CB. Increase in the applied overall pressure and decrease in the  concentration resulted in a …",15
Containing bauxite liquor using bentonite-polymer composite geosynthetic clay liners,"Kuo Tian, Craig H Benson",2019,Conference Proceedings of the 8th International Congress on Environmental Geotechnics Volume 2: Towards a Sustainable Geoenvironment 8th," Experiments were conducted to evaluate the hydraulic conductivity of geosynthetic clay liners (GCLs) to bauxite liquor from aluminum refining. Tests were conducted with a GCL containing conventional sodium-bentonite (Na-B) and one GCLs containing a bentonite-polymer composite. B-P has polymer loading of 6.8%. Hydraulic conductivity tests were conducted on the GCLs with bauxite liquor in flexible-wall permeameters following procedures in ASTM D6766. The bauxite liquor used in the experiments has pH 13 and ionic strength = 700 mM. Hydraulic conductivity of the Na-B GCL increased to approximately 10−7 m/s during permeation, whereas the B-P GCL maintained low hydraulic conductivity (~ 4.3 × 10−12 m/s). Suppression of bentonite swelling by the bauxite liquor is the primary factor responsible for the higher hydraulic conductivity of the Na-B GCL. Low hydraulic conductivity of the B-P …",15
Chemical characteristics of leachate in low-level radioactive waste disposal facilities,"Kuo Tian, Craig H Benson, James M Tinjum",2017/10/1,"Journal Journal of Hazardous, Toxic, and Radioactive Waste","Leachate data from four low-level radioactive waste and mixed waste disposal facilities operated by the U.S. DOE for environmental restoration programs are presented and analyzed. Constituents in the leachates are categorized into four groups: inorganic macrocomponents, metals and metalloids (e.g., Cu, Fe, and Zn), radionuclides, and organic compounds. The leachates are circumneutral (pH from 5.7 to 9.1) and generally oxidizing (redox potential, Eh, ranging from  to 344 mV, averaging from 72 to 144.5 mV at each of the four facilities). Ionic strength of the leachate ranges from 2.15 to 135.86 mM. Marcocomponents include  (0.77–24.90 mM),  (0.86–30.20 mM),  (0.19–38.1 mM),  (0.04–1.94 mM),  (0.33–19.27 mM),  (0.39–29.60 mM), and  or  (0.00021–38.30 mM). Metals and metalloids in the leachates include Al (0.18–87 μM), As (0.033–1.89 μM), Ba (0.16–3.3 μM), Cu (0.0047–5.4 μM), Fe (0.022–43 μM), Li …",7
Chemical compatibility of geosynthetic clay liners to aggressive bauxite liquor,"Kuo Tian, Craig H Benson",2017,Journal Proceedings of 35th international ICSOBA conference,"Experiments were conducted to evaluate the effect of an aggressive bauxite liquor on the hydraulic conductivity of geosynthetic clay liners (GCLs) used for composite liners in disposal facilities for red mud from aluminum refining. Tests were conducted on two sodium-bentonite (Na-B) GCL and one bentonite-polymer (BP) composite GCL. The Na-B GCLs contained powdered or granular bentonite. The BP GCL contained a mixture of granular NaB and dry water-soluble polymer. All GCLs were prehydrated to 100% water content with a 2500 mg/L NaCl solution prior to permeation. The Na-B GCL with granular bentonite was permeable to bauxite liquor (5.0 x10-10 m/s), whereas the Na-B GCL with powdered bentonite maintained low hydraulic conductivity (1.8 x10-11 m/s). Hydraulic conductivity of the BP GCL was very low initially (1x10-12 m/s), but increased over time to 1.3 x10-10 m/s as polymer was eluted from the pore space. Clogging of fine pores by precipitates is hypothesized as the mechanism for the low hydraulic conductivity of the Na-B GCL with powdered bentonite. The findings indicate that GCLs used for composite liners in disposal facilities for residuals from aluminum refining can have very different hydraulic conductivity depending on the characteristics of the bentonite or bentonite-polymer mixture in the GCL. Construction specifications should ensure that the GCL that is installed is chemically compatible with the liquid to be contained.",6
Long-term performance of geosynthetic liner materials in low-level radioactive waste disposal facilities,Kuo Tian,2015,Institution The University of Wisconsin-Madison,"Low-level radioactive waste (LLW) disposal facilities employ geosynthetic liner materials [eg, high-density polyethylene (HDPE) geomembrane (GM) and geosynthetic clay liner (GCL)] in multilayer barrier systems to control the flux of contaminants into the environment. Long-term durability of geosynthetics in contact with LLW leachate is of particular importance because the design life of LLW barrier systems is commonly 1000 yr.",5
Effect of incineration ash leachates on the hydraulic conductivity of bentonite-polymer composite geosynthetic clay liners,"Christian Wireko, Tarek Abichou, Kuo Tian, Binte Zainab, Zhiming Zhang",2022/2/15,Journal Waste Management,"A study was conducted to evaluate the hydraulic conductivity (k) of six bentonite-polymer composite (BPC) geosynthetic clay liners (GCLs) using five synthetic municipal solid waste incineration ash (IA) leachates with ionic strength (I) ranging from 174 to1978 mM. The BPC GCLs contained a dry blend of bentonite and proprietary polymers and had polymer loading ranging from 0.5 to 5.5%. The polymers used in the BPC GCLs were classified as linear polymer (LP) or crosslinked polymer (CP) based on the swelling characteristics of specimens extracted from the GCLs. Comparable hydraulic conductivity tests were also performed on two conventional bentonite (CB) GCLs as controls. The BPC GCLs had k of 2.6 – 6.7 × 10-11 m/s when permeated with IA leachate with I = 174 mM, whereas the CB GCLs had k > 5.0 × 10-8 m/s when permeated with the same leachate. However, k of the BPC GCLs ranged from the …",3
Antioxidant depletion in HDPE geomembranes exposed to low-level radioactive waste leachate,"Kuo Tian, James M Tinjum, Craig H Benson, Tuncer B Edil",2014,Book Geo-Congress 2014: Geo-characterization and Modeling for Sustainability,"Low-level radioactive waste (LLW) and mixed waste (MW) disposal facilities in the United States are required to have a service life in excess of 1000 yr. Understanding the rate of degradation of high-density polyethylene (HDPE) geomembranes used in LLW and MW facilities is necessary to assess their service life. HDPE geomembranes (GM) undergo degradation in three stages: antioxidant depletion (Stage I), induction time to the onset of polymer degradation (Stage II), and polymer property degradation (Stage III). This paper focuses on antioxidant depletion in LLW leachate. HDPE geomembrane coupons (2-mm thick) were immersed in radioactive synthetic leachate (RSL) with chemistry representative of leachate in LLW disposal facilities operated by the U.S. Department of Energy's environmental restoration programs. Depletion was assessed at four temperatures (25, 50, 70, and 90 °C). To identify the effect of …",3
Effect of effective stress on hydraulic conductivity of bentonite–polymer geosynthetic clay liners to coal combustion product leachates,"Dong Li, Binte Zainab, Kuo Tian",2021/11,Journal Environmental Geotechnics,"Experiments were conducted to evaluate the hydraulic conductivity of five geosynthetic clay liners (GCLs) permeated with four synthetic coal combustion product (CCP) leachates (ionic strength = 473–4676 mM). One of the GCLs contained conventional sodium bentonite (Na-B), and the other four GCLs contained a bentonite–polymer (B-P) composites with polymer loading ranging from 0.5 to 12.7% (B-P-0.5–B-P-12.7). Hydraulic conductivity tests were conducted at 20 kPa until reaching hydraulic and chemical equilibrium and then the effective confining stress was increased incrementally from 20 to 100, 250 and 500 kPa. The hydraulic conductivity of B-P GCLs with high polymer loading showed a faster decreasing trend than that of Na-B and B-P GCLs with lower polymer loading as the effective confining stress increased. Additionally, the hydraulic conductivity of GCLs permeated with a synthetic CCP leachate …",2
Lithium extraction to determine ammonium in the exchange complex of bentonite,"Melissa C Setz, Craig H Benson, Sabrina L Bradshaw, Kuo Tian",2018/8/16,Journal Geotechnical Testing Journal,"ASTM D7503, Standard Test Method for Measuring the Exchange Complex and Cation Exchange Capacity of Inorganic Fine-Grained Soils, is used to determine soluble and bound cation concentrations as well as the cation exchange capacity of fine-grained soils used in barrier systems for waste containment, including bentonite in geosynthetic clay liners (GCLs). ASTM D7503 prescribes the use of 1 M ammonium acetate (NH4OAc) as an extraction liquid for bound cations, which masks ammonium (NH4+) that may be in the exchange complex in bentonite in contact with municipal solid waste (MSW) leachate. A 1 M lithium bromide (LiBr) extraction liquid is proposed as an alternative to the 1 M NH4OAc in ASTM D7503 so that NH4+ in the exchange complex can be quantified without interfering with measurement of other bound cations of interest for waste containment. Nearly the same distribution of bound major cations was obtained using the method in ASTM D7503 and the proposed alternative using 1 M LiBr for two bentonites from two new GCLs (not permeated). Using the 1 M LiBr method revealed substantial NH4+ bound to eight bentonites obtained from GCLs that had been permeated with different MSW leachates. The bound NH4+ concentration varied directly with NH4+ concentration in the leachates, and this variance explained a charge imbalance obtained from tests conducted on the bentonites using the standard method in ASTM D7503.",1
Radon Fluxes from an Earthen Barrier Over Uranium Mill Tailings After Two Decades of Service-17234,"Craig H Benson, William H Albright, Mark Fuhrmann, William J Likos, Nicolas Stefani, Kuo Tian, W Joseph Waugh, Morgan M Williams",2017/3/5,Journal Waste Management Conference,"Radon (Rn) fluxes were measured at a disposal facility for uranium mill tailings after two decades of service. The facility was closed with an earthen cover vegetated with grasses. Measurements were made on the surface of the Rn barrier and directly on the surface of the tailings. Fluxes were measured using extra small (area= 0.018 m2), small (0.071 m2), medium (0.59 m2), and large (2.32 m2) flux chambers to evaluate the impact of measurement scale on Rn flux. Activated carbon (AC) passive collectors and electric radon detectors (RAD7) were used to measure Rn concentrations. Tests were conducted at various locations on each cover representing conditions that can lead to different levels of soil structural development and different water content. Rn fluxes at the surface of the Rn barrier were much lower than Rn fluxes measured at the surface of the tailings, indicating the barrier remained effective for Rn containment. Geometric mean Rn fluxes measured at the surface of the Rn barrier in each test pit were below the regulatory requirement (0.74 Bq/m2-s). Rn concentrations measured using AC samplers in the flux chambers were 60% of concentrations measured using the RAD7, on average, and Rn fluxes computed with the AC data were 9% of those computed with the RAD7 data, on average. Size of the flux chamber had no systematic effect on Rn flux, indicating that 20 y of soil forming processes had not created a pore network causing scale-dependent Rn flux. Geometric mean Rn fluxes in the test pits were similar regardless of differences in surface conditions (vegetation, thickness of soil cover) known to influence soil forming processes …",1
Hydraulic conductivity of GCL overlap permeated with saline solutions,"Jackeline Gastelo, Dong Li, Kuo Tian, Burak F Tanyu, F Erol Guler",2023/2/15,Source Waste Management,"Hydraulic conductivity of the overlap region of two needle-punched sodium bentonite (Na-B) geosynthetic clay liners (GCLs) permeated with CaCl2 solutions under confining stresses of 20, 100, 250, and 500 kPa were evaluated. One of the GCLs consisted of a uniform layer of Na-B encapsulated between a nonwoven (NW) and a woven (W) geotextile, and the other one consisted of NW geotextiles on both sides. Supplemental bentonite was placed within the overlap region. Experiments were conducted with 10, 20, and 50 mM CaCl2 solutions representing dilute and aggressive leachates. The results indicate that in most of the scenarios there is a possibility that the flow is not completely vertical (meaning flow passes through the overlap region horizontally). As the confining stress increased, the horizontal flow through the overlap region for GCLs reduced effectively when permeated with deionized water and 10 …",
