titles,authors,date,source,descriptions,citations
Evaluation of Atactic Polypropylene (APP) geomembranes used as liners for salt ponds,"Sandarva M Sharma, Kuo Tian, Burak Tanyu",2023/2/1,Journal Geotextiles and Geomembranes,"This study focused on evaluating the longevity of Atactic Polypropylene (APP) used as a geomembrane (GM) to line ponds that collect runoff water from salt handling facilities. Samples of APP were exhumed from the ponds that have been in service for 6-, 25-, and 44-years and evaluated in the laboratory. Tests were conducted to analyze the surface cracks and textures, tensile properties, puncture resistance, and ability to hold water (permeability). Control tests were conducted with virgin APP GM. Results were compared based on the difference in the age of the APP, location of where the APP samples were obtained within the side slope of the pond (i.e., submerged, and above water level), and orientation of the side slope in relation to the sun (e.g., east, west, north, or south). Based on the field observations and laboratory evaluations, it was determined that exposure to sunlight accelerates the degradation more so …",
Stress-induced pore water pressures in the vadose zone beneath a composite-lined landfill,"Craig H Benson, Jiannan Chen, Kuo Tian",2021/10/12,Journal Japanese Geotechnical Society Special Publication,"A finite-element model was developed to evaluate mechanisms contributing to positive pore pressures measured with sealed pressure transducers in the geological buffer beneath the Environmental Management Waste Management Facility (EMWMF), a composite-lined mixed waste disposal facility operated by the US Department of Energy. The geological buffer is a 3-m-thick engineered fine-textured layer directly beneath the EMWMF’s composite liner, and above the groundwater table. The model accounts for changes in pore water pressure resulting from (i) moistening of the geological buffer due to equilibration with the underlying geological materials,(ii) loading imposed by waste placed on the overlying liner, and (iii) fluctuations in the elevation of the underlying groundwater table. Pore water pressures predicted by the model are in good agreement with pore water pressures measured in the field. The predictions confirm that positive pore water pressures recorded by the sealed pressure transducers in the geological buffer are excess pore water pressures induced by the vertical normal stress imposed by waste placed on the liner, and are not due to a rise in the groundwater table. Simulations also showed that two additional years of filling would further increase the pore water pressure without any change in elevation of the groundwater table. The geological buffer remained unsaturated during the simulation, with a Bw-coefficient similar to that computed from the field-measured pore water pressures and waste filling records. Larger increases in pore water pressure were observed when the geological buffer was assumed to have higher …",
Chemical Compatibility of Conventional Geo-synthetic Clay Liners to Aggressive Low-Level Radioactive Waste Leachate-17296,"Kuo Tian, Craig H Benson",2017/7/1,Issue INIS-US-19-WM-17296,"representative of leachates in low-level radioactive waste (LLW) disposal facilities affected the hydraulic conductivity of a conventional sodium-bentonite (Na-B) geo-synthetic clay liner (GCL) used in composite liner systems. One leachate was highly alkaline (H-pH) and the other had a low abundance of monovalent cations relative to divalent cations (L-RMD). Tests were also conducted with a typical radioactive synthetic leachate (RSL) and with deionized (DI) water as control. Na-B from the GCL had a swell index of 24 mL/2 g in RSL, 22 mL/2 g in H-pH leachate, and 16 mL/2 g in L-RMD leachate, whereas the swell index was 36 mL/2 g in DI water. Hydraulic conductivity tests were conducted in flexible-wall permeameters using the falling headwater with an effective confining stress at 20 kPa. Hydraulic conductivity of Na-B GCL was low when permeated with RSL (1.8 x 10-10 m/s) and H-pH leachate (2.4 x 10{sup -10} m/s), but higher than the hydraulic conductivity to DI water (2.5 x10{sup -11} m/s). The GCL was two orders of magnitude more permeable when permeated with L-RMD leachate (7.9 x 10{sup -8} m/s). The higher hydraulic conductivity of the GCL to the leachates is attributed to reduced swelling of the Na-B in leachates with higher ionic strength solution (H-pH, RSL) or a predominance of divalent cations (L-RMD). Increasing the effective confining stress from 20 to 450 kPa reduced the hydraulic conductivity approximately two orders of magnitude for the L-RMD and H-pH leachates. (authors)",
Effect of Radiation from Low-Level Radioactive Waste Leachate on Antioxidant Depletion in HDPE Geomembrane–16087,"Kuo Tian, Craig Benson, Youming Yang, James Tinjum",2016/7/1,Issue INIS-US-19-WM-16087,"Low-level radioactive waste (LLW) and mixed waste (MW) disposal facilities in the US are required to have a service life in excess of 1000 yr. Understanding the rate of degradation of high-density polyethylene (HDPE) geomembranes (GMs) used in LLW and MW facilities is necessary to assess their service life when conducting a performance assessment for a disposal facility. In LLW and MW disposal facilities, GMs may be exposed to radionuclides that may accelerate antioxidant depletion and degradation. This paper evaluates how radiation dosage affects antioxidant depletion in HDPE GMs and makes inferences regarding the impact of radiation on GM service life. Specimens of 0.04-mm-, 0.1-mm-, and 2-mm-thick HDPE GMs were exposed to a sealed source of Am-241 to simulate alpha radiation from LLW leachate (eg, uranium). The specimens were exposed to the sealed source for 1–50 h, followed by oxidative induction time (OIT) testing to determine depletion of antioxidants in response to exposure. Penetration of alpha particles in the HDPE GM exposed to the sealed source was evaluated with the program GEometry ANd Tracking (GEANT4). The GEANT4 modeling indicates that physical dose deposition for alpha particles largely occurs on the superficial layers and decreased monotonically with depth to a negligible dose (~ 28 µm). For a 2-mm-thick HDPE GM, there was no change in OIT after exposure, whereas in much thinner GMs (eg, 0.04 mm), significant antioxidant depletion occurred after exposure, reflecting the shallow penetration of alpha radiation at the surface of HDPE GM.",
Effect of Low-Level Radioactive Waste Leachate on Antioxidant Depletion in HDPE Geomembranes–15135,"Kuo Tian, Youming Yang, Craig H Benson, James M Tinjum",2015/7/1,Issue INIS-US-19-WM-15135,"Low-level radioactive waste (LLW) and mixed waste (MW) disposal facilities in the US are required to have a service life in excess of 1000 yr. Understanding the rate of degradation of high-density polyethylene (HDPE) geomembranes (GMs) used in barriers of LLW and MW facilities is necessary to assess their service life. HDPE GMs undergo degradation in three stages: antioxidant depletion (Stage I), induction time (stage II), and polymer degradation (Stage III). For LLW and MW facilities, these degradation mechanisms must be assessed with the GM in contact with leachates representative of LLW or MW. This paper focuses on antioxidant depletion in LLW leachate. HDPE GM coupons (2-mm thick) were immersed in radioactive synthetic leachate (RSL) with chemistry representative of leachate in LLW disposal facilities operated by the US Department of Energy’s environmental restoration programs. Depletion was assessed at four temperatures (25, 50, 70, and 90 C). Comparative tests were conducted with non-radioactive synthetic leachate (NSL), which has the same chemistry as RSL except radionuclides are excluded. Control tests were conducted with deionized (DI) water. Specimens were removed periodically and tested to determine their mechanical and chemical properties. Antioxidant depletion was measured by both standard and high-pressure oxidative induction time (OIT) tests. The rate of antioxidant depletion in RSL is statistically no different than depletion in NSL. Extrapolating the laboratory data at elevated temperatures to a typical LLW liner at 15 oC via Arrhenius modeling showed that the time for antioxidant depletion for a GM …",
Effects of Prehydration on Hydraulic Conductivity of Bentonite-Polymer Geosynthetic Clay Liner to Coal Combustion Product Leachate,"Dong Li, Kuo Tian",Geo-Congress 2022,Pages 568-577,"Experiments were conducted to evaluate the hydraulic conductivity of non-prehydrated and prehydrated geosynthetic clay liners (GCLs) to coal combustion product (CCP) leachate. One commercially available bentonite-polymer (B-P) GCL with polymer loading of 3.8% (B-P-3.8) and one sodium-bentonite (Na-B) GCL were tested in this study. Hydraulic conductivity tests were conducted with Na-B and B-P-3.8 GCLs to one synthetic CCP leachate directly, which was chemically representative of the CCP leachate with high-ionic (HI) strength (ionic strength = 3179 mM). Comparative tests were conducted with the same GCL specimens prehydated with neutral or alkaline prehydration solutions until hydraulic equilibrium before permeated with HI leachate to determine the beneficial effect of prehydration. Hydraulic conductivity of Na-B GCLs prehydrated with synthetic solutions (pH = 6.8 and pH = 12) to HI leachate were …",
"Lessons Learned from GeoLegends: Harry G. Poulos, D. Sc. Eng., PE, Dist. M. ASCE, NAE","Merve Gizem Bozkurt, Jiannan Chen, Hulya Salihoglu, Kuo Tian",Geo-Strata—Geo Institute of ASCE,Volume 20,,
"Engineering, George Mason University, Fairfax, VA, USA 22030","Jiannan Chen, Craig H Benson, Kuo Tian","A finite-element model was developed to evaluate mechanisms contributing to positive pore pressures measured with sealed pressure transducers in the geological buffer beneath the Environmental Management Waste Management Facility, a composite-lined mixed waste disposal facility operated by the US Department of Energy. The geological buffer is a 3-m-thick engineered finetextured layer directly beneath the Environmental Management Waste Management Facility’s composite liner, and above the groundwater table. The model accounts for changes in pore water pressure resulting from (i) loading imposed by waste placed on the overlying liner,(ii) moistening of the geological buffer due to equilibration with the underlying geological materials, and (iii) fluctuations in the elevation of the underlying groundwater table. Pore water pressures predicted by the model are in good agreement with pore water pressures measured in the field. The predictions confirm that positive pore water pressures recorded by the sealed pressure transducers in the geological buffer are excess pore water pressures induced by the vertical normal stress imposed by waste placed on the liner, and are not due to a rise in the groundwater table. Simulations also showed that two additional years of filling would further increase the pore water pressure without any change in elevation of the groundwater table. The geological buffer remained unsaturated during the simulation, with a B-coefficient (parameter indicative of the degree of saturation) similar to that computed from the field-measured pore water pressures and waste filling records. Larger increases in pore water …","Scholar articles Engineering, George Mason University, Fairfax, VA, USA 22030J Chen, CH Benson, K TianRelated articles ","A finite-element model was developed to evaluate mechanisms contributing to positive pore pressures measured with sealed pressure transducers in the geological buffer beneath the Environmental Management Waste Management Facility, a composite-lined mixed waste disposal facility operated by the US Department of Energy. The geological buffer is a 3-m-thick engineered finetextured layer directly beneath the Environmental Management Waste Management Facility’s composite liner, and above the groundwater table. The model accounts for changes in pore water pressure resulting from (i) loading imposed by waste placed on the overlying liner,(ii) moistening of the geological buffer due to equilibration with the underlying geological materials, and (iii) fluctuations in the elevation of the underlying groundwater table. Pore water pressures predicted by the model are in good agreement with pore water pressures measured in the field. The predictions confirm that positive pore water pressures recorded by the sealed pressure transducers in the geological buffer are excess pore water pressures induced by the vertical normal stress imposed by waste placed on the liner, and are not due to a rise in the groundwater table. Simulations also showed that two additional years of filling would further increase the pore water pressure without any change in elevation of the groundwater table. The geological buffer remained unsaturated during the simulation, with a B-coefficient (parameter indicative of the degree of saturation) similar to that computed from the field-measured pore water pressures and waste filling records. Larger increases in pore water …",
Hydraulic Conductivity of Geosynthetic Clay Liners to Low-Level Radioactive Waste Leachate–14082,"Kuo Tian, Craig H Benson","Experiments were conducted to evaluate how permeation with leachate from lowlevel radioactive waste (LLW) disposal facilities affects the hydraulic conductivity of geosynthetic clay liners (GCLs) used in composite liner systems. Five commercially available GCLs were evaluated. Two of the GCLs contained conventional sodium (Na) bentonite (C1 and C2) and the others contained polymer-modified bentonite (R1, R2, BPC). The BPC GCL contains a bentonitepolymer composite, whereas the R1 and R2 GCLs contain a dry mixture of polymer and conventional Na bentonite. The GCLs were hydrated and permeated with two synthetic leachates that are chemically identical, except one leachate is prepared without radionuclides (non-radioactive synthetic leachate, or NSL) and the other with radionuclides (radioactive synthetic leachate, or RSL). Control tests were conducted with deionized (DI) water. For the C1, C2, R1, and R2 GCLs, the hydraulic conductivity gradually increased during permeation with synthetic LLW leachate, with final hydraulic conductivities ranging from 1.3 x10-10 to 5.6 x10-10 m/s at 20 kPa effective stress. In contrast, the hydraulic conductivity of these GCLs to DI water ranged from 7.6 x10-12 to 3.1 x10-11 m/s. The R1 and R2 GCLs, containing a dry mixture of polymer and bentonite, were no more resistant to increases in hydraulic conductivity due to permeation by leachate than conventional Na bentonites, and the largest increases in hydraulic conductivity were obtained with the R1 GCL. In contrast, hydraulic conductivity of the BPC GCL was very low to both LLW leachates (≈ 6x10-12 to 8x10-12 m/s) and DI water. The BPC …","Scholar articles Hydraulic Conductivity of Geosynthetic Clay Liners to Low-Level Radioactive Waste Leachate–14082K Tian, CH BensonRelated articles All 3 versions ","Experiments were conducted to evaluate how permeation with leachate from lowlevel radioactive waste (LLW) disposal facilities affects the hydraulic conductivity of geosynthetic clay liners (GCLs) used in composite liner systems. Five commercially available GCLs were evaluated. Two of the GCLs contained conventional sodium (Na) bentonite (C1 and C2) and the others contained polymer-modified bentonite (R1, R2, BPC). The BPC GCL contains a bentonitepolymer composite, whereas the R1 and R2 GCLs contain a dry mixture of polymer and conventional Na bentonite. The GCLs were hydrated and permeated with two synthetic leachates that are chemically identical, except one leachate is prepared without radionuclides (non-radioactive synthetic leachate, or NSL) and the other with radionuclides (radioactive synthetic leachate, or RSL). Control tests were conducted with deionized (DI) water. For the C1, C2, R1, and R2 GCLs, the hydraulic conductivity gradually increased during permeation with synthetic LLW leachate, with final hydraulic conductivities ranging from 1.3 x10-10 to 5.6 x10-10 m/s at 20 kPa effective stress. In contrast, the hydraulic conductivity of these GCLs to DI water ranged from 7.6 x10-12 to 3.1 x10-11 m/s. The R1 and R2 GCLs, containing a dry mixture of polymer and bentonite, were no more resistant to increases in hydraulic conductivity due to permeation by leachate than conventional Na bentonites, and the largest increases in hydraulic conductivity were obtained with the R1 GCL. In contrast, hydraulic conductivity of the BPC GCL was very low to both LLW leachates (≈ 6x10-12 to 8x10-12 m/s) and DI water. The BPC …",
