titles,authors,date,source,descriptions,citations
"Four decades of United States mobile source pollutants: spatial–temporal trends assessed by ground-based monitors, air quality models, and satellites","Lucas RF Henneman, Huizhong Shen, Christian Hogrefe, Armistead G Russell, Corwin M Zigler",2021/1/5,Journal Environmental science & technology,"On-road emissions sources degrade air quality, and these sources have been highly regulated. Epidemiological and environmental justice studies often use road proximity as a proxy for traffic-related air pollution (TRAP) exposure, and other studies employ air quality models or satellite observations. To assess these metrics’ abilities to reproduce observed near-road concentration gradients and changes over time, we apply a hierarchical linear regression to ground-based observations, long-term air quality model simulations using Community Multiscale Air Quality (CMAQ), and satellite products. Across 1980–2019, observed TRAP concentrations decreased, and road proximity was positively correlated with TRAP. For all pollutants, concentrations decreased fastest at locations with higher road proximity, resulting in “flatter” concentration fields in recent years. This flattening unfolded at a relatively constant rate for …",9
Counterfactual time series analysis of short-term change in air pollution following the COVID-19 state of emergency in the United States,"Tanujit Dey, Pooja Tyagi, M Benjamin Sabath, Leila Kamareddine, Lucas Henneman, Danielle Braun, Francesca Dominici",2021/12/7,Journal Scientific reports,"Lockdown measures implemented in response to the COVID-19 pandemic produced sudden behavioral changes. We implement counterfactual time series analysis based on seasonal autoregressive integrated moving average models (SARIMA), to examine the extent of air pollution reduction attained following state-level emergency declarations. We also investigate whether these reductions occurred everywhere in the US, and the local factors (geography, population density, and sources of emission) that drove them. Following state-level emergency declarations, we found evidence of a statistically significant decrease in nitrogen dioxide (NO2) levels in 34 of the 36 states and in fine particulate matter (PM2.5) levels in 16 of the 48 states that were investigated. The lockdown produced a decrease of up to 3.4 µg/m3 in PM2.5 (observed in California) with range (− 2.3, 3.4) and up to 11.6 ppb in NO2 (observed in …",8
Association between county-level coal-fired power plant pollution and racial disparities in preterm births from 2000 to 2018,"Misbath Daouda, Lucas Henneman, Marianthi-Anna Kioumourtzoglou, Alison Gemmill, Corwin Zigler, Joan A Casey",2021/3/2,Journal Environmental Research Letters,"Coal has historically been a primary energy source in the United States (US). The byproducts of coal combustion, such as fine particulate matter (PM 2.5), have increasingly been associated with adverse birth outcomes. The goal of this study was to leverage the current progressive transition away from coal in the US to assess whether coal PM 2.5 is associated with preterm birth (PTB) rates and whether this association differs by maternal Black/White race/ethnicity. Using a novel dispersion modeling approach, we estimated PM 2.5 pollution from coal-fired power plants nationwide at the county-level during the study period (2000–2018). We also obtained county-level PTB rates for non-Hispanic White and non-Hispanic Black mothers. We used a generalized additive mixed model to estimate the relationship between coal PM 2.5 and PTB rates, overall and stratified by maternal race. We included a natural spline to …",6
A source-oriented approach to coal power plant emissions health effects,"Kevin Cummiskey, Chanmin Kim, Christine Choirat, Lucas RF Henneman, Joel Schwartz, Corwin Zigler",2019/2/26,Journal arXiv preprint arXiv:1902.09703,"There is increasing focus on whether air pollution originating from different sources has different health implications. In particular, recent evidence suggests that fine particulate matter (PM2.5) with chemical tracers suggesting coal combustion origins is especially harmful. Augmenting this knowledge with estimates from causal inference methods to identify the health impacts of PM2.5 derived from specific point sources of coal combustion would be an important step towards informing specific, targeted interventions. We investigated the effect of high-exposure to coal combustion emissions from 783 coal-fired power generating units on ischemic heart disease (IHD) hospitalizations in over 19 million Medicare beneficiaries residing at 21,351 ZIP codes in the eastern United States. We used InMAP, a newly-developed, reduced-complexity air quality model to classify each ZIP code as either a high-exposed or control location. Our health outcomes analysis uses a causal inference method - propensity score matching - to adjust for potential confounders of the relationship between exposure and IHD. We fit separate Poisson regression models to the matched data in each geographic region to estimate the incidence rate ratio for IHD comparing high-exposed to control locations. High exposure to coal power plant emissions and IHD were positively associated in the Northeast (IRR = 1.08, 95% CI = 1.06, 1.09) and the Southeast (IRR = 1.06, 95% CI = 1.04, 1.08). No significant association was found in the Industrial Midwest (IRR = 1.02, 95% CI = 1.00, 1.04), likely the result of small exposure contrasts between high-exposed and control ZIP codes in that …",5
"Energy policy, air quality, and climate mitigation in South Africa: The case for Integrated Assessment","Carmen Klausbruckner, Lucas RF Henneman, Peter Rafaj, Harold J Annegarn",2018,Journal Systems analysis approach for complex global challenges,"Background and significance: South AfricaSouth Africa reports approximately 20,000 premature deaths due to air pollution annually. Policy in South Africa has typically addressed greenhouse gas emissions, energy supply, and air quality separately. Integrated assessment provides a framework in which policies related to these topics can be evaluated simultaneously. Methodology: The present study provides an overview of legal and policy documents and reviews available literature concerning existing energy, climate, and air quality policies in South Africa to highlight inconsistencies of different policy approaches and identify possible co-benefits. Previous applications of integrated assessment in South Africa are discussed as approaches to provide evidence-based decision support. Application/relevance to systems analysis: The analysis and results demonstrate that a complete analysis of the energy and industry …",4
Differential impacts of COVID-19 lockdowns on PM2. 5 across the United States,"Kevin L Chen, Lucas RF Henneman, Rachel C Nethery",2021/12/1,Journal Environmental Advances,"The COVID-19 pandemic has induced large-scale behavioral changes, presenting a unique opportunity to study how air pollution is affected by societal shifts. At 455 PM 2.5 monitoring sites across the United States, we conduct a causal inference analysis to determine the impacts of COVID-19 lockdowns on PM 2.5. Our approach allows for rigorous confounding adjustment with highly spatio-temporally resolved effect estimates. We find that, with the exception of the Southwest, most of the US experienced increases in PM 2.5 compared to concentrations expected under business-as-usual. To investigate possible drivers of this phenomenon, we use a regression model to characterize the relationship of various factors with the observed impacts. Our findings have immense environmental policy relevance, suggesting that mobility reductions alone may be insufficient to substantially and uniformly reduce PM 2.5.",3
Short-term change in air pollution following the COVID-19 state of emergency: A national analysis for the United States,"Pooja Tyagi, Danielle Braun, Benjamin Sabath, Lucas Henneman, Francesca Dominici",2020/8/6,Journal medRxiv,"Lockdown measures taken in response to the COVID-19 pandemic produced sudden social and economic changes. We examined the extent of air pollution reduction that was attained under these extreme circumstances, whether these reductions occurred everywhere in the US, and the local factors that drove them. Employing counterfactual time series analysis based on seasonal autoregressive integrated moving average models, we found that these extreme lockdown measures led to a reduction in the weekly PM2.5 average by up to 3.4 µg m-3 and the weekly NO2 average by up to 11 ppb. These values represent a substantial fraction of the annual mean NAAQS values of 12 µg m-3 and 53 ppb, respectively. We found evidence of a statistically significant decline in NO2 concentrations following the state-level emergency declaration in almost all states. However, statistically significant declines in PM2.5 occurred mostly in the West Coast and the Northeast. Certain states experienced a decline in NO2 but an increase in PM2.5 concentrations, indicating that these two pollutants arise from dissimilar sources in these states. Finally, we found evidence that states with a higher percentage of mobile source emissions prior to the emergency measures experienced a greater decline in NO2 levels during the pandemic. Although the current social and economic restrictions are not sustainable, our results provide a benchmark to estimate the extent to which air pollution reductions can be achieved. We also identify factors that contributed to the magnitude of pollutant reductions, which can help guide future state-level policies to sustainably reduce air …",3
A mechanistic model of annual sulfate concentrations in the United States,"Nathan B Wikle, Ephraim M Hanks, Lucas RF Henneman, Corwin M Zigler",2022/9/14,Journal Journal of the American Statistical Association,"Understanding how individual pollution sources contribute to ambient sulfate pollution is critical for assessing past and future air quality regulations. Since attribution to specific sources is typically not encoded in spatial air pollution data, we develop a mechanistic model which we use to estimate, with uncertainty, the contribution of ambient sulfate concentrations attributable specifically to sulfur dioxide (SO2) emissions from individual coal-fired power plants in the central United States. We propose a multivariate Ornstein–Uhlenbeck (OU) process approximation to the dynamics of the underlying space-time chemical transport process, and its distributional properties are leveraged to specify novel probability models for spatial data that are viewed as either a snapshot or time-averaged observation of the OU process. Using US EPA SO2 emissions data from 193 power plants and state-of-the-art estimates of ground …",2
Inequitable Exposures to U.S. Coal Power Plant–Related : 22 Years and Counting,"Lucas RF Henneman, Munshi Md Rasel, Christine Choirat, Susan C Anenberg, Corwin Zigler",2023/3/8,Journal Environmental Health Perspectives,"Emissions from coal power plants have decreased over recent decades due to regulations and economics affecting costs of providing electricity generated by coal vis-à-vis its alternatives. These changes have improved regional air quality, but questions remain about whether benefits have accrued equitably across population groups.",1
Ozone in the Eastern United States: Production Efficiency Variability Over Time and Between Sources,"Lucas RF Henneman, Huizhong Shen, Cong Liu, Yongtao Hu, James A Mulholland, Armistead G Russell",2020,Conference Air Pollution Modeling and its Application XXVI 36,"The eastern United States has seen dramatic air pollution emissions reductions since the turn of the century. These emissions reductions have in turn been linked to widespread reductions in ozone (O3)—between 2000 and 2016, the US EPA reports a reduction in 4th highest mean daily annual 8-hr O3 of 15% (from 82.3 to 69.6 ppb) across 206 sites nationwide. Reductions, however, have not been spatially uniform or linear with emissions reductions, and therefore motivate an investigation into spatial and source-specific O3 production efficiency (OPE). OPE is a measure of the number of O3 molecules produced per emitted NOX (NOX = NO + NO2) molecule. We assess OPE using both model-based and empirical approaches. We modelled July OPE in 2001 and 2011 using CMAQ-DDM version 5.0 with a 12 km resolution over the eastern US. CMAQ-modelled OPE is taken as a ratio of electricity generating …",1
"Impacts of Emission Changes on Air Quality and Acute Health Effects in the Southeast, 1993–2012","AG Russell, Paige Tolbert, Lucas Henneman, Cong Liu, Mitchel Klein, Joseph Abrams, James Mulholland, Yongtao Hu, Talat Odman, Howard Chang, Stefanie Sarnat, Matthew Strickland",2012,Journal Program and Abstracts,,1
Accounting for the Health Benefits of Air Pollution Regulations in China,"Patrick L Kinney, Xiaoming Shi, Shuxiao Wang, Maigeng Zhou, Lucas Henneman, Tiantian Li, Peng Yin, Zhenping Zhao, Haotian Zheng",2022/12/15,Journal Fall Meeting 2022,,
Trends in air pollution emissions in the contiguous United States from 1970 to 2010: an environmental justice analysis,"Yanelli Nunez, Jaime Benavides, Misbath Daouda, Lucas RF Henneman, Randall V Martin, Erin E McDuffie, Jeff Goldsmith, Joan A Casey, Marianthi-Anna Kioumourtzoglou",2022/9/18,Journal ISEE Conference Abstracts," Background: Air pollution emissions have substantially decreased in the US since the 1970 Clean Air Act. We examined racial and economic disparities in emissions reductions from specific pollution sources.  Methods: We evaluated racial/ethnic and economic disparities in emissions reductions from six pollution sectors [industry (SO2), energy (SO2), agriculture (NH3), commercial (NOx), residential (organic carbon), and on-road transport (NOx)] across the contiguous US from 1970–2010. We used the CEDGBD-MAP emissions inventory to estimate the average relative emissions change from one decennial to the following and its link to demographics (percent White, Black, Asian, American Indian Hispanic, family income, property value, poverty, and unemployment) at the county level. We constructed hierarchical models with the relative emissions change as the dependent variable and demographics as …",
Racial/ethnic disparities in nationwide PM2. 5 exposure: perils of assuming a linear relationship,"Misbath Daouda, Lucas Henneman, Jeff Goldsmith, Marianthi-Anna Kioumourtzoglou, Joan A Casey",2022/9/18,Journal ISEE Conference Abstracts," BACKGROUND AND AIM  Studies of racial/ethnic disparities in air pollution exposure assume an equal magnitude of disparity across the demographic distribution, which may under- or over-estimate the true disparity. Further, historic practices such as racist zoning policies could plausibly drive non-linear relationships between racial/ethnic composition and air pollution exposure. We aimed to conduct a nationwide analysis in urban areas allowing for non-linearity in the relationship between racial/ethnic composition and ambient particulate matter less than 2.5 micrometers (PM₂.₅), and test whether racial segregation modified this relationship.    METHODS  We obtained tract-level demographic information from the 2010 Census and computed the multi-group dissimilarity index, a metropolitan-area level measure of racial segregation. Ambient PM₂.₅ data was obtained from a publicly available source. We …",
The impact of coal and oil power plants retirements on air pollution and cardiorespiratory health in California: an application of generalized synthetic control design,"Chen Chen, Sindana Ilango, Lucas Henneman, Joan Casey, Tarik Benmarhnia",2022/9/18,Journal ISEE Conference Abstracts," Background and Aim:  Evidence documenting the harmful consequences of ambient air pollution can be advanced by examining the effect of well-defined interventions on air pollution and possible benefits on health outcomes. This study aims to evaluate the effect of coal and oil facility retirements, on fine particulate matter (PM2.5) and cardiorespiratory hospitalizations in California. Methods:  We identified 15 coal and oil facilities in California that retired between January 1st, 2006 and December 31st, 2013 and estimated the effect of facility retirements with a generalized synthetic control design. We classified California zip codes as exposed or unexposed to a facility retirement using emissions information and a dispersion model. We then estimated the difference in weekly average PM2.5 concentrations and cardiorespiratory hospitalization rate after each facility retirement between the exposed zip codes and the …",
Racial/Ethnic Disparities in Nationwide Concentrations: Perils of Assuming a Linear Relationship,"Misbath Daouda, Lucas Henneman, Jeff Goldsmith, Marianthi-Anna Kioumourtzoglou, Joan A Casey",2022/7/6,Journal Environmental health perspectives,Methods,
Forty years of road transport NOX emissions reductions in the contiguous United States: an environmental justice analysis,"Yanelli Nunez, Jaime Benavides, Mistbath Daouda, Lucas Henneman, Erin E Mcduffle, Randall V Martin, Joan Casey, Jeff Goldsmith, Marianthi Anna Kioumourtzoglou",2021/8/23,Journal ISEE Conference Abstracts," BACKGROUND AND AIM: Road transport-related nitrogen oxide (NOX) emissions in the United States (US) were drastically reduced over the last forty years. These improvements were mainly driven by environmental policies aiming to reduce emissions and, consequently, exposure to air pollutants. Prior research has identified inequalities in air pollution exposures in the US but, to our knowledge, no studies have evaluated potential disparities in emissions reductions across the country. We aim to describe the nationwide distribution of NOX emission reductions from 1970 to 2010 by race/ethnicity and socioeconomic status. METHODS: We conducted analyses at the county level from 1970 to 2010 across the contiguous US. We used annual NOX transport emissions estimated by a global emissions inventory model at 50km2 grid resolution, which we aggregated to area-weighted county averages. We obtained …",
Health improvements associated with reduced power plant emissions in the United States between 2005 and 2012,"LR Henneman, C Choirat, C Zigler",2020/10/26,Journal ISEE Conference Abstracts,,
"Coal-fired power plant closures and retrofits reduce asthma morbidity in the local population (vol 5, pg 365, 2020)","Joan A Casey, Jason G Su, Lucas RF Henneman, Corwin Zigler, Andreas M Neophytou, Ralph Catalano, Rahul Gondalia, Yu-Ting Chen, Leanne Kaye, Sarah S Moyer, Veronica Combs, Grace Simrall, Ted Smith, James Sublett, Meredith A Barrett",2020/5/1,Journal NATURE ENERGY,,
Publisher Correction: Coal-fired power plant closures and retrofits reduce asthma morbidity in the local population,"Joan A Casey, Jason G Su, Henneman Lucas RF, Zigler Corwin, Andreas M Neophytou, Ralph Catalano, Gondalia Rahul, Chen Yu-Ting, Leanne Kaye, Sarah S Moyer, Veronica Combs, Simrall Grace, Ted Smith, James Sublett, Meredith A Barrett",2020/5/1,Journal Nature Energy,,
Posterior predictive treatment assignment methods for causal inference in the context of time-varying treatments,"Shirley X Liao, Lucas Henneman, Cory Zigler",2020/1/1,Journal Epidemiologic Methods,"Marginal structural models (MSM) with inverse probability weighting (IPW) are used to estimate causal effects of time-varying treatments, but can result in erratic finite-sample performance when there is low overlap in covariate distributions across different treatment patterns. Modifications to IPW which target the average treatment effect (ATE) estimand either introduce bias or rely on unverifiable parametric assumptions and extrapolation. This paper extends an alternate estimand, the ATE on the overlap population (ATO) which is estimated on a sub-population with a reasonable probability of receiving alternate treatment patterns in time-varying treatment settings. To estimate the ATO within an MSM framework, this paper extends a stochastic pruning method based on the posterior predictive treatment assignment (PPTA) (Zigler, C. M., and M. Cefalu. 2017. “Posterior Predictive Treatment Assignment for Estimating …",
Google Maps Location History Data has Great Potentials for Improving Exposure Estimation for Air Pollution Health Studies,"Haofei Yu, Cesunica Ivey, Lucas Henneman",2019/12,Journal AGU Fall Meeting Abstracts,"Capturing individual spatiotemporal mobility is important for accurately estimating human exposure to ambient air pollution. However, detailed data on individual mobility is difficult to collect, particularly for retrospective health studies. Google Maps is one of the most used smartphone apps worldwide, and it will continuously collect location data from the smartphone when its"" Location History"" feature is enabled. In this study, we evaluated the accuracy of the Google Maps Location History (GMLH) data in capturing individual mobility for pollution exposure estimation purposes. One subject carried a smartphone installed with Google Maps and a standalone GPS recorder for one week. The retrieved GMLH data were then compared with the reference GPS data to evaluate its accuracy in capturing individual mobility. We found the GMLH data accurately captured the spatial movement of the subject during the week at up …",
"A multi-level analysis of the impact of changes in coal-fired power plant emissions on asthma-related healthcare utilization and symptoms in Louisville, Kentucky","J Casey, J Su, L Henneman, C Zigler, A Neophytou, Y Chen, S Moyer, M Barrett",2019/10/1,Journal Environmental Epidemiology,"Background/aim: Recently, US electricity generation has both implemented air emissions controls and begun to shift away from coal as a fuel source. Such energy transitions at individual power plants serve as natural experiments for assessing health benefits of resulting changes in air quality. We aimed to evaluate the impact of a coal-fired power plant retirement and 3 SO2 emission control installations on asthma outcomes in Louisville, Kentucky.",
Air pollution accountability: Assessing regulatory impacts on emissions and air quality,Lucas Richard Fath Henneman,2017/7/19,Institution Georgia Institute of Technology,"The United States has seen large improvements in air quality over the last half century with the implementation of regulations designed to reduce air pollutant emissions. Regulatory costs, estimated by the Environmental Protection Agency at tens of billions of dollars per year, motivate air pollution accountability research, which evaluates impacts of air quality regulations on emissions, air quality, exposure/dose, and public health—components of the so-called Accountability Chain. This work adds to the expanding air pollution accountability field by investigating a range of regulatory actions on electricity generating units and on-road mobile sources promulgated since the 1990s. Results show that the United States has seen major emissions reductions over this period, and most of the decreases are attributable to regulatory policies, although influences such as fuel costs, demographic shifts, and technological improvements have influenced emissions reductions as well. The bulk of this work investigates the impacts of changing emissions on air quality in the Eastern United States. Analyses focus on ambient ozone and particulate matter with diameter less than 2.5 µm (PM2.5), two pollutants linked with adverse health and environmental impacts. Observation-based statistical models and a deterministic air quality model (the Community Multiscale Air Quality model—CMAQ) show that emissions reduction programs reduced the highest ozone concentrations while simultaneously increasing the lowest concentrations. For PM2.5, controls reduced both the annual mean values and the variability. Meteorology had large impacts on daily pollutant …",
Estimating the Impact of Air Pollution Controls on Ambient Concentrations,"Lucas RF Henneman, Cong Liu, David Lavoué, Howard Chang, James A Mulholland, Armistead G Russell",2016,Conference Air Pollution Modeling and its Application XXIV,"This work describes the development and application of a statistical model that links electricity generating unit (EGU) and mobile source emissions with a city center monitoring cite. The model uses estimated emissions and measured concentrations over the period 2000–2012 in Atlanta, GA, USA to develop counterfactual time series of daily ozone concentrations. Further, the model estimates the sensitivity of observed ozone to each emissions sector. Results show that emissions control policies have had little effect on annual median ozone, have decreased 90th percentile ozone, and have increased 10th percentile ozone. Sensitivities to EGU and mobile emissions are compared and agree well with similar sensitivities calculated using a first-principles chemical transport model. ",
