titles,authors,date,source,descriptions,citations
Decision-driven execution: a distributed resource management paradigm for the age of IoT,"Tarek Abdelzaher, Md Tanvir A Amin, Amotz Bar-Noy, William Dron, Ramesh Govindan, Reginald Hobbs, Shaohan Hu, Jung-Eun Kim, Jongdeog Lee, Kelvin Marcus, Shuochao Yao, Yiran Zhao",2017/6/5,Conference 2017 IEEE 37th International Conference on Distributed Computing Systems (ICDCS),"This paper introduces a novel paradigm for resource management in distributed systems, called decision-driven execution. The paradigm is appropriate for mission-driven systems, where the goal is to enable faster, leaner, and more effective decision making. All resource consumption, in this paradigm, is tied to the needs of making decisions on alternative courses of action. A point of departure from traditional architectures lies in interfaces that allow applications to specify their underlying decision logic. This specification, in turn, allows the system to reason about most effective means to meet information needs of decisions, resulting in simultaneous optimization of decision accuracy, cost, and speed. The paper discusses the overall vision of decision-driven execution, outlining preliminary work and novel challenges.",14
Eugene: Towards deep intelligence as a service,"Shuochao Yao, Yifan Hao, Yiran Zhao, Ailing Piao, Huajie Shao, Dongxin Liu, Shengzhong Liu, Shaohan Hu, Dulanga Weerakoon, Kasthuri Jayarajah, Archan Misra, Tarek Abdelzaher",2019/7/7,Conference 2019 IEEE 39th International Conference on Distributed Computing Systems (ICDCS),"The paper discusses an emerging suite of machine intelligence services that are of increasing importance in the highly instrumented world of the Internet of Things (IoT). The suite, called Eugene, would offer a form of intelligent behavior (based on deep neural networks) to otherwise simple embedded devices; the clients of the service. These devices would benefit from service resources to learn from data and to perform intelligent inference, classification, prediction, and estimation tasks that they are too limited to carry out on their own. The paper discusses the taxonomy of such services and the state of implementation, as well as the various challenges entailed, including scheduling, caching (of intelligent functions), and cooperative learning.",13
Contrastive self-supervised representation learning for sensing signals from the time-frequency perspective,"Dongxin Liu, Tianshi Wang, Shengzhong Liu, Ruijie Wang, Shuochao Yao, Tarek Abdelzaher",2021/7/19,Conference 2021 International Conference on Computer Communications and Networks (ICCCN),"This paper presents a contrastive self-supervised representation learning framework that is new in being designed specifically for deep learning from frequency domain data. Contrastive self-supervised representation learning trains neural networks using mostly unlabeled data. It is motivated by the need to reduce the labeling burden of deep learning. In this paper, we are specifically interested in applying this approach to physical sensing scenarios, such as those arising in Internet-of-Things (IoT) applications. Deep neural networks have been widely utilized in IoT applications, but the performance of such models largely depends on the availability of large labeled datasets, which in turn entails significant training costs. Motivated by the success of contrastive self-supervised representation learning at substantially reducing the need for labeled data (mostly in areas of computer vision and natural language …",12
Truth discovery with multi-modal data in social sensing,"Huajie Shao, Dachun Sun, Shuochao Yao, Lu Su, Zhibo Wang, Dongxin Liu, Shengzhong Liu, Lance Kaplan, Tarek Abdelzaher",2020/7/10,Journal IEEE Transactions on Computers,"This article proposes unsupervised truth-finding algorithms that combine consideration of multi-modal content features with analysis of propagation patterns to evaluate the veracity of observations in social sensing applications. A key social sensing challenge is to develop effective algorithms for estimating both the reliability of sources and the veracity of their observations without prior knowledge. In contrast to prior solutions that use labeled examples to learn content features that are correlated with veracity, our approach is entirely unsupervised. Hence, given no prior training data, we jointly learn the importance of different content features together with the veracity of observations using propagation patterns as an indicator of perceived content reliability. A novel penalized expectation maximization (PEM) algorithm is proposed to improve the quality of estimation results for observations bolstered by multiple features …",12
Greenroute: a generalizable fuel-saving vehicular navigation service,"Yiran Zhao, Shuochao Yao, Dongxin Liu, Huajie Shao, Shengzhong Liu",2019/6/16,Conference 2019 IEEE International Conference on Autonomic Computing (ICAC),"This paper presents GreenRoute, a fuel-saving vehicular navigation system whose contribution is motivated by one of the key challenges in the design of autonomic services: namely, designing the service in a manner that reduces operating cost. GreenRoute achieves this end, in the specific context of fuel-saving vehicular navigation, by significantly improving the generalizability of fuel consumption models it learns (in order to recommend fuel-saving routes to drivers). By learning fuel consumption models that apply seamlessly across vehicles and routes, GreenRoute eliminates one of the key incremental costs unique to fuel-saving navigation: namely, the cost of upkeep with ever-changing fuel-consumption-specific route and vehicle parameters globally. Unlike shortest or fastest routes (that depend only on map topology and traffic), minimum-fuel routes depend additionally on the vehicle engine. This makes fuel …",10
Optimizing source selection in social sensing in the presence of influence graphs,"Huajie Shao, Shiguang Wang, Shen Li, Shuochao Yao, Yiran Zhao, Tanvir Amin, Tarek Abdelzaher, Lance Kaplan",2017/6/5,Conference 2017 IEEE 37th International Conference on Distributed Computing Systems (ICDCS),"This paper addresses the problem of choosing the right sources to solicit data from in sensing applications involving broadcast channels, such as those crowdsensing applications where sources share their observations on social media. The goal is to select sources such that expected fusion error is minimized. We assume that soliciting data from a source incurs a cost and that the cost budget is limited. Contrary to other formulations of this problem, we focus on the case where some sources influence others. Hence, asking a source to make a claim affects the behavior of other sources as well, according to an influence model. The paper makes two contributions. First, we develop an analytic model for estimating expected fusion error, given a particular influence graph and solution to the source selection problem. Second, we use that model to search for a solution that minimizes expected fusion error, formulating it as …",10
Delay-throughput tradeoff with correlated mobility of ad-hoc networks,"Shuochao Yao, Xinbing Wang, Xiaohua Tian, Qian Zhang",2014/4/27,Conference IEEE INFOCOM 2014-IEEE Conference on Computer Communications,"We analyze the scaling law in wireless ad hoc networks with the correlated mobility model. The former work about correlated mobility has shown the maximum throughput and the corresponding delay of several sub-cases, but the optimal throughput performances under various delay tolerant condition (the optimal delay-throughput tradeoff) remains open. We study the properties of correlated mobility model and establish the upper bound of delay-throughput tradeoff for several sub-cases. Then we find out an achievable lower bound by studying the optimal scheduling parameters and their constrains. We exploit the node correlation to achieve the delay-throughput tradeoff and give a picture that how node correlation impacts the packet delay, asymptotic throughput, and their tradeoff.",10
A predictive self-configuring simulator for online media,"Shuochao Yao, Yifan Hao, Dongxin Liu, Shengzhong Liu, Huajie Shao, Jiahao Wu, Mouna Bamba, Tarek Abdelzaher, James Flamino, Boleslaw Szymanski",2018/12/9,Conference 2018 Winter Simulation Conference (WSC),"This paper describes the design, implementation, and early experiences with a novel agent-based simulator of online media streams, developed under DARPA's SocialSim Program to extract and predict trends in information dissemination on online media. A hallmark of the simulator is its self-configuring property. Instead of requiring initial set-up, the input to the simulator constitutes data traces collected from the medium to be simulated. The simulator automatically learns from the data such elements as the number of agents involved, the number of objects involved, and the rate of introduction of new agents and objects. It also develops behavior models of simulated agents and objects, and their dependencies. These models are then used to run simulations allowing for future extrapolations and ""what if"" analyses. Results are presented on using this system to simulate GitHub transactions. They show good …",9
Dydiff-vae: A dynamic variational framework for information diffusion prediction,"Ruijie Wang, Zijie Huang, Shengzhong Liu, Huajie Shao, Dongxin Liu, Jinyang Li, Tianshi Wang, Dachun Sun, Shuochao Yao, Tarek Abdelzaher",2021/7/11,Book Proceedings of the 44th International ACM SIGIR Conference on Research and Development in Information Retrieval,"This paper describes a novel diffusion model, DyDiff-VAE, for information diffusion prediction on social media. Given the initial content and a sequence of forwarding users, DyDiff-VAE aims to estimate the propagation likelihood for other potential users and predict the corresponding user rankings. Inferring user interests from diffusion data lies the foundation of diffusion prediction, because users often forward the information in which they are interested or the information from those who share similar interests. Their interests also evolve over time as the result of the dynamic social influence from neighbors and the time-sensitive information gained inside/outside the social media. Existing works fail to model users' intrinsic interests from the diffusion data and assume user interests remain static along the time. DyDiff-VAE advances the state of the art in two directions: (i) We propose a dynamic encoder to infer the …",8
Amvp: Adaptive cnn-based multitask video processing on mobile stream processing platforms,"Mengyuan Chao, Radu Stoleru, Liuyi Jin, Shuochao Yao, Maxwell Maurice, Roger Blalock",2020/11/12,Conference 2020 IEEE/ACM Symposium on Edge Computing (SEC),"The popularity of video cameras has spawned a new type of application called multitask video processing, which uses multiple CNNs to obtain different information of interests from a raw video stream. Unfortunately, the huge resource requirements of CNNs make the concurrent execution of multiple CNNs on a single resource-constrained mobile device challenging. Existing solutions solve this challenge by offloading CNN models to the cloud or edge server, compressing CNN models to fit the mobile device, or sharing some common parts of multiple CNN models. Most of these solutions, however, use the above offloading, compression or sharing strategies in a separate manner, which fail to adapt to the complex edge computing scenario well. In this paper, to solve the above limitation, we propose AMVP, an adaptive execution framework for CNN-based multitask video processing, which elegantly integrates the …",8
Misinformation detection and adversarial attack cost analysis in directional social networks,"Huajie Shao, Shuochao Yao, Andong Jing, Shengzhong Liu, Dongxin Liu, Tianshi Wang, Jinyang Li, Chaoqi Yang, Ruijie Wang, Tarek Abdelzaher",2020/8/3,Conference 2020 29th International Conference on Computer Communications and Networks (ICCCN),"This paper develops a novel detection system of possibly fake accounts on public social media, called FADE, that uses features based on group behaviors to identify suspicious groups. The work is motivated by the prospect of mitigating misinformation campaigns on social media, where malicious entities on directional social networks pose as credible sources and coordinate the spreading of highly corroborated false information. Instead of account-level detection, this paper aims to detect the very group activity that underlies misinformation campaigns; namely, the coordinated spreading of messages to boost (misinformation) visibility. The existing group detection methods group users into two clusters (fake or not) and directly produce clusters of fake accounts. Conversely, we group users into many clusters based on information propagation patterns and user features and then classify them. The benefit of multiple …",8
Dependable machine intelligence at the tactical edge,"Archan Misra, Kasthuri Jayarajah, Dulanga Weerakoon, Randy Tandriansyah, Shuochao Yao, Tarek Abdelzaher",2019/5/10,Conference Artificial Intelligence and Machine Learning for Multi-Domain Operations Applications,"The paper describes a vision for dependable application of machine learning-based inferencing on resource-constrained edge devices. The high computational overhead of sophisticated deep learning learning techniques imposes a prohibitive overhead, both in terms of energy consumption and sustainable processing throughput, on such resource-constrained edge devices (e.g., audio or video sensors). To overcome these limitations, we propose a “cognitive edge” paradigm, whereby (a) an edge device first autonomously uses statistical analysis to identify potential collaborative IoT nodes, and (b) the IoT nodes then perform real-time sharing of various intermediate state to improve their individual execution of machine intelligence tasks. We provide an example of such collaborative inferencing for an exemplar network of video sensors, showing how such collaboration can significantly improve accuracy, reduce …",8
Social signal processing for real-time situational understanding: A vision and approach,"Kasthuri Jayarajah, Shuochao Yao, Raghava Mutharaju, Archan Misra, Geeth De Mel, Julie Skipper, Tarek Abdelzaher, Michael Kolodny",2015/10/19,Conference 2015 IEEE 12th International Conference on Mobile Ad Hoc and Sensor Systems,"The US Army Research Laboratory (ARL) and the Air Force Research Laboratory (AFRL) have established a collaborative research enterprise referred to as the Situational Understanding Research Institute (SURI). The goal is to develop an information processing framework to help the military obtain real-time situational awareness of physical events by harnessing the combined power of multiple sensing sources to obtain insights about events and their evolution. It is envisioned that one could use such information to predict behaviors of groups, be they local transient groups (e.g., Protests) or widespread, networked groups, and thus enable proactive prevention of nefarious activities. This paper presents a vision of how social media sources can be exploited in the above context to obtain insights about events, groups, and their evolution.",8
Self-cueing real-time attention scheduling in criticality-aware visual machine perception,"Shengzhong Liu, Xinzhe Fu, Maggie Wigness, Philip David, Shuochao Yao, Lui Sha, Tarek Abdelzaher",2022/5/4,Conference 2022 IEEE 28th Real-Time and Embedded Technology and Applications Symposium (RTAS),"This paper presents a self-cueing real-time frame-work for attention prioritization in AI-enabled visual perception systems that minimizes a notion of state uncertainty. By attention prioritization we refer to inspecting some parts of the scene before others in a criticality-aware fashion. By self-cueing, we refer to not needing external cueing sensors for prioritizing attention, thereby simplifying design. We show that attention prioritization saves resources, thus enabling more efficient and responsive real-time object tracking on resource-limited embedded platforms. The system consists of two components: First, an optical flow-based module decides on the regions to be viewed on a subframe level, as well as their criticality. Second, a novel batched proportional balancing (BPB) scheduling policy decides how to schedule these regions for inspection by a deep neural network (DNN), and how to parallelize execution on the …",7
Towards an accurate latency model for convolutional neural network layers on gpus,"Jinyang Li, Runyu Ma, Vikram Sharma Mailthody, Colin Samplawski, Benjamin Marlin, Songqing Chen, Shuochao Yao, Tarek Abdelzaher",2021/11/29,Conference MILCOM 2021-2021 IEEE Military Communications Conference (MILCOM),"Convolutional Neural Networks (CNN) have shown great success in many sensing and recognition applications. However, the excessive resource demand remains a major barrier against their deployment on low-end devices. Optimizations, such as model compression, are thus a need for practical deployment. To fully exploit existing system resources, platform-aware optimizations emerged in recent years, where an execution-time model becomes a necessity. However, non-monotonicity over the network configuration space makes execution time modeling a challenging task. Data-driven approaches have the advantage of being portable over different platforms by treating the hardware and software stack as a black box but at the cost of extremely long profiling time. On the other hand, analytical models can be found in the architecture and system literature that do not need heavy profiling but require laborious …",7
"Controlvae: Tuning, analytical properties, and performance analysis","Huajie Shao, Zhisheng Xiao, Shuochao Yao, Dachun Sun, Aston Zhang, Shengzhong Liu, Tianshi Wang, Jinyang Li, Tarek Abdelzaher",2021/11/17,Source IEEE transactions on pattern analysis and machine intelligence,"This paper reviews the novel concept of a controllable variational autoencoder (ControlVAE), discusses its parameter tuning to meet application needs, derives its key analytic properties, and offers useful extensions and applications. ControlVAE is a new variational autoencoder (VAE) framework that combines automatic control theory with the basic VAE to stabilize the KL-divergence of VAE models to a specified value. It leverages a non-linear PI controller, a variant of the proportional-integral-derivative (PID) controller, to dynamically tune the weight of the KL-divergence term in the evidence lower bound (ELBO) using the output KL-divergence as feedback. This allows us to precisely control the KL-divergence to a desired value (set point) that is effective in avoiding posterior collapse and learning disentangled representations. While prior work developed alternative techniques for controlling the KL divergence, we …",7
Deep compressive offloading: Speeding up edge offloading for ai services,"Shuochao Yao, Jinyang Li, Dongxin Liu, Tianshi Wang, Shengzhong Liu, Huajie Shao, Tarek Abdelzaher",2021/6/17,Journal GetMobile: Mobile Computing and Communications,"Future mobile and embedded systems will be smarter and more user-friendly. They will perceive the physical environment, understand human context, and interact with end-users in a human-like fashion. Daily objects will be capable of leveraging sensor data to perform complex estimation and recognition tasks, such as recognizing visual inputs, understanding voice commands, tracking objects, and interpreting human actions. This raises important research questions on how to endow low-end embedded and mobile devices with the appearance of intelligence despite their resource limitations.",6
A latent hawkes process model for event clustering and temporal dynamics learning with applications in github,"Shengzhong Liu, Shuochao Yao, Dongxin Liu, Huajie Shao, Yiran Zhao, Xinzhe Fu, Tarek Abdelzaher",2019/7/7,Conference 2019 IEEE 39th International Conference on Distributed Computing Systems (ICDCS),"Large volumes of event data are becoming increasingly available on online social networks. These events are usually causally dependent to each other, reflecting the interactions and collaborations among different parties. Learning and interpreting the temporal patterns and dynamics within these event streams plays an important role in many practical applications, such as trend prediction and anomaly detection. Since causal dependencies can be reflected in both event time (i.e., when) and event content (i.e., who and what), we thus develop a user community based generative model, called latent Hawkes process (LHP), taking into account both-side information to illustrate the generation of such inter-dependent event streams on GitHub repositories, where each attribute is assumed to be generated by interplays between correlated latent communities. Through learning of our model, two functionalities are fulfilled …",6
Hierarchical overlapping belief estimation by structured matrix factorization,"Chaoqi Yang, Jinyang Li, Ruijie Wang, Shuochao Yao, Huajie Shao, Dongxin Liu, Shengzhong Liu, Tianshi Wang, Tarek F Abdelzaher",2020/12/7,Conference 2020 IEEE/ACM International Conference on Advances in Social Networks Analysis and Mining (ASONAM),"Much work on social media opinion polarization focuses on a flat categorization of stances (or orthogonal beliefs) of different communities from media traces. We extend in this work in two important respects. First, we detect not only points of disagreement between communities, but also points of agreement. In other words, we estimate community beliefs in the presence of overlap. Second, in lieu of flat categorization, we consider hierarchical belief estimation, where communities might be hierarchically divided. For example, two opposing parties might disagree on core issues, but within a party, despite agreement on fundamentals, disagreement might occur on further details. We call the resulting combined problem a hierarchical overlapping belief estimation problem. To solve it, this paper develops a new class of unsupervised Non-negative Matrix Factorization (NMF) algorithms, we call Belief Structured Matrix …",5
Dynamicvae: Decoupling reconstruction error and disentangled representation learning,"Huajie Shao, Haohong Lin, Qinmin Yang, Shuochao Yao, Han Zhao, Tarek Abdelzaher",2020/9/15,Journal arXiv preprint arXiv:2009.06795,"This paper challenges the common assumption that the weight , in -VAE, should be larger than  in order to effectively disentangle latent factors. We demonstrate that -VAE, with , can not only attain good disentanglement but also significantly improve reconstruction accuracy via dynamic control. The paper removes the inherent trade-off between reconstruction accuracy and disentanglement for -VAE. Existing methods, such as -VAE and FactorVAE, assign a large weight to the KL-divergence term in the objective function, leading to high reconstruction errors for the sake of better disentanglement. To mitigate this problem, a ControlVAE has recently been developed that dynamically tunes the KL-divergence weight in an attempt to control the trade-off to more a favorable point. However, ControlVAE fails to eliminate the conflict between the need for a large  (for disentanglement) and the need for a small . Instead, we propose DynamicVAE that maintains a different  at different stages of training, thereby decoupling disentanglement and reconstruction accuracy. In order to evolve the weight, , along a trajectory that enables such decoupling, DynamicVAE leverages a modified incremental PI (proportional-integral) controller, and employs a moving average as well as a hybrid annealing method to evolve the value of KL-divergence smoothly in a tightly controlled fashion. We theoretically prove the stability of the proposed approach. Evaluation results on three benchmark datasets demonstrate that DynamicVAE significantly improves the reconstruction accuracy while achieving disentanglement comparable to the best of existing …",5
Unsupervised fact-finding with multi-modal data in social sensing,"Huajie Shao, Shuochao Yao, Yiran Zhao, Lu Su, Zhibo Wang, Dongxin Liu, Shengzhong Liu, Lance Kaplan, Tarek Abdelzaher",2019/7/2,Conference 2019 22th International Conference on Information Fusion (FUSION),"This paper develops unsupervised fact-finding algorithms that combine consideration of multi-modal microblog content features with analysis of propagation patterns to determine veracity of microblog observations. In contrast to prior solutions that use labeled examples to learn content features that are correlated with veracity, our approach is entirely unsupervised. Hence, given no prior training data, we jointly learn the importance of different content features together with the veracity of observations using propagation patterns as an indicator of perceived content reliability. To offer robustness, we describe fact-finding extensions that handle the existence of malicious colluding sources. We evaluate the performance of the proposed algorithms on real-world data sets collected from Twitter. The evaluation results demonstrate that the proposed algorithms outperform the existing fact-finding approaches, and offer …",5
