titles,authors,date,source,descriptions,citations
On source dependency models for reliable social sensing: Algorithms and fundamental error bounds,"Shuochao Yao, Shaohan Hu, Shen Li, Yiran Zhao, Lu Su, Lance Kaplan, Aylin Yener, Tarek Abdelzaher",2016/6/27,Conference 2016 IEEE 36th international conference on distributed computing systems (ICDCS),"This paper develops a simplified dependency model for sources on social networks that is shown to improve the quality of fact-finding -- assessing veracity of observations shared on social media. Recent literature developed a mathematical approach for exploiting social networks, such as Twitter, as noisy sensor networks that report observations on the state of the physical world. It was shown that the quality of state estimation from such noisy data, known as fact-finding, was a function of assumptions made regarding the independence of sources or lack thereof. When sources propagate information they hear from others (without verification), correlated errors may arise that degrade fact-finding performance. This work advances the state of the art by developing a simplified model of dependencies between sources and designing an improved dependency-aware estimator to assess veracity of observations, taking …",29
Scheduling real-time deep learning services as imprecise computations,"Shuochao Yao, Yifan Hao, Yiran Zhao, Huajie Shao, Dongxin Liu, Shengzhong Liu, Tianshi Wang, Jinyang Li, Tarek Abdelzaher",2020/8/19,Conference 2020 IEEE 26th international conference on embedded and real-time computing systems and applications (RTCSA),"The paper presents a real-time computing framework for intelligent real-time edge services, on behalf of local embedded devices that are themselves unable to support extensive computations. The work contributes to a new direction in realtime computing that develops scheduling algorithms for machine intelligence tasks that enable anytime prediction. We show that deep neural network workflows can be cast as imprecise computations, each with a mandatory part and (several) optional parts whose execution utility depends on input data. With our design, deep neural networks can be preempted before their completion and support anytime inference. The goal of the realtime scheduler is to maximize the average accuracy of deep neural network outputs while meeting task deadlines, thanks to opportunistic shedding of the least necessary optional parts. The work is motivated by the proliferation of increasingly …",28
On removing algorithmic priority inversion from mission-critical machine inference pipelines,"Shengzhong Liu, Shuochao Yao, Xinzhe Fu, Rohan Tabish, Simon Yu, Ayoosh Bansal, Heechul Yun, Lui Sha, Tarek Abdelzaher",2020/12/1,Conference 2020 IEEE Real-Time Systems Symposium (RTSS),"The paper discusses algorithmic priority inversion in mission-critical machine inference pipelines used in modern neural-network-based cyber-physical applications, and develops a scheduling solution to mitigate its effect. In general, priority inversion occurs in real-time systems when computations that are of lower priority are performed together with or ahead of those that are of higher priority. 1  In current machine intelligence software, significant priority inversion occurs on the path from perception to decision-making, where the execution of underlying neural network algorithms does not differentiate between critical and less critical data. We describe a scheduling framework to resolve this problem, and demonstrate that it improves the system's ability to react to critical inputs, while at the same time reducing platform cost.",27
Five challenges in cloud-enabled intelligence and control,"Tarek Abdelzaher, Yifan Hao, Kasthuri Jayarajah, Archan Misra, Per Skarin, Shuochao Yao, Dulanga Weerakoon, Karl-Erik Årzén",2020/2/10,Journal ACM Transactions on Internet Technology (TOIT),"The proliferation of connected embedded devices, or the Internet of Things (IoT), together with recent advances in machine intelligence, will change the profile of future cloud services and introduce a variety of new research problems, both in cloud applications and infrastructure layers. These problems are centered around empowering individually resource-limited devices to exhibit intelligent behavior, both in sensing and control, thanks to a judicious utilization of cloud resources. Cloud services will enable learning from data, perform inference, and execute control, all with assurances on outcomes. This article discusses such emerging services and outlines five resulting new research directions towards enabling and optimizing intelligent, cloud-assisted sensing and control in the age of the Internet of Things.",27
Hypergraph learning with line expansion,"Chaoqi Yang, Ruijie Wang, Shuochao Yao, Tarek Abdelzaher",2020/5/11,Journal arXiv preprint arXiv:2005.04843,"Previous hypergraph expansions are solely carried out on either vertex level or hyperedge level, thereby missing the symmetric nature of data co-occurrence, and resulting in information loss. To address the problem, this paper treats vertices and hyperedges equally and proposes a new hypergraph formulation named the \emph{line expansion (LE)} for hypergraphs learning. The new expansion bijectively induces a homogeneous structure from the hypergraph by treating vertex-hyperedge pairs as ""line nodes"". By reducing the hypergraph to a simple graph, the proposed \emph{line expansion} makes existing graph learning algorithms compatible with the higher-order structure and has been proven as a unifying framework for various hypergraph expansions. We evaluate the proposed line expansion on five hypergraph datasets, the results show that our method beats SOTA baselines by a significant margin.",26
An experimental evaluation of datacenter workloads on low-power embedded micro servers,"Yiran Zhao, Shen Li, Shaohan Hu, Hongwei Wang, Shuochao Yao, Huajie Shao, Tarek F Abdelzaher",2016/9/4,"Journal Proceedings of the VLDB Endowment 9, no. 9 (2016): 696-707.","This paper presents a comprehensive evaluation of an ultra-low power cluster, built upon the Intel Edison based micro servers. The improved performance and high energy efficiency of micro servers have driven both academia and industry to explore the possibility of replacing conventional brawny servers with a larger swarm of embedded micro servers. Existing attempts mostly focus on mobile-class micro servers, whose capacities are similar to mobile phones. We, on the other hand, target on sensor-class micro servers, which are originally intended for uses in wearable technologies, sensor networks, and Internet-of-Things. Although sensor-class micro servers have much less capacity, they are touted for minimal power consumption (< 1 Watt), which opens new possibilities of achieving higher energy efficiency in datacenter workloads. Our systematic evaluation of the Edison cluster and comparisons to conventional brawny clusters involve careful workload choosing and laborious parameter tuning, which ensures maximum server utilization and thus fair comparisons. Results show that the Edison cluster achieves up to 3.5× improvement on work-done-per-joule for web service applications and data-intensive MapReduce jobs. In terms of scalability, the Edison cluster scales linearly on the throughput of web service workloads, and also shows satisfactory scalability for MapReduce workloads despite coordination overhead.",26
ApDeepsense: Deep learning uncertainty estimation without the pain for iot applications,"Shuochao Yao, Yiran Zhao, Huajie Shao, Chao Zhang, Aston Zhang, Dongxin Liu, Shengzhong Liu, Lu Su, Tarek Abdelzaher",2018/7/2,Conference 2018 IEEE 38th International Conference on Distributed Computing Systems (ICDCS),"Recent advances in deep-learning-based applications have attracted a growing attention from the IoT community. These highly capable learning models have shown significant improvements in expected accuracy of various sensory inference tasks. One important and yet overlooked direction remains to provide uncertainty estimates in deep learning outputs. Since robustness and reliability of sensory inference results are critical to IoT systems, uncertainty estimates are indispensable for IoT applications. To address this challenge, we develop ApDeepSense, an effective and efficient deep learning uncertainty estimation method for resource-constrained IoT devices. ApDeepSense leverages an implicit Bayesian approximation that links neural networks to deep Gaussian processes, allowing output uncertainty to be quantified. Our approach is shown to significantly reduce the execution time and energy consumption …",25
paper2repo: GitHub repository recommendation for academic papers,"Huajie Shao, Dachun Sun, Jiahao Wu, Zecheng Zhang, Aston Zhang, Shuochao Yao, Shengzhong Liu, Tianshi Wang, Chao Zhang, Tarek Abdelzaher",2020/4/20,Book Proceedings of The Web Conference 2020,"GitHub has become a popular social application platform, where a large number of users post their open source projects. In particular, an increasing number of researchers release repositories of source code related to their research papers in order to attract more people to follow their work. Motivated by this trend, we describe a novel item-item cross-platform recommender system, paper2repo, that recommends relevant repositories on GitHub that match a given paper in an academic search system such as Microsoft Academic. The key challenge is to identify the similarity between an input paper and its related repositories across the two platforms, without the benefit of human labeling. Towards that end, paper2repo integrates text encoding and constrained graph convolutional networks (GCN) to automatically learn and map the embeddings of papers and repositories into the same space, where proximity offers the …",22
Qualitydeepsense: Quality-aware deep learning framework for internet of things applications with sensor-temporal attention,"Shuochao Yao, Yiran Zhao, Shaohan Hu, Tarek Abdelzaher",2018/6/15,Book Proceedings of the 2nd International Workshop on Embedded and Mobile Deep Learning,"Deep neural networks are becoming increasingly popular in mobile sensing and computing applications. Their capability of fusing multiple sensor inputs and extracting temporal relationships can enhance intelligence in a wide range of applications. One key problem however is the noisy on-device sensors, whose characters are heterogeneous and varying over time. The existing mobile deep learning frameworks usually treat every sensor input equally over time, lacking the ability of identifying and exploiting the heterogeneity of sensor noise. In this work, we propose QualityDeepSense, a deep learning framework that can automatically balance the contribution of sensor inputs over time by their sensing qualities. We propose a sensor-temporal attention mechanism to learn the dependencies among sensor inputs over time. These correlations are used to infer the qualities and reassign the contribution of sensor …",22
Handling missing sensors in topology-aware iot applications with gated graph neural network,"Shengzhong Liu, Shuochao Yao, Yifei Huang, Dongxin Liu, Huajie Shao, Yiran Zhao, Jinyang Li, Tianshi Wang, Ruijie Wang, Chaoqi Yang, Tarek Abdelzaher",2020/9/4,"Journal Proceedings of the ACM on Interactive, Mobile, Wearable and Ubiquitous Technologies","Reliable data collection, transmission, and delivery on Internet of Things (IoT) systems is crucial in order to provide high-quality intelligent services. However, sensor data delivery can be interrupted for various reasons, such as sensor malfunction, network failures, and external attacks. Thus, only data from a partial set of sensors may be available. We call it the missing sensor problem. This problem can lead to severe performance degradation at inference time by neural-network-based recognition models trained on the complete sensor set. This paper enhances the robustness of neural network models to the missing sensor problem by introducing a novel feature reconstruction module, named the graph recovery module, that handles missing sensors directly inside the network. Specifically, we consider topology-aware IoT applications, where sensors are placed on a physically interconnected network. We design a …",21
Multiscale online media simulation with SocialCube,"Tarek Abdelzaher, Jiawei Han, Yifan Hao, Andong Jing, Dongxin Liu, Shengzhong Liu, Hoang Hai Nguyen, David M Nicol, Huajie Shao, Tianshi Wang, Shuochao Yao, Yu Zhang, Omar Malik, Stephen Dipple, James Flamino, Fred Buchanan, Sam Cohen, Gyorgy Korniss, Boleslaw K Szymanski",2020/6,Journal Computational and Mathematical Organization Theory,"This paper describes the design, implementation, and early experiences with a novel agent-based simulator of online media streams, developed under DARPA’s SocialSim Program to extract and predict trends in information dissemination on online media. A hallmark of the simulator is its self-configuring property. Instead of requiring initial set-up, the input to the simulator constitutes data traces collected from the medium to be simulated. The simulator automatically learns from the data such elements as the number of agents involved, the number of objects involved, and the rate of introduction of new agents and objects. It also develops behavior models of simulated agents and objects, and their dependencies. These models are then used to run simulations allowing future extrapolation and “what if” analysis. An interesting property of the simulator is its multi-level abstraction capability that allows modeling social …",20
A spherical hidden markov model for semantics-rich human mobility modeling,"Wanzheng Zhu, Chao Zhang, Shuochao Yao, Xiaobin Gao, Jiawei Han",2018/4/29,Journal Proceedings of the AAAI Conference on Artificial Intelligence,"We study the problem of modeling human mobility from semantic trace data, wherein each GPS record in a trace is associated with a text message that describes the user's activity. Existing methods fall short in unveiling human movement regularities for such data, because they either do not model the text data at all or suffer from text sparsity severely. We propose SHMM, a multi-modal spherical hidden Markov model for semantics-rich human mobility modeling. Under the hidden Markov assumption, SHMM models the generation process of a given trace by jointly considering the observed location, time, and text at each step of the trace. The distinguishing characteristic of SHMM is the text modeling part. We use fixed-size vector representations to encode the semantics of the text messages, and model the generation of the l2-normalized text embeddings on a unit sphere with the von Mises-Fisher (vMF) distribution. Compared with other alternatives like multi-variate Gaussian, our choice of the vMF distribution not only incurs much fewer parameters, but also better leverages the discriminative power of text embeddings in a directional metric space. The parameter inference for the vMF distribution is non-trivial since it involves functional inversion of ratios of Bessel functions. We theoretically prove, for the first time, that: 1) the classical Expectation-Maximization algorithm is able to work with vMF distributions; and 2) while closed-form solutions are hard to be obtained for the M-step, Newton's method is guaranteed to converge to the optimal solution with quadratic convergence rate. We have performed extensive experiments on both synthetic and real …",17
Codrive: Cooperative driving scheme for vehicles in urban signalized intersections,"Yiran Zhao, Shuochao Yao, Huajie Shao, Tarek Abdelzaher",2018/4/11,Conference 2018 ACM/IEEE 9th International Conference on Cyber-Physical Systems (ICCPS),"This paper presents the design and evaluation of CoDrive, a cooperative speed advice system aiming at vehicular fuel savings by reconciling speeds of different vehicles with the timing of signalized intersections. Existing systems for speed coordination and platoon management primarily focus on safety, stability, and security issues. In the authors' own prior work, speed optimizations are discussed for minimizing fuel consumption by exploiting signalized intersection timing. In this paper, we recognize that vehicles whose paths diverge after the next intersection have different fuel-optimal speeds. Since slower vehicles will block faster ones from meeting their optimal speed in heavy traffic or on single-lane roads, we develop an algorithm for speed re-negotiation that arrives at a compromise speed for all vehicles involved. The resulting cooperative speed advice scheme minimizes the total fuel consumption of the …",16
On exploiting logical dependencies for minimizing additive cost metrics in resource-limited crowdsensing,"Shaohan Hu, Shen Li, Shuochao Yao, Lu Su, Ramesh Govindan, Reginald Hobbs, Tarek F Abdelzaher",2015/6/10,Conference 2015 International Conference on Distributed Computing in Sensor Systems,"We develop data retrieval algorithms for crowd-sensing applications that reduce the underlying network bandwidth consumption or any additive cost metric by exploiting logical dependencies among data items, while maintaining the level of service to the client applications. Crowd sensing applications refer to those where local measurements are performed by humans or devices in their possession for subsequent aggregation and sharing purposes. In this paper, we focus on resource-limited crowd sensing, such as disaster response and recovery scenarios. The key challenge in those scenarios is to cope with resource constraints. Unlike the traditional application design, where measurements are sent to a central aggregator, in resource limited scenarios, data will typically reside at the source until requested to prevent needless transmission. Many applications exhibit dependencies among data items. For example …",16
Real-time task scheduling for machine perception in intelligent cyber-physical systems,"Shengzhong Liu, Shuochao Yao, Xinzhe Fu, Huajie Shao, Rohan Tabish, Simon Yu, Ayoosh Bansal, Heechul Yun, Lui Sha, Tarek Abdelzaher",2021/8/20,Journal IEEE Transactions on Computers,"This paper explores  criticality-based real-time scheduling  of neural-network-based machine inference pipelines in cyber-physical systems (CPS) to mitigate the effect of algorithmic priority inversion. We specifically focus on the perception subsystem, an important subsystem feeding other components (e.g., planning and control). In general, priority inversion occurs in real-time systems when computations that are of lower priority are performed together with or ahead of those that are of higher priority. In current machine perception software, significant priority inversion occurs because  resource allocation  to the underlying neural network models does not differentiate between critical and less critical data within a scene. To remedy this problem, in recent work, we proposed an architecture to partition the input data into regions of different criticality, then formulated a utility-based optimization problem to batch and …",15
VibeBin: A vibration-based waste bin level detection system,"Yiran Zhao, Shuochao Yao, Shen Li, Shaohan Hu, Huajie Shao, Tarek F Abdelzaher",2017/9/11,"Journal Proceedings of the ACM on Interactive, Mobile, Wearable and Ubiquitous Technologies","This paper presents the design and implementation of VibeBin, a low-cost, non-intrusive and easy-to-install waste bin level detection system. Recent popularity of Internet-of-Things (IoT) sensors has brought us unprecedented opportunities to enable a variety of new services for monitoring and controlling smart buildings. Indoor waste management is crucial to a healthy environment in smart buildings. Measuring the waste bin fill-level helps building operators schedule garbage collection more responsively and optimize the quantity and location of waste bins. Existing systems focus on directly and intrusively measuring the physical quantities of the garbage (weight, height, volume, etc.) or its appearance (image), and therefore require careful installation, laborious calibration or labeling, and can be costly. Our system indirectly measures fill-level by sensing the changes in motor-induced vibration characteristics on the …",15
CrossRoI: cross-camera region of interest optimization for efficient real time video analytics at scale,"Hongpeng Guo, Shuochao Yao, Zhe Yang, Qian Zhou, Klara Nahrstedt",2021/7/15,Book Proceedings of the 12th ACM Multimedia Systems Conference,"Video cameras are pervasively deployed in city scale for public good or community safety (i.e. traffic monitoring or suspected person tracking). However, analyzing large scale video feeds in real time is data intensive and poses severe challenges to today's network and computation systems. We present CrossRoI, a resource-efficient system that enables real time video analytics at scale via harnessing the videos content associations and redundancy across a fleet of cameras. CrossRoI exploits the intrinsic physical correlations of cross-camera viewing fields to drastically reduce the communication and computation costs. CrossRoI removes the repentant appearances of same objects in multiple cameras without harming comprehensive coverage of the scene. CrossRoI operates in two phases - an offline phase to establish cross-camera correlations, and an efficient online phase for real time video inference …",14
A constrained maximum likelihood estimator for unguided social sensing,"Huajie Shao, Shuochao Yao, Yiran Zhao, Chao Zhang, Jinda Han, Lance Kaplan, Lu Su, Tarek Abdelzaher",2018/4/16,Conference IEEE INFOCOM 2018-IEEE Conference on Computer Communications,"This paper develops a constrained expectation maximization algorithm (CEM) that improves the accuracy of truth estimation in unguided social sensing applications. Unguided social sensing refers to the act of leveraging naturally occurring observations on social media as “sensor measurements”, when the sources post at will and not in response to specific sensing campaigns or surveys. A key challenge in social sensing, in general, lies in estimating the veracity of reported observations, when the sources reporting these observations are of unknown reliability and their observations themselves cannot be readily verified. This problem is known as fact-finding. Unsupervised solutions have been proposed to the fact-finding problem that explore notions of internal data consistency in order to estimate observation veracity. This paper observes that unguided social sensing gives rise to a new (and very simple …",14
Athena: Towards decision-centric anticipatory sensor information delivery,"Jongdeog Lee, Kelvin Marcus, Tarek Abdelzaher, Md Tanvir A Amin, Amotz Bar-Noy, William Dron, Ramesh Govindan, Reginald Hobbs, Shaohan Hu, Jung-Eun Kim, Lui Sha, Shuochao Yao, Yiran Zhao",2018/1/15,Journal Journal of Sensor and Actuator Networks,"The paper introduces a new direction in quality-of-service-aware networked sensing that designs communication protocols and scheduling policies for data delivery that are optimized specifically for decision needs. The work complements present decision monitoring and support tools and falls in the larger framework of decision-driven resource management. A hallmark of the new protocols is that they are aware of the inference structure used to arrive at decisions (from logical predicates), as well as the data (and data quality) that need to be furnished to successfully evaluate the unknowns on which these decisions are based. Such protocols can therefore anticipate and deliver precisely the right data, at the right level of quality, from the right sources, at the right time, to enable valid and timely decisions at minimum cost to the underlying network. This paper presents the decision model used and the protocol design philosophy, reviews the key recent results and describes a novel system, called Athena, that is the first to embody the aforementioned data delivery paradigm. Evaluation results are presented that compare the performance of decision-centric anticipatory information delivery to several baselines, demonstrating its various advantages in terms of decision timeliness, validity and network resources used. The paper concludes with a discussion of remaining future challenges in this emerging area.",14
On the improvement of classifying EEG recordings using neural networks,"Yiran Zhao, Shuochao Yao, Shaohan Hu, Shiyu Chang, Raghu Ganti, Mudhakar Srivatsa, Shen Li, Tarek Abdelzaher",2017/12/11,Conference 2017 IEEE International Conference on Big Data (Big Data),"This paper presents improved results on classifying electroencephalography (EEG) recordings using deep learning. The task is to classify movements that the subject is thinking about (motor imagery), using only the recorded electrical activities on the scalp. The challenges are: poor signal-to-noise ratio; interference from numerous sources such as electrical line noise, muscle activity, and eye movements; considerable variability between individuals and even recording sessions. Traditional signal processing techniques such as frequency band analysis, common spatial pattern (CSP) algorithm or independent component analysis (ICA) fall short due to their limited capacity. Thanks to the rise of big data in healthcare, medical recordings now come in abundance. Therefore deep learning which relies on large amounts of training data is becoming the new cutting edge tool. We present a significant improvement of …",14
