titles,authors,date,source,descriptions,citations
Deepsense: A unified deep learning framework for time-series mobile sensing data processing,"Shuochao Yao, Shaohan Hu, Yiran Zhao, Aston Zhang, Tarek Abdelzaher",2017/4/3,Book Proceedings of the 26th international conference on world wide web,"Mobile sensing and computing applications usually require time-series inputs from sensors, such as accelerometers, gyroscopes, and magnetometers. Some applications, such as tracking, can use sensed acceleration and rate of rotation to calculate displacement based on physical system models. Other applications, such as activity recognition, extract manually designed features from sensor inputs for classification. Such applications face two challenges. On one hand, on-device sensor measurements are noisy. For many mobile applications, it is hard to find a distribution that exactly describes the noise in practice. Unfortunately, calculating target quantities based on physical system and noise models is only as accurate as the noise assumptions. Similarly, in classification applications, although manually designed features have proven to be effective, it is not always straightforward to find the most robust features to …",555
Towards environment independent device free human activity recognition,"Wenjun Jiang, Chenglin Miao, Fenglong Ma, Shuochao Yao, Yaqing Wang, Ye Yuan, Hongfei Xue, Chen Song, Xin Ma, Dimitrios Koutsonikolas, Wenyao Xu, Lu Su",2018/10/15,Book Proceedings of the 24th annual international conference on mobile computing and networking,"Driven by a wide range of real-world applications, significant efforts have recently been made to explore device-free human activity recognition techniques that utilize the information collected by various wireless infrastructures to infer human activities without the need for the monitored subject to carry a dedicated device. Existing device free human activity recognition approaches and systems, though yielding reasonably good performance in certain cases, are faced with a major challenge. The wireless signals arriving at the receiving devices usually carry substantial information that is specific to the environment where the activities are recorded and the human subject who conducts the activities. Due to this reason, an activity recognition model that is trained on a specific subject in a specific environment typically does not work well when being applied to predict another subject's activities that are recorded in a …",334
DeepIoT: Compressing Deep Neural Network Structures for Sensing Systems with a Compressor-Critic Framework,"Shuochao Yao, Yiran Zhao, Aston Zhang, Lu Su, Tarek Abdelzaher",2017/6/5,Conference SenSys '17 Proceedings of the 15th ACM Conference on Embedded Network Sensor Systems,"Recent advances in deep learning motivate the use of deep neutral networks in sensing applications, but their excessive resource needs on constrained embedded devices remain an important impediment. A recently explored solution space lies in compressing (approximating or simplifying) deep neural networks in some manner before use on the device. We propose a new compression solution, called DeepIoT, that makes two key contributions in that space. First, unlike current solutions geared for compressing specific types of neural networks, DeepIoT presents a unified approach that compresses all commonly used deep learning structures for sensing applications, including fully-connected, convolutional, and recurrent neural networks, as well as their combinations. Second, unlike solutions that either sparsify weight matrices or assume linear structure within weight matrices, DeepIoT compresses neural …",187
Deep learning for the internet of things,"Shuochao Yao, Yiran Zhao, Aston Zhang, Shaohan Hu, Huajie Shao, Chao Zhang, Lu Su, Tarek Abdelzaher",2018/5/24,Journal Computer,"How can the advantages of deep learning be brought to the emerging world of embedded IoT devices? The authors discuss several core challenges in embedded and mobile deep learning, as well as recent solutions demonstrating the feasibility of building IoT applications that are powered by effective, efficient, and reliable deep learning models.",129
Fastdeepiot: Towards understanding and optimizing neural network execution time on mobile and embedded devices,"Shuochao Yao, Yiran Zhao, Huajie Shao, ShengZhong Liu, Dongxin Liu, Lu Su, Tarek Abdelzaher",2018/11/4,Book Proceedings of the 16th ACM Conference on Embedded Networked Sensor Systems,"Deep neural networks show great potential as solutions to many sensing application problems, but their excessive resource demand slows down execution time, pausing a serious impediment to deployment on low-end devices. To address this challenge, recent literature focused on compressing neural network size to improve performance. We show that changing neural network size does not proportionally affect performance attributes of interest, such as execution time. Rather, extreme run-time nonlinearities exist over the network configuration space. Hence, we propose a novel framework, called FastDeepIoT, that uncovers the non-linear relation between neural network structure and execution time, then exploits that understanding to find network configurations that significantly improve the trade-off between execution time and accuracy on mobile and embedded devices. FastDeepIoT makes two key …",122
Scalable social sensing of interdependent phenomena,"Shiguang Wang, Lu Su, Shen Li, Shaohan Hu, Tanvir Amin, Hongwei Wang, Shuochao Yao, Lance Kaplan, Tarek Abdelzaher",2015/4/13,Book Proceedings of the 14th international conference on information processing in sensor networks,"The proliferation of mobile sensing and communication devices in the possession of the average individual generated much recent interest in social sensing applications. Significant advances were made on the problem of uncovering ground truth from observations made by participants of unknown reliability. The problem, also called fact-finding commonly arises in applications where unvetted individuals may opt in to report phenomena of interest. For example, reliability of individuals might be unknown when they can join a participatory sensing campaign simply by downloading a smartphone app. This paper extends past social sensing literature by offering a scalable approach for exploiting dependencies between observed variables to increase fact-finding accuracy. Prior work assumed that reported facts are independent, or incurred exponential complexity when dependencies were present. In contrast, this …",72
Deep compressive offloading: Speeding up neural network inference by trading edge computation for network latency,"Shuochao Yao, Jinyang Li, Dongxin Liu, Tianshi Wang, Shengzhong Liu, Huajie Shao, Tarek Abdelzaher",2020/11/16,Book Proceedings of the 18th Conference on Embedded Networked Sensor Systems,"With recent advances, neural networks have become a crucial building block in intelligent IoT systems and sensing applications. However, the excessive computational demand remains a serious impediment to their deployments on low-end IoT devices. With the emergence of edge computing, offloading grows into a promising technique to circumvent end-device limitations. However, transferring data between local and edge devices takes up a large proportion of time in existing offloading frameworks, creating a bottleneck for low-latency intelligent services. In this work, we propose a general framework, called deep compressive offloading. By integrating compressive sensing theory and deep learning, our framework can encode data for offloading into tiny sizes with negligible overhead on local devices and decode the data on the edge server, while offering theoretical guarantees on perfect reconstruction and …",59
Rdeepsense: Reliable deep mobile computing models with uncertainty estimations,"Shuochao Yao, Yiran Zhao, Huajie Shao, Aston Zhang, Chao Zhang, Shen Li, Tarek Abdelzaher",2018/1/8,"Journal Proceedings of the ACM on Interactive, Mobile, Wearable and Ubiquitous Technologies","Recent advances in deep learning have led various applications to unprecedented achievements, which could potentially bring higher intelligence to a broad spectrum of mobile and ubiquitous applications. Although existing studies have demonstrated the effectiveness and feasibility of running deep neural network inference operations on mobile and embedded devices, they overlooked the reliability of mobile computing models. Reliability measurements such as predictive uncertainty estimations are key factors for improving the decision accuracy and user experience. In this work, we propose RDeepSense, the first deep learning model that provides well-calibrated uncertainty estimations for resource-constrained mobile and embedded devices. RDeepSense enables the predictive uncertainty by adopting a tunable proper scoring rule as the training criterion and dropout as the implicit Bayesian approximation …",57
Revisiting over-smoothing in deep GCNs,"Chaoqi Yang, Ruijie Wang, Shuochao Yao, Shengzhong Liu, Tarek Abdelzaher",2020/3/30,Journal arXiv preprint arXiv:2003.13663,"Oversmoothing has been assumed to be the major cause of performance drop in deep graph convolutional networks (GCNs). In this paper, we propose a new view that deep GCNs can actually learn to anti-oversmooth during training. This work interprets a standard GCN architecture as layerwise integration of a Multi-layer Perceptron (MLP) and graph regularization. We analyze and conclude that before training, the final representation of a deep GCN does over-smooth, however, it learns anti-oversmoothing during training. Based on the conclusion, the paper further designs a cheap but effective trick to improve GCN training. We verify our conclusions and evaluate the trick on three citation networks and further provide insights on neighborhood aggregation in GCNs.",55
SenseGAN: Enabling deep learning for internet of things with a semi-supervised framework,"Shuochao Yao, Yiran Zhao, Huajie Shao, Chao Zhang, Aston Zhang, Shaohan Hu, Dongxin Liu, Shengzhong Liu, Lu Su, Tarek Abdelzaher",2018/9/18,"Journal Proceedings of the ACM on Interactive, Mobile, Wearable and Ubiquitous Technologies","Recent proliferation of Internet of Things (IoT) devices with enhanced computing and sensing capabilities has revolutionized our everyday life. The massive data from these ubiquitous devices motivate the creation of intelligent IoT systems that can collectively learn. However, labelling data for learning purposes is extremely time-consuming, which greatly hinders deployment. In this paper, we describe a semi-supervised deep learning framework, called SenseGAN, that can leverage abundant unlabelled sensing data thereby minimizing the need for labelling effort. SenseGAN jointly trains three components with an adversarial game: (i) a classifier for predicting labels of input sensing data; (ii) a generator for generating sensing data samples based on the input labels; and (iii) a discriminator for differentiating the joint data/label distribution between real samples and partially generated samples from either the …",49
Controlvae: Controllable variational autoencoder,"Huajie Shao, Shuochao Yao, Dachun Sun, Aston Zhang, Shengzhong Liu, Dongxin Liu, Jun Wang, Tarek Abdelzaher",2020/11/21,Conference International Conference on Machine Learning,"Variational Autoencoders (VAE) and their variants have been widely used in a variety of applications, such as dialog generation, image generation and disentangled representation learning. However, the existing VAE models may suffer from KL vanishing in language modeling and low reconstruction quality for disentangling. To address these issues, we propose a novel controllable variational autoencoder framework, ControlVAE, that combines a controller, inspired by automatic control theory, with the basic VAE to improve the performance of resulting generative models. Specifically, we design a new non-linear PI controller, a variant of the proportional-integral-derivative (PID) control, to automatically tune the hyperparameter (weight) added in the VAE objective using the output KL-divergence as feedback during model training. The framework is evaluated using three applications; namely, language modeling, disentangled representation learning, and image generation. The results show that ControlVAE can achieve much better reconstruction quality than the competitive methods for the comparable disentanglement performance. For language modeling, it not only averts the KL-vanishing, but also improves the diversity of generated text. Finally, we also demonstrate that ControlVAE improves the reconstruction quality for image generation compared to the original VAE.",47
Recursive ground truth estimator for social data streams,"Shuochao Yao, Md Tanvir Amin, Lu Su, Shaohan Hu, Shen Li, Shiguang Wang, Yiran Zhao, Tarek Abdelzaher, Lance Kaplan, Charu Aggarwal, Aylin Yener",2016/4/11,Conference 2016 15th ACM/IEEE International Conference on Information Processing in Sensor Networks (IPSN),"The paper develops a recursive state estimator for social network data streams that allows exploitation of social networks, such as Twitter, as sensor networks to reliably observe physical events. Recent literature suggested using social networks as sensor networks leveraging the fact that much of the information upload on the former constitutes acts of sensing. A significant challenge identified in that context was that source reliability is often unknown, leading to uncertainty regarding the veracity of reported observations. Multiple truth finding systems were developed to solve this problem, generally geared towards batch analysis of offline datasets. This work complements the present batch approaches by developing an online recursive state estimator that recovers ground truth from streaming data. In this paper, we model physical world state by a set of binary signals (propositions, called assertions, about world state …",47
STFNets: Learning sensing signals from the time-frequency perspective with short-time fourier neural networks,"Shuochao Yao, Ailing Piao, Wenjun Jiang, Yiran Zhao, Huajie Shao, Shengzhong Liu, Dongxin Liu, Jinyang Li, Tianshi Wang, Shaohan Hu, Lu Su, Jiawei Han, Tarek Abdelzaher",2019/5/13,Conference The World Wide Web Conference,"Recent advances in deep learning motivate the use of deep neural networks in Internet-of-Things (IoT) applications. These networks are modelled after signal processing in the human brain, thereby leading to significant advantages at perceptual tasks such as vision and speech recognition. IoT applications, however, often measure physical phenomena, where the underlying physics (such as inertia, wireless signal propagation, or the natural frequency of oscillation) are fundamentally a function of signal frequencies, offering better features in the frequency domain. This observation leads to a fundamental question: For IoT applications, can one develop a new brand of neural network structures that synthesize features inspired not only by the biology of human perception but also by the fundamental nature of physics? Hence, in this paper, instead of using conventional building blocks (e.g., convolutional and …",44
Giobalfusion: A global attentional deep learning framework for multisensor information fusion,"Shengzhong Liu, Shuochao Yao, Jinyang Li, Dongxin Liu, Tianshi Wang, Huajie Shao, Tarek Abdelzaher",2020/3/18,"Journal Proceedings of the ACM on Interactive, Mobile, Wearable and Ubiquitous Technologies","The paper enhances deep-neural-network-based inference in sensing applications by introducing a lightweight attention mechanism called the global attention module for multi-sensor information fusion. This mechanism is capable of utilizing information collected from higher layers of the neural network to selectively amplify the influence of informative features and suppress unrelated noise at the fusion layer. We successfully integrate this mechanism into a new end-to-end learning framework, called GIobalFusion, where two global attention modules are deployed for spatial fusion and sensing modality fusion, respectively. Through an extensive evaluation on four public human activity recognition (HAR) datasets, we successfully demonstrate the effectiveness of GlobalFusion at improving information fusion quality. The new approach outperforms the state-of-the-art algorithms on all four datasets with a clear margin …",43
Unveiling polarization in social networks: A matrix factorization approach,"Md Tanvir Al Amin, Charu Aggarwal, Shuochao Yao, Tarek Abdelzaher, Lance Kaplan",2017/5/1,Conference IEEE INFOCOM 2017-IEEE Conference on Computer Communications,"This paper presents unsupervised algorithms to uncover polarization in social networks (namely, Twitter) and identify polarized groups. The approach is language-agnostic and thus broadly applicable to global and multilingual media. In cases of conflict, dispute, or situations involving multiple parties with contrasting interests, opinions get divided into different camps. Previous manual inspection of tweets has shown that such situations produce distinguishable signatures on Twitter, as people take sides leading to clusters that preferentially propagate information confirming their individual cluster-specific bias. We propose a model for polarized social networks, and show that approaches based on factorizing the matrix of sources and their claims can automate the discovery of polarized clusters with no need for prior training or natural language processing. In turn, identifying such clusters offers insights into prevalent …",43
Deepfusion: A deep learning framework for the fusion of heterogeneous sensory data,"Hongfei Xue, Wenjun Jiang, Chenglin Miao, Ye Yuan, Fenglong Ma, Xin Ma, Yijiang Wang, Shuochao Yao, Wenyao Xu, Aidong Zhang, Lu Su",2019/7/2,Book Proceedings of the Twentieth ACM International Symposium on Mobile Ad Hoc Networking and Computing,"In recent years, significant research efforts have been spent towards building intelligent and user-friendly IoT systems to enable a new generation of applications capable of performing complex sensing and recognition tasks. In many of such applications, there are usually multiple different sensors monitoring the same object. Each of these sensors can be regarded as an information source and provides us a unique ""view"" of the observed object. Intuitively, if we can combine the complementary information carried by multiple sensors, we will be able to improve the sensing performance. Towards this end, we propose DeepFusion, a unified multi-sensor deep learning framework, to learn informative representations of heterogeneous sensory data. DeepFusion can combine different sensors' information weighted by the quality of their data and incorporate cross-sensor correlations, and thus can benefit a wide spectrum …",42
DeepMV: Multi-view deep learning for device-free human activity recognition,"Hongfei Xue, Wenjun Jiang, Chenglin Miao, Fenglong Ma, Shiyang Wang, Ye Yuan, Shuochao Yao, Aidong Zhang, Lu Su",2020/3/18,"Journal Proceedings of the ACM on Interactive, Mobile, Wearable and Ubiquitous Technologies","Recently, significant efforts are made to explore device-free human activity recognition techniques that utilize the information collected by existing indoor wireless infrastructures without the need for the monitored subject to carry a dedicated device. Most of the existing work, however, focuses their attention on the analysis of the signal received by a single device. In practice, there are usually multiple devices ""observing"" the same subject. Each of these devices can be regarded as an information source and provides us an unique ""view"" of the observed subject. Intuitively, if we can combine the complementary information carried by the multiple views, we will be able to improve the activity recognition accuracy. Towards this end, we propose DeepMV, a unified multi-view deep learning framework, to learn informative representations of heterogeneous device-free data. DeepMV can combine different views' information …",40
Greendrive: A smartphone-based intelligent speed adaptation system with real-time traffic signal prediction,"Yiran Zhao, Shen Li, Shaohan Hu, Lu Su, Shuochao Yao, Huajie Shao, Hongwei Wang, Tarek Abdelzaher",2017/4/18,Book Proceedings of the 8th International Conference on Cyber-Physical Systems,"This paper presents the design and evaluation of GreenDrive, a smartphone-based system that helps drivers save fuel by judiciously advising on driving speed to match the signal phase and timing (SPAT) of upcoming signalized traffic intersections. In the absence of such advice, the default driver behavior is usually to accelerate to (near) the maximum legally allowable speed, traffic conditions permitting. This behavior is suboptimal if the traffic light ahead will turn red just before the vehicle arrives at the intersection. GreenDrive uses collected real-time vehicle mobility data to predict exact signal timing a few tens of seconds ahead, which allows it to offer advice on speed that saves fuel by avoiding unnecessary acceleration that leads to arriving too soon and stopping at red lights. Our work differs from previous work in three respects. First and most importantly, we tackle the more challenging scenario, where some …",34
Data acquisition for real-time decision-making under freshness constraints,"Shaohan Hu, Shuochao Yao, Haiming Jin, Yiran Zhao, Yitao Hu, Xiaochen Liu, Nooreddin Naghibolhosseini, Shen Li, Akash Kapoor, William Dron, Lu Su, Amotz Bar-Noy, Pedro Szekely, Ramesh Govindan, Reginald Hobbs, Tarek F Abdelzaher",2015/12/1,Conference 2015 IEEE Real-Time Systems Symposium,"The paper describes a novel algorithm for timely sensor data retrieval in resource-poor environments under freshness constraints. Consider a civil unrest, national security, or disaster management scenario, where a dynamic situation evolves and a decision-maker must decide on a course of action in view of latest data. Since the situation changes, so is the best course of action. The scenario offers two interesting constraints. First, one should be able to successfully compute the course of action within some appropriate time window, which we call the decision deadline. Second, at the time the course of action is computed, the data it is based on must be fresh (i.e., within some corresponding validity interval). We call it the freshness constraint. These constraints create an interesting novel problem of timely data retrieval. We address this problem in resource-scarce environments, where network resource limitations …",33
Optimal capacity–delay tradeoff in MANETs with correlation of node mobility,"Riheng Jia, Feng Yang, Shuochao Yao, Xiaohua Tian, Xinbing Wang, Wenjun Zhang, Jun Xu",2016/5/9,Journal IEEE Transactions on Vehicular Technology,"In this paper, we analyze the capacity and delay in mobile ad hoc networks (MANETs), considering the correlation of node mobility (correlated mobility). Previous studies on correlated mobility investigated the maximum capacity with the corresponding delay in several subcases; the problem of optimal capacity under various delay constraints (the optimal capacity-delay tradeoff) still remains open. To this end, we deeply explore the characteristics of correlated mobility and figure out the fundamental relationships between the network performance and the scheduling parameters. Based on that, we establish the overall upper bound of the capacity-delay tradeoff in all the subcases of correlated mobility. Then, we try to obtain the achievable lower bound by identifying the optimal scheduling parameters on certain constraints. Results demonstrate the whole picture of how the correlation of node mobility impacts the …",30
Sadeepsense: Self-attention deep learning framework for heterogeneous on-device sensors in internet of things applications,"Shuochao Yao, Yiran Zhao, Huajie Shao, Dongxin Liu, Shengzhong Liu, Yifan Hao, Ailing Piao, Shaohan Hu, Su Lu, Tarek F Abdelzaher",2019/4/29,Conference IEEE INFOCOM 2019-IEEE Conference on Computer Communications,"Deep neural networks are becoming increasingly popular in Internet of Things (IoT) applications. Their capabilities of fusing multiple sensor inputs and extracting temporal relationships can enhance intelligence in a wide range of applications. However, one key problem is the missing of adaptation to heterogeneous on-device sensors. These low-end sensors on IoT devices possess different accuracies, granularities, and amounts of information, whose sensing qualities are heterogeneous and vary over time. The existing deep learning frameworks for IoT applications usually treat every sensor input equally over time or increase model capacity in an ad-hoc manner, lacking the ability to identify and exploit the sensor heterogeneities. In this work, we propose SADeepSense, a deep learning framework that can automatically balance the contributions of multiple sensor inputs over time by exploiting their sensing …",29
