titles,authors,date,source,descriptions,citations
Speech enhancement using a minimum-mean square error short-time spectral amplitude estimator,"Yariv Ephraim, David Malah",1984/12,"Journal IEEE Transactions on acoustics, speech, and signal processing","This paper focuses on the class of speech enhancement systems which capitalize on the major importance of the short-time spectral amplitude (STSA) of the speech signal in its perception. A system which utilizes a minimum mean-square error (MMSE) STSA estimator is proposed and then compared with other widely used systems which are based on Wiener filtering and the ""spectral subtraction"" algorithm. In this paper we derive the MMSE STSA estimator, based on modeling speech and noise spectral components as statistically independent Gaussian random variables. We analyze the performance of the proposed STSA estimator and compare it with a STSA estimator derived from the Wiener estimator. We also examine the MMSE STSA estimator under uncertainty of signal presence in the noisy observations. In constructing the enhanced signal, the MMSE STSA estimator is combined with the complex …",4875
Speech enhancement using a minimum mean-square error log-spectral amplitude estimator,"Yariv Ephraim, David Malah",1985/4,"Journal IEEE transactions on acoustics, speech, and signal processing","In this correspondence we derive a short-time spectral amplitude (STSA) estimator for speech signals which minimizes the mean-square error of the log-spectra (i.e., the original STSA and its estimator) and examine it in enhancing noisy speech. This estimator is also compared with the corresponding minimum mean-square error STSA estimator derived previously. It was found that the new estimator is very effective in enhancing the noisy speech, and it significantly improves its quality.",2571
A signal subspace approach for speech enhancement,"Yariv Ephraim, Harry L Van Trees",1995/7,Journal IEEE Transactions on speech and audio processing,"A comprehensive approach for nonparametric speech enhancement is developed. The underlying principle is to decompose the vector space of the noisy signal into a signal-plus-noise subspace and a noise subspace. Enhancement is performed by removing the noise subspace and estimating the clean signal from the remaining signal subspace. The decomposition can theoretically be performed by applying the Karhunen-Loeve transform (KLT) to the noisy signal. Linear estimation of the clean signal is performed using two perceptually meaningful estimation criteria. First, signal distortion is minimized while the residual noise energy is maintained below some given threshold. This criterion results in a Wiener filter with adjustable input noise level. Second, signal distortion is minimized for a fixed spectrum of the residual noise. This criterion enables masking of the residual noise by the speech signal. It results in a …",1385
Hidden markov processes,"Yariv Ephraim, Neri Merhav",2002/6,Journal IEEE Transactions on information theory,"An overview of statistical and information-theoretic aspects of hidden Markov processes (HMPs) is presented. An HMP is a discrete-time finite-state homogeneous Markov chain observed through a discrete-time memoryless invariant channel. In recent years, the work of Baum and Petrie (1966) on finite-state finite-alphabet HMPs was expanded to HMPs with finite as well as continuous state spaces and a general alphabet. In particular, statistical properties and ergodic theorems for relative entropy densities of HMPs were developed. Consistency and asymptotic normality of the maximum-likelihood (ML) parameter estimator were proved under some mild conditions. Similar results were established for switching autoregressive processes. These processes generalize HMPs. New algorithms were developed for estimating the state, parameter, and order of an HMP, for universal coding and classification of HMPs, and for …",1041
Statistical-model-based speech enhancement systems,Yariv Ephraim,1992/10,Journal Proceedings of the IEEE,"Since the statistics of the speech signal as well as of the noise are not explicitly available, and the most perceptually meaningful distortion measure is not known, model-based approaches have recently been extensively studied and applied to the three basic problems of speech enhancement: signal estimation from a given sample function of noisy speech, signal coding when only noisy speech is available, and recognition of noisy speech signals in man-machine communication. Research on the model-based approach is integrated and put into perspective with other more traditional approaches for speech enhancement. A unified statistical approach for the three basic problems of speech enhancement is developed, using composite source models for the signal and noise and a fairly large set of distortion measures.< >",546
A Bayesian estimation approach for speech enhancement using hidden Markov models,Yariv Ephraim,1992/4,Journal IEEE Transactions on Signal Processing,"A Bayesian estimation approach for enhancing speech signals which have been degraded by statistically independent additive noise is motivated and developed. In particular, minimum mean square error (MMSE) and maximum a posteriori (MAP) signal estimators are developed using hidden Markov models (HMMs) for the clean signal and the noise process. It is shown that the MMSE estimator comprises a weighted sum of conditional mean estimators for the composite states of the noisy signal, where the weights equal the posterior probabilities of the composite states given the noisy signal. The estimation of several spectral functionals of the clean signal such as the sample spectrum and the complex exponential of the phase is also considered. A gain-adapted MAP estimator is developed using the expectation-maximization algorithm. The theoretical performance of the MMSE estimator is discussed, and …",337
On the application of hidden Markov models for enhancing noisy speech,"Yariv Ephraim, David Malah, B-H Juang",1989/12,"Journal IEEE Transactions on Acoustics, Speech, and Signal Processing","A maximum-a-posteriori approach for enhancing speech signals which have been degraded by statistically independent additive noise is proposed. The approach is based on statistical modeling of the clean speech signal and the noise process using long training sequences from the two processes. Hidden Markov models (HMMs) with mixtures of Gaussian autoregressive (AR) output probability distributions (PDs) are used to model the clean speech signal. The model for the noise process depends on its nature. The parameter set of the HMM model is estimated using the Baum or the EM (estimation-maximization) algorithm. The noisy speech is enhanced by reestimating the clean speech waveform using the EM algorithm. Efficient approximations of the training and enhancement procedures are examined. This results in the segmental k-means approach for hidden Markov modeling, in which the state sequence …",284
A Bayesian approach to robust adaptive beamforming,"Kristine L Bell, Yariv Ephraim, Harry L Van Trees",2000/2,Journal IEEE Transactions on Signal Processing,"An adaptive beamformer that is robust to uncertainty in source direction-of-arrival (DOA) is derived using a Bayesian approach. The DOA is assumed to be a discrete random variable with a known a priori probability density function (PDF) that reflects the level of uncertainty in the source DOA. The resulting beamformer is a weighted sum of minimum variance distortionless response (MVDR) beamformers pointed at a set of candidate DOAs, where the relative contribution of each MVDR beamformer is determined from the a posteriori PDF of the DOA conditioned on previously observed data. A simple approximation to the a posteriori PDF results in a straightforward implementation. Performance of the approximate Bayesian beamformer is compared with linearly constrained minimum variance (LCMV) beamformers and data-driven approaches that attempt to estimate signal characteristics or the steering vector from …",279
Extended Ziv-Zakai lower bound for vector parameter estimation,"Kristine L Bell, Yossef Steinberg, Yariv Ephraim, Harry L Van Trees",1997/3,Journal IEEE Transactions on information theory,"The Bayesian Ziv-Zakai bound on the mean square error (MSE) in estimating a uniformly distributed continuous random variable is extended for arbitrarily distributed continuous random vectors and for distortion functions other than MSE. The extended bound is evaluated for some representative problems in time-delay and bearing estimation. The resulting bounds have simple closed-form expressions, and closely predict the simulated performance of the maximum-likelihood estimator in all regions of operation.",225
Extension of the signal subspace speech enhancement approach to colored noise,"Hanoch Lev-Ari, Yariv Ephraim",2003/3/20,Journal IEEE Signal Processing Letters,"The signal subspace approach for speech enhancement is extended to colored-noise processes. Explicit forms for the linear time-domain- and spectral-domain-constrained estimators are presented. These estimators minimize the average signal distortion power for given constraints on the residual noise power in the time and spectral domains, respectively. Equivalent implementations of the two estimators using the whitening approach are described.",159
A minimum discrimination information approach for hidden Markov modeling,"Yariv Ephraim, Amir Dembo, Lawrence R Rabiner",1989/9,Journal IEEE Transactions on Information Theory,"An iterative approach for minimum-discrimination-information (MDI) hidden Markov modeling of information sources is proposed. The approach is developed for sources characterized by a given set of partial covariance matrices and for hidden Markov models (HMMs) with Gaussian autoregressive output probability distributions (PDs). The approach aims at estimating the HMM which yields the MDI with respect to all sources that could have produced the given set of partial covariance matrices. Each iteration of the MDI algorithm generates a new HMM as follows. First, a PD for the source is estimated by minimizing the discrimination information measure with respect to the old model over all PDs which satisfy the given set of partial covariance matrices. Then a new model that decreases the discrimination information measure between the estimated PD of the source and the PD of the old model is developed. The …",157
Recent advancements in speech enhancement,"Yariv Ephraim, Israel Cohen",2006,Source The electrical engineering handbook,"Speech enhancement is a long standing problem with numerous applications ranging from hearing aids, to coding and automatic recognition of speech signals. In this survey paper we focus on enhancement from a single microphone, and assume that the noise is additive and statistically independent of the signal. We present the principles that guide researchers working in this area, and provide a detailed design example. The example focuses on minimum mean square error estimation of the clean signal’s log-spectral magnitude. This approach has attracted significant attention in the past twenty years. We also describe the principles of a Monte-Carlo simulation approach for speech enhancement.",150
A unified approach for encoding clean and noisy sources by means of waveform and autoregressive model vector quantization,"Yariv Ephraim, Robert M Gray",1988/7,Journal IEEE Transactions on Information Theory,"Data compression by vector quantization is considered for sources which have been degraded by noise. It is shown that, by appropriately modifying the given distortion measure, the problem becomes a standard quantization problem for the noisy source and the modified distortion measure. For the special case of sources corrupted by statistically independent additive noise, the authors provide sufficient conditions on the original distortion measure and probability distributions of the source and the noise for convergence of the generalized Lloyd algorithm in designing the quantizers. The results are specialized to waveform and autoregressive model vector quantization using the weighted quadratic and the Itakura-Saito distortion measures, respectively.< >",110
Speech enhancement using optimal non-linear spectral amplitude estimation,"Yariv Ephraim, David Malah",1983/4/14,"Conference ICASSP'83. IEEE International Conference on Acoustics, Speech, and Signal Processing","A speech enhancement system which utilizes an optimal (in the minimum mean square error sense) short-time spectral amplitude estimator is described. The derivation of the optimal estimator is based on modeling speech as a quasi-periodic signal, and on applying spectral decomposition. The optimal spectral amplitude estimator and a recently developed vector spectral subtraction amplitude estimator, are round to be nearly equivalent. The optimal spectral amplitude estimator coincides with a Wiener spectral amplitude estimator at high signal to noise ratio (SNR) values, and is found to be superior to it at low SNR values. The enhanced speech obtained by using the proposed system, is less spectrally distorted, although contains some more residual noise, than the enhanced speech obtained by using the Wiener spectral amplitude estimator, in the same system. In addition, it is free of the ""musical noise"" …",95
Spectrum sensing using a hidden bivariate Markov model,"Thao Nguyen, Brian L Mark, Yariv Ephraim",2013/8/6,Journal IEEE Transactions on Wireless Communications,"A new statistical model, in the form of a hidden bivariate Markov chain observed through a Gaussian channel, is developed and applied to spectrum sensing for cognitive radio. We focus on temporal spectrum sensing in a single narrowband channel in which a primary transmitter is either in an idle or an active state. The main advantage of the proposed model, compared to a standard hidden Markov model (HMM), is that it allows a phase-type dwell time distribution for the process in each state. This distribution significantly generalizes the geometric dwell time distribution of a standard HMM. Measurements taken from real data confirm that the geometric dwell time distribution characteristic of the HMM is not adequate for this application. The Baum algorithm is used to estimate the parameter of the proposed model and a forward recursion is applied to online estimation and prediction of the state of the cognitive radio …",92
Gain-adapted hidden Markov models for recognition of clean and noisy speech,Yariv Ephraim,1992/6,Journal IEEE Transactions on Signal Processing,"In applying hidden Markov modeling for recognition of speech signals, the matching of the energy contour of the signal to the energy contour of the model for that signal is normally achieved by appropriate normalization of each vector of the signal prior to both training and recognition. This approach, however, is not applicable when only noisy signals are available for recognition. A unified approach is developed for gain adaptation in recognition of clean and noisy signals. In this approach, hidden Markov models (HMMs) for gain-normalized clean signals are designed using maximum-likelihood (ML) estimates of the gain contours of the clean training sequences. The models are combined with ML estimates of the gain contours of the clean test signals, obtained from the given clean or noisy signals, in performing recognition using the maximum a posteriori decision rule. The gain-adapted training and recognition …",91
A minimum mean square error approach for speech enhancement,Yariv Ephraim,1990/4/3,"Conference International Conference on Acoustics, Speech, and Signal Processing","A minimum mean square error (MMSE) estimation approach for enhancing speech signals degraded by statistically independent additive noise is developed, based upon Gaussian autoregressive (AR) hidden Markov modeling of the clean signal and Gaussian AR modeling of the noise process. The parameters of the models for the two processes are estimated from training sequences of clean speech and noise samples. It is shown that the MMSE estimator comprises a weighted sum of MMSE estimators for the individual output processes corresponding to the different states of the hidden Markov model for the clean speech. The weights at each time instant are the probabilities of the individual estimators to be the correct ones given the noisy speech. Typical signal-to-noise ratio (SNR) improvements achieved by this approach are 4.5-5.5 dB at 10-dB input SNR.< >",91
A brief survey of speech enhancement,Yariv Ephraim,2005,Source The Electronic Handbook,,90
On second-order statistics and linear estimation of cepstral coefficients,"Yariv Ephraim, Mazin Rahim",1999/3,Journal IEEE Transactions on Speech and Audio Processing,"Explicit expressions for the second-order statistics of cepstral components representing clean and noisy signal waveforms are derived. The noise is assumed additive to the signal, and the spectral components of each process are assumed statistically independent complex Gaussian random variables. The key result developed here is an explicit expression for the cross-covariance between the log-periodograms of the clean and noisy signals. In the absence of noise, this expression is used to show that the covariance matrix of cepstral components representing N signal samples, is a fixed signal independent matrix, which approaches a diagonal matrix at a rate of 1/N. In addition, the cross-covariance expression is used to develop an explicit linear minimum mean square error estimator for the clean cepstral components given noisy cepstral components. Recognition results on the English digits using the fixed …",85
Explicit Ziv-Zakai lower bound for bearing estimation,"Kristine L Bell, Yariv Ephraim, Harry L Van Trees",1996/11,Journal IEEE Transactions on Signal Processing,"The extended Ziv-Zakai bound for vector parameters is used to develop a lower bound on the mean square error in estimating the 2-D bearing of a narrowband planewave signal using planar arrays of arbitrary geometry. The bound has a simple closed-form expression that is a function of the signal wavelength, the signal-to-noise ratio (SNR), the number of data snapshots, the number of sensors in the array, and the array configuration. Analysis of the bound suggests that there are several regions of operation, and expressions for the thresholds separating the regions are provided. In the asymptotic region where the number of snapshots and/or SNR are large, estimation errors are small, and the bound approaches the inverse Fisher information. This is the same as the asymptotic performance predicted by the local Cramer-Rao bound for each value of bearing. In the a priori performance region where the number of …",78
On the relations between modeling approaches for speech recognition,"Yariv Ephraim, Lawrence R.  Rabiner",1990/3,Journal IEEE Transactions on Information Theory,"Some relations among approaches that have been applied to estimating models for acoustic signals in speech recognition systems are examined. In particular, the modeling approaches based on maximum likelihood (ML), maximum mutual information (MMI), and minimum discrimination information (MDI) are studied. It is shown that all three approaches can be formulated uniformly as MDI modeling approaches for simultaneous estimation of the acoustic models for all words in the vocabulary and that none of the approaches requires any model correctness assumption. The three approaches differ in the effective source being modeled and in the probability distribution attributed to this source.< >",77
Maximum likelihood hidden Markov modeling using a dominant sequence of states,"Neri Merhav, Yariv Ephraim",1991/9,Journal IEEE Transactions on Signal Processing,"Approximate maximum likelihood (ML) hidden Markov modeling using the most likely state sequence (MLSS) is examined and compared with the exact ML approach that considers all possible state sequences. It is shown that for any hidden Markov model (HMM), the difference between the approximate and the exact normalized likelihood functions cannot exceed the logarithm of the number of states divided by the dimension of the output vectors (frame length). Furthermore, for Gaussian HMMs and a given observation sequence, the MLSS is typically the sequence of nearest neighbor states in the Itakura-Saito sense, and the posterior probability of any state sequence which departs from the MLSS in a single time instant, decays exponentially with the frame length. Hence, for a sufficiently large frame length the exact and approximate ML approach provide similar model estimates and likelihood values.< >",72
Estimation of hidden Markov model parameters by minimizing empirical error rate,"Andrej Ljolje, Yariv Ephraim, Lawrence R Rabiner",1990/4/3,"Conference International Conference on Acoustics, Speech, and Signal Processing","An approach for designing a set of acoustic models for speech recognition applications which results in a minimal empirical error rate for a given decoder and training data is studied. In an evaluation of the system for an isolated word recognition task, hidden Markov models (HMMs) are used to characterize the probability density functions of the acoustic signals from the different words in the vocabulary. Decoding is performed by applying the maximum aposteriori decision rule to the acoustic models. The HMMs are estimated by minimizing a differentiable cost function, which approximates the empirical error rate function, using the steepest descent method. The HMMs designed by the minimum empirical error rate approach were used in multispeaker recognition of the English E-set words and compared to models designed by the standard maximum-likelihood estimation approach. The approach increased …",66
Revisiting autoregressive hidden Markov modeling of speech signals,"Yariv Ephraim, William JJ Roberts",2005/1/17,Journal IEEE Signal processing letters,Linear predictive hidden Markov modeling is compared with a simple form of the switching autoregressive process. The latter process captures existing signal correlation during transitions of the Markov chain. Parameter estimation is described using naturally stable forward-backward recursions. The switching autoregressive model outperformed the linear predictive model in a digit recognition task and provided comparable performance to a cepstral-based recognizer.,65
On Ryde/spl acute/n's EM algorithm for estimating MMPPs,"William JJ Roberts, Yariv Ephraim, Elvis Dieguez",2006/5/15,Journal IEEE Signal Processing Letters,"Two aspects of Ryden's expectation-maximization algorithm for estimating the parameter of a Markov modulated Poisson process are addressed. First, a scaling procedure is developed for the forward-backward recursions that circumvents the need for customized floating-point software. Second, evaluation of integrals of matrix exponentials is facilitated by applying a result due to Van Loan. For an MMPP of order four, a speedup of over two orders of magnitude was observed.",59
Hidden Markov modeling using a dominant state sequence with application to speech recognition,"Neri Merhav, Yariv Ephraim",1991/10/1,Journal Computer Speech & Language,"Approximate maximum likelihood (ML) hidden Markov modeling using the most likely state sequence (MLSS) is examined and compared with the exact ML approach that considers all possible state sequences. It is shown that for any hidden Markov model (HMM), the difference between the approximate and the exact normalized likelihood functions cannot exceed the logarithm of the number of states divided by the dimension of the output vectors (frame length), which is negligible for typically used values of vector dimension (128–256) and number of states (2–30). Furthermore, for Gaussian HMMs and a given observation sequence, the MLSS is typically the sequence of nearest neighbor states in the Itakura-Saito sense, and the posterior probability of any state sequence which departs from the MLSS in a single time instant decays exponentially with the frame length. Hence, for a sufficiently large frame length the …",59
A Bayesian classification approach with application to speech recognition,"Neri Merhav, Yariv Ephraim",1991/4/1,"Conference Acoustics, Speech, and Signal Processing, IEEE International Conference on","A Bayesian approach to classification of parametric information sources whose statistics are not explicitly given is studied and applied to recognition of speech signals based upon hidden Markov modeling. A classifier based on generalized likelihood ratios, which depends only on the available training and testing data, is developed and shown to be optimal in the sense of achieving the highest asymptotic exponential rate of decay of the error probability. The proposed approach is compared to the standard classification approach used in speech recognition, in which the parameters for the sources are first estimated from the given training data, and then the maximum and posteriori (MAP) decision rule is applied using the estimated statistics.",59
