titles,authors,date,source,descriptions,citations
Hidden Markov process based dynamic spectrum access for cognitive radio,"Thao Nguyeny, Brian L Mark, Yariv Ephraim",2011/3/23,Conference 2011 45th Annual Conference on Information Sciences and Systems,"Cognitive radio is an emerging technology for sensing and dynamic access of spectrum in mobile radio environments. It aims at dynamically allocating unused bandwidth among secondary users without causing harmful interference to the primary users. This approach, which has clear economical benefits, has recently attracted significant research effort. In this paper, we propose a new approach to dynamic spectrum access in which the occupancy state of each frequency band at each time instant is estimated, and available bands are allocated accordingly. Estimation is performed from power spectral density measurements which are assumed to obey a hidden Markov process. The value of the hidden state represents the status of a given frequency band which could be free or occupied. We have trained the system using real spectrum measurements, and tested it on simulated data for which the occupancy state of …",40
An EM algorithm for Markov modulated Markov processes,"Yariv Ephraim, William JJ Roberts",2008/10/31,Journal IEEE Transactions on Signal Processing,"An expectation-maximization (EM) algorithm for estimating the parameter of a Markov modulated Markov process in the maximum likelihood sense is developed. This is a doubly stochastic random process with an underlying continuous-time finite-state homogeneous Markov chain. Conditioned on that chain, the observable process is a continuous-time finite-state nonhomogeneous Markov chain. The generator of the observable process at any given time is determined by the state of the underlying Markov chain at that time. The parameter of the process comprises the set of generators for the underlying and conditional Markov chains. The proposed approach generalizes an earlier approach by Ryden for estimating the parameter of a Markov modulated Poisson process.",40
An EM algorithm for continuous-time bivariate Markov chains,"Brian L Mark, Yariv Ephraim",2013/1/1,Journal Computational statistics & data analysis,"We study properties and parameter estimation of a finite-state, homogeneous, continuous-time, bivariate Markov chain. Only one of the two processes of the bivariate Markov chain is assumed observable. The general form of the bivariate Markov chain studied here makes no assumptions on the structure of the generator of the chain. Consequently, simultaneous jumps of the observable and underlying processes are possible, neither process is necessarily Markov, and the time between jumps of each of the two processes has a phase-type distribution. Examples of bivariate Markov chains include the Markov modulated Poisson process and the batch Markovian arrival process when appropriate modulo counts are used in each case. We develop an expectation–maximization (EM) procedure for estimating the generator of a bivariate Markov chain, and we demonstrate its performance. The procedure does not rely on …",38
Method and apparatus for speech recognition using second order statistics and linear estimation of cepstral coefficients,"Yariv Ephraim, Mazin G Rahim",2001/3/13,Patent office US,"A method and apparatus for speech recognition using second order statistics and linear estimation of cepstral coefficients. In one embodiment, a speech input signal is received and cepstral features are extracted. An answer is generated using the extracted cepstral features and a fixed signal independent diagonal matrix as the covariance matrix for the cepstral components of the speech input signal and, for example, a hidden Markov model. In another embodiment, a noisy speech input signal is received and a cepstral vector representing a clean speech input signal is generated based on the noisy speech input signal and an explicit linear minimum mean square error cepstral estimator.",38
An EM algorithm for ion-channel current estimation,"William JJ Roberts, Yariv Ephraim",2007/12/18,Journal IEEE Transactions on Signal Processing,"Parameter estimation of a continuous-time Markov chain observed through a discrete-time memoryless channel is studied. An expectation-maximization (EM) algorithm for maximum likelihood estimation of the parameter of this hidden Markov process is developed and applied to a simple example of modeling ion-channel currents in living cell membranes. The approach follows that of Asmussen, Nerman and Olsson, and Ryden, for EM estimation of an underlying continuous-time Markov chain.",37
A linear predictive front-end processor for speech recognition in noisy environments,"Yariv Ephraim, J Wilpon, L Rabiner",1987/4/6,"Conference ICASSP'87. IEEE International Conference on Acoustics, Speech, and Signal Processing","We investigate the performance of a recent algorithm for linear predictive (LP) modeling of speech signals, which have been degraded by uncorrelated additive noise, as a front-end processor in a speech recognition system. The system is speaker dependent, and recognizes isolated words, based on dynamic time warping principles. The LP model for the clean speech is estimated through appropriate composite modeling of the noisy speech. This is done by minimizing the Itakura-Saito distortion measure between the sample spectrum of the noisy speech and the power spectral density of the composite model. This approach results in a ""filtering-modeling"" scheme in which the filter for the noisy speech, and the LP model for the clean speech, are alternatively optimized. The proposed system was tested using the 26 word English alphabet, the ten English digits, and the three command words, ""stop,"" ""error,"" and …",37
Bivariate Markov processes and their estimation,"Yariv Ephraim, Brian L Mark",2013/6/25,Journal Foundations and Trends® in Signal Processing,"A bivariate Markov process comprises a pair of random processes which are jointly Markov. One of the two processes in that pair is observable while the other plays the role of an underlying process. We are interested in three classes of bivariate Markov processes. In the first and major class of interest, the underlying and observable processes are continuous-time with finite alphabet; in the second class, they are discrete-time with finite alphabet; and in the third class, the underlying process is continuous-time with uncountably infinite alphabet, and the observable process is continuous-time with countably or uncountably infinite alphabet. We refer to processes in the first two classes as bivariate Markov chains. Important examples of continuoustime bivariate Markov chains include the Markov modulated Poisson process, and the batch Markovian arrival process. A hidden Markov model with finite alphabet is an example of a discrete-time bivariate Markov chain. In the third class we have diffusion processes observed in Brownian motion, and diffusion processes modulating the rate of a Poisson process. Bivariate Markov processes play central roles in the theory and applications of estimation, control, queuing, biomedical engineering, and reliability. We review properties of bivariate Markov processes, recursive estimation of their statistics, and recursive and iterative parameter estimation.",31
On the relations between modeling approaches for information sources,"Yariv Ephraim, Lawrence R Rabiner",1988/4,Journal Proc. ICASSP,"We examine the relations between maximum likelihood (ML), maximum mutual information (MMI), and minimum discrimination information (MDI) modeling approaches, which have been applied to estimating acoustic word models in speech recognition systems. We show that all three approaches can be uniformly formulated as MDI modeling approaches for estimating the acoustic models for all words simultaneously. The three approaches differ in either the probability distribution (PD) attributed to the source being modeled or in the model effectively being used. None of the approaches, however, assumes model correctness, ie, that the source has the PD of the model. A new modeling approach is proposed, which, in contrast with the other approaches considered here, directly aims at the minimization of the probability of error.",30
Speech enhancement using state dependent dynamical system model,Yariv Ephraim,1992/3/23,"Conference [Proceedings] ICASSP-92: 1992 IEEE International Conference on Acoustics, Speech, and Signal Processing",A time-varying linear dynamical system model for speech signals is proposed. The model generalizes the standard hidden Markov model (HMM) in the sense that vectors generated from a given sequence of states are assumed a first order Markov process rather than a sequence of statistically independent vectors. The reestimation formulas for the model parameters are developed using the Baum algorithm. The forward formula for evaluating the likelihood of a given sequence of signal vectors in speech recognition applications is also developed. The dynamical system model is used in developing minimum mean square error (MMSE) and maximum a posteriori (MAP) signal estimators given noisy signals. Both estimators are shown to be significantly more complicated than similar estimators developed earlier using the standard HMM. A feasible approximate MAP estimation approach in which the states of the …,27
Robust adaptive beamforming under uncertainty in source direction-of-arrival,"Kristine L Bell, Yariv Ephraim, Harry L Van Trees",1996/6/24,Conference Proceedings of 8th Workshop on Statistical Signal and Array Processing,"Adaptive beamforming can be used as a method for estimating an unknown waveform from a source impinging on an array of sensors. When the direction-of-arrival (DOA) of the incoming signal is known, the minimum variance distortionless response (MVDR) beamformer provides a distortionless version of the signal while suppressing noise and interference. However, if there is a mismatch between the look direction of the beamformer and the actual DOA of the signal, there can be significant degradation in performance. We use a Bayesian approach with the MVDR criterion to derive an adaptive beamformer which has nearly optimal performance under good conditions, and is robust to uncertainty in DOA under poor conditions.",25
Delay network tomography using a partially observable bivariate Markov chain,"Neshat Etemadi Rad, Yariv Ephraim, Brian L Mark",2016/7/19,Journal IEEE/ACM Transactions on Networking,"Estimation of link delay densities in a computer network, from source-destination delay measurements, is of great importance in analyzing and improving the operation of the network. In this paper, we develop a general approach for estimating the density of the delay in any link of the network, based on continuous-time bivariate Markov chain modeling. The proposed approach also provides the estimates of the packet routing probability at each node, and the probability of each source-destination path in the network. In this approach, the states of one process of the bivariate Markov chain are associated with nodes of the network, while the other process serves as an underlying process that affects statistical properties of the node process. The node process is not Markov, and the sojourn time in each of its states is phase-type. Phase-type densities are dense in the set of densities with non-negative support. Hence …",23
Speech enhancement based upon hidden markov modeling,"Yariv Ephraim, David Malah, B-H Juang",1989/5/23,"Conference International Conference on Acoustics, Speech, and Signal Processing,",A maximum a posteriori approach for enhancing speech signals which have been degraded by statistically independent additive noise is proposed. The approach is based upon statistical modeling of the clean speech signal and the noise process using long training sequences from the two processes. Hidden Markov models (HMMs) with mixtures of Gaussian autoregressive (AR) output probability distributions are used to model the clean speech signal. A low-order Gaussian AR model is used for the wideband Gaussian noise considered here. The parameter set of the HMM is estimated using the Baum or the EM (estimation-maximization) algorithm. The enhancement of the noisy speech is done by means of reestimation of the clean speech waveform using the EM algorithm. An approximate improvement of 4.0-6.0 dB in signal-to-noise ratio (SNR) is achieved at 10 dB input SNR.< >,23
Hidden Markov modeling of speech using Toeplitz covariance matrices,"William JJ Roberts, Yariv Ephraim",2000/5/1,Journal Speech Communication,"Hidden Markov modeling of speech waveforms using structured covariance matrices is studied and applied to recognition of clean and noisy speech signals. This technique allows for easier model adaptation in additive noise than does cepstral modeling of speech. Waveform modeling using autoregressive (AR) structured covariances has been extensively studied and applied previously. However, other covariance structures are possible and here we consider waveform modeling using Toeplitz and circulant structured covariances. We detail maximum likelihood (ML) hidden Markov model training and recognition routines using these matrices, and ML speech gain estimation routines. We show equivalence of asymptotic probabilities of recognition error, under certain conditions, using Toeplitz and circulant matrices to using AR matrices. In experimental results on isolated digits in clean conditions, the Toeplitz …",22
Speaker classification using composite hypothesis testing and list decoding,"William JJ Roberts, Yariv Ephraim, Howard W Sabrin",2005/2/22,Journal IEEE Transactions on Speech and Audio Processing,"Speaker classification is seen as a hypothesis testing problem of J simple hypotheses and a composite hypothesis. The simple hypotheses represent target speakers while the composite hypothesis represents nontarget speakers. The simple hypotheses have well-defined distributions that are estimated from training signals. The distribution of the signal under the composite hypothesis is assumed to belong to a given family. The parameter of that distribution is assumed random with a prior distribution that is estimated from a large set of speakers. This formulation converts the problem to that of testing J+1 simple hypotheses. Signals corresponding to target and nontarget speakers are assumed Gaussian mixtures processes. Once the system has been trained, list decoding is applied in which a test signal is associated with a list of possible speakers. The probability that the correct speaker is on the list is maximized for …",21
A spectrally-based signal subspace approach for speech enhancement,"Yariv Ephraim, Harry L Van Trees",1995/5/9,"Conference 1995 International Conference on Acoustics, Speech, and Signal Processing",The signal subspace approach for enhancing speech signals degraded by uncorrelated additive noise is studied. The underlying principle is to decompose the vector space of the noisy signal into a signal plus noise subspace and a noise subspace. Enhancement is performed by removing the noise subspace and estimating the clean signal from the remaining signal subspace. The decomposition can theoretically be performed by applying the Karhunen-Loeve transform to the noisy signal. Linear estimation of the clean signal is performed using a perceptually meaningful estimation criterion. The estimator is designed by minimizing signal distortion for a fixed desired spectrum of the residual noise. This criterion enables masking of the residual noise by the speech signal. The filter is implemented as a gain function which modifies the KLT components corresponding to the signal subspace. The gain function is solely …,21
Collaborative spectrum sensing via online estimation of hidden bivariate Markov models,"Yuandao Sun, Brian L Mark, Yariv Ephraim",2016/4/27,Journal IEEE Transactions on Wireless Communications,"Collaborative spectrum sensing exploits multiuser diversity by combining spectrum sensing information from multiple secondary users to make joint decisions about spectrum occupancy. In hard fusion schemes, each secondary user makes a hard decision on spectrum occupancy and a fusion center makes a final decision by combining the individual hard decisions according to a fusion rule. In soft fusion schemes, each secondary user provides a signal power measurement to the fusion center, which performs further processing on the collection of all observations to make a final decision. In this paper, we propose hard and soft fusion collaborative spectrum sensing schemes based on the online hidden bivariate Markov chain modeling of the signals received by secondary users. Compared with prior collaborative sensing schemes, the proposed model-based schemes do not rely on precomputed thresholds or …",19
Asymptotic minimum discrimination information measure for asymptotically weakly stationary processes,"Yariv Ephraim, Hanoch Lev-Ari, Robert M Gray",1988/9,Journal IEEE Transactions on Information Theory,"An explicit expression is derived for the minimum discrimination information (MDI) measure with respect to Gaussian priors for sources characterized by their mean and by any principal leading block of their covariance matrix. An explicit expression is provided for the MDI extension of the given partial covariance of the source with respect to a Gaussian prior. For zero-mean sources and zero-mean Gaussian priors that are asymptotically weakly stationary (AWS) processes, it is shown that the asymptotic MDI measure equals half the Itakura-Saito distortion measure between the asymptotic power spectral densities of the source and prior. Asymptotic MDI modelling of a given AWS source by autoregressive and autoregressive moving average models, which are AWS models, is considered, and conditions are given for convergence of the sample covariance estimator of the source to the stationary covariance used in the …",19
Online parameter estimation for temporal spectrum sensing,"Yuandao Sun, Brian L Mark, Yariv Ephraim",2015/3/26,Journal IEEE Transactions on Wireless Communications,"We develop a computationally efficient online parameter estimation algorithm for temporal spectrum sensing of a cognitive radio channel using a hidden bivariate Markov model. The online estimator is based on a block-recursive parameter estimation algorithm developed by Rydén for hidden Markov models. This approach requires the score function only. We develop an efficient method for computing the score function recursively and extend Rydén's approach to hidden bivariate Markov models. The advantage of the hidden bivariate Markov model over the hidden Markov model is its ability to characterize non-geometric state sojourn time distributions, which can be crucial in spectrum sensing. Based on the hidden bivariate Markov model, an estimate of the future state of the primary user can be obtained, which can be used to reduce harmful interference and improve channel utilization. Moreover, the online …",17
"Min-norm interpretations and consistency of MUSIC, MODE and ML","Yariv Ephraim, Neri Merhav, Harry L Van Trees",1995/12,Journal IEEE transactions on signal processing,"The multiple signal characterization (MUSIC) approach, its generalization to correlated signals known as the method of direction estimation (MODE), and the deterministic maximum likelihood (ML) approach for bearing estimation in array processing are shown to be signal subspace fitting approaches in a minimum norm sense. MODE, for example, is shown to be an approach in which the array manifold is linearly estimated from principal empirical eigenvectors in a minimum weighted Frobenius norm sense. Using the min-norm interpretations, a unified proof for strong consistency of the three approaches is provided for stationary and ergodic signals.",17
Hidden markov modeling using the most likely state sequence,"Neri Merhav, Yariv Ephraim",1991/4/1,"Conference Acoustics, Speech, and Signal Processing, IEEE International Conference on","Approximate maximum likelihood (ML) hidden Markov modeling using the most likely state sequence (MLSS) is examined and compared with the exact ML approach that considers all possible state sequences. It is shown that, for any hidden Markov model (HMM), the difference between the approximate and the exact normalized likelihood functions cannot exceed the logarithm of the number of states divided by the dimension of the output vectors (frame length). Furthermore, for Gaussian HMMs and a given observation sequence, the MLSS is typically the sequence of nearest-neighbor states in the Itakura-Saito sense, and the posterior probability of any state sequence which departs from the MLSS in a single time instant decays exponentially with the frame length. Hence, for a sufficiently large frame length the exact and approximate ML approaches provide similar model estimates and likelihood values.",17
Lower and upper bounds on the minimum mean-square error in composite source signal estimation,"Yariv Ephraim, Neri Merhav",1992/11,Journal IEEE transactions on information theory,"The performance of a minimum mean-square error (MMSE) estimator for the output signal from a composite source model (CSM), which has been degraded by statistically independent additive noise, is analyzed for a wide class of discrete-time and continuous-time models. In both cases, the MMSE is decomposed into the MMSE of the estimator, which is informed of the exact states of the signal and noise, and an additional error term. This term is tightly upper and lower bounded. The bounds for the discrete-time signals are developed using distribution tilting and Shannon's lower bound on the probability of a random variable exceeding a given threshold. The analysis for the continuous-time signal is performed using Duncan's theorem. The bounds in this case are developed by applying the data processing theorem to sampled versions of the state process and its estimate, and by using Fano's inequality. The …",16
Causal recursive parameter estimation for discrete-time hidden bivariate Markov chains,"Yariv Ephraim, Brian L Mark",2015/3/4,Journal IEEE Transactions on Signal Processing,"An algorithm for causal recursive parameter estimation of a discrete-time hidden bivariate Markov chain is developed. In this model, a discrete-time bivariate Markov chain is observed through a discrete-time memoryless channel. The algorithm relies on the EM-based recursive approach developed by Stiller and Radons for hidden Markov models. A distinct advantage of the discrete-time hidden bivariate Markov chain model is that the sojourn time distribution of its observable process in each state is phase-type rather than geometric as in the hidden Markov model. Phase-type distributions can approximate any desired sojourn time distribution. Particular phase-type distributions include mixtures and convolutions of geometric distributions. The parameter estimation algorithm requires causal recursive estimation of the relevant statistics in each EM step. These statistics include the number of jumps of the bivariate …",15
Ground vehicle classification using hidden markov models,"William J Roberts, Howard W Sabrin, Yariv Ephraim",2001/10/4,Publisher Atlantic Coast Technologies Inc Silver Spring MD,"Ground vehicle classification is performed using hidden Markov modelling of cepstral coefficients. The hidden Markov model HMM is used to represent audio signals. These signals are obtained as the vehicles travel past audio sensor arrays. Well known HMM training algorithms are applied to train models from training data. The trained models are used in two classification rules the MAP rule, and a list-based rule due to Forney. Under some general assumptions, these approaches can be regarded as optimal. Using recordings from the ACID database, over 96 recognition rate on single vehicle classification is achieved.",12
Ziv-Zakai lower bounds in bearing estimation,"Kristine L Bell, Yariv Ephraim, Harry L Van Trees",1995/5/9,"Conference 1995 International Conference on Acoustics, Speech, and Signal Processing","Bounds on the MSE in estimating the bearing of a planewave signal is of considerable interest in many fields. Of particular importance is the ability of a bound to closely characterize performance in the small error or asymptotic region, and the large error or ambiguity region, and to accurately predict the location of the threshold between the regions. The vector Ziv-Zakai bound is applied to the problem of estimating two-dimensional bearing with planar arrays of arbitrary geometry. The bound is calculated for square and circular arrays, and compared with the Weiss-Weinstein (1983, 1984) bound. The Ziv-Zakai bound is shown to be tighter than the Weiss-Weinstein bound in the threshold and asymptotic regions.",11
