,Doc_ID,Name,descriptions,titles,date,source,citations,Location,loc
18141,18141,david kepplinger,N/A,,,,,LinkedIn About,LinkedIn About david kepplinger
18142,18142,ilhan izmirli,director of undergraduate studiesdirector of undergraduate studies,,,,,LinkedIn About,LinkedIn About ilhan izmirli
18143,18143,wassim itani,specialties cloud computing security and privacycomputer and network securityspecialties cloud computing security and privacycomputer and network security,,,,,LinkedIn About,LinkedIn About wassim itani
18144,18144,ye wang,summary strong analytical and problem solving skills with knowledge in finance and economic policies and practical experiences in economic analysis highly selfmotivated and fast learner outstanding academic performance adaptive in both us and china environment strong communication and collaboration skills fluent in both english and chinesesummary strong analytical and problem solving skills with knowledge in finance and economic policies and practical experiences in economic analysis highly selfmotivated and fast learner outstanding academic performance adaptive in both us and china environment strong communication and collaboration skills fluent in both english and chinese,,,,,LinkedIn About,LinkedIn About ye wang
18145,18145,kirin furst,environmental engineering professor conducting research on drinking water and wastewater systems with focus on physicochemical treatment technologies and contaminant fate and transport areas of interest include wastewater reuse contaminants of emerging concern and combining systems thinking with experimental research to develop engineering and policy solutions advocate for evidencebased practices that promote diversity equity and inclusion in stemenvironmental engineering professor conducting research on drinking water and wastewater systems with focus on physicochemical treatment technologies and contaminant fate and transport areas of interest include wastewater reuse contaminants of emerging concern and combining systems thinking with experimental research to develop engineering and policy solutions advocate for evidencebased practices that promote diversity equity and inclusion in stem,,,,,LinkedIn About,LinkedIn About kirin furst
18146,18146,ting zhang,ting zhang is an associate professor of the department of finance and economics at the merrick school of business harry y wright chair associate director of the jacob france institute university of baltimore an appointed member of the maryland governors office of equal pay commission appam entrepreneurship faculty fellow and a newly elected counciloratlarge for the north america regional science council dr zhangs research interests include human capital entrepreneurship and employment dr zhang has been a principal investigator and lead economist for many workforcerelated national state and local grants with a total of 9 million usd including grants from us dept of labor usdol us dept of agriculture us dept of education the gates foundation the kauffman foundation abell foundation maryland dol maryland dept of disability maryland dept of human services etc dr zhang is a published author of peerreviewed books and journal articles including articles in small business economics applied economics archives of gerontology and geriatrics papers in regional science international journal of manpower southern economic journal accounting education applied economics letters etc her 2008 book elderly entrepreneurship in an aging us economy was favorably reviewed by dr jan wassel in the gerontologist her 2013 book entrepreneurship and economic growth in china was regarded as one of the best economics books on china studies in english by 海外汉学研究 she has given invited talks at the us congress joint economic committee the house committee on small businesses the us national press club usdol office of planning research evaluation the ewing marion kauffman foundation cambridge university etc and given invited keynote speeches at the university of lisbon portugal uddevalla symposium gran sasso science institute italy leadership in motion sweden johns hopkins university george washington university umbc national medical device conference etc dr zhangs research has been quoted in popular media such as forbes time bloomberg businessweek academic times market watch baltimore sun and so on dr zhang was a winner of the kauffman dissertation fellowship 2007 the finalist of the charles m tiebout prize in regional science 2008 usdol eta research fellowship 20092011 kauffman research grants 20152019 t rowe price excellence in teaching awards 20162019 labor employment relations association best paper selection 20172021 appam entrepreneurship faculty 2021 etcting zhang is an associate professor of the department of finance and economics at the merrick school of business harry y wright chair associate director of the jacob france institute university of baltimore an appointed member of the maryland governors office of equal pay commission appam entrepreneurship faculty fellow and a newly elected counciloratlarge for the north america regional science council dr zhangs research interests include human capital entrepreneurship and employment dr zhang has been a principal investigator and lead economist for many workforcerelated national state and local grants with a total of 9 million usd including grants from us dept of labor usdol us dept of agriculture us dept of education the gates foundation the kauffman foundation abell foundation maryland dol maryland dept of disability maryland dept of human services etc dr zhang is a published author of peerreviewed books and journal articles including articles in small business economics applied economics archives of gerontology and geriatrics papers in regional science international journal of manpower southern economic journal accounting education applied economics letters etc her 2008 book elderly entrepreneurship in an aging us economy was favorably reviewed by dr jan wassel in the gerontologist her 2013 book entrepreneurship and economic growth in china was regarded as one of the best economics books on china studies in english by 海外汉学研究 she has given invited talks at the us congress joint economic committee the house committee on small businesses the us national press club usdol office of planning research evaluation the ewing marion kauffman foundation cambridge university etc and given invited keynote speeches at the university of lisbon portugal uddevalla symposium gran sasso science institute italy leadership in motion sweden johns hopkins university george washington university umbc national medical device conference etc dr zhangs research has been quoted in popular media such as forbes time bloomberg businessweek academic times market watch baltimore sun and so on dr zhang was a winner of the kauffman dissertation fellowship 2007 the finalist of the charles m tiebout prize in regional science 2008 usdol eta research fellowship 20092011 kauffman research grants 20152019 t rowe price excellence in teaching awards 20162019 labor employment relations association best paper selection 20172021 appam entrepreneurship faculty 2021 etc,,,,,LinkedIn About,LinkedIn About ting zhang
18147,18147,yang shen,i am an interdisciplinary engineerresearcherlearner i received my phd degree of civil engineering from texas am university tamu now i am a postdoc research fellow in george mason university gmumy phd dissertation is hybrid building energystructure performance analysis which is tightly associated with building science building operational energy simulation embodied carbon quantificationoptimizationdecarbonization parametric modeling lifecycle analysis structural analysissimulation data analytics and machine learning the experience and skills built there include developing automated multiphysics simulation platform interpretability energy modeling for buildingurban level scales building energystructural system calibrationidentification processinganalyzingorganizingvisualizing largesmall datasets from simulation data automation and data analysisaiml besides i also worked as a oneyear teaching assistant and twoyear experience of federal proposal grant writing in tamu my postdoc job in gmu is about project management advisingmentoring undergraduatemasterphd students and collaboration with a multidisciplinary and diverse team the research focus on the studies of computer vision deep learning data analytics applications in civil engineering and medical informatics the experience and skills there include developing multiimage input model through deep learning eg cnn and timeseries prediction model eg rnn data fusion image processing photogrammetry and rigidnonrigid 3d point cloud reconstructioncorrespondencei am an interdisciplinary engineerresearcherlearner i received my phd degree of civil engineering from texas am university tamu now i am a postdoc research fellow in george mason university gmumy phd dissertation is hybrid building energystructure performance analysis which is tightly associated with building science building operational energy simulation embodied carbon quantificationoptimizationdecarbonization parametric modeling lifecycle analysis structural analysissimulation data analytics and machine learning the experience and skills built there include developing automated multiphysics simulation platform interpretability energy modeling for buildingurban level scales building energystructural system calibrationidentification processinganalyzingorganizingvisualizing largesmall datasets from simulation data automation and data analysisaiml besides i also worked as a oneyear teaching assistant and twoyear experience of federal proposal grant writing in tamu my postdoc job in gmu is about project management advisingmentoring undergraduatemasterphd students and collaboration with a multidisciplinary and diverse team the research focus on the studies of computer vision deep learning data analytics applications in civil engineering and medical informatics the experience and skills there include developing multiimage input model through deep learning eg cnn and timeseries prediction model eg rnn data fusion image processing photogrammetry and rigidnonrigid 3d point cloud reconstructioncorrespondence,,,,,LinkedIn About,LinkedIn About yang shen
18148,18148,ping xu,experienced research assistant with a demonstrated history of working in the higher education industry skilled in distributeddecentralized optimization and learning machine learning deep learning recommendation systems strong research professional with focus in mathematical modeling and optimization system design and technical reportingexperienced research assistant with a demonstrated history of working in the higher education industry skilled in distributeddecentralized optimization and learning machine learning deep learning recommendation systems strong research professional with focus in mathematical modeling and optimization system design and technical reporting,,,,,LinkedIn About,LinkedIn About ping xu
18149,18149,paulo costa,director center of excellence in c4i cyber george mason universityassociate professor at the department of system engineering and operations research and at the department of cybersecurity engineering cyse dept associate chair for graduate programs and research retired brazilian air force officer former fighter pilotspecialties ontology engineering bayesian logic command and control system engineering electronic warfare multisensor data fusion cyberphysical systems safety and securitydirector center of excellence in c4i cyber george mason universityassociate professor at the department of system engineering and operations research and at the department of cybersecurity engineering cyse dept associate chair for graduate programs and research retired brazilian air force officer former fighter pilotspecialties ontology engineering bayesian logic command and control system engineering electronic warfare multisensor data fusion cyberphysical systems safety and security,,,,,LinkedIn About,LinkedIn About paulo costa
18150,18150,shima mohebbi,httpsseorgmueduprofileview587766httpsseorgmueduprofileview587766,,,,,LinkedIn About,LinkedIn About shima mohebbi
18151,18151,bengt ljungquist,neuroinformatics scientist with background in software industry as a developer and requirements analystneuroinformatics scientist with background in software industry as a developer and requirements analyst featuredfeatured postposthow can you find neurons with similar hashtagmorphology in large data sets quickly we have implemented a fast morphological similarity search that combines summary morphometrics with descriptors of the neural branching structurewe evaluated visual similarity information content and duplicate detection ability similarity search provided both as gui and api for the neuromorphoorg database code and application are released opensource for further community developmenthashtagneuroscience hashtagneuroinformatics hashtagopensource httpslnkdingrzqeaue 4postpostour new publication on a new tool for metadata mining of neuronal morphologies is now available full access through link below efficient metadata mining of webaccessible neural morphologiessciencedirectcom 1 min read 3postposthappy that our review article highlights from the era of open source webbased tools now is published in journal of neuroscience httpslnkdindpaztuh 11 2 comments,,,,,LinkedIn About,LinkedIn About bengt ljungquist
18152,18152,diek wheeler,experienced research professor with a demonstrated history of working in the academic research strong education professional skilled in neuroinformatics physics and data analysisexperienced research professor with a demonstrated history of working in the academic research strong education professional skilled in neuroinformatics physics and data analysis,,,,,LinkedIn About,LinkedIn About diek wheeler
18153,18153,samuel acuna,hello i am a biomechanical engineer interested in rehabilitation engineering and humancentered product design i assist the development of new technologies to address movement disorders that arise after injuries such as stroke or traumatic brain injury im particularly interested in solving engineering problems for the hospital health care industry with innovative and emerging technology such as virtual reality and noninvasive neural stimulation skilled in human subjects testing study design matlab prototyping and scientific writingin another life im aiming to be a lead guitarist in a shoegaze or postrock bandhello i am a biomechanical engineer interested in rehabilitation engineering and humancentered product design i assist the development of new technologies to address movement disorders that arise after injuries such as stroke or traumatic brain injury im particularly interested in solving engineering problems for the hospital health care industry with innovative and emerging technology such as virtual reality and noninvasive neural stimulation skilled in human subjects testing study design matlab prototyping and scientific writingin another life im aiming to be a lead guitarist in a shoegaze or postrock band,,,,,LinkedIn About,LinkedIn About samuel acuna
18154,18154,amit kumar singh,presently i am pursuing postdoctoral research at the department of mechanical engineering george mason university usa my current research work is focused on development of nanobotbased treatments for pulmonary infections before joining the george mason university i was a senior research fellow for two years at the the centre for excellence in nanoelectronics theranostic devices centd indian institute of technology guwahati india i worked on synthesis of biomedical microrobots for anticancer therapy i earned my phd nanotechnology at the indian institute of technology guwahati in 2018 and my doctoral research was on designing micronanobots for applications in medicine energy and water treatment being the first generation of student in a startup lab i got a rare opportunity to set up the lab to develop establish new protocols for micronanobots fabrication from my phd i have the proven ability to deliver impactful innovative results which led to high impact publications through collaboration with other labs i have succeeded in material characterization using dls uv afm sem ftir raman xrd vsm tem techniques i have proven experience in managing projects and meeting critical deadlines to ensure project completion i am highly skilled in mentorship of new undergraduates and postgraduates in their final year projectsthesis i have received multiple awards including gandhian young technological innovation sristigyti award 2019 and dstserb international travel grant award 2016prior to my doctoral studies i completed my masters and bachelors in biotechnology from heritage institute of technology india i am familiar with analytical techniques like dna cloning dna purification dna gel analysis dnarna blotting enzymatic assays gram staining microscopy antibiotic assay solid and liquid cultures bacterial growth curve biochemical characterization of bacteria bioinformatics i possess strong written and oral communication skills have a keen attention to detail and the ability to work autonomously as well as in collaborative environments apart from conducting experiments and analyzing data i am an ardent illustrator and sketch artist a keen photographer and a cricket enthusiast i take great delight in turning my weaknesses into my core strengths i am deeply committed to lifelong learning and am constantly seeking new challengesi am on linkedin to make new connections network and looking for new job opportunities reach out to me here or at amitiitg2011gmailcompresently i am pursuing postdoctoral research at the department of mechanical engineering george mason university usa my current research work is focused on development of nanobotbased treatments for pulmonary infections before joining the george mason university i was a senior research fellow for two years at the the centre for excellence in nanoelectronics theranostic devices centd indian institute of technology guwahati india i worked on synthesis of biomedical microrobots for anticancer therapy i earned my phd nanotechnology at the indian institute of technology guwahati in 2018 and my doctoral research was on designing micronanobots for applications in medicine energy and water treatment being the first generation of student in a startup lab i got a rare opportunity to set up the lab to develop establish new protocols for micronanobots fabrication from my phd i have the proven ability to deliver impactful innovative results which led to high impact publications through collaboration with other labs i have succeeded in material characterization using dls uv afm sem ftir raman xrd vsm tem techniques i have proven experience in managing projects and meeting critical deadlines to ensure project completion i am highly skilled in mentorship of new undergraduates and postgraduates in their final year projectsthesis i have received multiple awards including gandhian young technological innovation sristigyti award 2019 and dstserb international travel grant award 2016prior to my doctoral studies i completed my masters and bachelors in biotechnology from heritage institute of technology india i am familiar with analytical techniques like dna cloning dna purification dna gel analysis dnarna blotting enzymatic assays gram staining microscopy antibiotic assay solid and liquid cultures bacterial growth curve biochemical characterization of bacteria bioinformatics i possess strong written and oral communication skills have a keen attention to detail and the ability to work autonomously as well as in collaborative environments apart from conducting experiments and analyzing data i am an ardent illustrator and sketch artist a keen photographer and a cricket enthusiast i take great delight in turning my weaknesses into my core strengths i am deeply committed to lifelong learning and am constantly seeking new challengesi am on linkedin to make new connections network and looking for new job opportunities reach out to me here or at amitiitg2011gmailcom,,,,,LinkedIn About,LinkedIn About amit kumar singh
18155,18155,nicholas clark,working at the intersection of data science and strategic decisionmaking nicholas has had hybrid roles in both public and private organizations he is experienced throughout the entire data science software development lifecycle sdlc and has led ai teams through various phases of government contracts and commercial projects as a data science and ml expert his passion lies in offering clients more informed decisions through machine learningtailored product offerings from traditional predictive pipelines to nlp architectures and realtime recommendation engines to image classification models leveraging in cloud computing environments he also spends far too much of his free time analyzing pga tour golf data in the shotlink database which can be seen in his blog posts belowprimary technical toolkit programming languages python pyspark scala r stata flask tensorflow database sql tsql psql mysql postgresql microsoft sql server db2 azure data studio sql server management studio cloud gcp vertex ai cloud storage compute data catalog bigquery bigtable aws s3 ec2 kinesis glue emr lambda dynamodb azure blob compute data studio ml studio big data databricks spark hadoop hive alteryx enterprise sap hana sas viya businessobjects universe designer tableau server devops jenkins git github gitlab agile methodologies visualization tableau powerbi aws quicksight sap design studiolumira businessobjects webipga tour shotlink side project httpsgithubcomnbeaudoinpgatourshotlinkanalyticsdata visualization portfolio httpspublictableaucomprofilenickbeaudoingithub httpsgithubcomnbeaudoinworking at the intersection of data science and strategic decisionmaking nicholas has had hybrid roles in both public and private organizations he is experienced throughout the entire data science software development lifecycle sdlc and has led ai teams through various phases of government contracts and commercial projects as a data science and ml expert his passion lies in offering clients more informed decisions through machine learningtailored product offerings from traditional predictive pipelines to nlp architectures and realtime recommendation engines to image classification models leveraging in cloud computing environments he also spends far too much of his free time analyzing pga tour golf data in the shotlink database which can be seen in his blog posts belowprimary technical toolkit programming languages python pyspark scala r stata flask tensorflow database sql tsql psql mysql postgresql microsoft sql server db2 azure data studio sql server management studio cloud gcp vertex ai cloud storage compute data catalog bigquery bigtable aws s3 ec2 kinesis glue emr lambda dynamodb azure blob compute data studio ml studio big data databricks spark hadoop hive alteryx enterprise sap hana sas viya businessobjects universe designer tableau server devops jenkins git github gitlab agile methodologies visualization tableau powerbi aws quicksight sap design studiolumira businessobjects webipga tour shotlink side project httpsgithubcomnbeaudoinpgatourshotlinkanalyticsdata visualization portfolio httpspublictableaucomprofilenickbeaudoingithub httpsgithubcomnbeaudoin,,,,,LinkedIn About,LinkedIn About nicholas clark
18156,18156,dorin marcu,my research has contributed to the development of key capabilities for cognitive agents mixedinitiative humancomputer interaction knowledge acquisition of ontological and problemsolving expertise from human experts knowledge engineering evidencebased reasoning automated management of evidence collection from external sources and assumptionbased reasoning as part of my research work i have also contributed to the implementation of these capabilities in several successive generations of learning agent shells disciple learning agent shell and the cognitive agents developed with them the disciple and cogent family of agentsmy research has contributed to the development of key capabilities for cognitive agents mixedinitiative humancomputer interaction knowledge acquisition of ontological and problemsolving expertise from human experts knowledge engineering evidencebased reasoning automated management of evidence collection from external sources and assumptionbased reasoning as part of my research work i have also contributed to the implementation of these capabilities in several successive generations of learning agent shells disciple learning agent shell and the cognitive agents developed with them the disciple and cogent family of agents,,,,,LinkedIn About,LinkedIn About dorin marcu
