titles,authors,date,source,descriptions,citations
Limiting replay vulnerabilities in dnssec,"He Yan, Eric Osterweil, Jon Hajdu, Jonas Acres, Dan Massey",2008/10/19,Conference 2008 4th Workshop on Secure Network Protocols,"The DNS security extensions (DNSSEC) added public key cryptography to the DNS, but problems remain in selecting signature lifetimes. A zonepsilas master server distributes signatures to secondary servers. The signatures lifetimes should be long so that a secondary server can still operate if the master fails. However, DNSSEC lacks revocation. Signed data can be replayed until the signature expires and thus zones should select a short signature lifetime. Operators must choose between reduced robustness or long replay vulnerability windows. This paper introduces a revised DNSSEC signature that allows secondary servers to operate even if the master has failed while simultaneously limiting replay windows to twice the TTL. Each secondary server constructs a hash chain and relays the hash chain anchor to the master server. The signature produced by the master server ensures the authenticity of the hash …",14
Tools for deployment and simulation of heterogeneous sensor networks,"Lewis Girod, Thanos Stathopoulos, Nithya Ramanathan, Eric Osterweil, Tom Schoellhammer, Deborah Estrin",2004,"Description Tools for Deployment and Simulation of Heterogeneous Sensor Networks Skip to main content 
eScholarship Open Access Publications from the University of California Search eScholarship 
Refine Search All of eScholarship This Series Center for Embedded Network Sensing 
Technical Reports banner UCLA Deposit ManageSubmissions Menu Unit Home About Main 
Menu Full Bibliography Policies Submission Guidelines RSS eScholarship UCLA Center for 
Embedded Network Sensing Technical Reports This item is not available for download from 
eScholarship Share EmailFacebookTwitter Tools for Deployment and Simulation of 
Heterogeneous Sensor Networks 2004 Author(s): Lewis Girod; Thanos Stathopoulos; Nithya 
Ramanathan; Eric Osterweil; Tom Schoellhammer; Deborah Estrin et al. No data is associated 
with this publication. ... Main Content Author & Article Info The text for this item is currently …",,14
21 years of distributed denial-of-service: A call to action,"Eric Osterweil, Angelos Stavrou, Lixia Zhang",2020/8/1,Journal Computer,"IEEE Senior Member; bmichael@ nps. edu web, email, messaging, streaming and video delivery, and so forth, are typically equipped to handle expected loads and user behavior under “peacetime” conditions. This provisioning often has a monetary component: buying transit traffic capacities, setting up server infrastructure, and staffing operations, among others. It also includes capacity plans for periodic above-average bursts of traffic, slow Transport Layer Security (TLS) handshakes, and other suboptimal but nonthreatening client behaviors. However, DDoS attacks are designed to overcome these capacities. Once an attack is detected, the common response is to apply network-or application-level filters to packets and/or packet flows to inspect and “scrub” attack traffic away from legitimate flows.",13
Route Leaks & MITM Attacks Against BGPSEC,"Danny McPherson, Shane Amante, Eric Osterweil, Dave Mitchell",2014,Journal IETF Draft draft-ietfgrow-simple-leak-attack-bgpsec-no-help-04,,13
The shape and size of threats: Defining a networked system's attack surface,"Eric Osterweil, Danny McPherson, Lixia Zhang",2014/10/21,Conference 2014 IEEE 22nd International Conference on Network Protocols,"As more complex security services have been added to today's Internet, it becomes increasingly difficult to quantify their vulnerability to compromise. The concept of ""attack surface"" has emerged in recent years as a measure of such vulnerabilities, however systematically quantifying the attack surfaces of networked systems remains an open challenge. In this work we propose a methodology to both quantify the attack surface and visually represent semantically different components (or resources) of such systems by identifying their dependencies. To illustrate the efficacy of our methodology, we examine two real Internet standards (the X.509 CA verification system and DANE) as case studies. We believe this work represents a first step towards systemically modeling dependencies of (and interdependencies between) networked systems, and shows the usability benefits from leveraging existing services.",12
The great ipv4 land grab: resource certification for the ipv4 grey market,"Eric Osterweil, Shane Amante, Dan Massey, Danny McPherson",2011/11/14,Book Proceedings of the 10th ACM Workshop on Hot Topics in Networks,"The era of free IPv4 address allocations has ended and the grey market in IPv4 addresses is now emerging. This paper argues that one cannot and should not try to regulate who sells addresses and at what price, but one does need to provide some proof of ownership in the form of resource certification. In this paper we identify key requirements of resource certification, gained from both theoretical analysis and operational history. We further argue these requirements can be achieved by making use of the existing reverse DNS hierarchy, enhanced with DNS Security. Our analysis compares reverse DNS entries and BGP routing tables and shows this is both feasible and achievable today; an essential requirement as the grey market is also emerging today and solutions are needed now, not years in the future.",12
Operational implications of the dns control plane,"Eric Osterweil, Danny McPherson, Lixia Zhang",2011/5/31,Journal IEEE Reliability Society Newsletter,"The Domain Name System (DNS)[7] provides vital mapping services for the Internet. It maps domain names such as ucla. edu to values ranging from IP addresses to email servers to geographic locations and more. Virtually every Internet application relies on looking up some form of DNS data. This article first describes a dichotomy that exists between DNS’well structured and ordered data plane (the hierarchical tree of domain names) and its, as yet underappreciated, control plane (the interconnected graph of name servers). Then the article focuses on the control structure’s dependency graphs, which are the recursive graphs of the inter-dependencies that exist between the name servers associated with each zone. The goal of this investigation is to understand the implications these graphs have on the security and performance of the overall DNS itself.",12
Managing trusted keys in internet-scale systems,"Eric Osterweil, Dan Massey, Lixia Zhang",2009/7/20,Conference 2009 Ninth Annual International Symposium on Applications and the Internet,"This paper considers a fundamental problem facing all applications that rely on public key cryptography: how to obtain, verify, and maintain the set of trusted public keys. Without some notion of where to find the right keys or which keys can be trusted, an adversary can create false keys, trick users into accepting the false keys, and impersonate legitimate online parties. Unfortunately, the problem of obtaining and managing trusted keys is made challenging by Internet's lack of a central authority: Generally speaking, there is no single point of authority to issue lists of trusted PGP keys, or SSL certificates, or DNSSEC keys for the entire Internet. In this work we explore a new direction to address the challenge of distributing and maintaining trusted keys. First, we note many of today's more successful Internet cryptographic systems (such as the SSL and PGP) use various forms of locally trusted key lists.",11
The missing piece: On namespace management in NDN and how DNSSEC might help,"Pouyan Fotouhi Tehrani, Eric Osterweil, Jochen H Schiller, Thomas C Schmidt, Matthias Wählisch",2019/9/24,Book Proceedings of the 6th ACM Conference on Information-Centric Networking,"Names are the cornerstone of every Information-Centric Network (ICN), nonetheless, namespace management has been by far neglected in ICN. A global and scalable namespace management approach is a challenge which not only concerns technical, but also requires attention to non-technical, e.g., organizational issues. In this paper, we present both a clear position on namespace management in ICN and preliminary work on a potential solution. We conceptualize a namespace management system for hierarchical names and introduce a prototype for NDN, which leverages existing DNSSEC equipped DNS infrastructure. Based on this, we are able to implement both technical and non-technical aspects of namespace management. We consider lessons learned and pitfalls from decades of the ever-evolving development of domain name system. As the de facto standard namespace management for the Internet …",10
Providing privacy enhanced resolution system in the domain name system,"Danny Mcpherson, Eric Osterweil",2014/11/4,Patent office US,An apparatus and a non-transitory computer-readable medium may perform a method of minimizing the disclosure of a domain name contained in a DNS query. The method may include: determining a first label and a second label associated with a domain name included in a DNS query; querying a first nameserver for the first label without revealing the second label to the first nameserver; receiving a response from the first nameserver directing a resolver to a second nameserver; and querying the second nameserver for the first label and the second label.,10
21 years of distributed denial-of service: Current state of affairs,"Eric Osterweil, Angelos Stavrou, Lixia Zhang",2020/6/30,Journal Computer,"The Internet's features and capacity have evolved, but is the nature of its security noticeably better? We examine the fundamental nature of distributed denial-of-service (DDoS) and the state of the union of our defenses in today's DDoS wars.",9
20 years of DDoS: A call to action,"Eric Osterweil, Angelos Stavrou, Lixia Zhang",2019/4/4,Journal arXiv preprint arXiv:1904.02739,"Botnet Distributed Denial of Service (DDoS) attacks are now 20 years old; what has changed in that time? Their disruptive presence, their volume, distribution across the globe, and the relative ease of launching them have all been trending in favor of attackers. Our increases in network capacity and our architectural design principles are making our online world richer, but are favoring attackers at least as much as Internet services. The DDoS mitigation techniques have been evolving but they are losing ground to the increasing sophistication and diversification of the attacks that have moved from the network to the application level, and we are operationally falling behind attackers. It is time to ask fundamental questions: are there core design issues in our network architecture that fundamentally enable DDoS attacks? How can our network infrastructure be enhanced to address the principles that enable the DDoS problem? How can we incentivize the development and deployment of the necessary changes? In this article, we want to sound an alarm and issue a call to action to the research community. We propose that basic research and principled analyses are badly needed, because the status quo does not paint a pretty picture for the future.",9
Strengthening integrity assurances for DNS data,"Burton S Kaliski Jr, Eric Osterweil",2018/10/23,Patent office US,"One or more DNS services are provided that are configured to not only tolerate some commonly observed DNSSEC misconfigurations (while still providing DNSSEC's security guarantees), but also provide a more intelligent DNS resolution process informed by DNSSEC.",9
Client-side name collision vulnerability in the new gtld era: A systematic study,"Qi Alfred Chen, Matthew Thomas, Eric Osterweil, Yulong Cao, Jie You, Z Morley Mao",2017/10/30,Book Proceedings of the 2017 ACM SIGSAC Conference on Computer and Communications Security,"The recent unprecedented delegation of new generic top-level domains (gTLDs) has exacerbated an existing, but fallow, problem called name collisions. One concrete exploit of such problem was discovered recently, which targets internal namespaces and enables Man in the Middle (MitM) attacks against end-user devices from anywhere on the Internet. Analysis of the underlying problem shows that it is not specific to any single service protocol, but little attention has been paid to understand the vulnerability status and the defense solution space at the service level. In this paper, we perform the first systematic study of the robustness of internal network services under name collision attacks.",9
Providing privacy enhanced resolution system in the domain name system,"Danny Mcpherson, Eric Osterweil",2014/11/4,Patent office US,An apparatus and a non-transitory computer-readable medium may perform a method of minimizing the disclosure of a domain name contained in a DNS query. The method may include: determining a first label and a second label associated with a domain name included in a DNS query; querying a first nameserver for the first label without revealing the second label to the first nameserver; receiving a response from the first nameserver directing a resolver to a second nameserver; and querying the second nameserver for the first label and the second label.,10
Assessing IPv6 adoption,"Jakub Czyz, Mark Allman, S Iekel-Johnson, E Osterweil, M Bailey",2013/8,"Journal International Computer Science Institute, Tec. Report TR-13-004","On February 3, 2011 the Internet Assigned Numbers Authority (IANA) allocated the last unallocated blocks of IPv4 address space to the five Regional Internet Registries (RIRs). While many solutions that tackle the problem of address scarcity have been proposed (eg address markets), the predominant opinion is that networks will eventually adopt the new Internet Protocol, IPv6. As a result, the Internet is on the verge of its first fundamentally disruptive transition–one which will impose extensive change throughout the network. This inflection point offers a unique opportunity to measure the adoption of new technologies at an unprecedented scale. In this paper, we tackle the problem of measuring this significant transition by first providing a framework to assess the complex ecosystem that underlies IPv6 adoption. We then provide the largest and most comprehensive snapshot of this evolution to date.",9
Tiny Diffusion in the Extensible Sensing System at the James Reserve,Eric Osterweil,2003,Journal http://www. cens. ucla. edu/~ eoster/tinydiff,,9
Detecting and remediating highly vulnerable domain names using passive DNS measurements,"Eric M Osterweil, Danny R McPherson, Matthew A Thomas, Qi Alfred Chen",2020/5/12,Patent office US,"Some embodiments provide a technique for detecting highly-vulnerable domain names and remediating associated problems. The technique can include collecting DNS data representing a requests to the DNS over a period of time and determining a subset of the DNS data representing DNS-based service discovery requests to unregistered domains over the period of time. The technique can also include, for each of the unregistered domains, determining a query ratio and a persistence ratio. The technique can also include ranking the unregistered domains according to a metric that includes the query ratios and the persistence ratios, such that a ranked list of domain names is produced and outputting an initial segment of the ranked list of domain names as the highly-vulnerable domain names. The technique can also include remediating attacks on at least one of the highly-vulnerable domain names.",8
Methods and systems for bootstrapping,"Ramakant Pandrangi, Eric Osterweil, Paul Livesay",2018/4/3,Patent office US,"The disclosure is directed to securely bootstrapping devices in a network environment. Methods and systems include hardware and/or operations for receiving, based on an identifier provisioned at a relying entity, instances of a security credential of an information system, wherein the instances are associated with respective certifying entities. The operations also include verifying the authenticity of the instances of the security credential using information of the certifying entities provisioned at the relying entity. The operations further includes determining matches between the instances of the security credential. Additionally, the operations include determining based on the matches that a first instance of the security credential satisfies a policy provisioned at the relying entity. Further, the operations include verifying the authenticity of information requested from the information system using the first instance of the …",8
Considerations for internet routing registries (IRRs) and routing policy configuration,"D McPherson, S Amante, E Osterweil, L Blunk, D Mitchell",2015/12,Issue rfc7682,,8
Reverse-DNS naming convention for CIDR address blocks,"Joe Gersch, Dan Massey, E Osterweil",2012/2,Journal Securing and Trusting Internet Names-SATIN,"Reverse DNS is the inverse naming technique that maps an IPv4 or IPv6 address to a domain name. The current reverse DNS naming method is used to specify a complete IP address. Currently, it cannot be used to handle address ranges. For example, there is no formal mechanism for specifying a reverse DNS name for the block of addresses specified by the IPv4 prefix 129.82. 0.0/16.",8
Expect more from the networking: Ddos mitigation by fitt in named data networking,"Zhiyi Zhang, Vishrant Vasavada, Siva Kesava Reddy Kakarla, Angelos Stavrou, Eric Osterweil, Lixia Zhang",2019/2/24,Journal arXiv preprint arXiv:1902.09033,"Distributed Denial of Service (DDoS) attacks have plagued the Internet for decades, but the basic defense approaches have not fundamentally changed. Rather, the size and rate of growth in attacks have actually outpaced carriers' and DDoS mitigation services' growth, calling for new solutions that can be, partially or fully, deployed imminently and exhibit effectiveness. In this paper, we examine the basic functions in Named Data Networking (NDN), a newly proposed Internet architecture, that can address the principle weaknesses in today's IP networks. We demonstrate by a new DDoS mitigation solution over NDN, Fine-grained Interest Traffic Throttling FITT, that NDN's architectural changes, even when incrementally deployed, can make DDoS attacks fundamentally more difficult to launch and less effective. FITT leverages the NDN design to enable the network to detect DDoS from victim's feedback, throttles DDoS traffic by reverse its exact paths through the network, and enforces control over the misbehaving entities at their sources. Our extensive simulation results show that FITT can throttle attack traffic with one-way time delay from the victim to the NDN gateway; upon activation, FITT effectively stop attack traffic from impacting benign flows, resulting in over 99\% of packets reaching victims being legitimate ones. We further demonstrate that service providers may implement NDN/FITT on existing CDN nodes as an incrementally deployable solution to effectuate the application level remediation at the sources, which remains unattainable in today's DDoS mitigation approaches.",7
Extending DNSSEC trust chains to objects outside the DNS,"Burton S Kaliski Jr, Eric Osterweil, Glen Wiley",2017/7/11,Patent office US,The present invention generally relates to systems and methods for extending a chain of trust beyond the DNS. Some embodiments provide a verifier with the ability to validate a chain of trust starting with the trust anchor at the DNS root all the way to a service or object of interest outside the DNS.,40
Systems and methods for automating client-side discovery of public keys of external contacts that are secured by DANE using DNSSEC,"Eric Osterweil, Sameer Thakar",2018/5/8,Patent office US,"Provided is a method of digitally securing a digital object from a first user in a first domain to a second user in a second domain using a DNS provider. The method includes accessing, at a client device of the first user, a client-side local policy, wherein the local policy comprises one or more zones managed by one or more DNS providers and secured by DANE using DNSSEC; constructing a DNS query for a cryptographic credential for the second user based, at least in part, on a zone of the one or more zones in the local policy; providing a request for the cryptographic credential for the second user; obtaining the cryptographic credential for the second user from a DNS provider of the one or more DNS providers; digitally securing the digital object using the cryptographic credential; and providing the digital object to the second user.",7
Resilient domain name service (DNS) resolution when an authoritative name server is degraded,"Shumon Huque, Burton S Kaliski Jr, Eric Osterweil, Frank Scalzo, Duane Wessels, Glen Wiley",2021/6/1,Patent office US,"In one embodiment, a resolution resiliency application modifies domain name service (DNS) resolution. In operation, the resolution resiliency application determines that an authoritative name server has begun recovering from a degraded state or receives a flush list update from the authoritative name server. In response, the resolution resiliency application performs operation (s) that modify a query rate and/or a cache. The query rate specifies a frequency associated with DNS queries transmitted to the first authoritative name server. The cache stores DNS record (s) received from the first authoritative name server. Finally, the resolution resiliency application generates a DNS response to a DNS query based on the modified query rate and/or the modified cache.",6
Profiling domain name system (dns) traffic,"Eric Osterweil, Michael Kaczmarek",2018/5/17,Patent office US,"In one embodiment, a profiling engine analyzes DNS transaction data that is logged by a recursive resolver to generate profiling results that are used to manage network activity. In operation, the profiling engine computes scores based on the DNS transaction data and scoring criteria. The profiling engine may compute any number of scores at any level of granularity. For example, the profiling engine may compute a score for each source IP address that is associated with the DNS transaction data. Subsequently, the profiling engine generates profiling results based on the scores and profiling criteria. Notably, DNS queries are typically the first step of longer transaction chains that result in the transfer of data to and from the network. Consequently, the profiling engine may provide more timely and comprehensive insight into network activities than conventional network management tools that analyze data at layers that …",5
"New gTLD security, stability, resiliency update: Exploratory consumer impact analysis","Eric Osterweil, Matt Thomas, Andrew Simpson, Danny McPherson",2013/8/22,"Journal Verisign Labs, Reston, Virigina, USA, Tech. Rep","Interesting times await those who rely on something, and at once cannot imagine it failing. For example, we rely on the Domain Name System (DNS)[47] for almost everything we do online. We often pay little attention to this seemingly simple system because it mostly “just works,” and it has been working for more than 30 years. We count on it to always be highly available, but some recent developments in the DNS ecosystem suggest that we might have begun to mistake its stability and ubiquity for unbounded robustness and flexibility. One might argue that the DNS has fallen victim to a famous curse, pronounced by Mark Weiser,",5
Verifying keys through publicity and communities of trust: Quantifying off-axis corroboration,"Eric Osterweil, Dan Massey, Danny McPherson, Lixia Zhang",2013/7/2,Journal IEEE Transactions on Parallel and Distributed Systems,"The DNS Security Extensions (DNSSEC) arguably make DNS the first core Internet system to be protected using public key cryptography. The success of DNSSEC not only protects the DNS, but has generated interest in using this secured global database for new services such as those proposed by the IETF DANE working group. However, continued success is only possible if several important operational issues can be addressed. For example, .gov and .arpa have already suffered misconfigurations where DNS continued to function properly, but DNSSEC failed (thus, orphaning their entire subtrees in DNSSEC). Internet-scale verification systems must tolerate this type of chaos, but what kind of verification can one derive for systems with dynamism like this? In this paper, we propose to achieve robust verification with a new theoretical model, called Public Data, which treats operational deployments as …",5
The extensible sensing system,"Eric Osterweil, Mohan Mysore, Mohamad Rahimi, Andrew Wu",2003,"Description The ESS is designed as a suite of components that enable and facilitate sensor networks, their deployment, management, and usage. In meeting its charter, the ESS spans a comprehensive set of platforms and operates in a diverse set of environments. It is, therefore, based on a tiered architecture comprised of; motes (mica2, tos, chipcon, sensor interface board), microservers (strongarm/xscale, linux, motenic, 802.11), commodity platforms (x86, linux, 802.11) platforms, and enterprise platforms (such as solaris and oracle)...","The ESS is designed as a suite of components that enable and facilitate sensor networks, their deployment, management, and usage. In meeting its charter, the ESS spans a comprehensive set of platforms and operates in a diverse set of environments. It is, therefore, based on a tiered architecture comprised of; motes (mica2, tos, chipcon, sensor interface board), microservers (strongarm/xscale, linux, motenic, 802.11), commodity platforms (x86, linux, 802.11) platforms, and enterprise platforms (such as solaris and oracle)...",5
