titles,authors,date,source,descriptions,citations
"Network Working Group J. Gersch Internet-Draft Secure64 SW Corp Intended status: Informational D. Massey Expires: August 29, 2013 Colorado State University","E Osterweil, C Olschanowsky",2013/2/25,"Description This draft proposes a naming convention for encoding CIDR address blocks into the reverse DNS namespace. The reverse DNS naming method is commonly used to specify a complete IP address. This document describes how to encode an IPv4 or IPv6 CIDR address block such as 129.82. 128.0/17. By defining a common naming convention, one can associate information with a prefix. The convention builds on past work in RFC 1101 that associates network names with prefixes. However, this previous work pre-dated the introduction of CIDR and has several critical ambiguities. This convention corrects the ambiguities and enables new applications ranging from routing information to geolocation.","This draft proposes a naming convention for encoding CIDR address blocks into the reverse DNS namespace. The reverse DNS naming method is commonly used to specify a complete IP address. This document describes how to encode an IPv4 or IPv6 CIDR address block such as 129.82. 128.0/17. By defining a common naming convention, one can associate information with a prefix. The convention builds on past work in RFC 1101 that associates network names with prefixes. However, this previous work pre-dated the introduction of CIDR and has several critical ambiguities. This convention corrects the ambiguities and enables new applications ranging from routing information to geolocation.",
"Network Working Group J. Gersch Internet-Draft Secure64 SW Corp Intended status: Informational D. Massey Expires: November 2, 2012 Colorado State University",E Osterweil,2012/5/1,"Description The reverse DNS naming method is used to specify a complete IP address. At present there is no standard way for the reverse DNS to handle address ranges. As an example, there is no formal mechanism to define a reverse DNS name for the block of addresses specified by the IPv4 prefix 129.82. 0.0/16. Defining such a reverse DNS naming convention would be useful for a number of applications. This draft proposes a naming convention for encoding CIDR address blocks into the reverse DNS namespace.","The reverse DNS naming method is used to specify a complete IP address. At present there is no standard way for the reverse DNS to handle address ranges. As an example, there is no formal mechanism to define a reverse DNS name for the block of addresses specified by the IPv4 prefix 129.82. 0.0/16. Defining such a reverse DNS naming convention would be useful for a number of applications. This draft proposes a naming convention for encoding CIDR address blocks into the reverse DNS namespace.",
"Network Working Group J. Gersch Internet-Draft Secure64 SW Corp Intended status: Standards Track D. Massey Expires: September 1, 2012 Colorado State University","E Osterweil, L Zhang",2012/2/29,Description This draft proposes the creation of two DNS record types for storing BGP routing information in the reverse DNS. The RLOCK record allows prefix owners to indicate whether the DNS is being used to publish routing data. The SRO record allows operators to indicate whether an IPv4 or IPv6 prefix ought to appear in global routing tables and identifies authorized origin Autonomous System Number (s) for that prefix. The published data can be used in a variety of contexts and can be extended to include additional information. This work is part of an on-going effort and is accessible in an active testbed.,This draft proposes the creation of two DNS record types for storing BGP routing information in the reverse DNS. The RLOCK record allows prefix owners to indicate whether the DNS is being used to publish routing data. The SRO record allows operators to indicate whether an IPv4 or IPv6 prefix ought to appear in global routing tables and identifies authorized origin Autonomous System Number (s) for that prefix. The published data can be used in a variety of contexts and can be extended to include additional information. This work is part of an on-going effort and is accessible in an active testbed.,
"Network Working Group J. Gersch Internet-Draft Secure64 SW Corp Intended status: Informational D. Massey Expires: September 1, 2012 Colorado State University",E Osterweil,2012/2/29,"Description This draft proposes a naming convention for encoding CIDR address blocks into the reverse DNS namespace. The reverse DNS naming method is commonly used to specify a complete IP address. This document describes how to encode an IPv4 or IPv6 CIDR address block such as 129.82. 0.0/16. By defining a common naming convention, one can associate information with a prefix. The convention builds on past work in RFC 1101 that associates network names with prefixes. However, this previous work pre-dated the introduction of CIDR and has several critical ambiguities. This convention corrects the ambiguities and enables new applications ranging from routing information to geolocation.","This draft proposes a naming convention for encoding CIDR address blocks into the reverse DNS namespace. The reverse DNS naming method is commonly used to specify a complete IP address. This document describes how to encode an IPv4 or IPv6 CIDR address block such as 129.82. 0.0/16. By defining a common naming convention, one can associate information with a prefix. The convention builds on past work in RFC 1101 that associates network names with prefixes. However, this previous work pre-dated the introduction of CIDR and has several critical ambiguities. This convention corrects the ambiguities and enables new applications ranging from routing information to geolocation.",
"Network Working Group V. Pappas Internet-Draft IBM Intended status: Standards Track B. Zhang Expires: April 26, 2007 Colorado State Univ.","E Osterweil, D Massey",2006/10/23,"Description Due to the hierarchical tree structure of the Domain Name System [RFC1034][RFC1035], losing all of the authoritative servers that serve a zone can disrupt services to not only that zone but all of its descendants. This problem is particularly severe if all the authoritative servers of the root zone, or of a top level domain’s zone, fail. Although proper placement of secondary servers, as discussed in [RFC2182], can be an effective means against isolated failures, it is insufficient to protect the DNS service against distributed denial of service attacks (DDoS). This document proposes to mitigate the impact of DDoS attacks against top level DNS servers by setting long TTL values for NS records and the associated A records. Our proposal involves only operational changes and can be deployed incrementally.","Due to the hierarchical tree structure of the Domain Name System [RFC1034][RFC1035], losing all of the authoritative servers that serve a zone can disrupt services to not only that zone but all of its descendants. This problem is particularly severe if all the authoritative servers of the root zone, or of a top level domain’s zone, fail. Although proper placement of secondary servers, as discussed in [RFC2182], can be an effective means against isolated failures, it is insufficient to protect the DNS service against distributed denial of service attacks (DDoS). This document proposes to mitigate the impact of DDoS attacks against top level DNS servers by setting long TTL values for NS records and the associated A records. Our proposal involves only operational changes and can be deployed incrementally.",
Improving DNS Service Availability by Using Long TTLs draft-pappas-dnsop-long-ttl-00,"E Osterweil, D Massey, L Zhang",2006/2,"Description [RFC2182] provides operational guidelines for selecting and operating authoritative servers to maximize a zone’s availability. Proper placement of authoritative servers can be an effective means to guard DNS service against unintentional failures or errors, but it cannot effectively protect DNS services against intentional attacks. A distributed denial of service attack could target all of the authoritative servers for a zone, regardless of where they are placed. By disabling all of a zone’s authoritative servers, an attacker can disrupt service for that zone and all the zones below it. In particular, attacks against domains such as the root, generic top level domains (gTLDs), country code top level domains (ccTLDs), and other zones serving popular DNS domains (such as co. uk. or co. jp.) could have a severe global impact. For example, knocking out all of the root zone servers may effectively render the entire Internet …","[RFC2182] provides operational guidelines for selecting and operating authoritative servers to maximize a zone’s availability. Proper placement of authoritative servers can be an effective means to guard DNS service against unintentional failures or errors, but it cannot effectively protect DNS services against intentional attacks. A distributed denial of service attack could target all of the authoritative servers for a zone, regardless of where they are placed. By disabling all of a zone’s authoritative servers, an attacker can disrupt service for that zone and all the zones below it. In particular, attacks against domains such as the root, generic top level domains (gTLDs), country code top level domains (ccTLDs), and other zones serving popular DNS domains (such as co. uk. or co. jp.) could have a severe global impact. For example, knocking out all of the root zone servers may effectively render the entire Internet …",
Vantages: Using “Public Data” for Key Verification,"Eric Osterweil, Dan Massey, Lixia Zhang","A public key verification system for the global Internet has long been thought of as prerequisite for enhancing Internet security with cryptographic protections. However, after years of efforts by numerous groups, such a facility remains absent in the operational Internet. In this paper, we formally define a novel concept of Public Data, and through the design of a system called Vantages we describe how we can leverage the concept of Public Data to develop a public key verification system for the global Internet. More specifically, the Vantages system is designed to solve the DNSSEC key learning problem. As of the writing of this paper, DNSSEC is in the verge of wide deployment and is in desperate need of an operationally realistic key learning system that allows DNS resolvers to obtain and verify public keys known as DNSKEYs. We further demonstrate the improvement that Vantages provides over DNSSEC’s native key verification by formally quantifying each of them and empirically measuring their effectiveness.","Scholar articles Vantages: Using “Public Data” for Key VerificationE Osterweil, D Massey, L ZhangRelated articles ","A public key verification system for the global Internet has long been thought of as prerequisite for enhancing Internet security with cryptographic protections. However, after years of efforts by numerous groups, such a facility remains absent in the operational Internet. In this paper, we formally define a novel concept of Public Data, and through the design of a system called Vantages we describe how we can leverage the concept of Public Data to develop a public key verification system for the global Internet. More specifically, the Vantages system is designed to solve the DNSSEC key learning problem. As of the writing of this paper, DNSSEC is in the verge of wide deployment and is in desperate need of an operationally realistic key learning system that allows DNS resolvers to obtain and verify public keys known as DNSKEYs. We further demonstrate the improvement that Vantages provides over DNSSEC’s native key verification by formally quantifying each of them and empirically measuring their effectiveness.",
SUSTAINABLE COMPUTING,"ERIC OSTERWEIL, ANGELOS STAVROU, LIXIA ZHANG","IEEE Transactions on Sustainable Computing Page 1 AUGUST 2020 99 13. C. Dietzel, G. 
Smaragdakis, M. Wichtlhuber, and A. Feldmann, “Stellar: Network attack mitigation using 
advanced blackholing,” in Proc. ACM 14th Int. Conf. Emerging Networking Experiments and 
Tech- nologies, 2018, pp. 152–164. doi: 10.1145/3281411.3281413. 14. M. Handley and A. 
Greenhalgh, “Steps towards a DoS-resistant internet architecture,” in Proc. ACM SIGCOMM 
Workshop Future Directions Network Ar- chitecture, 2004, pp. 49–56. doi: 10.1145/1016707.1016717. 
15. “NSF announces Future Internet Architecture awards,” National Science Foundation, 
Alexandria, VA, Aug. 2010. [Online]. Available: https:// www.nsf.gov/news/news _summ.jsp?cntn_id=117611 
16. JM Smith, “Extreme DDoS Defense (XD3),” DARPA, Arlington, VA. [Online]. Available: 
https://www.darpa.mil/ program/extreme-ddos-defense 17. JM Smith, “Open, …","Scholar articles SUSTAINABLE COMPUTINGE OSTERWEIL, A STAVROU, L ZHANGAll 3 versions ",,
Verifying Keys through Publicity and Communities of Trust,"Eric Osterweil, Dan Massey, Danny McPherson, Lixia Zhang","Verifying Keys through Publicity and Communities of Trust Page 1 Verifying Keys through 
Publicity and Communities of Trust Eric Osterweil Dan Massey Danny McPherson Lixia Zhang 
Page 2 2 Verisign Public • DNS is a staple of today’s online activities • Is there a pedestrian 
online activity that doesn’t use DNS? • We use it to map unique names to network resources • It 
has long been a very robust system • DNSSEC makes DNS the first core Internet system to 
protect itself and its data with hierarchical crypto • Protects DNS from cache poisoning and 
spoofing • 2010-2011, root and .net, and .com deployed DNSSEC • A straightforward design 
crypto-enhanced systems design • The deployment has been growing, and standards are being 
built on DNSSEC: DANE (TLS, S/MIME, etc.) DNSSEC: Security for a Core Internet System 
Page 3 3 Verisign Public Motivations Grow the Deployment (Graph From SecSpider) Page 4 …","Scholar articles Verifying Keys through Publicity and Communities of TrustE Osterweil, D Massey, D McPherson, L ZhangAll 3 versions ",,
Having your cake and eating it too: Domain Name Data Networking (DNDN),"Eric Osterweil, Craig Murray, Aziz Mohaisen","Named Data Networking (NDN) is a new architecture that has been proposed for the Internet. Among its insights is the realization that we predominantly use the Internet to access data, and that the endpoints of communications are generally not our focus. Indeed, the Internet Protocol and the use of IP addresses is just a means for delivery of content that could be directly addressed and distributed in a more efficient manner. However, the NDN architecture has several design and deployment obstacles. First, it relies heavily on caching among a dense population of NDN nodes, and yet there will be very few nodes deployed initially. Second, it uses an unstructured namespace in which names can be chosen by content providers. This makes it challenging to disambiguate which provider is the actual authority for a name. Third, NDN ensures security through cryptographic signatures on all data packets, but NDN does not have an architecture for securely discovering and verifying the authenticity of keys. These are just some of the barriers to widespread adoption of NDN. We suggest that all of these problems (and more) can be solved by implementing NDN on top of the Domain Name System (DNS). We propose Domain Name Data Networking (DNDN) as a possible way to facilitate use of NDN within the existing infrastructure. In this model, DNS becomes a substrate from which NDN can leverage essential components. We show the feasibility of DNDN, we evaluate the benefits if it were deployed, and we show a simulated sample application that uses it. DNS is one of the Internet’s most operationally well understood, ubiquitous, and resilient …","Scholar articles Having your cake and eating it too: Domain Name Data Networking (DNDN)E Osterweil, C Murray, A MohaisenRelated articles ","Named Data Networking (NDN) is a new architecture that has been proposed for the Internet. Among its insights is the realization that we predominantly use the Internet to access data, and that the endpoints of communications are generally not our focus. Indeed, the Internet Protocol and the use of IP addresses is just a means for delivery of content that could be directly addressed and distributed in a more efficient manner. However, the NDN architecture has several design and deployment obstacles. First, it relies heavily on caching among a dense population of NDN nodes, and yet there will be very few nodes deployed initially. Second, it uses an unstructured namespace in which names can be chosen by content providers. This makes it challenging to disambiguate which provider is the actual authority for a name. Third, NDN ensures security through cryptographic signatures on all data packets, but NDN does not have an architecture for securely discovering and verifying the authenticity of keys. These are just some of the barriers to widespread adoption of NDN. We suggest that all of these problems (and more) can be solved by implementing NDN on top of the Domain Name System (DNS). We propose Domain Name Data Networking (DNDN) as a possible way to facilitate use of NDN within the existing infrastructure. In this model, DNS becomes a substrate from which NDN can leverage essential components. We show the feasibility of DNDN, we evaluate the benefits if it were deployed, and we show a simulated sample application that uses it. DNS is one of the Internet’s most operationally well understood, ubiquitous, and resilient …",
Cross-Modal Vulnerabilities: An Illusive form of Hijacking,"Eric Osterweil, Dan Massey, Christos Papadopoulos","Content, connection, and other types of hijacking are a common occurrence in today’s Internet. One can broadly classify various types of hijacks as being locally scoped to an administrative domain, or pushed externally; where one administrative domain (intentionally or unintentionally) hijacks users in other domains. Current work in identifying and reacting to various types of Internet hijacking has focused on the network control plane and has not included cross-modal hijacks that involve both the control plane and the data plane of the Internet. In this work we introduce the idea that crossmodal threats exist in the Internet and form a highly illusive, but serious threat. Further, we detail an actual instance of Internet-scale cross-modal hijacking whose behavior depends on both network control data and data plane such as the order in which users request connections. Based on anecdotal evidence gleaned from several websites, it appears that this hijack existed for many months (and possibly years) before its recent detection.","Scholar articles Cross-Modal Vulnerabilities: An Illusive form of HijackingE Osterweil, D Massey, C PapadopoulosRelated articles All 2 versions ","Content, connection, and other types of hijacking are a common occurrence in today’s Internet. One can broadly classify various types of hijacks as being locally scoped to an administrative domain, or pushed externally; where one administrative domain (intentionally or unintentionally) hijacks users in other domains. Current work in identifying and reacting to various types of Internet hijacking has focused on the network control plane and has not included cross-modal hijacks that involve both the control plane and the data plane of the Internet. In this work we introduce the idea that crossmodal threats exist in the Internet and form a highly illusive, but serious threat. Further, we detail an actual instance of Internet-scale cross-modal hijacking whose behavior depends on both network control data and data plane such as the order in which users request connections. Based on anecdotal evidence gleaned from several websites, it appears that this hijack existed for many months (and possibly years) before its recent detection.",
The Shape and Size of Threats: Defining Attack Surface,"Eric Osterweil, Danny McPherson, Lixia Zhang","Security and privacy have become very relevant concerns in our online lives. However as we have created complex and layered security services, it has become increasingly difficult to quantify their vulnerability to compromise. Security solutions must strive for both usability of the security system and understandability of their vulnerabilities. The concept of “attack surface” has emerged in recent years as a measure of such vulnerabilities, however systematically quantifying the attack surfaces of networked systems with high degrees of interdependencies remains an open challenge (especially in an expressive way). In this work we propose a methodology to both quantify the attack surface and visually represent semantically different components (or resources) of such systems by identifying their systemic dependencies. To illustrate the efficacy of our methodology, we use two real Internet standards (the X. 509 CA …","Scholar articles The Shape and Size of Threats: Defining Attack SurfaceE Osterweil, D McPherson, L ZhangRelated articles ","Security and privacy have become very relevant concerns in our online lives. However as we have created complex and layered security services, it has become increasingly difficult to quantify their vulnerability to compromise. Security solutions must strive for both usability of the security system and understandability of their vulnerabilities. The concept of “attack surface” has emerged in recent years as a measure of such vulnerabilities, however systematically quantifying the attack surfaces of networked systems with high degrees of interdependencies remains an open challenge (especially in an expressive way). In this work we propose a methodology to both quantify the attack surface and visually represent semantically different components (or resources) of such systems by identifying their systemic dependencies. To illustrate the efficacy of our methodology, we use two real Internet standards (the X. 509 CA …",
