titles,authors,date,source,descriptions,citations
Habitat monitoring with sensor networks,"Robert Szewczyk, Eric Osterweil, Joseph Polastre, Michael Hamilton, Alan Mainwaring, Deborah Estrin",2004/6/1,Journal Communications of the ACM,"These networks deliver to ecologists data on localized environmental conditions at the scale of individual organisms to help settle large-scale land-use issues affecting animals, plants, and people.",1041
"A system for simulation, emulation, and deployment of heterogeneous sensor networks","Lewis Girod, Thanos Stathopoulos, Nithya Ramanathan, Jeremy Elson, Deborah Estrin, Eric Osterweil, Tom Schoellhammer",2004/11/3,Book Proceedings of the 2nd international conference on Embedded networked sensor systems,"Recently deployed Wireless Sensor Network systems (WSNs) are increasingly following heterogeneous designs, incorporating a mixture of elements with widely varying capabilities. The development and deployment of WSNs rides heavily on the availability of simulation, emulation, visualization and analysis support. In this work, we develop tools specifically to support heterogeneous systems, as well as to support the measurement and visualization of operational systems that is critical to addressing the inevitable problems that crop up in deployment. Our system differs from related systems in three key ways: in its ability to simulate and emulate heterogeneous systems in their entirety, in its extensive support for integration and interoperability between motes and microservers, and in its unified set of tools that capture, view, and analyze real time debugging information from simulations, emulations, and deployments.",279
Lightweight temporal compression of microclimate datasets,"Tom Schoellhammer, Ben Greenstein, Eric Osterweil, Michael Wimbrow, Deborah Estrin",2004/5/5,"Description Since the inception of sensor networks, in-network processing has been touted as the enabling technology for long-lived deployments. Radio communication is the overriding consumer of energy in such networks. Therefore, data reduction before transmission, either by compression or feature extraction, will directly and significantly increase network lifetime.In many cases, it is premature to begin implementing feature extraction techniques.Users do not yet understand in what forms interesting data will appear and consequently can’t risk automatically discarding what they presume to be uninteresting. Moreover, computer scientists are only beginning to develop algorithms to collect spatially distributed features in situ.Even for the many application where all of the data must be transported out of the network, data may be compressed before transport, so long as the chosen compression technique can operate under the stringent resource constraints of low-power nodes and induces only tolerable errors. This paper evaluates a simple temporal compression scheme designed specifically to be used bymicamotes for the compaction of microclimate data. The algorithm makes use of the observation that over a small enough window of time, samples of microclimate data are linear. It finds such windows and generates a series of line segments that accurately represent the data. It compresses data up to 20-to-1 while introducing error on the order of the sensor hardware’s specified margin of error. Furthermore it is simple, consumes little CPU and requires very little storage when compared to other compression techniques. This paper describes the technique …","Since the inception of sensor networks, in-network processing has been touted as the enabling technology for long-lived deployments. Radio communication is the overriding consumer of energy in such networks. Therefore, data reduction before transmission, either by compression or feature extraction, will directly and significantly increase network lifetime.In many cases, it is premature to begin implementing feature extraction techniques.Users do not yet understand in what forms interesting data will appear and consequently can’t risk automatically discarding what they presume to be uninteresting. Moreover, computer scientists are only beginning to develop algorithms to collect spatially distributed features in situ.Even for the many application where all of the data must be transported out of the network, data may be compressed before transport, so long as the chosen compression technique can operate under the stringent resource constraints of low-power nodes and induces only tolerable errors. This paper evaluates a simple temporal compression scheme designed specifically to be used bymicamotes for the compaction of microclimate data. The algorithm makes use of the observation that over a small enough window of time, samples of microclimate data are linear. It finds such windows and generates a series of line segments that accurately represent the data. It compresses data up to 20-to-1 while introducing error on the order of the sensor hardware’s specified margin of error. Furthermore it is simple, consumes little CPU and requires very little storage when compared to other compression techniques. This paper describes the technique …",197
Measuring ipv6 adoption,"Jakub Czyz, Mark Allman, Jing Zhang, Scott Iekel-Johnson, Eric Osterweil, Michael Bailey",2014/8/17,Book Proceedings of the 2014 ACM conference on SIGCOMM,"After several IPv4 address exhaustion milestones in the last three years, it is becoming apparent that the world is running out of IPv4 addresses, and the adoption of the next generation Internet protocol, IPv6, though nascent, is accelerating. In order to better understand this unique and disruptive transition, we explore twelve metrics using ten global-scale datasets to create the longest and broadest measurement of IPv6 adoption to date. Using this perspective, we find that adoption, relative to IPv4, varies by two orders of magnitude depending on the measure examined and that care must be taken when evaluating adoption metrics in isolation. Further, we find that regional adoption is not uniform. Finally, and perhaps most surprisingly, we find that over the last three years, the nature of IPv6 utilization-in terms of traffic, content, reliance on transition technology, and performance-has shifted dramatically from prior …",188
White listing DNS top-talkers,"Eric Osterweil, Danny Mcpherson",2015/1/13,Patent office US,"Systems and methods for creating a list of trustworthy resolvers in a domain name system. A computer receives a resolver profile for a resolver sending queries to a domain name server. The resolver profile is based on any, or a combination, of a top-talker status of the resolver, a normalcy of distribution of domain names queried, a continuity of distribution of query type, and a RD bit status, and information related to query traffic based on the topology of the domain name server. Resolver profiles can be compared to a trust policy to determine whether the resolver is trustworthy. Resolvers deemed trustworthy can be added to a list of trustworthy resolvers. Embodiments can detect the occurrence of a network-based attack. Embodiments can mitigate the effect of a network-based attack by responding only to queries from resolvers on the list of trustworthy resolvers.",103
Quantifying the operational status of the dnssec deployment,"Eric Osterweil, Michael Ryan, Dan Massey, Lixia Zhang",2008/10/20,Book Proceedings of the 8th ACM SIGCOMM conference on Internet measurement,"This paper examines the deployment of the DNS Security Extensions (DNSSEC), which adds cryptographic protection to DNS, one of the core components in the Internet infrastructure. We analyze the data collected from the initial DNSSEC deployment which started over 2 years ago, and identify three critical metrics to gauge the deployment: availability, verifiability, and validity. Our results provide the first comprehensive look at DNSSEC's deployment and reveal a number of challenges that were not anticipated in the design but have become evident in the deployment. First, obstacles such as middle-boxes (firewalls, NATs, etc.) that exist in today's Internet infrastructure have proven to be problematic and have resulted in unforeseen availability problems. Second, the public-key delegation system of DNSSEC has not evolved as it was hoped and it currently leaves over 97% of DNSSEC zones isolated and …",93
Authenticated name resolution,"Danny Mcpherson, Joseph Waldron, Eric Osterweil",2019/4/23,Patent office US,"A method, system, and computer-readable memory containing instructions include receiving a DNS request containing authentication information, validating the authentication information, determining an appropriate action to take based on the validating status, and taking the appropriate action. Actions may include responding with an individualized network layer address or service location address, delaying sending a response message, sending a network layer address or service location address corresponding to a site containing authentication information, and sending a response with a network layer address or service location address with a web address configured to mimic the website related to the requested resource.",84
Adaptive name resolution,"Danny Mcpherson, Joseph Waldron, Eric Osterweil",2015/3/24,Patent office US,"A method, system, and computer-readable memory containing instructions include receiving a DNS request containing information related to user-specific information, device-specific information, and/or authentication information, analyzing the information, determining an appropriate action to take based on analyzing the status, and taking the appropriate action. Actions may include responding with an individualized network layer address or service location address, delaying sending a response message, sending a network layer address or service location address corresponding to a site containing authentication information, and sending a response with a network layer address or service location address with a web address configured to mimic the website related to the requested resource.",79
Deploying cryptography in Internet-scale systems: A case study on DNSSEC,"Hao Yang, Eric Osterweil, Dan Massey, Songwu Lu, Lixia Zhang",2010/4/8,Journal IEEE Transactions on Dependable and Secure Computing,"The DNS Security Extensions (DNSSEC) are among the first attempts to deploy cryptographic protections in an Internet-scale operational system. DNSSEC applies well-established public key cryptography to ensure data integrity and origin authenticity in the DNS system. While the cryptographic design of DNSSEC is sound and seemingly simple, its development has taken the IETF over a decade and several protocol revisions, and even today its deployment is still in the early stage of rolling out. In this paper, we provide the first systematic examination of the design, deployment, and operational challenges encountered by DNSSEC over the years. Our study reveals a fundamental gap between cryptographic designs and operational Internet systems. To be deployed in the global Internet, a cryptographic protocol must possess several critical properties including scalability, flexibility, incremental deployability, and …",76
Dissecting ghost clicks: Ad fraud via misdirected human clicks,"Sumayah A Alrwais, Alexandre Gerber, Christopher W Dunn, Oliver Spatscheck, Minaxi Gupta, Eric Osterweil",2012/12/3,Book Proceedings of the 28th Annual Computer Security Applications Conference,"FBI's Operation Ghost Click, the largest cybercriminal takedown in history, recently took down an ad fraud infrastructure that affected 4 million users and made its owners 14 million USD over a period of four years. The attackers hijacked clicks and ad impressions on victim machines infected by a DNS changer malware to earn ad revenue fraudulently. We experimented with the attack infrastructure when it was in operation and present a detailed account of the attackers' modus operandi. We also study the impact of this attack on real-world users and find that 37 subscriber lines were impacted in our data set. Also, 20 ad networks and 257 legitimate Web content publishers lost ad revenue while the attackers earned revenue convincing a dozen other ad networks that their ads were served on websites with real visitors. Our work expands the understanding of modalities of ad fraud and could help guide appropriate …",61
"Registering, managing, and communicating with IOT devices using domain name system processes","Stephen Daniel James, Daniel Schonfeld, Andrew Fregly, Eric Osterweil",2017/9/12,Patent office US,"Provided herein is a method for registering an IoT device with a DNS registry. The method can include obtaining, at a DNS server, an identifier, IP address, and a public key of an asymmetric key pair associated with the IoT device from a network gateway device that is in communication with the IoT device, wherein the asymmetric key pair is provisioned onto the IoT device and an associated private key stored within a memory of the IoT device at a time that IoT device is manufactured or during a predetermined time window after manufacturing; creating at least one DNS record for the IoT device; assigning a domain name associated with the internet protocol (“IP”) address to the IoT device; storing the identifier, IP address, the domain name, and the public key in the at least one DNS record; and providing confirmation of the registration to the IoT device.",60
Systems and methods for device detection and authorization in a IoT framework,"Ashvatth Lakshmanan, Eric Osterweil, Andrew Fregly",2017/4/25,Patent office US,"Provided herein are a method, a device, and a computer-readable medium operable to perform a method of automatically admitting a device to a network. The method can include receiving, from the one or more authorized devices in the network, first data that is associated with one or more sensing modalities, wherein the one or more sensing modalities are detected by the one or more of the one or more of the authorized devices during a defined time window; identifying a new device to be admitted to the network; constructing a time sequence of proximity events of the new device, within the defined time window, based on the first data; determining that the time sequence of the proximity events matches an expected time sequence of expected of proximity events; and admitting the new device to the network based on the determining.",60
Deploying and monitoring dns security (dnssec),"Eric Osterweil, Dan Massey, Lixia Zhang",2009/12/7,Conference 2009 Annual Computer Security Applications Conference,"SecSpider is a DNSSEC monitoring system that helps identify operational errors in the DNSSEC deployment and discover unforeseen obstacles. It collects, verifies, and publishes the DNSSEC keys for DNSSEC-enabled zones, which enables operators of both authoritative zones and recursive resolvers to deploy DNSSEC immediately, and benefit from its cryptographic protections. In this paper we present the design and implementation of SecSpider as well as several general lessons that stem from its design and implementation.",46
Architectural considerations of IP anycast,"Danny McPherson, Dave Oran, D Thaler, E Osterweil",2014/1,Issue rfc7094,,44
Extending DNSSEC trust chains to objects outside the DNS,"Burton S Kaliski Jr, Eric Osterweil, Glen Wiley",2017/7/11,Patent office US,The present invention generally relates to systems and methods for extending a chain of trust beyond the DNS. Some embodiments provide a verifier with the ability to validate a chain of trust starting with the trust anchor at the DNS root all the way to a service or object of interest outside the DNS.,40
Problem definition and classification of BGP route leaks,"Kotikalapudi Sriram, Doug Montgomery, D McPherson, Eric Osterweil, Brian Dickson",2016/6,Issue rfc7908,,34
Implementing instant messaging using named data,"Jiangzhe Wang, Chunyi Peng, Chiyu Li, Eric Osterweil, Ryuji Wakikawa, Pei-chun Cheng, Lixia Zhang",2010/11/15,Book Proceedings of the 6th Asian Internet Engineering Conference,"The Internet has been a huge success, but it is showing signs of age. Among multiple proposed directions for the Internet's future design is a promising architecture called Named Data Networking (NDN). NDN casts data as a first class element of the network's architecture in an effort to greatly facilitate new application development. However, as with any new architecture, one important deployment issues is being able to evolve existing applications. In this paper, we use a library for Instant Messaging (IM) applications called libpurple as a case study to demonstrate both the advantages of implementing IM as a serverless application in NDN and to explore promising approaches to porting applications to NDN. Our new serverless design enables IM clients to chat with each other without infrastructure support. Since libpurple is widely used as the transport layer of several IM applications (including Pidgin, Adium, and …",26
Observations from the DNSSEC Deployment,"Eric Osterweil, Dan Massey, Lixia Zhang",2007/10/16,Conference 2007 3rd IEEE Workshop on Secure Network Protocols,DNS security extensions have been developed to add cryptographic protection to the Internet name resolution service. In this paper we report the results from our monitoring effort with early DNSSEC deployment trials and the. lessons learned.,26
MitM attack by name collision: Cause analysis and vulnerability assessment in the new gTLD era,"Qi Alfred Chen, Eric Osterweil, Matthew Thomas, Z Morley Mao",2016/5/22,Conference 2016 IEEE Symposium on Security and Privacy (SP),"Recently, Man in the Middle (MitM) attacks on web browsing have become easier than they have ever been before because of a problem called ""Name Collision"" and a protocol called the Web Proxy Auto-Discovery (WPAD) protocol. This name collision attack can cause all web traffic of an Internet user to be redirected to a MitM proxy automatically right after the launching of a standard browser. The underlying problem of this attack is internal namespace WPAD query leakage, which itself is a known problem for years. However, it remains understudied since it was not easily exploitable before the recent new gTLD (generic Top-Level Domains) delegation. In this paper, we focus on this newly-exposed MitM attack vector and perform the first systematic study of the underlying problem causes and its vulnerability status in the wild. First, we show the severity of the problem by characterizing leaked WPAD query traffic to …",23
Interadministrative challenges in managing dnskeys,"Eric Osterweil, Lixia Zhang",2009/10/6,Journal IEEE Security & Privacy,"Although the visible deployment of domain name system security extensions is growing at a tremendous rate, evidence suggests that managing cryptographic keys is deceptively complex. Here, the authors outline the problem of managing DNSKEYs and present a survey comparison of existing proposed solutions.",23
Sizing estimates for a fully deployed rpki,"Eric Osterweil, Terry Manderson, Russ White, Danny McPherson",2012/12,"Journal Verisign Labs, TR","As the Resource Public Key Infrastructure (RPKI)[12] has begun its early deployment trials, estimating how large a global RPKI deployment must be to certify today’s Internet has become increasingly relevant. In this document, we present a “back-of-the-envelope” style evaluation of the number of objects required to fully deploy a global RPKI in today’s Internet, the performance characteristics of the RPKI under potential usage models (ie, the degree of “hosting” employed, cache replication strategies, etc.), and how deployments of the RPKI under these different deployment models might scale. This work is intended to be a first stab at addressing these questions, and the authors welcome feedback, corrections, comments, etc. Note this document does not try to estimate the increasing size of the RPKI system due to massive new connectivity expected as IPv6 grows. With these caveats in mind, we begin from the perspective of a thought exercise, and pose the following questions:",19
Reducing the X. 509 Attack Surface with DNSSEC’s DANE,"Eric Osterweil, Burt Kaliski, Matt Larson, Danny McPherson",2012/3,"Journal Securing and Trusting Internet Names, SATIN","For the last decade, perhaps the most commonly used type of end-user security has been the HTTP Secure (HTTPS) protocol employed by web browsers (which runs over the Secure Sockets Layer, SSL or its successor, TLS). In HTTPS, any service (such as a website) may create its own cryptographic certificate to secure its communication channel, and clients use this certificate to verify data from, and transmit data to the server. This model has helped to secure online banking transactions, eCommerce websites, social networking websites, and more. However, two inherent complications to this approach are that clients must have a secure way to learn the authentic certificate for each website before they begin using this protocol, and they must be able to determine if they can trust the named entity that the certificate belongs to. These complications are conflated in today’s security model, which is based on a list of prespecified trusted X. 509 Certificate Authorities (CAs) that every client must know a priori, and a very ad-hoc approach to determining which of this list of CAs will vouch for any keys discovered. In this paper we first outline some of the fundamental problems that exist with today’s CA model, problems that arise from its conflation of the two inherent complications, and some of the implications and attack vectors that these problems present to the security of this model’s users. Then we introduce some of the relative benefits that can be gained from a new approach being standardized in the IETF called DNS-based Authentication of Named Entities (DANE), in which certificate credentials are verified by DNSSEC-enabled zones, rather than the …",19
"Behavior of DNS’ Top Talkers, a .com/.net View","Eric Osterweil, Danny McPherson, Steve DiBenedetto, Christos Papadopoulos, Dan Massey",2012,"Conference Passive and Active Measurement: 13th International Conference, PAM 2012, Vienna, Austria, March 12-14th, 2012. Proceedings 13","This paper provides the first systematic study of DNS data taken from one of the 13 servers for the. com/. net registry. DNS’generic Top Level Domains (gTLDs) such. com and. net serve resolvers from throughout the Internet and respond to billions of DNS queries every day. This study uses gTLD data to characterize the DNS resolver population and profile DNS query types. The results show a small and relatively stable set of resolvers (ie the top-talkers) constitute 90% of the overall traffic. The results provide a basis for understanding for this critical Internet service, insights on typical resolver behaviors and the use of IPv6 in DNS, and provides a foundation for further study of DNS behavior.",19
Security Through Publicity.,"Eric Osterweil, Daniel Massey, Batsukh Tsendjav, Beichuan Zhang, Lixia Zhang",2006/7/31,Conference HotSec,"Current large-scale authentication and non-repudiation systems offer various security measures, but do not meet the needs of today’s Internet-scale applications. Though several designs exist, there have been no significant deployments of Internet-scale security infrastructures. In this paper we propose a novel concept called the public-space that makes complete information of digital entities’ actions publicly available to every user. It is a structured framework that maintains a large number of entities, their actions, relationships, and histories. Posting such information in public does not endorse the information’s correctness, but it does provide users with a quantifiable set of information that enables them to detect faults and make informed security decisions. Combined with traditional cryptographic techniques, the public-space system can support the intrinsic heterogeneity of user security requirements in Internetscale infrastructures and applications.",19
Zone state revocation for dnssec,"Eric Osterweil, Vasileios Pappas, Dan Massey, Lixia Zhang",2007/8/27,Book Proceedings of the 2007 workshop on Large scale attack defense,"DNS Security Extensions (DNSSEC) are designed to add cryptographic protection to the Internet's name resolution service. However the current design lacks a key revocation mechanism. In this paper we present Zone State Revocation (ZSR), a lightweight and backward compatible enhancement to DNSSEC. ZSR enables zones to explicitly revoke keys using self-certifying certificates, and enables DNS name-servers to opportunistically inform distributed caching resolvers of key revocations via lightweight control messages. Further, ZSR allows resolvers to distinguish between legitimate key changes and potential attacks when authentication chains are broken. ZSR is designed to work well with global-scale DNS operations, where millions of caches may need to be informed of a revocation, and where time is critical.",16
