titles,authors,date,source,descriptions,citations
From the Beginning: Key Transitions in the First 15 Years of DNSSEC,"Eric Osterweil, Pouyan Fotouhi Tehrani, Thomas C Schmidt, Matthias Wählisch",2022/8/1,Journal IEEE Transactions on Network and Service Management,"When the global rollout of the DNS Security Extensions (DNSSEC) began in 2005, a first-of-its-kind trial started: The complexity of a core Internet protocol was magnified in favor of better security for the overall Internet. Thereby, the scale of the loosely-federated delegation in DNS became an unprecedented cryptographic key management challenge. Though fundamental for current and future operational success, our community lacks a clear notion of how to empirically evaluate the process of securely transitioning keys. In this paper, we propose two building blocks to formally characterize and assess key transitions. First, the anatomy of key transitions, i.e. measurable and well-defined properties of key changes; and second, a novel classification model based on this anatomy for describing key transition practices in abstract terms. This abstraction allows for classifying operational behavior. We apply our proposed …",4
TASRS: Towards a Secure Routing System Through Internet Number Resource Certification,"Eric Osterweil, Shane Amante, Danny McPherson",2013/2/3,"Publisher Verisign Labs Technical Report, 1130009","The Border Gateway Protocol (BGP) is the Internet’s core routing protocol. Today, any BGP speaker can attest to be the origin for any IP prefix, and this results in the implicit assertion that this ASN is the rightful resource holder for that IP prefix. Unfortunately, any BGP speaker can lie about this. Such lies have allowed BGP speakers to “leak routes” and “hijack” each others prefixes. There has never been a programmatic way to securely disambiguate who the rightful resource holder actually is for any given IP prefix, or any Autonomous System Number (ASN). This leaves a very pronounced need for an Internet number resource certification framework. BGP, for example, currently propagates unverified announcements from origin ASNs to their neighbors, who selectively re-announce them to their neighbors in a form of gossip. Meanwhile, none of these parties have any way to properly assure the veracity of the announcements they are working from.",4
Improving DNS service availability by using long TTL values,"Vasileious Pappas, B Zhang, E Osterweil, D Massey, L Zhang",2006,Publisher Internet Draft,,4
Resilient domain name service (DNS) resolution when an authoritative name server is unavailable,"Shumon Huque, Burton S Kaliski Jr, Eric Osterweil, Frank Scalzo, Glen Wiley",2021/6/8,Patent office US,"In one embodiment, a resolution resiliency application performs robust domain name system (DNS) resolution. In operation, the resolution resiliency application determines that an authoritative name server that is responsible for a domain name specified in a DNS query is unavailable. In response to determining that the authoritative name server is unavailable, the resolution resiliency application performs operation (s) that modify one or more DNS records stored in a cache based on one or more resiliency policies associated with the authoritative name server. The resolution resiliency application then generates a DNS response to the DNS query based on a DNS record stored in the modified cache. Notably, unlike conventional techniques that may generate inaccurate DNS responses based on stale DNS records, the disclosed techniques increase the likelihood of providing clients with DNS responses that …",3
Ndnssec: Namespace management in ndn with dnssec,"Pouyan Fotouhi Tehrani, Luca Keidel, Eric Osterweil, Jochen H Schiller, Thomas C Schmidt, Matthias Wählisch",2019/9/24,Book Proceedings of the 6th ACM Conference on Information-Centric Networking,"In this demo, we showcase NDNSSEC. NDNSSEC provides a namespace management solution for named-data networking (NDN) based on the DNS ecosystem and its security extensions. Our prototype allows content consumers to verify the name ownership in commonly used NDN software.",3
"Security of Alerting Authorities in the WWW: Measuring Namespaces, DNSSEC, and Web PKI","Pouyan Fotouhi Tehrani, Eric Osterweil, Jochen H Schiller, Thomas C Schmidt, Matthias Wählisch",2021/4/19,Book Proceedings of the Web Conference 2021," During disasters, crisis, and emergencies the public relies on online services provided by official authorities to receive timely alerts, trustworthy information, and access to relief programs. It is therefore crucial for the authorities to reduce risks when accessing their online services. This includes catering to secure identification of service, secure resolution of name to network service, and content security and privacy as a minimum base for trustworthy communication. ",2
Authenticated name resolution,"Danny Mcpherson, Joseph Waldron, Eric Osterweil",2019/4/23,Patent office US,"A method, system, and computer-readable memory containing instructions include receiving a DNS request containing authentication information, validating the authentication information, determining an appropriate action to take based on the validating status, and taking the appropriate action. Actions may include responding with an individualized network layer address or service location address, delaying sending a response message, sending a network layer address or service location address corresponding to a site containing authentication information, and sending a response with a network layer address or service location address with a web address configured to mimic the website related to the requested resource.",84
"Systems, devices, and methods for detecting and mitigating domain name registrations used for malicious behavior","Tomofumi Okubo, Eric Osterweil, Matthew Thomas",2020/7/28,Patent office US,A method for detecting a domain name that is associated with malicious behavior includes receiving domain data for a plurality of domain names including a first domain name and a plurality of similar domain names. The domain data includes a first attribute and a second attribute of the first domain name and the similar domain names. The first attribute of the first domain name is compared to the first attributes of the similar domain names to produce a first value. The second attribute of the first domain name is compared to the second attributes of the similar domain names to produce a second value. The first value and the second value are combined to produce a combined value. A likelihood that the first domain name is associated with malicious behavior is determined based on the combined value.,2
Resilient domain name service (DNS) resolution when an authoritative name server is unavailable,"Shumon Huque, Burton S Kaliski Jr, Eric Osterweil, Frank Scalzo, Glen Wiley",2021/6/8,Patent office US,"In one embodiment, a resolution resiliency application performs robust domain name system (DNS) resolution. In operation, the resolution resiliency application determines that an authoritative name server that is responsible for a domain name specified in a DNS query is unavailable. In response to determining that the authoritative name server is unavailable, the resolution resiliency application performs operation (s) that modify one or more DNS records stored in a cache based on one or more resiliency policies associated with the authoritative name server. The resolution resiliency application then generates a DNS response to the DNS query based on a DNS record stored in the modified cache. Notably, unlike conventional techniques that may generate inaccurate DNS responses based on stale DNS records, the disclosed techniques increase the likelihood of providing clients with DNS responses that …",3
"Who ya gonna call?(Alerting Authorities): Measuring Namespaces, Web Certificates, and DNSSEC","Pouyan Fotouhi Tehrani, Eric Osterweil, Jochen H Schiller, Thomas C Schmidt, Matthias Wählisch",2020,Journal arXiv preprint arXiv:2008.10497,"During disasters, crisis, and emergencies the public relies on online services provided by authorities to receive timely alerts, trustworthy information, and access to relief programs. It is therefore crucial for the authorities to reduce risks when accessing their Web services. This includes proper naming (eg, against phishing attacks), name protection (eg, against forged DNS data), adequate identification (eg, against spoofing and impersonation), and transport security (eg, against traffic manipulation).",2
New gTLD Security and Stability Considerations,"Eric Osterweil, Danny McPherson",2013,Journal Technical Report 1130007 version 1,"The introduction of multitudes of new generic Top Level Domains (gTLDs) into the DNS (the Internet’s de facto name mapping system) will have far-reaching effects. Any party concerned with the issues of privacy, trust, confidence, or the overall security of the DNS after the addition of new gTLDs (either from the consumer or the operator perspective) is implicitly depending on the Internet Corporation for Assigned Names and Numbers (ICANN) and the broader DNS community to appropriately address these issues before delegating any new gTLDs. The risk of a misstep during the process of introducing new gTLDs to the global DNS could have far-reaching and longlasting residual implications.",2
Measuring the placement of DNS servers in top-level-domain,"Yingdi Yu, Jiwen Cai, Eric Osterweil, Lixia Zhang",2011,Journal Submitted to IMC,"DNS is a critical infrastructure of the global Internet. To assure DNS’s efficient and robust operations, each domain, especially each of the Top-Level-Domains (TLDs), should deploy multiple redundant nameservers in diverse locations. To assess the robustness of TLD nameserver deployment regarding the nameserver redundancy and location diversity, we conduct a measurement study by sending special DNS queries and running traceroute to TLD nameservers from about 200 PlanetLab sites. By combining the measurement data with other data sources including IP address assignment, BGP routing tables, and IP address location inference, we identify the nameserver providers for all TLDs and the locations of their servers. Our results suggest that TLD nameservers are adequately distributed as of today, more than 90% TLDs can survive from single point failure. We also observe that many TLD nameservers are co-located at a small group of “hot spots”. We conduct simulations to evaluate the impact of such co-locations. Our results show that failure of single hot spot does not affect robustness of TLD services.",2
Measurable security: A new substrate for DNSSEC,Eric Osterweil,2010,"Institution University of California, Los Angeles","As the Internet plays an increasingly critical role in both our global economy and governments all over the world, it has become a central concern for everyone. This has elevated its security from just a relevant research area to one of the global linchpins of our society. Unfortunately, it is widely recognized (and often lamented) that the designs of the Internet's core protocols did not make security a top priority, and there has been an increasingly palpable sense that the Internet needs to enhance its security. Though there have been many efforts to add security protections, the Internet's environment has confounded designs or models that require strict behaviors, rigid configurations, or any form of global consensus (such as a global Certificate Authority, CA). One of the most notable attempts to secure a core protocol has been the DNS Security Extensions (DNSSEC), which is the first attempt to actually deploy a true …",2
Improving DNS Service Availability by Using Long TTLs,"V Pappas, B Zhang, E Osterweil, D Massey, L Zhang",2006/6,Journal draft-pappas-dnsop-long-ttl-02,,2
Externally applying internal network domain name system (DNS) policies,"Michael Kaczmarek, Eric Osterweil",2021/9/14,Patent office US,"In one embodiment, a global domain name system (DNS) server processes a DNS query based on an internal network policy. Upon receiving a DNS query that is associated with a source IP address, the global DNS server identifies a client subnet based on the DNS query. The client subnet is associated with an internal device on an internal network. The global DNS server selects an internal network policy from multiple predetermined policies based on the source IP address and the client subnet. The global DNS server then tailors one or more DNS resolution operations that generate a response to the DNS query based on the selected internal network policy. Advantageously, the client subnet provides the global DNS server with visibility into the internal network. Such visibility enables the global DNS server to apply policies selectively at the granularity of individual devices on the internal network.",1
Strengthening integrity assurances for DNS data,"Burton S Kaliski Jr, Eric Osterweil",2018/10/23,Patent office US,"One or more DNS services are provided that are configured to not only tolerate some commonly observed DNSSEC misconfigurations (while still providing DNSSEC's security guarantees), but also provide a more intelligent DNS resolution process informed by DNSSEC.",9
Authenticated name resolution,"Danny Mcpherson, Joseph Waldron, Eric Osterweil",2019/4/23,Patent office US,"A method, system, and computer-readable memory containing instructions include receiving a DNS request containing authentication information, validating the authentication information, determining an appropriate action to take based on the validating status, and taking the appropriate action. Actions may include responding with an individualized network layer address or service location address, delaying sending a response message, sending a network layer address or service location address corresponding to a site containing authentication information, and sending a response with a network layer address or service location address with a web address configured to mimic the website related to the requested resource.",84
A Cooperative Market-based Decision Guidance Approach for Resilient Power Systems.,"Alexander Brodsky, Eric Osterweil, Roberto Levy",2021,Conference ICORES,"National and local economies are strongly dependent on stable power systems. While the problem of power system resilience in the face of natural disasters and terrorist attacks has been extensively studied from the systems engineering perspective, a major unsolved problem remains in the need for preventive solutions against the collapse of power systems. These solutions must ensure the most economically efficient operation of power systems, within the bounds of any remaining power capacity. Transferring power usage rights from the lowest-loss to the highest-loss entities would result in significant reduction of the combined loss. The existing power systems do not take this fact into account. To address this need, we envision a paradigm shift toward three-step system for (1) a cooperation power market where power usage rights can be transferred among participating entities,(2) decision guidance to recommend market asks and bids to each entity, and (3) optimization that, given the market clearance, will recommend precise operational controls for each entity’s microgrid. The key challenge to address is the design of this three-step market system that will guarantee important properties including Pareto-optimality, individual rationality, and fairness, as well as privacy, security, pseudo-anonymity and non-repudiation.",1
Techniques for indicating a degraded state of an authoritative name server,"Burton S Kaliski Jr, Eric Osterweil, Duane Wessels, Frank Scalzo, Glen Wiley, Shumon Huque",2018/12/27,Patent office US,"In one embodiment, a zone resiliency application indicates that an authoritative name server is in a degraded state. In operation, the zone resiliency application determines that the authoritative name server is in a degraded state. The zone resiliency application then generates a status record that indicates the degraded state. Subsequently, the zone resiliency application associates the status record with a domain name service (DNS) response to a DNS query. The zone resiliency application then transmits the DNS response and the associated status record to a requester.",1
A Quantitative Comparison Between X. 509 CA Verification and DANE Via Attack,"Eric Osterweil, Danny McPherson, Lixia Zhang",2012,"Description Almost every Internet user relies on security protections to guard our online lives. In particular, when in need of secure communications over the Internet, a protocol called Transport Layer Security (TLS), is commonly used. TLS uses cryptographic certificates to bootstrap secure communications between web browsers and web servers, as well as to secure email, Internet news, and other Internet communications, and it is arguably the most widely used Internet-scale cryptographic protocol in use today. In this paper, we examine the way TLS performs its certificate verification, and compare it to the wouldbe successor, DNS-based Authentication of Named Entities (DANE). In this work, we do this by using a concept called an attack surface, and we propose a novel new methodology for actually quantifying what the attack surface is for each verification scheme, and then we measure the Alexa top 1,000 websites to empirically quantify the relative attack surfaces of actual web sites. In searching for a way to compare the protections of these two verification schemes, our candidate methodology illustrates that the attack surface can be shrunk by as much as three orders of magnitude by moving from today’s CA verification scheme to DANE.","Almost every Internet user relies on security protections to guard our online lives. In particular, when in need of secure communications over the Internet, a protocol called Transport Layer Security (TLS), is commonly used. TLS uses cryptographic certificates to bootstrap secure communications between web browsers and web servers, as well as to secure email, Internet news, and other Internet communications, and it is arguably the most widely used Internet-scale cryptographic protocol in use today. In this paper, we examine the way TLS performs its certificate verification, and compare it to the wouldbe successor, DNS-based Authentication of Named Entities (DANE). In this work, we do this by using a concept called an attack surface, and we propose a novel new methodology for actually quantifying what the attack surface is for each verification scheme, and then we measure the Alexa top 1,000 websites to empirically quantify the relative attack surfaces of actual web sites. In searching for a way to compare the protections of these two verification schemes, our candidate methodology illustrates that the attack surface can be shrunk by as much as three orders of magnitude by moving from today’s CA verification scheme to DANE.",1
Public data: a new substrate for key verification in DNSSEC,"Eric Osterweil, Dan Massey, Beichuan Zhang, Lixia Zhang",2010/9/7,Volume 100020,"Motivated at least partly by operational problems associated with deploying global-scale PKIs, a growing number of alternative approaches propose to verify cryptographic keys by cross checking their consistency from topologically distinct locations and over time. These systems are experiencing growing operational use, but there has been no rigorous analysis to show the advantages and limitations. This paper provides a formal model of a consistency checking key learning and verification approach based on the concept of Public Data. Public Data offers a probabilistic description of users’ risks based on the structure of their own deployments. A user of this framework can provision her own Community of Trust in such a way that she can reduce and accurately estimate the probability of being spoofed by an adversary. The results are applied specifically to the DNS Security (DNSSEC) problem and show that after reasonable provisioning, a user can force an adversary to pay an unrealistic cost to launch a successful attack.",1
Availability Problems in the DNSSEC Deployment,"Eric Osterweil, Dan Massey, Lixia Zhang",2009/5,Volume 58,,1
The magazine archive includes every article published in Communications of the ACM for over the past 50 years.,"Robert Szewczyk, Eric Osterweil, Joseph Polastre, Michael Hamilton, Alan Mainwaring, Deborah Estrin",2004/6,Journal Communications of the ACM,"Historically, the study of microclimate and habitat utilization have been largely observational, with climatic and behavioral variables being extrapolated from a few or even individual measurement sites. Today, densely deployed sensor networks are being scaled to the size of the organisms under study, sampling phenomena at frequencies the organisms encounter, and dispersed in patterns that capture the full range of environmental exposures to provide the fine-grain information needed for accurate modeling and prediction.",1
EmTOS: A development tool for heterogeneous sensor networks,"Lewis Girod, Thanos Stathopoulos, Nithya Ramanathan, Eric Osterweil, Tom Schoellhammer, R Kapur, Deborah Estrin",2004,"Description Posters Page 1 UCLA Posters Title EmTOS: A Development Tool for Heterogeneous Sensor 
Networks Permalink https://escholarship.org/uc/item/2wx27188 Authors Lewis Girod Thanos 
Stathopoulos Nithya Ramanathan et al. Publication Date 2004 eScholarship.org Powered by the 
California Digital Library University of California Page 2 ÐÏà¡±á > þÿ m µ þÿÿÿ bcdefghi jkl þ { ú H ý 
ÿÿÿÿÿÿÿÿÿÿÿÿÿÿÿÿÿÿÿÿÿÿÿÿÿÿÿÿÿÿÿÿÿÿÿÿÿÿÿÿÿ 
ÿÿÿÿÿÿÿÿÿÿÿÿÿÿÿÿÿÿÿÿÿÿÿÿÿÿÿÿÿÿÿÿÿÿÿÿÿÿÿÿÿÿÿÿÿÿÿÿÿÿÿÿÿÿÿÿÿÿÿÿÿÿÿÿÿÿÿÿÿÿÿÿÿÿÿÿÿÿÿÿ 
ÿÿÿÿÿÿÿÿÿÿÿÿÿÿÿÿÿÿÿÿÿÿÿÿÿÿÿÿÿÿÿÿÿÿÿÿÿÿÿÿÿÿÿÿÿÿÿÿÿÿÿÿÿÿÿÿÿÿÿÿÿÿÿÿÿÿÿÿÿÿÿÿÿÿÿÿÿÿÿÿ 
ÿÿÿÿÿÿÿÿÿÿÿÿÿÿÿÿÿÿÿÿÿÿÿÿÿÿÿÿÿÿÿÿÿÿÿÿÿÿÿÿÿÿÿÿÿÿÿÿÿÿÿÿÿÿÿÿÿÿÿÿÿÿÿÿÿÿÿÿÿÿÿÿÿÿÿÿÿÿÿÿ 
ÿÿÿÿÿÿÿÿÿÿÿÿÿÿÿÿÿÿÿÿÿÿÿÿÿÿÿÿÿÿÿÿÿÿÿÿÿÿÿÿÿÿÿÿÿÿÿÿÿÿÿÿÿÿÿÿÿÿÿÿÿÿÿÿÿÿÿÿÿÿÿÿÿÿÿÿÿÿÿÿ 
ÿÿÿÿÿÿÿn-ð~ 7ò$)Ç`g®Knì ~’„ÿ‰PNG IHDR È … -ž·, sBIT |dˆ pHYs ÒÝ~ü tEXtCreation …",,1
IPsec’s Appeal: Protecting DNS Under the Covers,"Eric Osterweil, Danny McPherson",1130006,Publisher Verisign Labs Technical Report,"IPsec is a network-layer protection suite that has met with limited deployment success. While there are clearly some applications for which it is well suited (such as Virtual Private Networks, VPNs), there is often debate over the idea of a wider role for it. Indeed, when applications and higher level protocols are secured by semantics above the network layer, such as by SSL/TLS, DNSSEC, etc. the network layer’s protections are often left unaddressed. We propose that security assurances should be embraced by as many layers as possible, and that securing semantics above the network layer should not obviate one from securing the network layer itself. Specifically, we propose that there are very tangible benefits to be gained by augmenting DNSSEC’s protections with IPsec. In this work we will outline the specific ways in which IPsec can be used to augment DNSSEC and how their protections are complimentary.",1
