titles,authors,date,source,descriptions,citations
American Sign Language Recognition Using an FMCW Wireless Sensor (Student Abstract),"Yuanqi Du, Nguyen Dang, Riley Wilkerson, Parth Pathak, Huzefa Rangwala, Jana Kosecka",2020/4/3,Journal Proceedings of the AAAI Conference on Artificial Intelligence,"In today's digital world, rapid technological advancements continue to lessen the burden of tasks for individuals. Among these tasks is communication across perceived language barriers. Indeed, increased attention has been drawn to American Sign Language (ASL) recognition in recent years. Camera-based and motion detection-based methods have been researched extensively; however, there remains a divide in communication between ASL users and non-users. Therefore, this research team proposes the use of a novel wireless sensor (Frequency-Modulated Continuous-Wave Radar) to help bridge the gap in communication. In short, this device sends out signals that detect the user's body positioning in space. These signals then reflect off the body and back to the sensor, developing thousands of cloud points per second, indicating where the body is positioned in space. These cloud points can then be examined for movement over multiple consecutive time frames using a cell division algorithm, ultimately showing how the body moves through space as it completes a single gesture or sentence. At the end of the project, 95% accuracy was achieved in one-object prediction as well as 80% accuracy on cross-object prediction with 30% other objects' data introduced on 19 commonly used gestures. There are 30 samples for each gesture per person from three persons.",
IEEE Robotics and Automation Society Congratulates Recently Elevated Senior Members,"Taif Al Obaidi, Mohammad Al-Shabi, Sven Behnke, Saroj Biswas, Aymeric Bonnaud, Mike Borowczak, Pinar Boyraz, Adrijan Bozinovski, Ramachandra Budihal, Sindhu Preetham Burugupally, Daniel Casner, Wenceslao Cebuhar, Fernando De la Rosa, Christian Debrunner, Kristen Dorsey, Gyorgy Eigner, Fausto Ferreira, Gabriele Ferri, Daniele Fontanelli, Matthew Garratt, Selvakumar Gopalasamy, Jonathan Hurst, Loay Ismail, Endra Joelianto, Aaron Johnson, Michael Kaess, Sungchul Kang, Jana Kosecka, Swagat Kumar, Rafiq Lakhani, Xuguang Lan, Dimitri Lefebvre, Chaomin Luo, Samer Mohammed, Meeko Mitsuko Oishi",2019/12,Journal IEEE Robotics & Automation Magazine,,
Target Driven Instance Detection,"Jana Košecká, Alexander C Berg",2018/7/17,"Description While state-of-the-art general object detectors are getting better and better, there are not many systems specifically designed to take advantage of the instance detection problem. For many applications, such as household robotics, a system may need to recognize a few very specific instances at a time. Speed can be critical in these applications, as can the need to recognize previously unseen instances. We introduce a Target Driven Instance Detector (TDID), which modifies existing general object detectors for the instance recognition setting. TDID not only improves performance on instances seen during training, with a fast runtime, but is also able to generalize to detect novel instances.","While state-of-the-art general object detectors are getting better and better, there are not many systems specifically designed to take advantage of the instance detection problem. For many applications, such as household robotics, a system may need to recognize a few very specific instances at a time. Speed can be critical in these applications, as can the need to recognize previously unseen instances. We introduce a Target Driven Instance Detector (TDID), which modifies existing general object detectors for the instance recognition setting. TDID not only improves performance on instances seen during training, with a fast runtime, but is also able to generalize to detect novel instances.",
Self-supervisory Signals for Robotic Object Discovery and Detection,"Etienne Pot, Alexander Toshev, Jana Kosecka",2018,"Description In robotic application we often face the challenge of detecting instances of objects for which we have neither trained models or very little labeled data. In this paper we propose to use self-supervisory signals, generated without human supervision by a robot exploring an environment, to learn a representation of the novel object instances present in this environment. We demonstrate the utility of this representation in two ways. First, we can automatically discover objects by performing clustering in this space. Each resulting cluster contains examples of one instance seen from various viewpoints and scales. Second, if given a small number of labeled images, we can learn efficiently detectors for these labels. In the few-shot regime these detectors have a substantially higher mAP of XX compared to off-the-shelf standard detectors trained on this limited data. Thus, the self-supervision results in efficient and performant …","In robotic application we often face the challenge of detecting instances of objects for which we have neither trained models or very little labeled data. In this paper we propose to use self-supervisory signals, generated without human supervision by a robot exploring an environment, to learn a representation of the novel object instances present in this environment. We demonstrate the utility of this representation in two ways. First, we can automatically discover objects by performing clustering in this space. Each resulting cluster contains examples of one instance seen from various viewpoints and scales. Second, if given a small number of labeled images, we can learn efficiently detectors for these labels. In the few-shot regime these detectors have a substantially higher mAP of XX compared to off-the-shelf standard detectors trained on this limited data. Thus, the self-supervision results in efficient and performant …",
Message from the general and program chairs,"L Agapito, T Berg, J Kosecka, L Zelnik-Manor, T Tuytelaars, FF Li, R Bajcsy",2016,Journal Proceedings of the 29th IEEE conference on computer vision and pattern recognition-CVPR 2016,,
Confidence Estimation in Stem Cell Classification,"Zahra Rajabi, Jana Kosecka, Peter Bajcsy",2015,Journal BioImage Informatics Conference,"We study the problem of supervised classification of stem cell colonies and confidence estimation of the attained classification labels. The problem is investigated in the application context of heterogeneity labels of stem cell colonies observed by using fluorescent microscopy imaging. Given the features of colonies using numerous image statistics, we report the classification results using adaptive k-Nearest Neighbor (NN) algorithm. This algorithm minimizes typical k-NN classification bias by giving more weight to more informative features in predicting class posterior probabilities. We then estimate the confidence of each prediction for unlabeled data using transductive p-value and strangeness metrics. We show that such an introspection can gradually increase the accuracy of learned model, quantify false positives, and guide the resource-limited manual colony annotation process to provide training labels for the less confident unlabeled samples.",1
Evaluating the robustness of an ultrasound based sensing strategy for intuitive control of upper extremity prosthetics,"Nima Akhlaghi, Alex Baker, Huzefa J Rangwala, Jana Kosecka, Siddhartha Sikdar",2015/9,Journal The Journal of the Acoustical Society of America,"Current commercially available prostheses based on myoelectric control have limited functionality, leading to many amputees abandoning use. Myoelectric control using surface electrodes has a number of limitations and lacks specificity for deep muscles, presenting a continued need for more robust strategies. We propose a new strategy for sensing muscle activity based on real-time ultrasound imaging. Results from our previous work demonstrate that complex motions could be classified with 92% accuracy in real-time. However, arm and hand repositioning during natural movements tend to alter the geometry of forearm musculature, possibly affecting performance. In this study, we evaluated the robustness of the image-based control strategy in the presence of varied forearm positions on able-bodied subjects. Ultrasound images of the forearm muscles were collected during two different scenarios using a Sonix …",
Novel use of ultrasound imaging to decode activity of forearm muscles for upper extremity prosthetic control,"Nima Akhlaghi, Mohamed Lahlou, Brian J Monroe, Parag V Chitnis, Huzefa Rangwala, Jana Kosecka, Joseph J Pancrazio, Siddhartha Sikdar",2015/4,Journal The Journal of the Acoustical Society of America,"With the recent developments in the electro-mechanical design of upper extremity prosthetics, the need for more advanced control strategies for such prosthetics has increased. Current commercially available prostheses based on myoelectric control have limited functionality, which leads to many amputees abandoning use. Myoelectric control using surface electrodes has a number of limitations, such as low signal to noise ratio and lack of specificity for deep muscles. To address these limitations, and enable more intuitive dexterous control, we propose a new strategy for sensing muscle activity based on real-time ultrasound imaging. Ultrasound imaging of the forearm muscles was performed on six healthy volunteers and a transradial amputee using a Sonix RP system with a 5–14 MHz linear array transducer. Images were analyzed to map muscle activity based on the changes in the ultrasound echogenicity of the …",
"Acquiring Semantically Meaningful Models for Robotic Localization, Mapping and Target Recognition",Jana Kosecka,2014/12/21,Publisher GEORGE MASON UNIV FAIRFAX VA,"The goal of this proposal is to develop novel representations and techniques for localization, mapping and target recognition from videos of indoors and urban outdoors environments. The proposed techniques will facilitate enhanced navigation capabilities by means of visual sensing and enable scalable, long-term navigation and target detection in outdoors and indoors environments. The attained representations will also be applicable towards human-robot interaction, enhancement of human navigational and decision making capabilities and provide compact semantically meaningful summaries of the acquired sensory experience. The proposed representations will be governed by principles of compositionality, facilitate bottom-up learning, enable efficient inference and could be adapted to a task at hand. The main novelty of the approach will be the use both 3D and 2D geometric and photometric cues computed either from video sequence or from novel RBG-D cameras, which provide synchronized video and range data at frame rate. Video poses challenges related to more extreme variations in viewpoint and scale, dramatic changes in lighting and large amount of clutter and occlusions, but also enables computation of 3D structure and motion cues, which can aid segmentation and recognition of object and non-object categories. As a part of this proposal we have developed techniques for semantic labeling of outdoors and indoors environments using photometric and geometric cues from video. The proposed approach is informed by novel features and representations for learning models of objects and non-object categories from video …",
Semantic Context for Nonparametric Scene Parsing and Scene Classification (Author's Manuscript),"Gautam Singh, Jana Kosecka",2013/6/23,Publisher George Mason University Fairfax United States,"Our work focuses on different aspects of image representations as related to a variety of scene understanding tasks. We are interested in simple patch based representations as basic primitives and the role of semantic context as provided by different datasets. In our work, we have pursued a nonparametric approach for semantic parsing which uses small patches and simple gradient, color and location features. We demonstrate the value of relevance of different features channels by learning a locally adaptive distance metric and the effect of feedback in terms of semantic context, which greatly improves the performance, achieving state of the art results on different semantic parsing datasets. Here we report on an additional utility of the proposed representation for scene categorization on a subset of the scene attributes dataset introduced in.",
Detecting simple objects in RGB-D data,"Jana Kosecka, Xing Zhou",2013/1/1,Publisher GEORGE MASON UNIV FAIRFAX VA,"In this paper we present an approach for detection of simple objects in RGB-D data. Object detection in cluttered indoors environments is an important perceptual capability of robotic systems required for object search and pick and deliver tasks. For long term autonomy robots should learn how objects look like and where they appear in an weakly supervised manner. In this work we exploit the depth information to provide evidence about occlusion boundaries and scale of the objects. The depth discontinuities along with image contours computed in the vicinity of the detection window boundary form an em objectness measure, which is used to train an SVM classifier. In the testing stage we exploit the knowledge of the actual size of the object to propose the scale of the detection window significantly pruning the number window candidates to be evaluated. We evaluate our approach for detecting simple objects on NYU RGB-D dataset, illustrate the effectiveness of our approach as well as difficulties with the standard evaluation methodologies.",
Semantic parsing for priming object detection in RGB-D Scenes,"C Cadena Lerma, J Kosecka",2013,Publisher SPME,"The advancements in robot autonomy and capabilities for carrying out more complex tasks in unstructured indoors environments can be greatly enhanced by endowing existing environment models with semantic information. In this paper we describe an approach for semantic parsing of indoors environments into semantic categories of Ground, Structure, Furniture and Props. Instead of striving to categorize all object classes and instances encountered in the environment, this choice of semantic labels separates clearly objects and nonobject categories. We use RGB-D images of indoors environments and formulate the problem of semantic segmentation in the Conditional Random Fields Framework. The appearance and depth information enables us induce the graph structure of the random field, which can be effectively approximated by a tree, and to design robust geometric features, which are informative for separation and characterization of different categories. These two choices notably improve the efficiency and performance of the semantic parsing tasks. We carry out the experiments on a NYU V2 dataset and achieve superior or comparable performance and the fraction of computational cost.",
Segmentation of behavioral spaces for navigation,"Ruzena Bajcsy, Henrik I Christensen, Jana Košecká",2012/12/6,Journal Advances in Computer Vision,"From the very beginning, the forefathers of the Artificial Intelligence field (Mc-Carthy, Minsky, Newel and Simon) have emphasized the importance of the internal representation of an agent, whether artificial or biological. The issue that has been debated for the last 30 years is what the exact form of this representation is. In fact some philosophers, such as Dreyfus [5], even doubt whether this inter-nal representation can ever be formalized. In this paper we shall assume such a formalism exists and do our part to address the long-debated question of what it is or what it should be.",
Dynamic RGB-D Mapping,Michael Paton,2012/1/31,"Description Localization and mapping has been an area of great importance and interest to the robotics and computer vision community. Localization and mapping has traditionally been accomplished with range sensors such as lasers and sonars. Recent improvements in processing power coupled with advancements in image matching and motion estimation has allowed development of vision based localization techniques. Despite much progress, there are disadvantages to both range sensing and vision techniques making localization and mapping that is inexpensive and robust hard to attain. With the advent of RGB-D cameras which provide synchronized range and video data, localization and mapping is now able to exploit both range data as well as RGB features. This thesis exploits the strengths of vision and range sensing localization and mapping strategies and proposes novel algorithms using RGB-D cameras. We show how to combine existing strategies and present through evaluation of the resulting algorithms against a dataset of RGB-D benchmarks. Lastly we demonstrate the proposed algorithm on a challenging indoor dataset and demonstrate improvements where either pure range sensing or vision techniques perform poorly.","Localization and mapping has been an area of great importance and interest to the robotics and computer vision community. Localization and mapping has traditionally been accomplished with range sensors such as lasers and sonars. Recent improvements in processing power coupled with advancements in image matching and motion estimation has allowed development of vision based localization techniques. Despite much progress, there are disadvantages to both range sensing and vision techniques making localization and mapping that is inexpensive and robust hard to attain. With the advent of RGB-D cameras which provide synchronized range and video data, localization and mapping is now able to exploit both range data as well as RGB features. This thesis exploits the strengths of vision and range sensing localization and mapping strategies and proposes novel algorithms using RGB-D cameras. We show how to combine existing strategies and present through evaluation of the resulting algorithms against a dataset of RGB-D benchmarks. Lastly we demonstrate the proposed algorithm on a challenging indoor dataset and demonstrate improvements where either pure range sensing or vision techniques perform poorly.",
Special issue on Virtual Representations and Modeling of Large-scale environments (VRML),"Jan-Michael Frahm, Marc Pollefeys, Frank Dellaert, Jana Kosecka",2012/1/1,Journal Computer Vision and Image Understanding,,
Augmenting Images with Context on Mobile Devices,"Harlan Hile, Radek Grzeszczuk, Ramakrishna Vedantham, Jana Košecka, Alan Liu, Gaetano Borriello",2009,"Description Mobile phones are an attractive platform that include image capture, location sensing, increasing processing power, and network connectivity. This set of features is ideal for navigation and other location-based services. We present a system to provide additional contextual information to images displayed on these mobile devices. By utilizing reconstruction and alignment techniques, we can produce highly accurate georegistered camera poses for existing sets of images. This pose information can then be used to accurately render new details onto the images. In the area of navigation, we use this set of images to automatically generate landmark-based navigation instructions, providing additional context to the images in the form of directional arrows, surrounding map information, and building annotations. Our system also enables live registration of views acquired by a camera phone, allowing users to conceptually point at and click on a building in their environment through the window of their phone’s camera. We demonstrate a light-weight mobile client that can utilize a touch-based user interface for easy access to all of the functionality supported by our context-rich navigation system.This work makes the following contributions to the area of augmenting images with contextual information:• We present an approach to automatically compute camera poses from unstructured datasets and to correct poor GPS readings by leveraging on algorithms for robust image-based matching and 3D structure and motion computation. Our system automatically reconstructs camera pose by using the Photo Tourism system [2]. We extend this reconstruction by …","Mobile phones are an attractive platform that include image capture, location sensing, increasing processing power, and network connectivity. This set of features is ideal for navigation and other location-based services. We present a system to provide additional contextual information to images displayed on these mobile devices. By utilizing reconstruction and alignment techniques, we can produce highly accurate georegistered camera poses for existing sets of images. This pose information can then be used to accurately render new details onto the images. In the area of navigation, we use this set of images to automatically generate landmark-based navigation instructions, providing additional context to the images in the form of directional arrows, surrounding map information, and building annotations. Our system also enables live registration of views acquired by a camera phone, allowing users to conceptually point at and click on a building in their environment through the window of their phone’s camera. We demonstrate a light-weight mobile client that can utilize a touch-based user interface for easy access to all of the functionality supported by our context-rich navigation system.",
From sensors to human spatial concepts,"Zoran Zivkovic, Jana Kosecka",2008/6/1,Journal Robotics and Autonomous Systems,,
estimation problems,"Wei Zhang, Jana Košecká",2007,Journal Robotics: Science and Systems II,"Common goal of many computer vision and robotics only 50% of outliers. Although it is desirable to design estima-algorithms is to extract geometric information from the sensory tors with a solid theoretical footing and provable breakdown data. Due to noisy measurements and errors in matching or points, they often have a small bearing on practical problems, segmentation, the available data are often corrupted with outliers.",
Motion Segmentation and Estimation-Nonparametric Estimation of Multiple Structures with Outliers (WDV 2006),"Wei Zhang, Jana Kosecka",2007,Journal Lecture Notes in Computer Science,,
IEEE Executive Staff,"KAZUO TANIE, TJ TARN, ANTHONY A MACIEJEWSKI, SUKHAN LEE, MAKOTO KANEKO, ALESSANDRO DE LUCA, PETER B LUH, RICHARD A VOLZ, RUSSELL H TAYLOR, GEORGE A BEKEY, HIROHIKO ARAI, SETH A HUTCHINSON, FRANK C PARK, IAND WALKER, JORGE ANGELES, FRANCOIS CHAUMETTE, WAN KYUN CHUNG, PIERRE E DUPONT, DIETER FOX, QIANG HUANG, JANA KOSECKA, KEVIN LYNCH, SHUGEN MA, JEAN-PIERRE MERLET, BRADLEY J NELSON, GIUSEPPE ORIOLO, EVANGELOS PAPADOPOULOS, LYNNE PARKER, RAJNI PATEL, DOMENICO PRATTICHIZZO, RODNEY ROBERTS, PAOLO ROCCO, JOSEPH M SCHIMMELS, GAURAV SUKHATME, DONG SUN, JOCELYNE TROCCAZ",2005,"Description IEEE Transactions on Robotics publication information Page 1 IEEE TRANSACTIONS ON 
ROBOTICS IEEE TRANSACTIONS ON ROBOTICS is published by the IEEE Robotics and 
Automation Society. All members of the IEEE are eligible for membership in the Society and 
will receive this TRANSACTIONS upon payment of the annual Society membership fee of 
$25.00 plus an annual subscription fee of $19.00. For information on joining, write to the lEEE 
Service Center at the address below. Member copies of Transactions/Journals are for 
personal use only. IEEE ROBOTICS AND AUTOMATION SOCIETY URL: http://www.ncsu.edu/IEEE-RAS/ 
(Continued on inside back cover) President KAZUO TANIE Natl. Inst. Advanced Industrial Sci. 
and Technol. Ibaraki 305-8568, Japan tanie.k@aist.go.jp Vice President, Conference Activities 
TJ TARN Systems Sci. & Math. Dept. Washington Univ. St. Louis, MO 63130 USA tarn@…",,
Errata of An Invitation to 3-D Vision,"Yi Ma, Stefano Soatto, Jana Košecká, Shankar Sastry",2004/10/7,"Description Typos are listed below in the order in which they appear in the book. If you find additional typos in the book, please report to “yima@ uiuc. edu,” and your help will be greatly appreciated. We hope that these typos will be corrected in the paper edition.","Typos are listed below in the order in which they appear in the book. If you find additional typos in the book, please report to “yima@ uiuc. edu,” and your help will be greatly appreciated. We hope that these typos will be corrected in the paper edition.",
Image Primitives and Correspondence,"Yi Ma, Stefano Soatto, Jana Košecká, S Shankar Sastry, Yi Ma, Stefano Soatto, Jana Košecká, S Shankar Sastry",2004,Journal An Invitation to 3-D Vision: From Images to Geometric Models,"In previous chapters we have seen how geometric primitives, such as points and lines in space, can be transformed so that one can compute the coordinates of their “image,” i.e. their projection onto the image plane. In practice, however, images are arrays of positive numbers that measure the amount of light incident on a sensor at a particular location (see Sections 3.1 and 3.2, and Appendix 3.A). So, how do we reconcile a geometric image formation model (Section 3.3) with the fact that what we measure with a camera is not points and lines, but light intensity? In other words, how do we go from measurements of light (photometry) to geometry? This is the subject of this chapter: we will show how geometric primitives can be extracted from photometric measurements and matched across different views, so that the rest of the book can concentrate on geometry.",
