titles,authors,date,source,descriptions,citations
An invitation to 3-d vision: from images to geometric models,"Yi Ma, Stefano Soatto, Jana Košecká, Shankar Sastry",2004/11,Volume 26,"This book is intended to give students at the advanced undergraduate or introduc tory graduate level, and researchers in computer vision, robotics and computer graphics, a self-contained introduction to the geometry of three-dimensional (3-D) vision. This is the study of the reconstruction of 3-D models of objects from a collection of 2-D images. An essential prerequisite for this book is a course in linear algebra at the advanced undergraduate level. Background knowledge in rigid-body motion, estimation and optimization will certainly improve the reader's appreciation of the material but is not critical since the first few chapters and the appendices provide a review and summary of basic notions and results on these topics. Our motivation Research monographs and books on geometric approaches to computer vision have been published recently in two batches: The first was in the mid 1990s with books on the …",2616
3d bounding box estimation using deep learning and geometry,"Arsalan Mousavian, Dragomir Anguelov, John Flynn, Jana Kosecka",2017,Conference Proceedings of the IEEE conference on Computer Vision and Pattern Recognition,"We present a method for 3D object detection and pose estimation from a single image. In contrast to current techniques that only regress the 3D orientation of an object, our method first regresses relatively stable 3D object properties using a deep convolutional neural network and then combines these estimates with geometric constraints provided by a 2D object bounding box to produce a complete 3D bounding box. The first network output estimates the 3D object orientation using a novel hybrid discrete-continuous loss, which significantly outperforms the L2 loss. The second output regresses the 3D object dimensions, which have relatively little variance compared to alternatives and can often be predicted for many object types. These estimates, combined with the geometric constraints on translation imposed by the 2D bounding box, enable us to recover a stable and accurate 3D object pose. We evaluate our method on the challenging KITTI object detection benchmark [??] both on the official metric of 3D orientation estimation and also on the accuracy of the obtained 3D bounding boxes. Although conceptually simple, our method outperforms more complex and computationally expensive approaches that leverage semantic segmentation, instance level segmentation and flat ground priors [??] and sub-category detection [??][??]. Our discrete-continuous loss also produces state of the art results for 3D viewpoint estimation on the Pascal 3D+ dataset [??].",915
Image based localization in urban environments,"Wei Zhang, Jana Kosecka",2006/6/14,"Conference Third international symposium on 3D data processing, visualization, and transmission (3DPVT'06)","In this paper we present a prototype system for image based localization in urban environments. Given a database of views of city street scenes tagged by GPS locations, the system computes the GPS location of a novel query view. We first use a wide-baseline matching technique based on SIFT features to select the closest views in the database. Often due to a large change of viewpoint and presence of repetitive structures, a large percentage of matches (> 50%) are not correct correspondences. The subsequent motion estimation between the query view and the reference view, is then handled by a novel and efficient robust estimation technique capable of dealing with large percentage of outliers. This stage is also accompanied by a model selection step among the fundamental matrix and the homography. Once the motion between the closest reference views is estimated, the location of the query view is then …",483
On evaluation of embodied navigation agents,"Peter Anderson, Angel Chang, Devendra Singh Chaplot, Alexey Dosovitskiy, Saurabh Gupta, Vladlen Koltun, Jana Kosecka, Jitendra Malik, Roozbeh Mottaghi, Manolis Savva, Amir R Zamir",2018/7/18,Journal arXiv preprint arXiv:1807.06757,"Skillful mobile operation in three-dimensional environments is a primary topic of study in Artificial Intelligence. The past two years have seen a surge of creative work on navigation. This creative output has produced a plethora of sometimes incompatible task definitions and evaluation protocols. To coordinate ongoing and future research in this area, we have convened a working group to study empirical methodology in navigation research. The present document summarizes the consensus recommendations of this working group. We discuss different problem statements and the role of generalization, present evaluation measures, and provide standard scenarios that can be used for benchmarking.",465
Video compass,"Jana Košecká, Wei Zhang",2002,"Conference Computer Vision—ECCV 2002: 7th European Conference on Computer Vision Copenhagen, Denmark, May 28–31, 2002 Proceedings, Part IV 7","In this paper we describe a flexible approach for determining the relative orientation of the camera with respect to the scene. The main premise of the approach is the fact that in man-made environments, the majority of lines is aligned with the principal orthogonal directions of the world coordinate frame. We exploit this observation towards efficient detection and estimation of vanishing points, which provide strong constraints on camera parameters and relative orientation of the camera with respect to the scene.",457
Vision guided navigation for a nonholonomic mobile robot,"Yi Ma, Jana Kosecka, S Shankar Sastry",1999/6,Journal IEEE Transactions on robotics and automation,"Theoretical and analytical aspects of the visual servoing problem have not received much attention. Furthermore, the problem of estimation from the vision measurements has been considered separately from the design of the control strategies. Instead of addressing the pose estimation and control problems separately, we attempt to characterize the types of control tasks which can be achieved using only quantities directly measurable in the image, bypassing the pose estimation phase. We consider the task of navigation for a nonholonomic ground mobile base tracking an arbitrarily shaped continuous ground curve. This tracking problem is formulated as one of controlling the shape of the curve in the image plane. We study the controllability of the system characterizing the dynamics of the image curve, and show that the shape of the image curve is controllable only up to its ""linear"" curvature parameters. We …",316
A comparative study of vision-based lateral control strategies for autonomous highway driving,"Camillo J Taylor, Jana Košecká, Robert Blasi, Jitendra Malik",1999/5,Journal The International Journal of Robotics Research,"With the increasing speeds of modern microprocessors, it has become ever more common                 for computer-vision algorithms to find application in real-time control tasks. In                 this paper, we present an analysis of the problem of steering an autonomous vehicle                 along a highway based on the images obtained from a CCD camera mounted in the                 vehicle. We explore the effects of changing various important system parameters like                 the vehicle velocity, the look-ahead range of the vision sensor, and the processing                 delay associated with the perception and control systems.",232
Piecewise planar city 3D modeling from street view panoramic sequences,"Branislav Micusik, Jana Kosecka",2009/6/20,Conference 2009 IEEE Conference on Computer Vision and Pattern Recognition,"City environments often lack textured areas, contain repetitive structures, strong lighting changes and therefore are very difficult for standard 3D modeling pipelines. We present a novel unified framework for creating 3D city models which overcomes these difficulties by exploiting image segmentation cues as well as presence of dominant scene orientations and piecewise planar structures. Given panoramic street view sequences, we first demonstrate how to robustly estimate camera poses without a need for bundle adjustment and propose a multi-view stereo method which operates directly on panoramas, while enforcing the piecewise planarity constraints in the sweeping stage. At last, we propose a new depth fusion method which exploits the constraints of urban environments and combines advantages of volumetric and viewpoint based fusion methods. Our technique avoids expensive voxelization of space …",204
Synthesizing training data for object detection in indoor scenes,"Georgios Georgakis, Arsalan Mousavian, Alexander C Berg, Jana Kosecka",2017/2/25,Journal arXiv preprint arXiv:1702.07836,"Detection of objects in cluttered indoor environments is one of the key enabling functionalities for service robots. The best performing object detection approaches in computer vision exploit deep Convolutional Neural Networks (CNN) to simultaneously detect and categorize the objects of interest in cluttered scenes. Training of such models typically requires large amounts of annotated training data which is time consuming and costly to obtain. In this work we explore the ability of using synthetically generated composite images for training state-of-the-art object detectors, especially for object instance detection. We superimpose 2D images of textured object models into images of real environments at variety of locations and scales. Our experiments evaluate different superimposition strategies ranging from purely image-based blending all the way to depth and semantics informed positioning of the object models into real scenes. We demonstrate the effectiveness of these object detector training strategies on two publicly available datasets, the GMU-Kitchens and the Washington RGB-D Scenes v2. As one observation, augmenting some hand-labeled training data with synthetic examples carefully composed onto scenes yields object detectors with comparable performance to using much more hand-labeled data. Broadly, this work charts new opportunities for training detectors for new objects by exploiting existing object model repositories in either a purely automatic fashion or with only a very small number of human-annotated examples.",199
Multi-view image and tof sensor fusion for dense 3d reconstruction,"Young Min Kim, Christian Theobalt, James Diebel, Jana Kosecka, Branislav Miscusik, Sebastian Thrun",2009/9/27,"Conference 2009 IEEE 12th international conference on computer vision workshops, ICCV workshops","Multi-view stereo methods frequently fail to properly reconstruct 3D scene geometry if visible texture is sparse or the scene exhibits difficult self-occlusions. Time-of-Flight (ToF) depth sensors can provide 3D information regardless of texture but with only limited resolution and accuracy. To find an optimal reconstruction, we propose an integrated multi-view sensor fusion approach that combines information from multiple color cameras and multiple ToF depth sensors. First, multi-view ToF sensor measurements are combined to obtain a coarse but complete model. Then, the initial model is refined by means of a probabilistic multi-view fusion framework, optimizing over an energy function that aggregates ToF depth sensor information with multi-view stereo and silhouette constraints. We obtain high quality dense and detailed 3D models of scenes challenging for stereo alone, while simultaneously reducing complex …",192
Optimization criteria and geometric algorithms for motion and structure estimation,"Yi Ma, Jana Košecká, Shankar Sastry",2001/9,Journal International Journal of Computer Vision,"Prevailing efforts to study the standard formulation of motion and structure recovery have recently been focused on issues of sensitivity and robustness of existing techniques. While many cogent observations have been made and verified experimentally, many statements do not hold in general settings and make a comparison of existing techniques difficult. With an ultimate goal of clarifying these issues, we study the main aspects of motion and structure recovery: the choice of objective function, optimization techniques and sensitivity and robustness issues in the presence of noise.",179
Generation of conflict resolution manoeuvres for air traffic management,"Jana Kosecka, Claire Tomlin, George Pappas, Shankar Sastry",1997/9/11,Conference Proceedings of the 1997 IEEE/RSJ International Conference on Intelligent Robot and Systems. Innovative Robotics for Real-World Applications. IROS'97,"We explore the use of distributed online motion planning algorithms for multiple mobile agents, in air traffic management systems (ATMS). The work is motivated by current trends in ATMS to move towards decentralized air traffic management, in which the aircraft operate in ""free flight"" mode instead of following prespecified ""sky freeways"". Conflict resolution strategies are an integral part of the free flight setting. The purpose of this paper is to obtain a set of manoeuvres to cover all possible conflict scenarios involving multiple agents. A distributed motion planning algorithm based on potential and vortex fields is used. While the algorithm is not always guaranteed to generate flyable trajectories, the obtained trajectories can serve as qualitative prototypes for coordination manoeuvres between multiple aircraft. The actual manoeuvres are generated by approximating these prototypes with trajectories made zip of straight …",168
A dataset for developing and benchmarking active vision,"Phil Ammirato, Patrick Poirson, Eunbyung Park, Jana Košecká, Alexander C Berg",2017/5/29,Conference 2017 IEEE International Conference on Robotics and Automation (ICRA),"We present a new public dataset with a focus on simulating robotic vision tasks in everyday indoor environments using real imagery. The dataset includes 20,000+ RGB-D images and 50,000+ 2D bounding boxes of object instances densely captured in 9 unique scenes. We train a fast object category detector for instance detection on our data. Using the dataset we show that, although increasingly accurate and fast, the state of the art for object detection is still severely impacted by object scale, occlusion, and viewing direction all of which matter for robotics applications. We next validate the dataset for simulating active vision, and use the dataset to develop and evaluate a deep-network-based system for next best move prediction for object classification using reinforcement learning. Our dataset is available for download at cs.unc.edu/~ammirato/active_vision_dataset_website/.",163
Vision based topological Markov localization,"Jana Kosecká, Fayin Li",2004/4/26,"Conference IEEE International Conference on Robotics and Automation, 2004. Proceedings. ICRA'04. 2004","In this paper we study the problem of acquiring a topological model of indoors environment by means of visual sensing and subsequent localization given the model. The resulting model consists of a set of locations and neighborhood relationships between them. Each location in the model is represented by a collection of representative views and their associated descriptors selected from a temporally sub-sampled video stream captured by a mobile robot during exploration. We compare the recognition performance using global image histograms as well as local scale-invariant features as image descriptors, demonstrate their strengths and weaknesses and show how to model the spatial relationships between individual locations by a Hidden Markov Model. The quality of the acquired model is tested in the localization stage by means of location recognition: given a new view or a sequence of views, the most likely …",163
Visual representations for semantic target driven navigation,"Arsalan Mousavian, Alexander Toshev, Marek Fišer, Jana Košecká, Ayzaan Wahid, James Davidson",2019/5/20,Conference 2019 International Conference on Robotics and Automation (ICRA),"What is a good visual representation for navigation? We study this question in the context of semantic visual navigation, which is the problem of a robot finding its way through a previously unseen environment to a target object, e.g. go to the refrigerator. Instead of acquiring a metric semantic map of an environment and using planning for navigation, our approach learns navigation policies on top of representations that capture spatial layout and semantic contextual cues. We propose to use semantic segmentation and detection masks as observations obtained by state-of-the-art computer vision algorithms and use a deep network to learn the navigation policy. The availability of equitable representations in simulated environments enables joint training using real and simulated data and alleviates the need for domain adaptation or domain randomization commonly used to tackle the sim-to-real transfer of the learned …",161
"Extraction, matching, and pose recovery based on dominant rectangular structures","Jana Košecká, Wei Zhang",2005/12/1,Journal Computer Vision and Image Understanding,"Man-made environments possess many regularities which can be efficiently exploited for image-based rendering as well as robotic navigation and localization tasks. In this paper, we present an approach for automatic extraction of dominant rectangular structures from a single view and show how they facilitate the recovery of camera pose, planar structure, and matching across widely separated views. In the presented approach, the rectangular hypothesis formation is based on a higher-level information encoded by the presence of orthogonal vanishing directions, the dominant rectangular structures can be detected and matched despite the presence of multiple repetitive structures often encountered in a variety of buildings. Different stages of the approach are demonstrated on various examples of images of indoor and outdoor structured environments.",159
Qualitative image based localization in indoors environments,"Jana Kosecka, Liang Zhou, Philip Barber, Zoran Duric",2003/6/18,"Conference 2003 IEEE Computer Society Conference on Computer Vision and Pattern Recognition, 2003. Proceedings.","Man made indoor environments possess regularities, which can be efficiently exploited in automated model acquisition by means of visual sensing. In this context we propose an approach for inferring a topological model of an environment from images or the video stream captured by a mobile robot during exploration. The proposed model consists of a set of locations and neighborhood relationships between them. Initially each location in the model is represented by a collection of similar, temporally adjacent views, with the similarity defined according to a simple appearance based distance measure. The sparser representation is obtained in a subsequent learning stage by means of learning vector quantization (LVQ). The quality of the model is tested in the context of qualitative localization scheme by means of location recognition: given a new view, the most likely location where that view came from is determined.",149
Discrete event systems for autonomous mobile agents,"Jana Košecká, Ruzena Bajcsy",1994/4/1,Journal Robotics and Autonomous Systems,"Discrete Event Systems (DES) are a special type of dynamic system. The ‘state’ of these systems changes at discrete instants in time and the term ‘event’ represents the occurrence of discontinuous change (at possibly unknown intervals). Different Discrete Event Systems models are currently used for specification, verification, synthesis as well as for analysis and evaluation of different qualitative and quantitative properties of existing physical systems. The focus of this paper is the presentation of the automata and formal language model for DES introduced by Ramadge and Wonham and its application to the domain of mobile manipulator/observer agents. We demonstrate the feasibility of the DES framework for modeling, analysis and synthesis of some visually guided behaviors of agents engaged in navigational tasks and address synchronization issues between different components of the system. The use of DES …",149
Fast single shot detection and pose estimation,"Patrick Poirson, Phil Ammirato, Cheng-Yang Fu, Wei Liu, Jana Kosecka, Alexander C Berg",2016/10/25,Conference 2016 Fourth International Conference on 3D Vision (3DV),"For applications in navigation and robotics, estimating the 3D pose of objects is as important as detection. Many approaches to pose estimation rely on detecting or tracking parts or keypoints [11, 21]. In this paper we build on a recent state-of-the-art convolutional network for sliding-window detection [10] to provide detection and rough pose estimation in a single shot, without intermediate stages of detecting parts or initial bounding boxes. While not the first system to treat pose estimation as a categorization problem, this is the first attempt to combine detection and pose estimation at the same level using a deep learning approach. The key to the architecture is a deep convolutional network where scores for the presence of an object category, the offset for its location, and the approximate pose are all estimated on a regular grid of locations in the image. The resulting system is as accurate as recent work on pose …",138
Joint semantic segmentation and depth estimation with deep convolutional networks,"Arsalan Mousavian, Hamed Pirsiavash, Jana Košecká",2016/10/25,Conference 2016 Fourth International Conference on 3D Vision (3DV),"Multi-scale deep CNNs have been used successfully for problems mapping each pixel to a label, such as depth estimation and semantic segmentation. It has also been shown that such architectures are reusable and can be used for multiple tasks. These networks are typically trained independently for each task by varying the output layer(s) and training objective. In this work we present a new model for simultaneous depth estimation and semantic segmentation from a single RGB image. Our approach demonstrates the feasibility of training parts of the model for each task and then fine tuning the full, combined model on both tasks simultaneously using a single loss function. Furthermore we couple the deep CNN with fully connected CRF, which captures the contextual relationships and interactions between the semantic and depth cues improving the accuracy of the final results. The proposed model is trained and …",137
Global localization and relative positioning based on scale-invariant keypoints,"Jana Košecká, Fayin Li, Xialong Yang",2005/7/31,Journal Robotics and Autonomous Systems,"The localization capability of a mobile robot is central to basic navigation and map building tasks. We describe a probabilistic environment model which facilitates global localization scheme by means of location recognition. In the exploration stage the environment is partitioned into locations, each characterized by a set of scale-invariant keypoints. The descriptors associated with these keypoints can be robustly matched despite changes in contrast, scale and viewpoint. We demonstrate the efficacy of these features for location recognition, where given a new view the most likely location from which this view came from is determined. The misclassifications due to dynamic changes in the environment or inherent appearance ambiguities are overcome by exploiting location neighborhood relationships captured by a Hidden Markov Model. We report the recognition performance of this approach in an indoor …",135
Multi-view superpixel stereo in urban environments,"Branislav Micusik, Jana Kosecka",2010/8/1,Journal International journal of computer vision,"Urban environments possess many regularities which can be efficiently exploited for 3D dense reconstruction from multiple widely separated views. We present an approach utilizing properties of piecewise planarity and restricted number of plane orientations to suppress reconstruction and matching ambiguities causing failures of standard dense stereo methods. We formulate the problem of the 3D reconstruction in MRF framework built on an image pre-segmented into superpixels. Using this representation, we propose novel photometric and superpixel boundary consistency terms explicitly derived from superpixels and show that they overcome many difficulties of standard pixelbased formulations and handle favorably problematic scenarios containing many repetitive structures and no or low textured regions. We demonstrate our approach on several wide-baseline scenes demonstrating superior performance …",129
Localization in urban environments using a panoramic gist descriptor,"Ana C Murillo, Gautam Singh, Jana Kosecka, José Jesús Guerrero",2012/11/16,Journal IEEE Transactions on Robotics,"Vision-based topological localization and mapping for autonomous robotic systems have received increased research interest in recent years. The need to map larger environments requires models at different levels of abstraction and additional abilities to deal with large amounts of data efficiently. Most successful approaches for appearance-based localization and mapping with large datasets typically represent locations using local image features. We study the feasibility of performing these tasks in urban environments using global descriptors instead and taking advantage of the increasingly common panoramic datasets. This paper describes how to represent a panorama using the global gist descriptor, while maintaining desirable invariance properties for location recognition and loop detection. We propose different gist similarity measures and algorithms for appearance-based localization and an online loop …",123
