titles,authors,date,source,descriptions,citations
Experiments in behavior composition,"Jana Košecká, Henrik I Christensen, Ruzena Bajcsy",1997/3/1,Journal Robotics and Autonomous systems,"Widespread use of mobile robots can only be achieved when framworks that enable specification, design and implementation of systems are available. These frameworks must provide a level of abstraction that enables use of the same methods for different tasks/missions to facilitate fast prototyping and design at low cost. In this paper a Task Description Language (TDL) for task specification is outlined. The tasks are specified as network of processes. The processes are described in terms of finite state machines (FSMs) and their composition is achieved via a set of composition operators, common to many process algebra models. From the obtained description of the task a Discrete Event Systems supervisory controller can be synthesized. To demonstrate that such an approach is suitable basis for description of robot tasks a set of experiments with two different platforms situated in two different laboratories is …",58
Semantic segmentation with heterogeneous sensor coverages,"Cesar Cadena, Jana Košecká",2014/5/31,Conference 2014 IEEE International Conference on Robotics and Automation (ICRA),"We propose a new approach to semantic parsing, which can seamlessly integrate evidence from multiple sensors with overlapping but possibly different fields of view (FOV), account for missing data and predict semantic labels over the spatial union of sensors coverages. The existing approaches typically carry out semantic segmentation using only one modality, incorrectly interpolate measurements of other modalities or at best assign semantic labels only to the spatial intersection of coverages of different sensors. In this work we remedy these problems by proposing an effective and efficient strategy for inducing the graph structure of Conditional Random Field used for inference and a novel method for computing the sensor domain dependent potentials. We focus on RGB cameras and 3D data from lasers or depth sensors. The proposed approach achieves superior performance, compared to state of the art and …",56
Rank conditions on the multiple-view matrix,"Yi Ma, Kun Huang, René Vidal, Jana Košecká, Shankar Sastry",2004/9,Journal International Journal of Computer Vision,"Geometric relationships governing multiple images of points and lines and associated algorithms have been studied to a large extent separately in multiple-view geometry. The previous studies led to a characterization based on multilinear constraints, which have been extensively used for structure and motion recovery, feature matching and image transfer. In this paper we present a universal rank condition on the so-called multiple-view matrix M for arbitrarily combined point and line features across multiple views. The condition gives rise to a complete set of constraints among multiple images. All previously known multilinear constraints become simple instantiations of the new condition. In particular, the relationship between bilinear, trilinear and quadrilinear constraints can be clearly revealed from this new approach. The theory enables us to carry out global geometric analysis for multiple images, as well …",55
Semantically guided location recognition for outdoors scenes,"Arsalan Mousavian, Jana Košecká, Jyh-Ming Lien",2015/5/26,Conference 2015 IEEE international conference on robotics and automation (ICRA),"The problem of image based localization has a long history both in robotics and computer vision and shares many similarities with image based retrieval problem. Existing techniques use either local features or (semi)-global image signatures in the context of topological mapping or loop closure detection. Difficulties of the location recognition problem are often affected by large appearance and viewpoint variation between the query view and reference dataset and presence of non-discriminative features due to vegetation, sky and road. In this work we show that semantic segmentation labeling of man-made structures can inform the traditional bag-of-visual words models to obtain proper feature weighting and improve the overall location recognition accuracy. We also demonstrate additional capability of identifying individual buildings and estimating their extent in images, providing the essential building block for …",50
Semantic parsing for priming object detection in indoors RGB-D scenes,"César Cadena, Jana Košecka",2015/4,Journal The International Journal of Robotics Research,"The semantic mapping of the environment requires simultaneous segmentation and categorization of the acquired stream of sensory information. The existing methods typically consider the semantic mapping as the final goal and differ in the number and types of considered semantic categories. We envision semantic understanding of the environment as an on-going process and seek representations which can be refined and adapted depending on the task and robot’s interaction with the environment. In this work we propose a novel and efficient method for semantic parsing, which can be adapted to the task at hand and enables localization of objects of interest in indoor environments. For basic mobility tasks we demonstrate how to obtain initial semantic segmentation of the scene into ground, structure, furniture and props categories which constitute the first level of hierarchy. Then, we propose a simple and …",48
Deep convolutional features for image based retrieval and scene categorization,"Arsalan Mousavian, Jana Kosecka",2015/9/20,Journal arXiv preprint arXiv:1509.06033,"Several recent approaches showed how the representations learned by Convolutional Neural Networks can be repurposed for novel tasks. Most commonly it has been shown that the activation features of the last fully connected layers (fc7 or fc6) of the network, followed by a linear classifier outperform the state-of-the-art on several recognition challenge datasets. Instead of recognition, this paper focuses on the image retrieval problem and proposes a examines alternative pooling strategies derived for CNN features. The presented scheme uses the features maps from an earlier layer 5 of the CNN architecture, which has been shown to preserve coarse spatial information and is semantically meaningful. We examine several pooling strategies and demonstrate superior performance on the image retrieval task (INRIA Holidays) at the fraction of the computational cost, while using a relatively small memory requirements. In addition to retrieval, we see similar efficiency gains on the SUN397 scene categorization dataset, demonstrating wide applicability of this simple strategy. We also introduce and evaluate a novel GeoPlaces5K dataset from different geographical locations in the world for image retrieval that stresses more dramatic changes in appearance and viewpoint.",44
Detecting changes in images of street scenes,Jana Košecka,2013,"Conference Computer Vision–ACCV 2012: 11th Asian Conference on Computer Vision, Daejeon, Korea, November 5-9, 2012, Revised Selected Papers, Part IV 11","In this paper we propose an novel algorithm for detecting changes in street scenes when the vehicle revisits sections of the street at different times. The proposed algorithm detects structural geometric changes, changes due to dynamically moving objects and as well as changes in the street appearance (e.g. posters put up) between two traversal times. We exploit geometric, appearance and semantic information to determine which areas have changed and formulate the problem as an optimal image labeling problem in the Markov Random Field framework. The approach is evaluated on street sequences from 3 different locations which were visited multiple times by the vehicle. The proposed method is applicable to monitoring and updating models and images of urban environments.",43
Advanced air traffic automation: A case study in distributed decentralized control,"Claire J Tomlin, George J Pappas, Jana Košecká, John Lygeros, Shankar S Sastry",1998,Conference Control Problems in Robotics and Automation,"In this survey chapter, we present some of the issues in designing algorithms for the control of distributed, multi-agent systems. The control of such systems is becoming an increasing issue in many areas owing to technological advances which make it possible to take “legacy” systems to new levels of functioning and efficiency. Of specific interest to us in this chapter is advanced air traffic management (ATM) to increase the efficiency and safety of air travel while accommodating the growing demand for air traffic. ATM systems will replace the completely centralized, ground-based air traffic control procedures. Within ATM, the concept of free flight allows each aircraft to plan four dimensional trajectories in real time, thus replacing the rigid and inefficient discrete airspace structure. These changes are feasible due to technological innovations such as advanced flight management systems with GPS. In this chapter …",42
Discrete event modeling of visually guided behaviors,"Jana Košecka, Henrik I Christensen, Ruzena Bajcsy",1995/3,Journal International Journal of Computer Vision,"When visual behaviors are combined to provide a specific functionality needed for a task, the combination is often based on heuristic rules. In this article we show that by adopting the Discrete-Event Systems (DES) formalism for describing the interaction between visual behaviors it is possible to provide systems that have well-defined properties in terms of observability and controllability. The method is in particular suited for describing the coupling between action and perception. An introduction to the use of DES is provided and it is demonstrated how DES are used for modeling behaviors and controlling a mobile robot equipped with a binocular camera head and some additional sensors.",41
An invitation to 3-D vision: from images to geometric models,"Stefano Soatto, Jana Kosecká, S Shankar Sastry, Yi Ma",2004,Publisher Springer,,39
Visually guided navigation,Jana Košecká,1997/7/1,Journal Robotics and Autonomous Systems,"Rich sensory information, robust control strategies and proper representation of the environment are crucial for successful navigation of the mobile robot. We propose a model of the environment which is suitable for global navigation using visual sensing. At the lowest level of interaction of the robot with the environment we employ visual servoing techniques which facilitate robust local navigation by means of relative positioning. Further we demonstrate how to use these local control strategies in a global setting. The environment is represented in terms of place graph, where the nodes correspond to places and arcs have associated servoing strategies for moving from one place to another. The global navigation is expressed as a sequence of relative positioning tasks obtainable from the search of a place graph. The proposed model facilitates generation of motion plans which can be executed in a robust manner …",38
Motion recovery from image sequences: Discrete viewpoint vs. differential viewpoint,"Yi Ma, Jana Košecká, Shankar Sastry",1998,"Conference Computer Vision—ECCV’98: 5th European Conference on Computer Vision Freiburg, Germany, June 2–6, 1998 Proceedings, Volume II 5",The aim of this paper is to explore intrinsic geometric methods of recovering the three dimensional motion of a moving camera from a sequence of images. Generic similarities between the discrete approach and the differential approach are revealed through a parallel development of their analogous motion estimation theories.,37
Dense piecewise planar RGB-D SLAM for indoor environments,"Phi-Hung Le, Jana Košecka",2017/9/24,Conference 2017 IEEE/RSJ International Conference on Intelligent Robots and Systems (IROS),"The paper exploits weak Manhattan constraints to parse the structure of indoor environments from RGB-D video sequences in an online setting. We extend the previous approach for single view parsing of indoor scenes to video sequences and formulate the problem of recovering the floor plan of the environment as an optimal labeling problem solved using dynamic programming. The temporal continuity is enforced in a recursive setting, where labeling from previous frames is used as a prior term in the objective function. In addition to recovery of piecewise planar weak Manhattan structure of the extended environment, the orthogonality constraints are also exploited by visual odometry and pose graph optimization. This yields reliable estimates in the presence of large motions and absence of distinctive features to track. We evaluate our method on several challenging indoors sequences demonstrating accurate …",36
Kruppa equation revisited: Its renormalization and degeneracy,"Yi Ma, René Vidal, Jana Kosecka, Shankar Sastry",2000/4,Conference ECCV (2),"In this paper, we study general questions about the solvability of the Kruppa equations and show that, in several special cases, the Kruppa equations can be renormalized and become linear. In particular, for cases when the camera motion is such that its rotation axis is parallel or perpendicular to translation, we can obtain linear algorithms for self-calibration. A further study of these cases not only reveals generic difficulties with degeneracy in conventional self-calibration methods based on the nonlinear Kruppa equations, but also clarifies some incomplete discussion in the literature about the solutions of the Kruppa equations. We demonstrate that Kruppa equations do not provide sufficient constraints on camera calibration and give a complete account of exactly what is missing in Kruppa equations. In particular, a clear relationship between the Kruppa equations and chirality is revealed. The results then resolve the discrepancy between the Kruppa equations and the necessary and sufficient condition for a unique calibration. Simulation results are presented for evaluation of the sensitivity and robustness of the proposed linear algorithms.",36
"A framework for modeling and verifying visually guided agents: Design, analysis and experiments",Jana Kosecka,1996,Institution University of Pennsylvania,The successful functioning of robotic agents in a dynamically changing environment requires rich sensory input and advanced sensory-motor control. The robotic agents are typically equipped with multiple sensors and multiple actuators. The interactions between agents and the environment can be characterized by both discrete and continuous models. The accomplishment of various tasks is mediated by complex coordination and interaction between individual sensing and control strategies. It is crucial for the reliable and predictable operation of robotic systems that the design be within a structured methodology which supports analysis and modularity.,35
Application of discrete events systems for modeling and controlling robotic agents,"Jana Kosecka, Luca Bogoni",1994/5/8,Conference Proceedings of the 1994 IEEE International Conference on Robotics and Automation,"In this paper we present a framework for modeling behaviors and tasks for heterogeneous robotic agents. For this purpose we have adopted a formalism from the discrete events systems (DES) theory. We distinguish two kinds of scenarios. In the first one, reactive behaviors of mobile agents directly connect observations with actions. The overall objective is to achieve controllability of the system which is composed from modular components operating in parallel. In the second one, observations are implicitly connected with actions and the objective is to design an observer for manipulatory tasks which would guarantee the task's observability. The use of the DES formalism allows one to describe complex interactions between different components in a systematic fashion and guarantee some control-theoretic properties. We demonstrate our approach by presenting examples of navigation, obstacle avoidance, piercing …",33
Gist vocabularies in omnidirectional images for appearance based mapping and localization,"AC Murillo, P Campos, J Kosecka, J Guerrero",2010/6,"Journal 10th OMNIVIS, held with Robotics: Science and Systems (RSS)","Appearance based topological localization and mapping is a subject of great interest for autonomous robotics systems. The need for mapping larger environments and describing them at different levels of abstraction requires alternatives to purely metric representations of the environment and additional ability to deal with large amounts of data efficiently. The key component of image based localization is the search for the closest view in the image database representing the environment. In this work we study the efficiency and potential of global gist descriptor [1] adapted to catadioptric systems and present a new hierarchical approach for topological mapping and localization. Our method relies on the omni-gist descriptor and integrates local feature matching to refine the candidates at places where loop-closure detection can occur. Three different omnidirectional image datasets from real scenarios are used to demonstrate the performance of this method, providing comparable results for appearance based localization than previous approaches based on local features. The storage and computation efficiency of global descriptors notably improves the efficiency of the system.",32
Adaptive rgb-d localization,"Michael Paton, Jana Kosecka",2012/5/28,Conference 2012 Ninth Conference on Computer and Robot Vision,"The advent of RGB-D cameras which provide synchronized range and video data creates new opportunities for exploiting both sensing modalities for various robotic applications. This paper exploits the strengths of vision and range measurements and develops a novel robust algorithm for localization using RGB-D cameras. We show how correspondences established by matching visual SIFT features can effectively initialize the generalized ICP algorithm as well as demonstrate situations where such initialization is not viable. We propose an adaptive architecture which computes the pose estimate from the most reliable measurements in a given environment and present thorough evaluation of the resulting algorithm against a dataset of RGB-D benchmarks, demonstrating superior or comparable performance in the absence of the global optimization stage. Lastly we demonstrate the proposed algorithm on a …",31
Acquiring semantics induced topology in urban environments,"Gautam Singh, Jana Košecká",2012/5/14,Conference 2012 IEEE International Conference on Robotics and Automation,"Methods for acquisition and maintenance of an environment model are central to a broad class of mobility and navigation problems. Towards this end, various metric, topological or hybrid models have been proposed. Due to recent advances in sensing and recognition, acquisition of semantic models of the environments have gained increased interest in the community. In this work, we will demonstrate a capability of using weak semantic models of the environment to induce different topological models, capturing the spatial semantics of the environment at different levels. In the first stage of the model acquisition, we propose to compute semantic layout of the street scenes imagery by recognizing and segmenting buildings, roads, sky, cars and trees. Given such semantic layout, we propose an informative feature characterizing the layout and train a classifier to recognize street intersections in challenging urban inner …",31
Creating compact architectural models by geo-registering image collections,"Radek Grzeszczuk, Jana Košecka, Ramakrishna Vedantham, Harlan Hile",2009/9/27,"Conference 2009 IEEE 12th International Conference on Computer Vision Workshops, ICCV Workshops","We present a method for automatically constructing compact, photo-realistic architectural 3D models. This method uses simple 3D building outlines obtained from existing GIS databases to bootstrap reconstruction and works with both structured and unstructured image datasets. We propose an optimal view-selection algorithm for selecting a small set of views for texture mapping that best describe the structure, while minimizing warping and stitching artifacts, and producing a consistent visual representation. The proposed method is fully automatic and can process large structured datasets in close to real-time, making it suitable for large scale urban modeling and 3D map construction.",30
Global localization and relative pose estimation based on scale-invariant features,"Jana Kosecka, Xiaolong Yang",2004/8/26,"Conference Proceedings of the 17th International Conference on Pattern Recognition, 2004. ICPR 2004.","The capability of maintaining the pose of the mobile robot is central for basic navigation and map building tasks. In This work we describe a vision-based hybrid localization scheme based on scale-invariant keypoints. In the first stage the topological localization is accomplished by matching the keypoints detected in the current view with the database of model views. Once the best match has been found, the relative pose between the model view and the current image is recovered. We demonstrate the efficiency of the location recognition approach and present a closed form solution to the relative pose recovery for the case of planar motion and unknown focal length of the camera. The approach is demonstrated on several examples of indoor environments.",30
Representation of a three-dimensional moving scene,"Yi Ma, Stefano Soatto, Jana Košecká, S Shankar Sastry, Yi Ma, Stefano Soatto, Jana Košecká, S Shankar Sastry",2004,Journal An invitation to 3-d vision: from images to geometric models,"The study of the geometric relationship between a three-dimensional (3-D) scene and its two-dimensional (2-D) images taken from a moving camera is at heart the interplay between two fundamental sets of transformations: Euclidean motion, also called rigid-body motion,which models how the camera moves, and perspective projection,which describes the image formation process. Long before these two transformations were brought together in computer vision, their theory had been developed independently. The study of the principles of motion of a material body has a long history belonging to the foundations of mechanics. For our purpose, more recent noteworthy insights to the understanding of the motion of rigid objects came from Chasles and Poinsot in the early 1800s. Their findings led to the current treatment of this subject, which has since been widely adopted.",28
2 1/2 D conflict resolution maneuvers for ATMS,"Jana Kosecka, Claire Tomlin, George Pappas, Shankar Sastry",1998/12/18,Conference Proceedings of the 37th IEEE Conference on Decision and Control (Cat. No. 98CH36171),"This work is motivated by the current trend in the aviation community to move towards decentralized air traffic management systems (ATMS), in which the aircraft operate in ""free flight"" mode instead of following prespecified ""freeways in the sky"". Automatic conflict resolution strategies are an integral part of the free flight setting. Given the nature of the problem, the limited sensing capabilities, and the complex aircraft dynamics and constraints, it is very hard to solve the conflict resolution problem in its full generality. Indeed, the appropriate solution should be safe (collisions never occur), live (destinations are always reached), and flyable (dynamic constraints on accelerations and velocities are satisfied). This paper explores the use of distributed motion planning for multiple aircraft using vector field techniques. The coordination between aircraft is achieved using a series of horizontal and vertical planar avoidance …",28
Location recognition and global localization based on scale invariand keypoints,"Jana Košecká, Xiaolong Yang",2004/5,"Journal Proc. Workshop on Statistical Learning in Computer Vision, ECCV","The localization capability of a mobile robot is central to basic navigation and map building tasks. We describe a probabilistic environment model which facilitates global localization scheme by means of location recognition. In the exploration stage the environment is partitioned into several locations, each characterized by a set of scale-invariant keypoints. The descriptors associated with these keypoints can be robustly matched despite the changes in contrast, scale and affine distortions. We demonstrate the efficacy of these features for location recognition, where given a new view the most likely location from which this view came is determined. The misclassifications due to dynamic changes in the environment or inherent location appearance ambiguities are overcome by exploiting the location neighborhood relationships captured by a Hidden Markov Model. We report the recognition performance of this approach in an indoor environment consisting of eighteen locations and discuss the suitability of this approach for a more general class of recognition problems.",27
Estimating planar surface orientation using bispectral analysis,"Hany Farid, Jana Kosecka",2007/7/16,Journal IEEE Transactions on image processing,"In this correspondence, we propose a direct method for estimating the orientation of a plane from a single view under perspective projection. Assuming that the underlying planar texture has random phase, we show that the nonlinearities introduced by perspective projection lead to higher order correlations in the frequency domain. We also empirically show that these correlations are proportional to the orientation of the plane. Minimization of these correlations, using tools from polyspectral analysis, yields the orientation of the plane. We show the efficacy of this technique on synthetic and natural images.",25
