titles,authors,date,source,descriptions,citations
Finehand: Learning hand shapes for american sign language recognition,"Panneer Selvam Santhalingam, Parth Pathak, Huzefa Rangwala, Jana Košecká",2020/11/16,Conference 2020 15th IEEE International Conference on Automatic Face and Gesture Recognition (FG 2020),"American Sign Language recognition is a difficult gesture recognition problem, characterized by fast, highly articulate gestures. These are comprised of arm movements with different hand shapes, facial expression and head movements. Among these components, hand shape is the vital, often the most discriminative part of a gesture. In this work, we present an approach for effective learning of hand shape embeddings, which are discriminative for ASL gestures. For hand shape recognition our method uses a mix of manually labelled hand shapes and high confidence predictions to train deep convolutional neural network (CNN). The sequential gesture component is captured by recursive neural network (RNN) trained on the embeddings learned in the first stage. We will demonstrate that higher quality hand shape models can significantly improve the accuracy of final video gesture classification in challenging …",12
Experiments in building recognition,"Wei Zhang, Jana Kosecka",2004,Journal Technical report CMU-CS-TR-2004,"In this report we study the problem of building recognition. Given a database of building images, we are interested in classifying a novel view of a building by finding the closest match from the database. We examine the efficacy of local scale-invariant features and their associated descriptors as representations of building appearance and use a simple voting scheme in the recognition phase.",12
Efficient computation of vanishing points,"J Kogecka, Wei Zhang",2002/5/11,Conference Proceedings 2002 IEEE International Conference on Robotics and Automation (Cat. No. 02CH37292),"Man-made environments possess a lot of regularities which simplify otherwise difficult pose estimation and visual reconstruction tasks. The constraints arising front parallel and orthogonal lines and planes can be efficiently exploited at various stages of vision processing pipeline. In this paper we propose an approach for estimation of vanishing points by exploiting the constraints of structured man-made environments, where the majority of lines is aligned with the principal orthogonal directions of the world coordinate frame. We combine efficient image processing techniques used in the line detection and initialization stage with simultaneous grouping and estimation of vanishing directions using expectation maximization (EM) algorithm. Since we assume an uncalibrated camera the estimated vanishing points can be used towards partial camera calibration and estimation of the relative orientation of the camera with …",65
Motion bias and structure distortion induced by calibration errors.,"Marco Zucchelli, Jana Kosecka",2001/9,Conference BMVC,"This article provides an account of sensitivity and robustness of structure and motion recovery with respect to the errors in intrinsic parameters of the camera. We demonstrate both analytically and in simulation, the interplay between measurement and calibration errors and their effect on motion and structure estimates. In particular we show that the calibration errors introduce an additional bias towards the optical axis, which has opposite sign to the bias typically observed by egomotion algorithms. The overall bias causes a distortion of the resulting 3D structure, which we express in a parametric form. The analysis and experiments are carried out in the differential setting for motion and structure estimation from image velocities. While the analytical explanations are derived in the context of linear techniques for motion estimation, we verify our observations experimentally on a variety of optimal and suboptimal motion and structure estimation algorithms. The obtained results illuminate and explain the performance and sensitivity of the differential structure and motion recovery techniques in the presence of calibration errors.",12
Self-supervisory signals for object discovery and detection,"Etienne Pot, Alexander Toshev, Jana Kosecka",2018/6/8,Journal arXiv preprint arXiv:1806.03370,"In robotic applications, we often face the challenge of discovering new objects while having very little or no labelled training data. In this paper we explore the use of self-supervision provided by a robot traversing an environment to learn representations of encountered objects. Knowledge of ego-motion and depth perception enables the agent to effectively associate multiple object proposals, which serve as training data for learning object representations from unlabelled images. We demonstrate the utility of this representation in two ways. First, we can automatically discover objects by performing clustering in the learned embedding space. Each resulting cluster contains examples of one instance seen from various viewpoints and scales. Second, given a small number of labeled images, we can efficiently learn detectors for these labels. In the few-shot regime, these detectors have a substantially higher mAP of 0.22 compared to 0.12 of off-the-shelf standard detectors trained on this limited data. Thus, the proposed self-supervision results in effective environment specific object discovery and detection at no or very small human labeling cost.",10
Active vision dataset benchmark,"Phil Ammirato, Alexander C Berg, Jana Kosecka",2018,Conference Proceedings of the IEEE Conference on Computer Vision and Pattern Recognition Workshops,"Several recent efforts in computer vision indicate a trend toward studying and understanding problems in larger scale environments, beyond single images, and focus on connections to tasks in navigation, mobile manipulation, and visual question answering. A common goal of these tasks is the capability of moving in the environment, acquiring novel views during perception and while performing a task. This capability comes easily in synthetic environments, however achieving the same effect with real images is much more laborious. We propose using the existing Active Vision Dataset to form a benchmark for such problems in a real-world settings with real images. The dataset is well suited for evaluating tasks of multiview active recognition, target driven navigation, and target search, and also can be effective for studying the transfer of strategies learned in simulation to real settings.",10
Reinforcement learning for semantic segmentation in indoor scenes,"Md Reza, Jana Kosecka",2016/6/3,Journal arXiv preprint arXiv:1606.01178,"Future advancements in robot autonomy and sophistication of robotics tasks rest on robust, efficient, and task-dependent semantic understanding of the environment. Semantic segmentation is the problem of simultaneous segmentation and categorization of a partition of sensory data. The majority of current approaches tackle this using multi-class segmentation and labeling in a Conditional Random Field (CRF) framework or by generating multiple object hypotheses and combining them sequentially. In practical settings, the subset of semantic labels that are needed depend on the task and particular scene and labelling every single pixel is not always necessary. We pursue these observations in developing a more modular and flexible approach to multi-class parsing of RGBD data based on learning strategies for combining independent binary object-vs-background segmentations in place of the usual monolithic multi-label CRF approach. Parameters for the independent binary segmentation models can be learned very efficiently, and the combination strategy---learned using reinforcement learning---can be set independently and can vary over different tasks and environments. Accuracy is comparable to state-of-art methods on a subset of the NYU-V2 dataset of indoor scenes, while providing additional flexibility and modularity.",10
Object recognition and segmentation in indoor scenes from RGB-D images,"Md Alimoor Reza, Jana Kosecka",2014/7,Journal Robotics Science and Systems (RSS) conference-5th workshop on RGB-D: Advanced Reasoning with Depth Cameras,"We study the problem of automatic recognition and segmentation of objects in indoor RGB-D scenes. We propose to formulate the object recognition and segmentation in RGBD data as a binary object-background segmentation, using an informative set of features and grouping cues for small regular superpixels. The main novelty of the proposed approach is the exploitation of the informative depth channel features which indicate presence of depth boundaries, the use of efficient supervised object specific binary segmentation and effective hard negative mining exploiting the object co-occurrence statistics. The binary segmentation is meaningful in the context of robotics applications, where often only an object of interest needs to be sought. This yields an efficient and flexible method, which can be easily extended to additional object categories. We report the performance of the approach on NYU-V2 indoor dataset and demonstrate improvement in the global and average accuracy compared to the state of the art methods.",10
Vision based lateral control of vehicles: look-ahead and delay issues,Jana Kosecka,1997,"Journal Internal Memo, Department of EECS, University of California Berkeley",,10
Object pose estimation using mid-level visual representations,"Negar Nejatishahidin, Pooya Fayyazsanavi, Jana Košecka",2022/10/23,Conference 2022 IEEE/RSJ International Conference on Intelligent Robots and Systems (IROS),"This work proposes a novel pose estimation model for object categories that can be effectively transferred to pre-viously unseen environments. The deep convolutional network models (CNN) for pose estimation are typically trained and evaluated on datasets specifically curated for object detection, pose estimation, or 3D reconstruction, which requires large amounts of training data. In this work, we propose a model for pose estimation that can be trained with small amount of data and is built on the top of generic mid-level represen-tations [33] (e.g. surface normal estimation and re-shading). These representations are trained on a large dataset without requiring pose and object annotations. Later on, the predictions are refined with a small CNN neural network that exploits object masks and silhouette retrieval. The presented approach achieves superior performance on the Pix3D dataset [26] and shows nearly 35 …",9
Communication enhanced navigation strategies for teams of mobile agents,"Justin Hayes, Martha McJunkin, Jana Kosecka",2003/10/27,Conference Proceedings 2003 IEEE/RSJ International Conference on Intelligent Robots and Systems (IROS 2003)(Cat. No. 03CH37453),"In multi-agent systems engaged in cooperative activities there is an apparent trade-off between the complexity of the individual agents, their sensing capabilities and communication required for accomplishment of particular tasks. One of the main computationally intensive components which affects the complexity of the overall system is the acquisition and maintenance of the environment model where the agents reside. In this paper, in the context of foraging and coordinated traversal task, we will examine control strategies that in the absence of the global model of the environment can substantially improve the performance of the team using additional sensing and communication capabilities. In one case the coordinated strategy is motivated by an ant trail following behavior while in another case the line of sight information is used to constrain the movement of individual agents guaranteeing shorter total traversal …",9
Label propagation in RGB-D video,"Md Alimoor Reza, Hui Zheng, Georgios Georgakis, Jana Košecká",2017/9/24,Conference 2017 IEEE/RSJ International Conference on Intelligent Robots and Systems (IROS),"We propose a new method for the propagation of semantic labels in RGB-D video of indoor scenes given a set of ground truth keyframes. Manual labeling of all pixels in every frame of a video sequence is labor intensive and costly, yet required for training and testing of semantic segmentation methods. The availability of video enables propagation of labels between the frames for obtaining a large amounts of annotated pixels. While previous methods commonly used optical flow motion cues for label propagation, we present a novel approach using the camera poses and 3D point clouds for propagating the labels in superpixels computed on the unannotated frames of the sequence. The propagation task is formulated as an energy minimization problem in a Conditional Random Field (CRF). We performed experiments on 8 video sequences from SUN3D dataset [1] and showed superior performance to an optical …",8
Ensemble method for robust motion estimation,"Wei Zhang, Jana Kosecka",2006/6/17,Conference 2006 Conference on Computer Vision and Pattern Recognition Workshop (CVPRW'06),"The core of the traditional RANSAC algorithm and its more recent efficient counterparts is the hypothesis evaluation stage, with the focus on finding the best, outlier free hypothesis. Motivated by a non-parametric ensemble techniques, we demonstrate that it proves advantageous to use the entire set of hypotheses generated in the sampling stage. We show that by studying the residual distribution of each data point with respect to the entire set of hypotheses, the problem of inlier/ outlier identification can be formulated as a classification problem. We present extensive simulations of the approach, which in the presence of a large percentage (> 50%) of outliers, provides a repeatable and, an order of magnitude more efficient method compared to the currently existing techniques. Results on widebaseline matching and fundamental matrix estimation are presented.",8
Discrete event modeling of navigation and gaze control,"R Bajscy, J Kosecka, H Christiansen",1995,"Journal International Journal of Computer Vision, Special Issue on Qualitative Vision",,8
Farsight: Long-range depth estimation from outdoor images,"Md Alimoor Reza, Jana Kosecka, Philip David",2018/10/1,Conference 2018 IEEE/RSJ International Conference on Intelligent Robots and Systems (IROS),"This paper introduces the problem of long-range monocular depth estimation for outdoor urban environments. Range sensors and traditional depth estimation algorithms (both stereo and single view) predict depth for distances of less than 100 meters in outdoor settings and 10 meters in indoor settings. The shortcomings of outdoor single view methods that use learning approaches are, to some extent, due to the lack of long-range ground truth training data, which in turn is due to limitations of range sensors. To circumvent this, we first propose a novel strategy for generating synthetic long-range ground truth depth data. We utilize Google Earth images to reconstruct large-scale 3D models of different cities with proper scale. The acquired repository of 3D models and associated RGB views along with their long-range depth renderings are used as training data for depth prediction. We then train two deep neural …",7
Mosaic construction from a sparse set of views,"Wei Zhang, Jana Kosecka, Fayin Li",2002/6/19,Conference Proceedings. First International Symposium on 3D Data Processing Visualization and Transmission,"This paper describes a flexible approach for mosaic construction from a sparse set of uncalibrated views. The observation, that in architectural environments the majority of lines is aligned with the principal orthogonal directions of the world coordinate frame, is exploited in different stages of the mosaic construction pipeline. In the first stage the vanishing points are automatically detected and used for partial calibration of the camera and estimation of camera's relative orientation with respect to the scene. This single view analysis enables efficient feature matching and alignment of multiple views. In the final mosaic construction stage the internal camera parameters are refined simultaneously using all available views. We point out some practical issues related to the conditioning of this self-calibration technique. While the approach described here can be presented in the context of rotational mosaics, the alignment …",7
Introduction to Multiview Rank Conditions and their Applications: A Review.,"Jana Košecká, Yi Ma",2002,"Source Proceedings of the Tyrrhenian International Workshop on Digital Communications (IWDC 2002), Advanced Methods for Multimedia Signal Processing","Understanding the representations of 3D scenes as encoded in multiple views taken by a camera from different vantage points is central to many tasks in image and video analysis. These tasks range from recovering the camera motion, 3D structure of the scene and detection and characterization of multiple motions in video. We will demonstrate that the natural representations of a 3D scene in 2D images is in terms of the incidence relations among different geometric primitives, which can be concisely characterized by rank conditions of multiview matrices. The proposed rank conditions capture all existing independent multilinear constraints and enable truly global geometric analysis of the multiple views comprised of different geometric features. In addition to the analysis, we present natural factorization based linear algorithms for structure and motion recovery, image transfer and matching across multiple views applicable in both calibrated and uncalibrated setting. We will demonstrate the approach experimentally on a problem of multiframe structure and motion recovery using point and line features and their incidence relations.",7
"Development of binocular stereopsis for vehicle lateral control, longitudinal control and obstacle detection","Jitendra Malik, Jana Kosecka, Camillo J Taylor, Philip McLauchlan",1999/11/1,"Description This nal report describes the application of computer vision techniques to the lateral and longitudinal control of an autonomous highway vehicle. In the part of the project we focused on an analysis of the vehicle's lateral dynamics and the design of an appropriate controller for lateral control and investigated various static feedback strategies where the measurements obtained from vision, namely o set from the centerline and angle between the road tangent and the orientation of the vehicle at some look-ahead distance, are directly used for control. The role of the look-ahead, its relation to the vision processing delay, longitudinal velocity and road geometry was crucial on the design of the control and their experimental evaluation. We carried out a thorough analysis of the e ects of changing various important system parameters like the vehicle velocity, thelookahead range of the vision sensor and the processing delay associated with the perception and control systems. We also present the results of a series of experiments that were designed to provide a systematic comparison of a number of control strategies. The control strategies that were explored include a lead-lag control law, a full- state linear controller and input-output linearizing control law. Each of these control strategies was implemented and tested at highway speeds on our experimental vehicle platform, a Honda Accord LX sedan. For the longitudinal control problem, we investigated the possibility of using stereo vision to provide the range information, in conjunction with a scanning laser radar sensor. The vision based tracking system utilizes a layered architecture wherein the bottom …","This nal report describes the application of computer vision techniques to the lateral and longitudinal control of an autonomous highway vehicle. In the part of the project we focused on an analysis of the vehicle's lateral dynamics and the design of an appropriate controller for lateral control and investigated various static feedback strategies where the measurements obtained from vision, namely o set from the centerline and angle between the road tangent and the orientation of the vehicle at some look-ahead distance, are directly used for control. The role of the look-ahead, its relation to the vision processing delay, longitudinal velocity and road geometry was crucial on the design of the control and their experimental evaluation. We carried out a thorough analysis of the e ects of changing various important system parameters like the vehicle velocity, thelookahead range of the vision sensor and the processing delay associated with the perception and control systems. We also present the results of a series of experiments that were designed to provide a systematic comparison of a number of control strategies. The control strategies that were explored include a lead-lag control law, a full- state linear controller and input-output linearizing control law. Each of these control strategies was implemented and tested at highway speeds on our experimental vehicle platform, a Honda Accord LX sedan. For the longitudinal control problem, we investigated the possibility of using stereo vision to provide the range information, in conjunction with a scanning laser radar sensor. The vision based tracking system utilizes a layered architecture wherein the bottom …",7
Motion estimation in computer vision: optimization on Stiefel manifolds,"Yi Ma, Jana Kosecka, Shankar Sastry",1998/12/18,Conference Proceedings of the 37th IEEE Conference on Decision and Control (Cat. No. 98CH36171),"Motion recovery from image correspondences is typically a problem of optimizing an objective function associated with the epipolar (or Longuet-Higgins) constraint. This objective function is defined on the so called essential manifold. In the paper, the intrinsic Riemannian structure of the essential manifold is thoroughly studied. Based on existing optimization techniques on Riemannian manifolds, in particular on Stiefel manifolds, we propose a Riemannian Newton algorithm to solve the motion recovery problem, making use of the natural geometric structure of the essential manifold. Although only the Newton algorithm is studied in detail, the same ideas also apply to other typical conjugate gradient algorithms. It is shown that the proposed nonlinear algorithms converge very rapidly (with quadratic rate of convergence) as long as the conventional SVD based eight-point linear algorithm has a unique solution. Such …",7
Supervisory control theory for autonomous mobile agents,J Kosecká,1996,"Institution PhD thesis, University of Pennsylvania, GRASP Laboratory",,7
Uncertainty aware proposal segmentation for unknown object detection,"Yimeng Li, Jana Košecká",2022,Conference Proceedings of the IEEE/CVF Winter Conference on Applications of Computer Vision,"Recent efforts in deploying Deep Neural Networks for object detection in real world applications, such as autonomous driving, assume that all relevant object classes have been observed during training. Quantifying the performance of these models in settings when the test data is not represented in the training set has mostly focused on pixel-level uncertainty estimation techniques of models trained for semantic segmentation. This paper proposes to exploit additional predictions of semantic segmentation models and quantifying its confidences, followed by classification of object hypotheses as known vs. unknown, out of distribution objects. We use object proposals generated by Region Proposal Network (RPN) and adapt distance aware uncertainty estimation of semantic segmentation using Radial Basis Functions Networks (RBFN) for class agnostic object mask prediction. The augmented object proposals are then used to train a classifier for known vs. unknown objects categories. Experimental results demonstrate that the proposed method achieves parallel performance to state of the art methods for unknown object detection and can also be used effectively for reducing object detectors' false positive rate. Our method is well suited for applications where prediction of non-object background categories obtained by semantic segmentation is reliable.",6
Recursive inference for prediction of objects in urban environments,"Cesar Cadena, Jana Košecká",2016,Journal Robotics Research: The 16th International Symposium ISRR,"Future advancements in robotic navigation and mapping rest to a large extent on robust, efficient and more advanced semantic understanding of the surrounding environment. The existing semantic mapping approaches typically consider small number of semantic categories, require complex inference or large number of training examples to achieve desirable performance. In the proposed work we present an efficient approach for predicting locations of generic objects in urban environments by means of semantic segmentation of a video into object and non-object categories. We exploit widely available exemplars of non-object categories (such as road, buildings, vegetation) and use geometric cues which are indicative of the presence of object boundaries to gather the evidence about objects regardless of their category. We formulate the object/non-object semantic segmentation problem in the …",6
