titles,authors,date,source,descriptions,citations
Comparing the Performance of Machine Learning Algorithms for Multiclass Network Traffic Classification,"DAN NGUYEN, Pouyan Ahmadi, Khondkar Islam",2020,Journal Journal of Student-Scientists' Research,"As we move into a technology-based generation, more devices will be in use, increasing network traffic activity. High levels of activity force network operators to be able to segregate traffic quickly and efficiently. This issue brings light to the importance of network traffic classification. Network traffic classifiers are expected to be able to identify the network service that a particular traffic flow belongs to, which is crucial information for network management and security. Recently, the research area has turned to machine learning (ML) algorithms to act as classifiers. With just a few attributes, machine learning classifiers can group traffic flows into classes with high accuracy. In this study, our objective was to compare various machine learning algorithms and find the optimal algorithm for network traffic classification. We used a dataset that consisted of 100,000 traffic flows and 40 distinct network applications. We applied five …",
A Novel Study of the Relation Between Students Navigational Behavior on Blackboard and their Learning Performance in an Undergraduate Networking Course,"Salman Yousaf, Pouyan Ahmadi, Khondkar Islam",2018/11/8,Journal arXiv preprint arXiv:1811.03669,"This paper provides an overview of students behavior analysis on a learning management system (LMS), Blackboard (Bb) Learn for a core data communications course of the Undergraduate IT program in the Information Sciences and Technology (IST) Department at George Mason University (GMU). This study is an attempt to understand the navigational behavior of students on Blackboard Learn which can be further attributed to the overall performance of the students. In total, 160 undergraduate students participated in the study. Vast amount of students activities data across all four sections of the course were collected. All sections have similar content, assessment design and instruction methods. A correlation analysis between the different assessment methods and various key variables such as total student time, total number of logins and various other factors were performed, to evaluate students engagement on Blackboard Learn. Our findings can help instructors to efficiently identify students strengths or weaknesses and fine-tune their courses for better student engagement and performance.",
A Survey of Learning Management Systems and Synchronous Distance Education Tools,"Khondkar Islam, Pouyan Ahmadi, Salman Yousaf",2017/11/15,Journal arXiv preprint arXiv:1711.10585,"Although compelling assessments have been quite frequently examined in recent years, more studies are required to yield a better understanding of several Distance Learning (DL) methods where Learning Management Systems (LMSs) significantly affect student learning process. Most studies in this area do not consider the effect of varying web-facilitated DL application tools. To address these drawbacks, the objective of our study is to compare two LMSs and four synchronous distance education tools (SDET). The comparisons confirm the superiority of Moodle Integrated Synchrotrons Teaching Conferencing (MIST/C), which seems to be the most practical, convenient and modest distance education tool offered in the market today because it is open source and has a second mirrored whiteboard for simulteaching that is not available with any other system.",
COMPARATIVE LEARNING ANALYTICS APPLIED TO CREDIT AND NON-CREDIT CCNA COURSES DELIVERED ONLINE AND FACE-TO-FACE,"Betsy Tretola, Khondkar Islam, Salman Yousaf",2017,Conference EDULEARN17 Proceedings,This study is a continuation of the findings from an online hybrid non-credit distance learning research course developed by the Virtual Academy (VirtAC) in the Department of Information Sciences and Technology (IST) of the Volgenau School of Engineering (VSE) at George Mason University (GMU).   The development and research is funded by a grant from Cisco Systems.   An initial study compared the effectiveness of traditional and social media marketing strategies in launching the first online non-credit 24-week Cisco Certified Network Associate (CCNA) course.  Preliminary cost and conversion metrics from the first course supported the use of social media to market the course. The second study analyzed the results of the marketing activities for the second offering of the course that impacted retention and satisfaction.   This third study compares student performance enrolled in the same CCNA course delivered …,
A peer-to-peer network architecture for emerging applications,Khondkar R Islam,2014/8/13,Conference Proceedings of the 2014 IEEE 15th International Conference on Information Reuse and Integration (IEEE IRI 2014),"There has been a noticeable rise in machine-to-machine (M2M) and vehicle-to-vehicle (V2V) communications during the past decade. This has been mostly prompted by the increase in the number of unmanned aerial vehicles (UAVs) and research in autonomous cars. Additionally, information security and privacy issues are becoming more critical with the rapid growth and complexity of network attached devices. As we depend more on the Internet, we become more vulnerable to security breaches. The rise in communication is also placing a huge toll on the Internet because most of these applications use the traditional client-server network infrastructure where the clients are served by the central server(s). This network model is also vulnerable to single point of failure, not ensuring high availability that is critical for sensitive applications. This paper presents a novel network architecture that leverages peer-to-peer …",
A Distributed Architecture to Support Distance Education in Developing Countries,,,,,
Meeting MDG 2: can IT save us?,"Charles M Snow, Khondkar R Islam",2012/10/11,Book Proceedings of the 13th annual conference on Information technology education,"While there continues to be rapid growth in the deployment of IT based teaching technology in the developed world, there is a much greater need to find a effective means of using such technology to reach millions of underserved children in the developing world. This paper briefly looks at the problem, the technology, and how the latter may mitigate the former.",
