titles,authors,date,source,descriptions,citations
Design for Resilience in Autonomous Systems: Lessons Learned from Controlled Flight into Stall Accidents,"Lance Sherry, Robert Mauro",2015,"Book 15th AIAA Aviation Technology, Integration, and Operations Conference","Resilience is the means to extend the design reliability of a system beyond the design assurance achieved by the technology. In the case of supervised autonomous systems, resilience can be achieved by the intervention of a human operator when the autonomous system creates an undesired state. This paper describes a detailed analysis of the requirements and the design for intervention in the operation of an autonomous function on a modern airliner. The analysis derives the requirements for the intervention task from an analysis of the six step scenario leading to the Controlled Flight into Stall (CFIS) accidents. Some of the requirements that cannot be performed adequately by the human operator (ie monitoring for rare events, complex calculations, and correlation of disparate data) are automated in a stand-alone device on the flight deck. The functional design of this intervention support device, known as the Paranoid Pilot Associate, is described. Limitations and implications of the design are discussed.",
Modernizing the US air navigation service,Lance Sherry,2014/12,Journal Robert Schuman Centre for Advanced Studies Research Paper,"The modern Air Navigation Service (ANS), also known as Air Traffic Control (ATC), is one of the largest networked socio-technical systems developed and operated by humankind. The ANS ensures safe and efficient flight operations 24 hours a day, 365 days a year across continents and oceans for upwards of 15 million flights per year. Since Air Navigation Service Providers (ANSP) operate under the legal framework of a public utility (or quasi-public utility) and are subject to a range of externalities, productivity improvements and modernization initiatives are not efficiently driven by market forces and require government mandates. This paper describes the ANS modernization initiatives underway in the United States. The enabling technologies, concepts-of-operations, and challenges to modernization are discussed.",
Resilience and the limits of autonomy on the airline flightdeck: Lessons learned from CFIS accidents,Lance Sherry,2014/10/5,Conference 2014 IEEE/AIAA 33rd Digital Avionics Systems Conference (DASC),This article consists of a collection of slides from the author's conference presentation. Some of the specific areas/topics discussed include: Economic pressure driving innovation in Air Transportation; Next revolution in Air Transportation lead to increased Autonomy; Analysis of Controlled Flight into Stall (CFIS) accidents defines an upper limit on command-and-control system reliability; the Gap between required Operational Reliability and system reliability can only be closed by Resilience by Design.,
Design of cockpit displays to support flightcrew intervention tasks,"Lance Sherry, Robert Mauro",2014/10/5,Conference 2014 IEEE/AIAA 33rd Digital Avionics Systems Conference (DASC),• CFIS accidents — Functional/Architectural Complexity Failures — Flightcrew “minds-the-gap” 10–9 operational hazard and 10–5 automation design assurance • CFIS = no active speed control — No longer coupled/engaged — Speed control strategy • Flightcrew intervention task is not directly supported by flightdeck user-interface • Solution → explicitly design displays for intervention tasks,
A Network Model to Simulate Airport Surface Operations,"Adel Elessawy, Robert Eftekari, Yuriy Zhylenko, Kathryn Laskey, Lance Sherry",2014/2/11,"Description This paper details the systems engineering design and development of a tool to simulate aircraft surface operations and congestion at Hartsfield-Jackson Atlanta International Airport (ATL). Problem and need statements were formulated, an appropriate scope was identified, and a feasible methodology was produced. Multiple data sources were used to develop an aircraft kinematics model, simulation input models, and a wireframe network model representing ATL. The simulation tool was tuned such that outputs closely matched observed characteristics of normal, uncongested scenarios. A moderately complex graphical user interface was developed in conformance with international avionics standards.Analysis of the simulation tool indicates that it is an accurate representation of the upper half of ATL. Analysis also indicates that banks of aircraft arriving ahead of schedule may be the cause of severe congestion events. The airport surface simulation is modular, scalable to include additional airport objects and features, and adaptable to multiple airports.","This paper details the systems engineering design and development of a tool to simulate aircraft surface operations and congestion at Hartsfield-Jackson Atlanta International Airport (ATL). Problem and need statements were formulated, an appropriate scope was identified, and a feasible methodology was produced. Multiple data sources were used to develop an aircraft kinematics model, simulation input models, and a wireframe network model representing ATL. The simulation tool was tuned such that outputs closely matched observed characteristics of normal, uncongested scenarios. A moderately complex graphical user interface was developed in conformance with international avionics standards.",
Big data analysis of non-routine operations: Aborted approaches and their underlying factors,"Lance Sherry, John Shortle, Houda Kourdali, Zhenming Wang",2013/4/22,"Conference 2013 Integrated Communications, Navigation and Surveillance Conference (ICNS)",Presents a collection of slides covering the following topics: radar track data analysis; METAR data analysis; go around frequency data analysis; air traffic analysis; and traffic flow management initiatives.,
Airport surface gridlock analysis: A case study of Chicago O'Hare 2007,"Saba Neyshabouri, Lance Sherry, Karla Hoffman",2013/4/22,"Conference 2013 Integrated Communications, Navigation and Surveillance Conference (ICNS)","The evolution of Air Traffic Control (ATC) and Traffic Flow Management (TFM) over the last decade has resulted in improved coordination of departures and enroute trajectories to minimize airborne congestion and airborne holding. Since the system is a “closed-system,” the effect of these changes has been to shift airborne holding, to holding flights on the airport surface at the origin. This has placed increased emphasis on the coordination of gates, remote stands, airport parking, and surface trajectories. Previous research in this area has evaluated surface operations at specific airports through manual observation and/or surface track data, and through aggregate airport data and air traffic control logs. The purpose of this research is to develop a tool to systematically measure airport surface gridlock using publicly available data over extended periods of time (e.g. one year). The tool uses ASPM and AOTP data to …",
Passenger trip reliability metrics: 2011,"Lance Sherry, Kevin Lai, Sanja Avramovic, Ashwin Samant",2013/4/22,"Conference 2013 Integrated Communications, Navigation and Surveillance Conference (ICNS)",,
Um modelo para estimar métricas de confiabilidade de viagens de passageiros das companhias aéreas a partir de simulações de voo sistêmicas,Lance Sherry,2013/4,Journal Journal of Transport Literature,"SHERRY, Lance. Um modelo para estimar métricas de confiabilidade de viagens de passageiros das companhias aéreas a partir de simulações de voo sistêmicas. J. Transp. Lit.[online]. 2013, vol. 7, n. 2, pp. 319-337. ISSN 2238-1031. https://doi. org/10.1590/S2238-10312013000200017.",
Troublesome trends in US air transportation,"Lance Sherry, George Donohue",2012/11/1,Journal Aerospace America,"The ups and downs of the nation's airline industry have ripple effects throughout the U.S. economy. Since deregulation in 1978, decisions on fares and regions of service are left up to the carriers. But a changed economic picture may call for a larger government role and some dramatic innovations.",
Troublesome trendsinU. S.,"Lance Sherry, George Donohue",2012/11,Journal AEROSPACE AMERICA,"Viewpoint airline service was faster than the growth of the gross domestic product. In the second phase, from 1987 to 1997, expansion of service kept pace with growth in GDP. However, in the third phase, from 1997 to the present, airline service has expanded more slowly than the GDP. The result is that during the past decade, in the presence of a net growth in GDP, airlines are serving fewer markets with lower frequency of service and smaller aircraft than estimates would have pre-",
A Robust Method for Universal Beacon Code Assignment,"Vivek Kumar, Lance Sherry, Richard Jehlen",2012/10,Journal Air Traffic Control Quarterly,"This paper describes a method for assignment of beacon codes for secondary surveillance that eliminates the need for code reassignments. The method, Space-Time Adjacency algorithm, assigns unique codes to flights by exploiting the temporal and spatial opportunities in individual flight plans. In simulations of 2007 National Airspace System traffic using this method no reassignments were required. The method is robust for peak day operations in all seasons in the presence of temporal and spatial variations in flight plans. As a result, controller and pilot workload can be reduced, while increasing safety margins.",
"Metroplex Optimization Model Expansion and Analysis: The Airline Fleet, Route, and Schedule Optimization Model (AFRS-OM)","Lance Sherry, John Ferguson, Karla Hoffman, George Donohue, Frank Beradino",2012/8/1,Issue NASA/CR-2012-217755,"This report describes the Airline Fleet, Route, and Schedule Optimization Model (AFRS-OM) that is designed to provide insights into airline decision-making with regards to markets served, schedule of flights on these markets, the type of aircraft assigned to each scheduled flight, load factors, airfares, and airline profits. The main inputs to the model are hedged fuel prices, airport capacity limits, and candidate markets. Embedded in the model are aircraft performance and associated cost factors, and willingness-to-pay (i.e. demand vs. airfare curves). Case studies demonstrate the application of the model for analysis of the effects of increased capacity and changes in operating costs (e.g. fuel prices). Although there are differences between airports (due to differences in the magnitude of travel demand and sensitivity to airfare), the system is more sensitive to changes in fuel prices than capacity. Further, the benefits of modernization in the form of increased capacity could be undermined by increases in hedged fuel prices",
"Metroplex Optimization Model Expansion and Analysis: The Airline Fleet, Route, and Schedule Optimization Model","F Beradino, G Donohue, J Ferguson, K Hoffman, L Sherry",2012/8,"Description This report describes the Airline Fleet, Route, and Schedule Optimization Model (AFRS-OM) that is designed to provide insights into airline decision-making with regards to markets served, schedule of flights on these markets, the type of aircraft assigned to each scheduled flight, load factors, airfares, and airline profits. The main inputs to the model are hedged fuel prices, airport capacity limits, and candidate markets. Embedded in the model are aircraft performance and associated cost factors, and willingness-to-pay (ie demand vs. airfare curves). Case studies demonstrate the application of the model for analysis of the effects of increased capacity and changes in operating costs (eg fuel prices). Although there are differences between airports (due to differences in the magnitude of travel demand and sensitivity to airfare), the system is more sensitive to changes in fuel prices than capacity. Further, the benefits of modernization in the form of increased capacity could be undermined by increases in hedged fuel prices.","This report describes the Airline Fleet, Route, and Schedule Optimization Model (AFRS-OM) that is designed to provide insights into airline decision-making with regards to markets served, schedule of flights on these markets, the type of aircraft assigned to each scheduled flight, load factors, airfares, and airline profits. The main inputs to the model are hedged fuel prices, airport capacity limits, and candidate markets. Embedded in the model are aircraft performance and associated cost factors, and willingness-to-pay (ie demand vs. airfare curves). Case studies demonstrate the application of the model for analysis of the effects of increased capacity and changes in operating costs (eg fuel prices). Although there are differences between airports (due to differences in the magnitude of travel demand and sensitivity to airfare), the system is more sensitive to changes in fuel prices than capacity. Further, the benefits of modernization in the form of increased capacity could be undermined by increases in hedged fuel prices.",
How NextGen will maintain affordability of air travel in the presence of higher energy costs,Lance Sherry,2012/4/24,"Conference 2012 Integrated Communications, Navigation and Surveillance Conference",,
Anatomy of airline passenger,"Lance Sherry, Ashwin Samant",2012/4/24,"Conference 2012 Integrated Communications, Navigation and Surveillance Conference",,
Improving quality of prediction in highly dynamic environments using approximate dynamic programming 519: Y,"Rajesh Ganesan, Poornima Balakrishna, Lance Sherry",2012,Journal Quality Control and Applied Statistics,,
Analysis of the contribution of flight plan route selection to delays and conflicts,"Akshay Belle, Lance Sherry",2011/5/10,"Conference 2011 Integrated Communications, Navigation, and Surveillance Conference Proceedings","The absence of predictability of flight operations in the National Airspace System (NAS) is a significant source of excess cost, requiring airlines to pad flight schedules, staff for worst-case scenarios, and build and maintain mitigation plans and equipment. Flight plan routes are selected by airlines to optimize their operations (e.g. minimize crew time, fuel burn and delays). In the absence of coordination of 4-D flight plan route selection, flights can converge at the intersection of the flight plan routes, creating delays and fluctuations in A ir Traffic Control (ATC) workload. Furthermore, due to the high degrees of freedom available in flight plan route selection and the varying constraints in the NAS, flight plan route selection can contribute to the stochasticity of the NAS. This paper evaluates the role of flight plan route selection in the stochasticity and performance of the NAS. One hundred simulations were run using …",
"Optimizing Air Transportation Service to Metroplex Airports, Part 1: Analysis of Historical Data","George Donohue, Karla Hoffman, Lance Sherry, John Ferguson, Abdul Qadar Kara",2010/11,Issue NASA-CR-2010-216860,"The air transportation system is a significant driver of the US economy, providing safe, affordable, and rapid transportation. During the past three decades airspace and airport capacity has not grown in step with demand for air transportation (+ 4% annual growth), resulting in unreliable service and systemic delays. Estimates of the impact of delays and unreliable air transportation service on the economy range from $32 B to $41 B per year. This report describes the results of an analysis of airline strategic decision-making with regards to:(1) geographic access,(2) economic access, and (3) airline finances. This analysis evaluated markets-served, scheduled flights, aircraft size, airfares, and profit from 2005-2009. During this period, airlines experienced changes in costs of operation (due to fluctuations in hedged fuel prices), changes in travel demand (due to changes in the economy), and changes in infrastructure capacity (due to the capacity limits at Newark (EWR), Kennedy (JFK), and LaGuardia (LGA)). This analysis captures the impact of the implementation of capacity limits at airports, as well as the effect of increased costs of operation (ie hedged fuel prices). The increases in costs of operation serve as a proxy for increased costs per flight that might occur if auctions or congestion pricing are imposed.",
"Optimizing Air Transportation Service to Metroplex Airports, Part II: Analysis Using the Airline Schedule Optimization Model (ASOM)","George Donohue, Karla Hoffman, Lance Sherry, John Ferguson, Abdul Qadar Kara",2010/10,Issue NASA-CR-2010-216861,"The air transportation system is a significant driver of the US economy, providing safe, affordable, and rapid transportation. During the past three decades airspace and airport capacity has not grown in step with demand for air transportation; the failure to increase capacity at the same rate as the growth in demand results in unreliable service and systemic delay. This report describes the results of an analysis of airline strategic decision-making that affects geographic access, economic access, and airline finances, extending the analysis of these factors using historic data (from Part 1 of the report). The Airline Schedule Optimization Model (ASOM) was used to evaluate how exogenous factors (passenger demand, airline operating costs, and airport capacity limits) affect geographic access (markets-served, scheduled flights, aircraft size), economic access (airfares), airline finances (profit), and air transportation efficiency (aircraft size). This analysis captures the impact of the implementation of airport capacity limits, as well as the effect of increased hedged fuel prices, which serve as a proxy for increased costs per flight that might occur if auctions or congestion pricing are imposed; also incorporated are demand elasticity curves based on historical data that provide information about how passenger demand is affected by airfare changes.",
Optimizing Air Transportation Service to Metroplex Airports,"George Donoue, Karla Hoffman, Lance Sherry, John Ferguson, Abdul Qadar Kara",2010/10/1,Issue NF1676L-11436,"The air transportation system is a significant driver of the U.S. economy, providing safe, affordable, and rapid transportation. During the past three decades airspace and airport capacity has not grown in step with demand for air transportation; the failure to increase capacity at the same rate as the growth in demand results in unreliable service and systemic delay. This report describes the results of an analysis of airline strategic decision-making that affects geographic access, economic access, and airline finances, extending the analysis of these factors using historic data (from Part 1 of the report). The Airline Schedule Optimization Model (ASOM) was used to evaluate how exogenous factors (passenger demand, airline operating costs, and airport capacity limits) affect geographic access (markets-served, scheduled flights, aircraft size), economic access (airfares), airline finances (profit), and air transportation efficiency (aircraft size). This analysis captures the impact of the implementation of airport capacity limits, as well as the effect of increased hedged fuel prices, which serve as a proxy for increased costs per flight that might occur if auctions or congestion pricing are imposed; also incorporated are demand elasticity curves based on historical data that provide information about how passenger demand is affected by airfare changes.",
Towards a Mixed Integer Linear optimization model for universal beacon code assignment,"Vivek Kumar, Lance Sherry",2010/5/11,"Conference 2010 Integrated Communications, Navigation, and Surveillance Conference Proceedings",A Mixed Integer Linear Program (MILP) formulation of NAS-wide beacon code assignment in the CONUS is presented. The optimization model is also tested with historical data and results demonstrated for a limited scenario. The objective of this research is to minimize (and if-possible eliminate) the need for change in the flight beacon codes as they cross center boundaries en-route to their destination. This reduction in the need to change beacon codes can help alleviate the additional burden during the workload intensive hand-off procedures.,
Tarmac delay surveillance and mitigation system: Requirements analysis for NextGen,"Lance Sherry, Maricel Medina",2010/5/11,"Conference 2010 Integrated Communications, Navigation, and Surveillance Conference Proceedings","Several widely publicized incidents, in which passengers remained on an aircraft on the tarmac for up to 11 hours prompted the Department of Transportation (DOT) to issue a new rule designed to provide consumer protection to airline passengers. The rule mandates water/food/amenities for passengers on a plane for two hours, and an option to deplane after three hours. The rule also stipulates that airlines develop internal, auditable plans to meet the two/three hour clauses, and to report tarmac delays to the government for causal analysis. The underlying premise of the rule is that causal analysis (and incentives of fines) will enable elimination of the phenomenon. This approach assumes that the issue is not inherent to the design of the system-of-systems (e.g. span-of-control and availability of information), and that phenomenon that occur in-the-tails of the distribution are homogeneous and have finite causes. An …",
Analysis of “Tarmac Delays” at New York Airports,"Maricel Medina, Lance Sherry",2010/5/11,"Conference 2010 Integrated Communications, Navigation, and Surveillance Conference Proceedings","In response to media coverage of so called Tarmac Delays, new Department of Transportation (DOT) regulations come into effect on April 2010. These regulations outline airline responsibilities with regards to flights that remain on the ground in excess of two hours. Included in the regulations are requirements that airlines provide food, water and lavatory service for passengers delayed more than two hours on the tarmac, and for gate resources to be made available for flights to return to the gate and de-plane passengers for flights grounded for more than three hours. This paper describes the results of an analysis of “tarmac delays” at New York Airports from 2005 to 2009 using Bureau of Transportation Statistics (BTS) data: (i) John F. Kennedy (JFK), Newark Liberty International Airport (EWR) and La Guardia Airport (LGA) have been ranked as the top three airports with longest tarmac delays during the last five …",
Learning-based models for estimating airport taxi-out time using approximate dynamic programming,"Rajesh Ganesan, Lance Sherry, Poornima Balakrishna",2010/5/11,"Conference 2010 Integrated Communications, Navigation, and Surveillance Conference Proceedings","This paper discusses about stochastic dynamic programming approach to taxi out predictions that provides a method for sequential taxi out time predictions in real-time, predicts at least 15 minutes before scheduled push back time of a flight and method provides increased accuracy when compared with regression based model.",
The Relationship Between Rationalized Schedules and Reduced Arrival Variability,"John Shortle, Lance Sherry",2010,"Book 10th AIAA Aviation Technology, Integration, and Operations (ATIO) Conference","The objective of this paper is to determine the relationship between rationalized schedules and reduced arrival variability and their relative impact on reducing arrival delays. Many NextGen technologies and procedures aim to reduce arrival variability, while policies like congestion pricing and slot auctions seek to rationalize the schedule. Using a simple queueing model, we explore the relative impact of these reductions.",
Center for Air Transportation Systems Research Department of Systems Engineering and Operations Research George Mason University,"John F Shortle, Lance Sherry",2009/8/1,"Description Airport gates are one of the congestion points of the air transportation system. When an arriving flight lands on a runway, it is possible that it cannot pull into its gate due to gate unavailability. We define this phenomenon as gate-waiting delay. This paper gives a functional analysis of gate-waiting delays at New York Laguardia airport (LGA) for 92 days in the summer of 2007. We find that daily delays are typically not problematic (less than 600 minutes in 80 days). However, in the worst days, delays can be extremely large (1200 to 2400 minutes in the worst 4 days when worst 6 delayed flights are delayed for almost 3 hours in average). In the 12 worst days, there are 9 days in which delays can be attributed to a higher gate demand than the number of existing gates. On 8 of these days, this is due to compressed arrivals. On one day, this is due to increased gate-occupancy times. Delay mitigation strategies are also discussed.","Airport gates are one of the congestion points of the air transportation system. When an arriving flight lands on a runway, it is possible that it cannot pull into its gate due to gate unavailability. We define this phenomenon as gate-waiting delay. This paper gives a functional analysis of gate-waiting delays at New York Laguardia airport (LGA) for 92 days in the summer of 2007. We find that daily delays are typically not problematic (less than 600 minutes in 80 days). However, in the worst days, delays can be extremely large (1200 to 2400 minutes in the worst 4 days when worst 6 delayed flights are delayed for almost 3 hours in average). In the 12 worst days, there are 9 days in which delays can be attributed to a higher gate demand than the number of existing gates. On 8 of these days, this is due to compressed arrivals. On one day, this is due to increased gate-occupancy times. Delay mitigation strategies are also discussed.",
