titles,authors,date,source,descriptions,citations
Statistical separation standards for the aircraft-approach process,"Babak G Jeddi, John F Shortle, Lance Sherry",2006/10/15,Conference 2006 ieee/aiaa 25TH Digital Avionics Systems Conference,"Demand for air transportation has been increasing. A response to this is enhancing the runway utilization and throughput before investing on new runways or instruments. Runway throughput can be increased by reducing in-trail landing separation between aircraft, but the consequence may be an increase in the chance of a severe wake vortex encounter or a simultaneous runway occupancy (or go-around). Current instrument flight rule (IFR) standards provide fixed separation minima for given pairs of wake vortex weight classes of aircraft. In practice, the observed separation is a random variable and fluctuates near or above the specified minimum. In this paper, we propose a framework for statistical separation standards that specifies not only a lower bound for the separation but also a standard for the target value and the variance of the process. We address the question of what a more efficient separation …",8
Automotive-grade MEMS sensors used for general aviation,"Lance Sherry, Chris Brown, Ben Motazed, Dave Vos",2004/12/13,Journal IEEE Aerospace and Electronic Systems Magazine,"The attitude heading reference system (AHRS) provides data for primary flight instruments, head-up displays, autopilots, and moving map navigation systems. Advances in solid-state MEMS rate sensors, coupled with Kalman filter algorithms designed to mitigate high drift rates, provide the basis for low-cost, high-performance AHRS for general aviation. This paper describes the performance of a low cost, miniaturized AHRS using automotive-grade MEMS sensors. The performance of the system is detailed. The implications for certification of this class of system and fault tolerance are discussed.",8
Drinking from the fire hose: Why the flight management system can be hard to train and difficult to Use,"Lance Sherry, Michael Feary, Peter Polson, Karl Fennell",2003/7/1,Issue NASA/TM-2003-212274,"The Flight Management Computer (FMC) and its interface, the Multi-function Control and Display Unit (MCDU) have been identified by researchers and airlines as difficult to train and use. Specifically, airline pilots have described the ""drinking from the fire-hose"" effect during training. Previous research has identified memorized action sequences as a major factor in a user s ability to learn and operate complex devices. This paper discusses the use of a method to examine the quantity of memorized action sequences required to perform a sample of 102 tasks, using features of the Boeing 777 Flight Management Computer Interface. The analysis identified a large number of memorized action sequences that must be learned during training and then recalled during line operations. Seventy-five percent of the tasks examined require recall of at least one memorized action sequence. Forty-five percent of the tasks require recall of a memorized action sequence and occur infrequently. The large number of memorized action sequences may provide an explanation for the difficulties in training and usage of the automation. Based on these findings, implications for training and the design of new user-interfaces are discussed.",8
Drinking from the Fire Hose: Why the FMC/MCDU can be hard to learn and difficult to use,"Lance Sherry, Peter Polson, Karl Fennell, Michael Feary",2002,Publisher Honeywell internal report C69-5370-022,,8
Formal method for identifying two types of automation-surprises,"Lance Sherry, Michael Feary, Peter Polson, Everett Palmer",2000,"Journal Honeywell, Phoenix, AZ, Tech. Rep. C69-5370-016","“Automation surprises” occur when operators of sophisticated automation, such as pilots of aircraft, hold a mental model of the behavior of the automation that does not reflect the actual behavior of the automation. This leads to increased workload, and reduced efficiency and safety.",8
Primer on aircraft induced clouds and their global warming mitigation options,"Lance Sherry, Terrence Thompson",2020/11,Journal Transportation Research Record,"Pressure is increasing on all industrial sectors to address climate sustainability, not only for the welfare of the planet, but also to preserve the customer base and manage operating costs. The aviation industry has a unique opportunity to halve its global radiative forcing (RF) contribution by minimizing the generation of aircraft induced clouds (AIC). These anthropogenic (human-made) condensation trails create a greenhouse effect by absorbing or directing back to Earth approximately 33% of emitted outgoing thermal longwave radiation. The effect of AIC accounts for 2% of the Earth's total anthropogenic RF. The effect of reducing AIC on global warming is immediate (unlike CO2 emissions which have a 2-decade delay in affecting global warming).",7
"Evaluation of technology concepts for energy, automation, and system state awareness in commercial airline flight decks","Lynda J Kramer, Timothy Etherington, Emory Evans, Taumi Daniels, Steven D Young, James Barnes, Stefan Schuet, Thomas Lombaerts, Lance Sherry",2019,Book AIAA Scitech 2019 Forum,"In the period 2010 to 2014, the Commercial Aviation Safety Team (CAST) sponsored a study of 18 commercial aviation events that occurred within~ 10 years prior to the study kickoff. The results identified 12 recurring problem themes involving loss of airplane state awareness by the flight crew and suggested a number of intervention strategies [1]. CAST assessed these strategies for effectiveness and feasibility, and recommended Safety Enhancements (SEs) for the industry to implement [2]. Of these, six were deemed to require research to enable the enhancement. As part of its role in CAST, NASA initiated subprojects within the Airspace Operations and Safety Program to collaborate with the industry to produce many of these outputs.",7
Available operational time window: A method for evaluating and monitoring airline procedures,"Houda Kerkoub Kourdali, Lance Sherry",2017/12,Journal Journal of Cognitive Engineering and Decision Making,"Time is a widely accepted means for evaluation of procedures used in the management and control of complex, dynamic systems, such as airliners. Time provides a common unit of measurement of operator performance in the context of the task in both naturalistic and experimental conditions. Time is also correlated with errors, operational efficiency, and task loading. Analytical and simulation methods used for the design and evaluation of procedures require information on the allowable operational time window (AOTW). For complex, dynamic systems, such as airliners, the AOTW exhibits a high degree of variance. The statistical properties of the AOTW have not been readily available to designers. The recent availability of flight data monitoring/flight operations quality assurance, typically used for aircraft performance and maintenance purposes, provides the means to characterize the statistical properties of the …",7
Functional complexity failures and automation surprises: The mysterious case of Controlled Flight Into Stall (CFIS),"Lance Sherry, Robert Mauro",2015,Journal 18th International Symposium on Aviation Psychology,"Nineteen modern airliner Loss of Control (LOC) accidents resulting in aerodynamic stalls were analyzed. These accidents involved structurally and mechanically sound aircraft decelerating through the 1.3 VStall buffer to the stall airspeed-ie a Controlled Flight into Stall (CFIS). The analysis produced three main observations: First, the accidents were “functional complexity” failures--the result of a complex sequence of behaviors of the automation functions. There were no consistent: failures that triggered the events (eg sensor failures), effects of triggering events on the automation (eg mode change), or commands issued by the automation (eg thrust setting). Second, the pilots were unable to intervene effectively due to the absence on the flight deck of relevant information and salient cues to monitor these rare events or their effects. Third, there was no single intervention that could mitigate all of these accidents. Implications for flight deck procedures, training and automation design are discussed.",7
Analysis of airport surface operations: a case-study of Atlanta Hartfield airport,"Saba Neyshabouri, Lance Sherry",2014/1,"Journal Proceedings of the Transportation Research Board 93rd Annual Meeting, Washington, DC, USA","Over the last two decades the successes of Traffic Flow Management (TFM) initiatives have successfully decreased the airborne delay for the flights in the National Airspace System (NAS). The next opportunity for efficiency improvement is airport surface operations. Research on surface operations has focused on methods of analysis and metrics using time-stamped event data and surface track data to quantify performance of “normal” operations. This paper describes a method using time-stamped event data to quantify and diagnose “irregular” surface operations (ie surface counts in excess of two standard deviations from the mean worst-case surface count). An analysis of surface operations at Hartsfield-Jackson Atlanta International (ATL) airport for 2012 identified an average surface count of 25 active flights, with an average daily maximum surface count of 67. The daily maximum surface count ranged from 46 to 124 active flights. On 18 days the daily maximum surface count exceeded 2 standard deviations from the average (ie 2= 86 flights). Fifteen of these days occurred between May and August. There are multiple patterns in the surface counts in excess of 2:(i) reduced airport departure rates coupled with arrivals being delayed by a ground delay program (ii) changes in runway configuration,(iii) fluctuating arrival capacity (iv) high early arrival count with no or minimal capacity reduction (ie “blue sky days”). The high surface counts in 9 of the 18 days were compounded by interaction between arrivals and departures. These results suggest an opportunity to coordinate arrivals, gate operations, and departures to balance operations at the overall …",7
A methodology for airport arrival flow analysis using track data—A case study for MDW arrivals,"Akshay Belle, Lance Sherry, Michael Wambsganss, Anastasia Mukhina",2013/4/22,"Conference 2013 Integrated Communications, Navigation and Surveillance Conference (ICNS)",Traffic flow in the Terminal Radar Approach Control Facilities (TRACON) is a significant factor in determining airport throughput capacity and airline operational efficiency. In recent years the availability of high fidelity terminal area track data has made it possible to increase the granularity of airport and airspace performance analysis. This paper describes a methodology for airport arrival flow analysis using National Offload Program (NOP) track data. The analysis provides insight into track distances flown and track time for alternate terminal arrival flows (i.e. from the final waypoint in the Standard Terminal Arrival Route (STAR) to the runway threshold via a type of approach). The methodology is applied to 35 days of NOP track data for Chicago TRACON (C90) for arrivals into MDW. Arrivals into MDW landing to the northwest on 31C and to the north-east on 4R exhibit the shortest average track distance (28.42 NM and …,7
Passenger trip delays statistics for 2010,Lance Sherry,2012,Source Transportation Research Board 91st Annual MeetingTransportation Research Board,"The raison d'etre of the Airline Passenger Transportation System (APTS) is the rapid, affordable, and safe transportation of passengers (and cargo). The top-level performance measure of the system is passenger trip delay, defined as the difference between ticketed passenger arrival time and actual passenger arrival time. Passenger trip delay accounts for delays caused by cancelled flights, missed connections and diversions, as well as delayed flights. Algorithms developed to estimate passenger itineraries and passenger trip delay statistics using publicly available data were used to generate passenger trip delay statistics for 2010. In 2010 an estimated 421 million passengers ticketed on 46.8 million itineraries were transported on 8.7 million flights. Passenger on-time performance was 78.7%. The average delay for a disrupted passenger was 67 minutes. The total trip delay experienced by passengers in 2010 was 11,669 years. The largest contributors to total passenger trip delays were: passengers on direct itineraries disrupted by delayed flights-32%, passengers on connecting itineraries disrupted by cancelled flights-23%, connecting itineraries disrupted by delayed flights-16%, and missed connections-14%. Since 2007, annual passenger trip delay is down 26%, however in 2010 1-in-5 passengers experienced a trip disruption (compared to 1-in-4 in 2007) with an average delay for disrupted passengers of 67 minutes (73 minutes in 2007). These results highlight the important role the “structure” of the airline network, in addition to on-time flight performance, plays in determining passenger trip reliability, and have important implications for …",7
Unmanned aerial vehicle (UAV) cargo system: senior design capstone project,"K Han, AM Garcia, IM Leo, MM Campo, C Muhammad, L Ortiz-Valles, GL Donohue, H Redeiss, L Sherry",2004/4/16,"Conference Proceedings of the 2004 IEEE Systems and Information Engineering Design Symposium, 2004.","To respond to current and future consumer demands in air cargo delivery, an unmanned air vehicle (UAV) cargo system is proposed. It would provide a safe, automated air cargo system which could be operational and more cost effective than the existing system. The system could potentially operate twenty four hours a day, seven days a week and provide guaranteed one business day delivery service. For the UAV cargo system to be in full operation it is assumed that the operational ground infrastructure for airport-independent operations is in place, accurate, and reliable, and the data link communication between air traffic control (ATC) and the UAV are in place. The analysis approach consists of evaluating the operational cost of the system by performing a trade-off analysis to measure the feasibility of the UAV cargo system for a business case; simulating the landing and en-route portion of the alternative …",7
Design of a Display for Alerting Cockpit Automation Function Configuration Changes,"Lance Sherry, Oleksandra Sasha Donnelly",2019/4/9,"Conference 2019 Integrated Communications, Navigation and Surveillance Conference (ICNS)","The evolution of automation on the modern airliner flight deck has resulted in a ""stack"" of functions that has been incrementally ""layered"" over time to support the flight crew in performing the mission. The stack includes automation functions for: (1) Stability Augmentation and Engine Control for instantaneous control of aerodynamic control surfaces and engines, (2) Autopilot and Autothrottle for tactical control of the trajectory, and (3) Flight Management for strategic flight plan path management and optimization. By engaging/disengaging these functions there are up to 16 combinations of automation function configurations that can be engaged at any time. Due to the evolutionary development of the flight deck, the engagement status of the combination of functions is annunciated in an adhoc, distributed fashion across the flight deck displays. There is no single display of the consolidated automation function …",6
Collision risk analysis for alternate airspace architectures,"John Shortle, Seungwon Noh, Lance Sherry",2017/9/17,Conference 2017 IEEE/AIAA 36th Digital Avionics Systems Conference (DASC),"This paper investigates an airspace architecture in which the core requirement is maintaining a target level of collision risk throughout the airspace, accounting for a diversity of aircraft types and a diversity of collision avoidance capabilities in different regions of the airspace. Because collision risk depends on both the density of aircraft and the collision avoidance capabilities of the aircraft involved, aircraft with better collision avoidance capabilities are able to fly in regions of higher density. Conversely, aircraft with lesser collision avoidance capabilities are restricted to less dense airspace or off-peak hours. This paper provides a framework for evaluating the proposed architecture, including a framework for evaluating collision risk based on the numbers and types of aircraft in the airspace and a framework for specifying the corresponding airspace admittance function. Properties of the airspace admittance function are …",6
Needs analysis and technology alignment method: A case study of planning work in an International Space Station Controller Group–Part 1,"Dorrit Billman, Michael Feary, Debra Schreckenghost, Lance Sherry",2015/6,Journal Journal of Cognitive Engineering and Decision Making,"Our research (reported in two parts) improved software for a NASA Mission Controller group for the International Space Station and provided evidence for a key factor we believed contributed to the expected improvement. This factor is the degree of alignment of the technology to the structure of the work it is intended to support, or its fitness-for-purpose. This paper, Part 1, reports our needs analysis and software redesign, which provide specific and more general contributions. The specific contribution was new prototype software for planning work of the Attitude Determination and Control Officer group, who schedules trajectory and orientation changes of the International Space Station, with its Russian counterparts. The general contribution was a new needs analysis method, product-document analysis, a general design-process benefit. Product document analysis is a method complementary to task analysis and …",6
Estimating takeoff thrust from surveillance track data,"Lance Sherry, Saba Neyshabouri",2014/1,Journal Transportation Research Board Annual Meeting,"Emissions inventory calculations for airports, using standard emissions inventory reporting methods, are inflated due an assumption of use of maximum takeoff thrust. To enhance the operational life of jet engines and reduce fuel burn, airlines frequently use reduced thrust (ie Derated or Flex Temperature thrust) for the takeoff procedure. Without access to internal airline “load sheet” paperwork or flight data recorders it is not possible to identify the thrust setting for each departure operation and account for the reduced thrust in emissions inventory calculations.",6
Analysis of stakeholder benefits of nextgen trajectory-based operations,"Guillermo Calderón-Meza, Lance Sherry",2010/5/11,"Conference 2010 Integrated Communications, Navigation, and Surveillance Conference Proceedings",Trajectory-Based Operations is a NextGen initiative that seeks to increase the effective-capacity of the National Airspace System by adding flexibility to the 4-D trajectories as flights traverse airspace.,6
Airline response to changing economics and policy,"John Ferguson, Karla Hoffman, Lance Sherry, George Donohue, Abdul Qadar Kara",2010/5/11,"Conference 2010 Integrated Communications, Navigation, and Surveillance Conference Proceedings","Industry strategists, government regulators, and the media have focused on addressing concerns over the performance of the air transportation system with respect to delays. One of the strategies proposed has been to limit the scheduled operations at an airport to a-priori feasible capacity limits. This approach has been criticized on the basis that it would reduce the number of markets served and increase airfares. This paper describes a comparison of the behavior of the air transportation system (e.g. markets served, airfares, delays, load factors, aircraft size) during the recent run-up in fuel prices at capacity-limited New York airports and non-slot controlled San Francisco and Philadelphia airports. The results indicate: i. Airfares change show a positive relationship to to changes in fuel prices 11. m. IV. Flights per day and Markets served show a positive relationship to changes in gross domestic product Flights per …",6
Estimating the benefits of human factors engineering in NextGen development: Towards a formal definition of pilot proficiency,"Lance Sherry, Michael Feary, Karl Fennell, Peter Polson",2009,"Book 9th AIAA Aviation Technology, Integration, and Operations Conference (ATIO) and Aircraft Noise and Emissions Reduction Symposium (ANERS)","Current design and certification processes for avionics, aircraft, and pilots prove the reliability of the “deterministic” automated functions in a comprehensive manner. The design and certification requirements for ensuring and testing the reliability of the inherently “non-deterministic” operator interaction with the automation are not rigorous and are the source of operational inefficiencies and reduced safety margins. Unless the design and certification process are radically modified and refocused, pilots will find themselves with the same types of issues that researchers documented with the introduction of the “glass cockpit” in the 1980s and 1990’s. This paper provides a quantifiable definition of Human Computer Interaction performance and explicit measures of individual and crew proficiency. A method for estimating revenue-service cost savings generated by improved proficiency is described along with an example …",6
Passenger flow simulation (PFS) in a complex networked transportation system,"Danyi Wang, Lance Sherry, George Donohue, Bert Hackney",2008,Journal Submitted to International Conference on Research in Air Transportation,"Passenger trip time performance is positively correlated with passenger satisfaction, airfare elasticity, and airline profits. Researchers have demonstrated that flight metrics are poor proxy for passenger trip experience. Trip delays experienced by passengers due to missed connections and cancelled flights are not negligible.",6
System analysis of flight and passenger trip delays in the National Airspace System (NAS),"Danyi Wang, Lance Sherry, Ning Xu, George Donohue",2007/10/21,Conference 2007 IEEE/AIAA 26th Digital Avionics Systems Conference,"The primary objective of the National Airspace System (NAS) is the transportation of passengers and cargo. It is no surprise, therefore, that passenger trip time performance is positively correlated with passenger satisfaction, airfare elasticity, and airline profits. Regulatory consumer information available to airline passengers provides measures of trip performance using only flight data (and not passenger trip data). Previously, researchers, using a small set of proprietary airline data, demonstrated that trip delays experienced by passengers due to missed connections, cancelled flights, and delayed flights are not negligible. Further they showed that flight delay data cannot be used as a proxy for passenger trip delays. This paper describes a comparative statistical analysis between flight delay data and passenger trip delay data for one year's worth of flights on the 1030 single segment routes between the OEP-35 …",6
Portfolio Analysis of Air Transportation Infrastructure Investment,"Bengi Mezhepoglu, Lance Sherry",2006/7/31,"Journal Transportation Research Board, 2007 Annual Meeting","The air transportation system is a significant “engine” of the national economy providing costeffective transportation of goods and services. This form of transportation is heavily reliant on a large, distributed, and capital-intensive infrastructure that must be maintained and enhanced in a timely manner to ensure a reliable transport service. Researchers have shown that the national air transportation infrastructure must be enhanced to meet the growing demand. This paper describes the results of an analysis of alternative investment strategies for increasing the capacity of the National Airspace System (NAS). The dynamic system analysis shows that there exists a tradeoff between the cost of any unutilized capacity that is added, and the cost of congestion not addressed by additional capacity. Table 1 shows the trade-space for decision makes to choose the optimum investment given their risk acceptance and the start time of the capacity project. Net Present Value (NPV) is maximized for risk-averse decision makers when capacity is increased moderately (25%) with lead-times less than 5 years.",6
Evaluation of a formal methodology for developing aircraft vertical flight guidance training material,"Michael Feary, Lance Sherry",1998/10,Source Proceedings of the Human Factors and Ergonomics Society Annual Meeting,"Aircraft automation, particularly the automation surrounding vertical navigation, has been cited as an area of training difficulty and a source of confusion during operation. A number of incidents have been attributed to a lack of crew understanding of what the automation is doing. This paper describes the translation of information from a formal methodology used in design of an automated vertical guidance system to a training package, and an experiment that tested the new training. This study is part of a larger project to improve the recognition and understanding of the “objectives and behaviors” of automated systems through a formal methodology. The formal method, referred to as the operational procedures methodology, integrates the design of the system with the design of the training and display information requirements for that system (Sherry, 1995). The study utilized a training package designed to teach the …",6
