titles,authors,date,source,descriptions,citations
Simulating the impact of gate operation disruptions and mitigation strategies on gate delay,"Jianfeng Wang, John F Shortle, Lance Sherry",2011/5/10,"Conference 2011 Integrated Communications, Navigation, and Surveillance Conference Proceedings","When an arriving flight cannot pull into its gate, this is called gate delay. This paper presents a simulation model to evaluate the impact of gate operation disruptions and gate-delay mitigation strategies. Operation disruptions investigated include arrival delays, longer gate blocking times, and unavailable gates. Mitigation strategies investigated include adding new gates, implementing common gates, using overnight off-gate parking and adopting self-docking gates. Simulation results show the following effects of disruptions: (i) The impact of arrival delay in a time window is bounded, (ii) The impact of longer gate-blocking times increases linearly in the size of the disruption, (iii) Reduced gate availability has a small impact when a small number of gates are affected, due to slack gate capacity, but when the slack gate capacity is used up, gate delay increases non-linearly. Simulation results show the following effects of …",2
NAS-wide simulation and passenger itinerary performance: Implications for NextGen benefits analysis,Lance Sherry,2011/5/10,"Conference 2011 Integrated Communications, Navigation, and Surveillance Conference Proceedings","NAS-wide simulations are one of the methods used to estimate annual system-wide benefits for Air Traffic Control modernization concepts-of-operations and technologies (e.g. NextGen/SESAR). These tools simulate the operation of up to 60,000 flights per day in various combinations of demand (i.e. flights) and capacity (i.e. airport and airspace capacity). The main input to the simulation is a schedule of flights (not a schedule of passenger itineraries). As a result, estimates of passenger delays assume all passengers are on direct itineraries only, and the impact of cancelled flights, missed connection, and airline network effects are not considered. This paper describes the results of an aggregate model of the operation of a hub-and-spoke network that takes into account passenger itineraries (i.e. direct and connecting) and a ll forms of itinerary disruptions (i.e. delayed flights, cancelled flights and missed connections …",2
Rethinking airport improvement: Analysis of domestic airline service to us metroplex airports,"David Schaar, Lance Sherry, George L Donohue",2010/3,Journal CASTR Internal Report CASTR-01-2010,"The airline transportation system is a significant component of the US economy providing rapid, safe, cost-effective transportation services. Regional airport authorities play a significant role in shaping the airline transportation system. Operating as “public utilities,” airport authorities seek to serve the interests of the businesses and residents of their region by working to ensure cost-effective connectivity in support of the region’s economy.",2
Analysis of gate-hold delays at the OEP-35 airports,"John F Shortle, Jianfeng Wang, Juan Wang, Lance Sherry",2009,Journal Submitted to The eighth USA/Europe Seminar on Air Traffic Management Research & Development,"One point of congestion in the air transportation system is the set of gates at a terminal. When an inbound flight is unable to pull into its assigned gate, the flight, its connecting passengers, and its flight crews experience delays and missed connections. Previous research has focussed on optimizing gate assignments, both scheduled and disrupted, and optimizing surface flow. This paper analyzes the degree to which gate hold is a problem and the functional causes of gate hold. Analysis of flight performance data for 35 OEP airports for the summer of 2007 identifies that:(i) Significant gate-hold delays, in which more than 30% of arriving aircraft are delayed, occurred at 11 of the OEP-35 airports,(ii) major gate-hold delays are rare events (eg, once a month at ATL),(iii) on days when there is a major gate hold, large delays are experienced by all major carriers at the airport,(iv) the primary causes of gate-hold delays are increased turnaround times and/or disrupted arrival/departure banks. The methodology for analysis, the results, and the implications of these results are discussed.",2
Why Equity Is so Elusive: Dynamical Properties of Overscheduled National Airspace System Resources,"Lance Sherry, John Shortle, Vivek Kumar",2009/1/1,"Book 9th AIAA Aviation Technology, Integration, and Operations Conference (ATIO) and Aircraft Noise and Emissions Reduction Symposium (ANERS)","One of the major issues in the design of the concepts-of-operations for NEXTGEN is the equitable allocation of overscheduled National Airspace System (NAS) resources. Although federal regulations, Congressional policies, and modernization plans call for equitable allocation of publicly held resources, the mechanisms for equitable allocation, and the tradeoffs that must be made between stakeholders, exhibit a high degree of social, political, and economic complexity. Further, the allocations that are routinely made in Traffic Flow Management (TFM) and Air Traffic Control (ATC) are subject to widespread perceptions of systemic inequity and economic inefficiency. This paper describes the properties associated with the dynamic allocation of an overscheduled resource. The mathematical model demonstrates that (i) a natural equity asymmetry exists in the first-scheduled/firstallocated mechanism,(ii) this asymmetry …",2
Accuracy of Reinforcement Learning Algorithms for Predicting Aircraft Taxi-out Times,"Poornima Balakrishna, Rajesh Ganesan, Lance Sherry",2008,Journal Proceedings of the ICRAT,"Taxi-out delay is a significant portion of the block time of a flight. Uncertainty in taxi-out times reduces predictability of arrival times at the destination. This in turn results in inefficient use of airline resources such as aircraft, crew, and ground personnel. Taxi-out time prediction is also a first step in enabling schedule modifications that would help mitigate congestion and reduce emissions. The dynamically changing operation at the airport makes it difficult to accurately predict taxi-out time. In this paper we investigate the accuracy of taxi out time prediction using a nonparametric reinforcement learning (RL) based method, set in the probabilistic framework of stochastic dynamic programming. A casestudy of Tampa International Airport (TPA) shows that on an average, with 93.7% probability, on any given day, our predicted mean taxi-out time for any given quarter, matches the actual mean taxi-out time for the same quarter …",2
Performance of the Air Transportation System for the Atlanta-Chicago-O'Hare Route,"David Schaar, Lance Sherry",2006/10/15,Conference 2006 ieee/aiaa 25TH Digital Avionics Systems Conference,"The goal of the air transportation system is to provide reliable, affordable, rapid transportation of people and goods. This service is achieved by the interaction between autonomous, distributed agents (e.g. airports, air traffic control and airlines) that operate under a high degree of uncertainty (e.g. weather, economy). As a consequence, the overall speed of and reliability of this mode of transportation is determined by the collective interaction between these agents and the impact of uncertainty in the system. This paper describes a methodology and the results of an analysis of the degree of uncertainty in trip time reliability on a single congested-hub to congested-hub route (Atlanta - Chicago O'Hare). The analysis identified that the actual gate-to-gate trip time varies by up to 30% of the average trip time. The analysis also identified systemic schedule padding of 16 minutes on this route, and statistically significant …",2
Overview of the FAA's NAS Strategy Simulator,"Lance Sherry, Bengi Mezhepoglu, Dan Goldner, Anne Yablonski, D Knorr",2005/5/3,Journal NASA-Integrated CNS Conference,,2
Accessing FMS functionality: The impact of design on learning,"Karl Fennell, Lance Sherry, Ralph Roberts Jr",2004/8/1,Issue IH-051,"In modern commercial and military aircraft, the Flight Management System (FMS) lies at the heart of the functionality of the airplane. The nature of the FMS has also caused great difficulties learning and accessing this functionality. This study examines actual Air Force pilots who were qualified on the newly introduced advanced FMS and shows that the design of the system itself is a primary source of difficulty learning the system. Twenty representative tasks were selected which the pilots could be expected to accomplish on an ' actual flight. These tasks were analyzed using the RAFIV stage model (Sherry, Polson, et al. 2002). This analysis demonstrates that a great burden is placed on remembering complex reformulation of the task to function mapping. 65% of the tasks required retaining one access steps in memory to accomplish the task, 20% required two memorized access steps, and 15% required zero memorized access steps. The probability that a participant would make an access error on the tasks was: two memorized access steps - 74%, one memorized access step - 13%, and zero memorized access steps - 6%. Other factors were analyzed as well, including experience with the system and frequency of use. This completed the picture of a system with many memorized steps causing difficulty with the new system, especially when trying to fine where to access the correct function.",2
How a cognitive tutor can improve pilot knowledge of mode transitions,"Denis Javaux, Lance Sherry",1999/10/24,Conference Gateway to the New Millennium. 18th Digital Avionics Systems Conference. Proceedings (Cat. No. 99CH37033),"The behavior of a modern autopilot is governed by a set of rules. Several researchers have demonstrated that pilots have gaps in their knowledge of these rules and have difficulty explaining and predicting the behavior of the autopilot. Apart from the absence of training and cockpit annunciations, natural cognitive mechanisms cause pilots to forget (due to infrequent use) and simplify (due to similarities) the rules of behavior. This paper describes how a cognitive tutor can counteract the cognitive mechanisms that forget conditions and simplify rules.",2
Application of CASE tools in the development of commercial avionics software,"Lance Sherry, Arturo Suarez, Phil Wolfe",1998/10/14,"Conference SMC'98 Conference Proceedings. 1998 IEEE International Conference on Systems, Man, and Cybernetics (Cat. No. 98CH36218)","CASE tools increase productivity in the development of software-based systems by performing analysis that cannot be done by humans, and by automating repetitive tasks. The potential of these tools has not been realized due to limited use by small pockets of engineers. The paper describes the results of a survey that explores the perceptions of the engineers that use CASE tools for the development of certified software for commercial air transport avionics. All the engineers cited improvements in software duality, but were split down the middle on the contribution of CASE tools to reduction in project cycle-time. Ease-of-use of the tool the most critical factor in the individual engineers choice to use a CASE tool. Differences between the format and style of documents and code generated by the CASE tool and the corporate format and style standards is the biggest hurdle to integrating CASE tools into corporate …",2
Wake Turbulence Research Modeling,"John Shortle, Lance Sherry, Jianfeng Wang, Yimin Zhang, C Doug Swol, Antonio Trani",C. Doug Swol and Antoni Trani. George Mason University. Virginia Tech,"Description • This presentation and a companion presentation from MIT examine the NextGen Concept of Operations to determine what parts (if any) of the concept may cause an increased risk of an aircraft encountering a wake turbulence hazard over today’s operations• Identification of these potential risk areas will help the FAA focus efforts towards a more refined risk assessment and development of any necessary mitigation strategies• The main focus of the research work presented is the development of tools (ie, computer models) to study potential wake turbulence hazards in future NextGen procedures",• This presentation and a companion presentation from MIT examine the NextGen Concept of Operations to determine what parts (if any) of the concept may cause an increased risk of an aircraft encountering a wake turbulence hazard over today’s operations,2
Lessons Learned From Human Operator Intervention for Ai Navigation and Flight Management Systems,"Jomana Bashatah, Lance Sherry",2022/4/5,"Conference 2022 Integrated Communication, Navigation and Surveillance Conference (ICNS)","The advent of Machine Learning (ML) has made possible the deployment of AI systems to perform complex decision-making formerly performed by ""expert"" human operators. Although modern airliner avionics were not developed using ML methods, they exhibit the characteristics of complex AI functions, especially regarding the complex decision making required for Flight Planning, Navigation, Guidance and Control functions. To address operational situations that the AI functions are not designed for, human operators are required to monitor and intervene should the AI functions command the vehicle into a hazardous operating region. Accident investigations of modern airliner accidents have cited the failure of the flight-crew to complete the required intervention Standard Operating Procedure in a timely manner. This will be an important issue that must be addressed in the design of the proposed new eVTOL/eSTOl …",1
Design of an Aircraft Induced Cloud (AIC) Abatement Program (AAP) for Global Warming Mitigation,"Lance Sherry, Amy Rose, Terry Thompson",2021/4/19,Conference 2021 Integrated Communications Navigation and Surveillance Conference (ICNS),"Aircraft Induced Clouds (AIC), also known as Contrails, absorb, scatter and reflect back to the Earth an estimated 33% of the outgoing ""thermal"" radiation emitted from the Earth that is directed at the cloud. The resulting global warming is estimated to account for 55% of aviation's total contribution to global warming. The CO2 emissions from aircraft is estimated to account for only 39% of aviation's total contribution. Recent studies of options to mitigate the global warming effects of AIC identified that the most cost effective and near-term solution is an ""operational"" change such that flights fly over the Ice Super Saturated Regions (ISSR) in the atmosphere in which AIC are generated. This operational change would affect, on average, only 15% of the flights each day and would add no net direct operating cost to the airlines or Air Traffic Control while reducing global warming immediately. When the industry decides to take …",1
Best of Both Worlds: Using Explainable AI and Model-based System Engineering to Design Flight Guidance and Control Systems,"Lance Sherry, James Baldo, Brett Berlin, Oleksandra Snisarevska",2021,Book AIAA AVIATION 2021 FORUM,View Video Presentation: https://doi.org/10.2514/6.2021-2779.vid,1
Systems and methods for improved aircraft safety,"Lance Sherry, Oleksandra Snisarevska",2020/10/8,Patent office US,Methods and system for improved aircraft safety are described herein. A machine learning model may be trained using historical flight data for a number of previously flown flights where an automation function autonomously disengaged. The trained machine learning model may be used to generate probabilistic alert rules. The probabilistic alert rules may be used by a computing device onboard an aircraft to provide contextual information to flight crew relating to engagement status for one or more automation functions of the aircraft.,1
Agent-based simulation of metropolitan area evacuation by unmanned air mobility,"Jonathan West, Lance Sherry",2020/9/8,Conference 2020 Integrated Communications Navigation and Surveillance Conference (ICNS),"Researchers have proposed a portfolio of autonomous transportation systems for metropolitan areas including Urban Air Mobility (UAM) systems. Urban Air Mobility systems consist of low occupant battery operated helicopters, similar to drones. In a future state, when Urban Air Mobility is a ubiquitous transportation option, urban planners will need to understand the potential role of the Urban Air Mobility system for an efficient evacuation of a metropolitan area. An agent-based model is used to assess the evacuation efficiency as throughput and time to complete. The agent-based model includes autonomous Urban Air Mobility systems operating in an urban environment on routes defined by existing city streets and originating at a central location that may be on the ground or on the top of a building. In the event of an evacuation, the routing of each Urban Air Mobility unit is determined by a central air traffic flow …",1
Confronting Functional Complexity Failures: The Case of a Runway Excursion in Munich,"Robert Mauro, Lance Sherry",2019/11,Journal Proceedings of the Human Factors and Ergonomics Society Annual Meeting,"Complex systems often produce unanticipated emergent behavior as a result of the interactions between behaviorally complex sub-systems or agents. The sub-systems may be human or artificial. They may be co-located or geographically distributed and operate autonomously. Although the individual sub-systems may be tested and certified for high levels of reliability (e.g. 10-7), interactions between the sub-systems may occur so that emergent behaviors allow the system to migrate into an unsafe operating region. This may occur even when all of the sub-systems are behaving nominally and no equipment has failed. This phenomenon is called a “functional complexity failure.” In this paper, we present an analysis of a functional complexity failure that resulted in a runway excursion and discuss the options for detecting and mitigating the conditions for these “normal accidents” before the accident occurs.",1
A Contrail Inventory of US Airspace (2015),"Denis Avila, Lance Sherry, Terrence Thompson",2019/4/9,"Conference 2019 Integrated Communications, Navigation and Surveillance Conference (ICNS)","High thin clouds are generated by aircraft when hot exhaust gases from the jet engines mix with cold, humid air. These anthropogenic (human made) clouds, known as condensation trails or ""contrails,"" provide a net global warming effect. Although they block approximately 23% of the incoming shortwave radiation, they also reflect back to Earth approximately 33% of outgoing longwave radiation. Although the contrails generate only 2% of total anthropogenic radiative forcing they affect global warming immediately (unlike CO2 that affects global warning in 20-40 years). In this way contrails could be used to reduce global warming now to buy-time for CO2 mitigation initiatives to take effect. For this reason it is necessary to inventory contrails in the National Airspace System (NAS).This paper provides an inventory of contrails for the U.S. NAS for 2015. The analysis is based on publicly available weather data, flight …",1
Design of Ice Super Saturated Region (ISSR) visualization tool for contrail planning,"Denis Avila, Lance Sherry, Terrence Thompson",2018/4/10,"Conference 2018 Integrated Communications, Navigation, Surveillance Conference (ICNS)","Hot exhaust from jet airliners generate condensation trails when the appropriate atmospheric conditions exist. These high altitude “clouds” reflect 23% of incoming shortwave radiation back into space, but also reflect 33% of outgoing longwave radiation back to Earth. In this way, anthropogenic (i.e. human made) contrails have a net warming effect. Under the auspices of future government regulations, airlines could earn traffic flow management slot prioritization credits for flying flight plans that lay persistent contrails in the morning (to block incoming shortwave radiation) and avoid laying persistent contrails in the evening (to allow longwave radiation to escape). This paper describes a method for processing publicly available weather forecast data to identify the location of Ice Super Saturated Regions where persistent contrails will form. The ISSRs statistics and a 3-D visualization of the ISSR over the CONUS are …",1
Design of a Control Law for an Autonomous Approach and Landing Spacing System,"Lance Sherry, John Shortle, Oleksandra Snisarevska",2018,"Book 2018 Aviation Technology, Integration, and Operations Conference","One of the bottlenecks in air traffic flow is the final approach segment and the runway. Flights are at their lowest speed for the approach and landing phase, and must be sequenced in a flow in close proximity to each other to maximize use of the runway.",1
A comparison of two takeoff and climb out flap retraction standard operating procedures,"Houda Kerkoub Kourdali, Lance Sherry",2016/4/19,Conference 2016 Integrated Communications Navigation and Surveillance (ICNS),"Takeoff and climb out flap retraction is a procedure that is conducted following takeoff to retract the flaps and slats from a takeoff configuration to a clean-up-and-away configuration. During this period the aircraft accelerates from the takeoff V2 speed to 250 knots and generally includes a thrust reduction from the takeoff thrust setting to the climb thrust setting. Timing of the flap retraction is critical to avoid overspeed or underspeed. Also, due to the vicinity of terrain and traffic, the aircraft performance and airspace must be carefully monitored while staying responsive to Air Traffic Control voice communication. As a result the design and certification of these procedures must resolve multiple conflicting objectives. This paper describes a formal analysis of alternate takeoff flap retraction procedures for the BAE 146 (Avro) aircraft. One procedure requires a “callout” by the Pilot Flying (PF) for each stage of flap retraction. The …",1
A Comparison of Two Takeoff Flap Retraction Standard Operating Procedures,"Houda Kerkoub Kourdali, Lance Sherry",2016,"Journal Integrated Communications Navigation and Surveillance (ICNS), 2016, Herndon, VA, USA","Takeoff Flap Retraction is a procedure that is conducted following takeoff to retract the flaps and slats from a takeoff configuration to a clean-up-and-away configuration. During this period the aircraft accelerates from the takeoff V2 speed to 250 knots and generally includes a maximum thrust reduction from the takeoff thrust setting to the climb thrust setting. Timing of the flap retraction is critical to avoid over speed or under speed. Also, due to the vicinity of terrain and traffic, the vehicle performance and airspace must be carefully monitored all the while staying responsive to Air Traffic Control voice communication. As a result the design and certification of these procedures must resolve multiple conflicting objectives.",1
Flight rescheduling decisions for minimizing passenger trip delays,"Susan Farley, Alexander Brodsky, Lance Sherry",2014/1/1,Journal Intelligent Decision Technologies,"It has been the practice of the majority of airlines to reschedule passengers and flights so as to minimize flight delay. Some airlines are now starting to look at the problem of rescheduling from the perspective of the passenger and are trying to minimize the impact of missed and cancelled connecting flights on the consumer. In this paper we propose the algorithm Basic Reduction Yare Approach for fliGHts,(BRYAGH) for minimizing airline passenger trip delay. Though BRYAGH is a first step in developing an algorithm for decreasing passenger trip delay, we demonstrate improvement in passenger delay.",1
A Micro-Economic Model of Airline Choice of Airfare and Aircraft Size in the Presence of Changing Energy Costs,"Lance Sherry, George Donohue",2013,"Book 2013 Aviation Technology, Integration, and Operations Conference","INCE deregulation of the US domestic airline marketplace in 1978, the airline firms directly determine the structure of the airline transportation network: the markets served, the frequency of service, the airfare, and the aircraft size (ie number of seats). These decisions directly affect regional and national commerce, and determine the degree of equity in geographic access (eg service to rural communities) and the degree of equity in economic access (eg access across the socio-economic spectrum) provided by the transportation system. Understanding the dynamics of the network structure is critical to decision-making related to transportation policies, climate change and environmental policies, aircraft fleet size manufacturing, airline fleet planning, and aeronautics research. As shown in Figure 1, in the first decade after deregulation the network increased faster than the growth in Gross Domestic Product (GDP). In the …",1
