titles,authors,date,source,descriptions,citations
"Crumpled graphene photodetector with enhanced, strain‐tunable, and wavelength‐selective photoresponsivity","Pilgyu Kang, Michael Cai Wang, Peter M Knapp, SungWoo Nam",2016/6,Journal Advanced Materials,"A stretchable photodetector with enhanced, strain-tunable photoresponsivity is developed based on crumpled graphene by engineering 2D graphene into 3D structures. This crumpled graphene photodetector demonstrates≈ 400% enhanced photoresponsivity led by an order-of-magnitude enhanced extinction of graphene and 100% modulation in photoresponsivity with 200% applied strain. Finally, strain-tunable, wavelength-selective photodetection is shown by integrated colloidal photonic crystals–crumpled graphene photodetector devices.",178
"Mechanically self-assembled, three-dimensional graphene–gold hybrid nanostructures for advanced nanoplasmonic sensors","Juyoung Leem, Michael Cai Wang, Pilgyu Kang, SungWoo Nam",2015/11/11,Journal Nano letters,"Hybrid structures of graphene and metal nanoparticles (NPs) have been actively investigated as higher quality surface enhanced Raman spectroscopy (SERS) substrates. Compared with SERS substrates, which only contain metal NPs, the additional graphene layer provides structural, chemical, and optical advantages. However, the two-dimensional (2D) nature of graphene limits the fabrication of the hybrid structure of graphene and NPs to 2D. Introducing three-dimensionality to the hybrid structure would allow higher detection sensitivity of target analytes by utilizing the three-dimensional (3D) focal volume. Here, we report a mechanical self-assembly strategy to enable a new class of 3D crumpled graphene–gold (Au) NPs hybrid nanoplasmonic structures for SERS applications. We achieve a 3D crumpled graphene–Au NPs hybrid structure by the delamination and buckling of graphene on a thermally activated …",151
"Heterogeneous, three-dimensional texturing of graphene","Michael Cai Wang, SungGyu Chun, Ryan Steven Han, Ali Ashraf, Pilgyu Kang, SungWoo Nam",2015/3/11,Journal Nano letters,"We report a single-step strategy to achieve heterogeneous, three-dimensional (3D) texturing of graphene and graphite by using a thermally activated shape-memory polymer substrate. Uniform arrays of graphene crumples can be created on the centimeter scale by controlling simple thermal processing parameters without compromising the electrical properties of graphene. In addition, we show the capability to selectively pattern crumples from otherwise flat graphene and graphene/graphite in a localized manner, which has not been previously achievable using other methods. Finally, we demonstrate 3D crumpled graphene field-effect transistor arrays in a solution-gated configuration. The presented approach has the capability to conform onto arbitrary 3D surfaces, a necessary prerequisite for adaptive electronics, and will enable facile large-scale topography engineering of not only graphene but also other thin …",100
A stretchable crumpled graphene photodetector with plasmonically enhanced photoresponsivity,"Minsu Kim, Pilgyu Kang, Juyoung Leem, SungWoo Nam",2017,Journal Nanoscale,"Graphene has been widely explored for flexible, high-performance photodetectors due to its exceptional mechanical strength, broadband absorption, and high carrier mobility. However, the low stretchability and limited photoabsorption of graphene have restricted its applications in flexible and highly sensitive photodetection systems. Various hybrid systems based on photonic or plasmonic nanostructures have been introduced to improve the limited photoresponsivity of graphene photodetectors. In most cases, the hybrid systems succeeded in the enhancement of photoresponsivity, but showed limited mechanical stretchability. Here, we demonstrate a stretchable photodetector based on a crumpled graphene–gold nanoparticle (AuNP) hybrid structure with ∼1200% enhanced photoresponsivity, compared to a conventional flat graphene-only photodetector, and exceptional mechanical stretchability up to a 200 …",78
High resolution reversible color images on photonic crystal substrates,"Pilgyu Kang, Samuel O Ogunbo, David Erickson",2011/8/16,Journal Langmuir,"When light is incident on a crystalline structure with appropriate periodicity, some colors will be preferentially reflected (Joannopoulos, J. D.; Meade, R. D.; Winn, J. N. Photonic crystals : molding the flow of light; Princeton University Press: Princeton, NJ, 1995; p ix, 137 pp). These photonic crystals and the structural color they generate represent an interesting method for creating reflective displays and drawing devices, since they can achieve a continuous color response and do not require back lighting (Joannopoulos, J. D.; Villeneuve, P. R.; Fan, S. H. Photonic crystals: Putting a new twist on light. Nature1997, 386, 143–149; Graham-Rowe, D. Tunable structural colour. Nat. Photonics2009, 3, 551–553.; Arsenault, A. C.; Puzzo, D. P.; Manners, I.; Ozin, G. A. Photonic-crystal full-colour displays. Nat. Photonics2007, 1, 468–472; Walish, J. J.; Kang, Y.; Mickiewicz, R. A.; Thomas, E. L. Bioinspired Electrochemically …",73
Mechanically reconfigurable architectured graphene for tunable plasmonic resonances,"Pilgyu Kang, Kyoung-Ho Kim, Hong-Gyu Park, SungWoo Nam",2018/6/13,Journal Light: Science & Applications,"Graphene nanostructures with complex geometries have been widely explored for plasmonic applications, as their plasmonic resonances exhibit high spatial confinement and gate tunability. However, edge effects in graphene and the narrow range over which plasmonic resonances can be tuned have limited the use of graphene in optical and optoelectronic applications. Here we present a novel approach to achieve mechanically reconfigurable and strongly resonant plasmonic structures based on crumpled graphene. Our calculations show that mechanical reconfiguration of crumpled graphene structures enables broad spectral tunability for plasmonic resonances from mid- to near-infrared, acting as a new tuning knob combined with conventional electrostatic gating. Furthermore, a continuous sheet of crumpled graphene shows strong confinement of plasmons, with a high near-field intensity enhancement of ~1 …",57
Bioelectronics with two-dimensional materials,"Pilgyu Kang, Michael Cai Wang, SungWoo Nam",2016/8/1,Source Microelectronic Engineering,"In this article, we review the emerging field of bioelectronics with two-dimensional (2D) materials. Recently, 2D materials including graphene, transition metal dichalcogenides (TMDs), and other elementary 2D crystals, have emerged as functional materials in bioelectronic applications benefitting from their superior electrical, optical, and mechanical properties compared to conventional bulk semiconductor and metallic materials. The 2D dimensional materials enable advanced bioelectronics by allowing easy integration due to their atomic thinness, biocompatibility, mechanical flexibility and conformity. Electronics with 2D materials have thus far enabled various applications in chemical, biochemical and neurobiological sensing. Here we review bioelectronics with a variety of 2D materials including graphene, a popular material in the recent decade, as well as other emerging 2D materials such as TMDs including …",54
Rapid stencil mask fabrication enabled one-step polymer-free graphene patterning and direct transfer for flexible graphene devices,"Keong Yong, Ali Ashraf, Pilgyu Kang, SungWoo Nam",2016/4/27,Journal Scientific reports,"We report a one-step polymer-free approach to patterning graphene using a stencil mask and oxygen plasma reactive-ion etching, with a subsequent polymer-free direct transfer for flexible graphene devices. Our stencil mask is fabricated via a subtractive, laser cutting manufacturing technique, followed by lamination of stencil mask onto graphene grown on Cu foil for patterning. Subsequently, micro-sized graphene features of various shapes are patterned via reactive-ion etching. The integrity of our graphene after patterning is confirmed by Raman spectroscopy. We further demonstrate the rapid prototyping capability of a stretchable, crumpled graphene strain sensor and patterned graphene condensation channels for potential applications in sensing and heat transfer, respectively. We further demonstrate that the polymer-free approach for both patterning and transfer to flexible substrates allows the realization of …",51
Colloidal photonic crystal strain sensor integrated with deformable graphene phototransducer,"Peter Snapp, Pilgyu Kang, Juyoung Leem, SungWoo Nam",2019/8,Journal Advanced Functional Materials,"Flexible, architectured, photonic nanostructures such as colloidal photonic crystals (CPCs) can serve as colorimetric strain sensors, where external applied strain leads to a noticeable color change. However, CPCs' response to strain is difficult to quantify without the use of optical spectroscopy. Integration of flexible electrical readout of CPCs' color change is a challenge due to a lack of flexible/stretchable electrical transducers. This work details a colorimetric strain sensor with optoelectrical quantification based on an integrated system of CPCs over a crumpled graphene phototransducer, which optoelectrically quantifies CPCs, response to strain. The hybrid system enables direct visual perception of strain, while strain quantification via electrical measurement of the hybrid system outperforms that of crumpled graphene strain sensors by more than 100 times. The unique combination of a photonic sensing element …",46
Laser-induced photothermal generation of flexible and salt-resistant monolithic bilayer membranes for efficient solar desalination,"Minsu Kim, Kwansoo Yang, Yong Seok Kim, Jong Chan Won, Pilgyu Kang, Yun Ho Kim, Byoung Gak Kim",2020/8/30,Journal Carbon,"Harvesting solar energy and generating steam through solar thermal energy are viable approaches with diverse applications such as power generation, desalination, and water purification. Particularly, for efficient and stable solar desalination, hierarchically porous materials are desired to enable the required multiple functionalities. However, high thermal/chemical energy required and time consumed remain roadblocks. In this study, a facile, fast, and scalable laser-induced photothermal method to achieve flexible monolithic bilayer sheets (MBS) of hierarchically porous graphitic carbon (HPGC) and polymeric foam for use in salt-resistant and flexible solar steam generators is reported. The MBS-based self-floating solar steam generator shows outstanding solar desalination performance with a solar thermal efficiency of 83.2% (1-sun) and a high salt-rejection ratio (99.9%). Efficient solar thermal energy …",43
Mechanical instability driven self-assembly and architecturing of 2D materials,"Michael Cai Wang, Juyoung Leem, Pilgyu Kang, Jonghyun Choi, Peter Knapp, Keong Yong, SungWoo Nam",2017/3/17,Source 2D Materials,"Two-dimensional (2D) materials have been well studied for their diverse and impressive properties and superlative mechanical strength. Their atomic thinness and weak van der Waals interaction, while fascinating and unique, dictate their tendency to exhibit out of plane morphologies such as bending, buckling, folding, rippling, scrolling, and wrinkling, etc. In this review, we discuss the mechanisms behind these instability driven morphologies and the resultant phenomena that arise. We then survey methods to manipulate them especially in a scalable manner, and elucidate some interesting applications uniquely enabled by these structures. Contrary to conventional wisdom, the deterministic control of these features has great implications for the local and overall material properties due to heterogeneous distribution of stresses and strains. The introduction of deformable and shape memory substrates especially …",39
Nanophotonic detection of freely interacting molecules on a single influenza virus,"Pilgyu Kang, Perry Schein, Xavier Serey, Dakota O’Dell, David Erickson",2015/7/10,Journal Scientific Reports,"Biomolecular interactions, such as antibody-antigen binding, are fundamental to many biological processes. At present, most techniques for analyzing these interactions require immobilizing one or both of the interacting molecules on an assay plate or a sensor surface. This is convenient experimentally but can constrain the natural binding affinity and capacity of the molecules, resulting in data that can deviate from the natural free-solution behavior. Here we demonstrate a label-free method for analyzing free-solution interactions between a single influenza virus and specific antibodies at the single particle level using near-field optical trapping and light-scattering techniques. We determine the number of specific antibodies binding to an optically trapped influenza virus by analyzing the change of the Brownian fluctuations of the virus. We develop an analytical model that determines the increased size of the virus …",39
Angular orientation of nanorods using nanophotonic tweezers,"Pilgyu Kang, Xavier Serey, Yih-Fan Chen, David Erickson",2012/12/12,Journal Nano letters,"Near-field optical techniques have enabled the trapping, transport, and handling of nanoscopic materials much smaller than what can be manipulated with traditional optical tweezers. Here we extend the scope of what is possible by demonstrating angular orientation and rotational control of both biological and nonbiological nanoscale rods using photonic crystal nanotweezers. In our experiments, single microtubules (diameter 25 nm, length 8 μm) and multiwalled carbon nanotubes (outer diameter 110–170 nm, length 5 μm) are rotated by the optical torque resulting from their interaction with the evanescent field emanating from these devices. An angular trap stiffness of κ = 92.8 pN·nm/rad2·mW is demonstrated for the microtubules, and a torsional spring constant of 22.8 pN·nm/rad2·mW is measured for the nanotubes. We expect that this new capability will facilitate the development of high precision nanoassembly …",38
Nanophotonic force microscopy: characterizing particle–surface interactions using near-field photonics,"Perry Schein, Pilgyu Kang, Dakota O’Dell, David Erickson",2015/2/11,Journal Nano letters,"Direct measurements of particle–surface interactions are important for characterizing the stability and behavior of colloidal and nanoparticle suspensions. Current techniques are limited in their ability to measure pico-Newton scale interaction forces on submicrometer particles due to signal detection limits and thermal noise. Here we present a new technique for making measurements in this regime, which we refer to as nanophotonic force microscopy. Using a photonic crystal resonator, we generate a strongly localized region of exponentially decaying, near-field light that allows us to confine small particles close to a surface. From the statistical distribution of the light intensity scattered by the particle we are able to map out the potential well of the trap and directly quantify the repulsive force between the nanoparticle and the surface. As shown in this Letter, our technique is not limited by thermal noise, and therefore …",36
Strain-resilient electrical functionality in thin-film metal electrodes using two-dimensional interlayers,"Chullhee Cho, Pilgyu Kang, Amir Taqieddin, Yuhang Jing, Keong Yong, Jin Myung Kim, Md Farhadul Haque, Narayana R Aluru, SungWoo Nam",2021/2,Journal Nature electronics,"Flexible electrodes that allow electrical conductance to be maintained during mechanical deformation are required for the development of wearable electronics. However, flexible electrodes based on metal thin films on elastomeric substrates can suffer from complete and unexpected electrical disconnection after the onset of mechanical fracture across the metal. Here we show that the strain-resilient electrical performance of thin-film metal electrodes under multimodal deformation can be enhanced by using a two-dimensional interlayer. Insertion of atomically thin interlayers—graphene, molybdenum disulfide or hexagonal boron nitride—induces continuous in-plane crack deflection in thin-film metal electrodes. This leads to unique electrical characteristics (termed electrical ductility) in which electrical resistance gradually increases with strain, creating extended regions of stable resistance. Our two-dimensional …",35
Laser scribing of fluorinated polyimide films to generate microporous structures for high-performance micro-supercapacitor electrodes,"Minsu Kim, Min Guk Gu, Heeyoung Jeong, Eunseok Song, Jun Woo Jeon, Kang-Moo Huh, Pilgyu Kang, Sung-Kon Kim, Byoung Gak Kim",2020/11/25,Journal ACS Applied Energy Materials,"Laser-induced graphene (LIG) typically exhibits a mesostructure with a small specific surface area, which is detrimental to the electrochemical performance of micro-supercapacitors (MSCs). Herein, 3D nanostructured LIGs patterned on fluorinated polyimides (fPIs) via a laser photothermal method are reported. During laser-induced graphitization, a highly microporous structure in the LIG develops. Consequently, the patterned LIG (LIG-fPI) exhibits a very large specific surface area (1126.0 m2 g–1), thereby enhancing its electrochemical performance. Specifically, in an H2SO4 aqueous electrolyte, the micropatterned electrode exhibits an exceptional areal capacitance of 110 mF cm–2 (determined by cyclic voltammetry), which is 27 times higher than that of a LIG based on commercial polyimides and at least 7 times higher than that of current state-of-the-art MSCs. Furthermore, mechanically stable and flexible LIG-fPI …",26
Uniaxially crumpled graphene as a platform for guided myotube formation,"Junghoon Kim, Juyoung Leem, Hong Nam Kim, Pilgyu Kang, Jonghyun Choi, Md Farhadul Haque, Daeshik Kang, SungWoo Nam",2019/11/4,Journal Microsystems & nanoengineering,"Graphene, owing to its inherent chemical inertness, biocompatibility, and mechanical flexibility, has great potential in guiding cell behaviors such as adhesion and differentiation. However, due to the two-dimensional (2D) nature of graphene, the microfabrication of graphene into micro/nanoscale patterns has been widely adopted for guiding cellular assembly. In this study, we report crumpled graphene, i.e., monolithically defined graphene with a nanoscale wavy surface texture, as a tissue engineering platform that can efficiently promote aligned C2C12 mouse myoblast cell differentiation. We imparted out-of-plane, nanoscale crumpled morphologies to flat graphene via compressive strain-induced deformation. When C2C12 mouse myoblast cells were seeded on the uniaxially crumpled graphene, not only were the alignment and elongation promoted at a single-cell level but also the differentiation and maturation of …",26
"Photodetectors: Crumpled Graphene Photodetector with Enhanced, Strain‐Tunable, and Wavelength‐Selective Photoresponsivity (Adv. Mater. 23/2016)","Pilgyu Kang, Michael Cai Wang, Peter M Knapp, SungWoo Nam",2016/6,Journal Advanced Materials,"On page 4639, SW Nam and co-workers present a stretchable photodetector with enhanced, strain-tunable photoresponsivity based on engineering 2D graphene into crumpled 3D structures. The crumpled graphene photodetector demonstrates ca. 400% enhanced photo-responsivity, led by an order-of-magnitude enhanced optical extinction over flat graphene. The highly flexible system has future potential for integrated biomedical optical sensing systems.",13
Photothermochemical nanoassembly of 3D porous graphene and palladium nanoparticles for high-performance hydrogen detection,"Minsu Kim, Seung Min Lee, Jun Woo Jeon, Shirin Movaghgharnezhad, Heeyoung Jeong, Farbod Moghaddam, Daniel Mitchell, Pilgyu Kang, Byoung Gak Kim",2021/10/1,Journal ACS Applied Materials & Interfaces,"Hybrid materials comprising graphene and palladium nanoparticles (PdNPs) are desirable for high-performance hydrogen detection because of the high specific surface area, electron mobility, and flexibility of graphene and the high electrochemical responsivity and reversibility of PdNPs. However, obtaining hybrid materials is energy-intensive and time-consuming. Here, a facile and rapid laser photothermochemical single-step processing method to synchronously produce a nanoassembly of three-dimensional porous graphene and PdNPs from polymer films is reported. Polymers with intrinsic microporosity show high solubility in volatile solvents and miscibility with inorganic materials, allowing the fabrication of homogeneous polymer films containing Pd ligands. The films are photothermally processed using a laser to generate a nanohybrid via photoinduced thermal and chemical processes. The nanohybrid …",2
Mechanically robust flexible hybrid electrode,"SungWoo Nam, Pilgyu Kang, Chullhee Cho",2019/9/26,Patent office US,"A mechanically robust flexible hybrid electrode comprises a polymeric substrate, one or more monolayers of a two-dimensional (2D) material on the polymeric substrate, and an electrically conductive film on the 2D material. The mechanically robust flexible hybrid electrode may exhibit a bending strain to failure of at least about 12%. A method of making a flexible hybrid electrode may comprise transferring a monolayer comprising a 2D material to a polymeric substrate. After transferring one or more of the monolayers to the polymeric substrate, an electrically conductive film may be formed on the one or more monolayers, thereby forming a mechanically robust flexible hybrid electrode.",2
Localized Opto-Mechanical Control of Protein Adsorption onto Carbon Nanotubes,"Dakota O'Dell, Xavier Serey, Pilgyu Kang, David Erickson",2014/10/21,Journal Scientific Reports,"Chemical reactions can be described by an energy diagram along a reaction coordinate in which an activation barrier limits the rate at which reactants can be transformed into products. This reaction impedance can be overcome by reducing the magnitude of the barrier through the use of catalysis, increasing the thermal energy of the system, or through macroscopic mechanical processes. Here, we demonstrate direct molecular-scale control of a reaction through the precise application of opto-mechanical work. The method uses optical gradient forces generated in the evanescent field surrounding hybrid photonic-plasmonic structures to drive an otherwise unlikely adsorption reaction between proteins and carbon nanotubes. The adsorption of immunoglobulins on carbon nanotubes is used as a model reaction and investigated with an extended DLVO theory. The technique is also used to force a Förster resonance …",1
Hybrid Sensors: Colloidal Photonic Crystal Strain Sensor Integrated with Deformable Graphene Phototransducer (Adv. Funct. Mater. 33/2019),"Peter Snapp, Pilgyu Kang, Juyoung Leem, SungWoo Nam",2019/8,Journal Advanced Functional Materials,"In article number 1902216, SungWoo Nam and co-workers report a colorimetric strain sensor with electrical quantification based on an integrated system of colloidal photonic crystals and a crumpled graphene photo-transducer. The developed sensor enables direct visual readout and a 100-fold improved strain sensing over plain crumpled graphene strain sensors in applications including body motion monitoring.",
Methods and apparatus for monitoring interactions between particles and molecules using nanophotonic trapping,"David Erickson, Pilgyu Kang",2019/3/26,Patent office US,"A method for characterizing an interaction between a first particle and a second particle is provided. The method includes the steps of:(i) providing an optical trap system including a photonics-based trap, a light source, and a camera;(ii) optically trapping, using the photonics-based trap, the first particle;(iii) obtaining a first measurement of a trap stiffness of the photonics-based trap;(iv) introducing the second particle to the optically trapped particle;(v) incubating the first and second particles under conditions suitable for an interaction between the first and second particles;(vi) obtaining a second measurement of the trap stiffness of the photonics-based trap after the incubation; and (vii) determining, using the first measurement of trap stiffness and the second measurement of trap stiffness, a property of the interaction between the first particle and the second particle.",
Crumple nanostructuring of atomically thin 2D materials for flexible optoelectronic devices and plasmonic metamaterials,"Pilgyu Kang, Michael Cai Wang, Peter M Knapp, Kyoung-Ho Kim, Hong-Gyu Park, SungWoo Nam",2019/2/27,Conference 2D Photonic Materials and Devices II,"Atomically-thin two-dimensional (2D) materials including graphene and transition metal dichalcogenide (TMD) atomic layers (e.g. Molybdenum disulfide, MoS2) are attractive materials for optoelectronic and plasmonic applications and devices due to their exceptional flexural strength led by atomic thickness, broadband optical absorption, and high carrier mobility. Here, we show that crumple nanostructuring of 2D materials allows the enhancement of the outstanding material properties and furthermore enables new, multi-functionalities in mechanical, optoelectronic and plasmonic properties of atomically-thin 2D materials. Crumple nanostructuring of atomically thin materials, graphene and MoS2 atomic layers are used to achieve flexible/stretchable, strain-tunable photodetector devices and plasmonic metamaterials with mechanical reconfigurability. Crumpling of graphene enhances optical absorption by more than …",
