titles,authors,date,source,descriptions,citations
Crumple nanostructured graphene for mechanically reconfigurable plasmonic resonances,"Pilgyu Kang, Kyoung-Ho Kim, Hong-Gyu Park, SungWoo Nam",2018/9/16,Conference Laser Science,"Graphene has been widely used for optical and optoelectronic applications due to the capability of achieving electrostatically tunable plasmonic resonances. However, patterning of graphene in complex geometries and a narrow tunable range of plasmonic resonances have been a challenge for practical use of graphene in the applications. Here, we present a novel approach to achieve mechanically reconfigurable, strong plasmonic resonances based on crumple-nanostructured graphene. We show that the mechanical reconfiguration of crumple nanostructured graphene enables broad spectral tunability of plasmonic resonances from mid-to near-infrared, introducing a new tuning method combined with conventional electrostatic tuning. Our results demonstrate that crumple nanostructured graphene provides an innovative platform to graphene-based plasmonics for strong, broadband tunable plasmonic resonances.",
Optofluidics and the next generation of health-care engineering,"Li Jiang, Pilgyu Kang, David Erickson",2014/5/1,Journal LASER FOCUS WORLD,"Instruments that can do medical diagnoses at home or other places far from hospitals are the wave of the future. Optofluidic devices, some of which can be used with smartphones, have a part to play in this future.",
Nanophotonic technologies for manipulating biomolecules and investigating molecular interactions,Pilgyu Kang,2014,Institution Cornell University,"This dissertation aims to develop nanophotonic technologies by integrating photonic-crystal-based nanostructures with microfluidic techniques. Firstly, a selfassembled photonic nanostructure is developed to exploit that a range of colors on incident light will reflect on a crystalline structure with appropriate periodicity.",
Near-Field Angular Orientation of Biological Materials,"Pilgyu Kang, Xavier Serey, Yih-Fan Chen, Dakota O'Dell, David Erickson",2013/1/29,Journal Biophysical Journal,"Near-field optical techniques have enabled trapping, transport, and handling of nanoscale materials. Despite its importance, angular orientation has not been addressed by nano-optics. The angular orientation control of trapped objects provides an additional restriction on their rotational movement leaving them with one degree of freedom. This capability is well established for conventional optical tweezers, but has not been addressed in the near-field trapping literature. Near-field optical traps are of particular interest because they allow for the trapping of smaller materials than far-field optics. Additionally, in biophysical studies the orientation control of elongated objects is significant since numerous biomolecules such as DNA, viruses, and bacteria can take rod-like shapes.",
Near-Field Optical Immobilization of Antibodies for Novel Fluorescent Bioassays,"Xavier Serey, Pilgyu Kang, Dakota O'Dell, David Erickson",2013/1/29,Journal Biophysical Journal,"Tsz-Leung To, Xiaokun Shu. University of California San Francisco, San Francisco, CA, USA. Forster resonance energy transfer (FRET) has been widely used for the detection of protein-protein interactions but its detection distance is< 10 nm. To overcome the short detection range of FRET, we have developed a new concept for molecular imaging: Singlet oxygen Triplet Energy Transfer (STET). We have engineered genetically encoded singlet oxygen generator (SOG) and singlet oxygen sensor (SOS). The proximity of protein X to protein Y can be assayed by fusing X to SOS and Y to SOG. Upon illumination, SOG is excited and converts molecular oxygen into singlet oxygen through triplet energy transfer. The singlet oxygen transfers to SOS through diffusion and chemically reacts with the sensor. The closer X and Y are, the faster SOS will respond to illumination of SOG. STET has a distance range (~ 50-100 nm) an …",
Label-free optofluidic biomolecular sensing using a photonic crystal nanotweezer: The wiggle assay,"Pilgyu Kang, Yih Fan Chen, David Erickson",2013,"Conference 17th International Conference on Miniaturized Systems for Chemistry and Life Sciences, MicroTAS 2013","Here we introduce a novel optofluidic biosensing method using a nanotweezer which allows a simple and rapid biological assay. Optical biosensing methods have provided necessities that biosensors needed such as high sensitivity and specificity with a price. The methodology we present rely on an optical trapping and an observation with epifluorescent microscopy. We utilize an optical trap and observe a change of the trap stiffness, which is sensitive to the change of the size of an optically trapped particle caused by the binding of label-free target biomolecules. We have demonstrated reliability and consistency of our sensing method with experimental results.",
Overcoming the temperature increase hurdle in photonic crystal molecular tweezers,"Xavier Serey, Yih-Fan Chen, Romy Fain, Pilgyu Kang, David Erickson",2012/5/6,Conference CLEO: Science and Innovations,We study the thermal effects on flow and transport of species near 1550nm silicon photonic crystal nano-tweezers. With a silicon nitride based 1064nm alternative we reduce heating to 0.3 K temperature increase and demonstrate molecular tweezing.,
Forced Spreading and Coalescence of Viscous Drops,"Shelley Anna, Pilgyu Kang, Shahab Shojaei-Zadeh, Christine Appleby",2009/11,Journal APS Division of Fluid Dynamics Meeting Abstracts,"This study investigates the dynamics of spreading and coalescence of sessile droplets on a surface, a process important in applications such as inkjet printing, spray coating, and flooding of fuel cells. We use a simple microfluidic device to control the spreading and merging processes. Droplet shape, diameter and maximum height are monitored as functions of time. We compare the dynamics with existing scaling models modified to incorporate time dependent volume, and we extend these models to describe the scaling behavior of the liquid bridge growing between merging droplets on a surface. The experiments agree well with the expected scaling incorporating capillary, gravity, and viscous forces.",
Scaling Law for Driven Spreading and Coalescence of Sessile Droplets,"Pilgyu Kang, Shahab Shojaei-Zadeh, Christine Appleby, Shelley Anna",2009/3,Journal APS March Meeting Abstracts,"This study investigates the dynamics of spreading and coalescence of droplets on a surface, a process important in applications such as inkjet printing, spray coating, and flooding of fuel cells. We use a simple microfluidic device to control the spreading and merging processes. Droplet diameter and maximum height are monitored as functions of time. We compare the dynamics with existing scaling models modified to incorporate time dependent volume, and we extend the model to describe the scaling behavior of the liquid bridge growing between merging droplets on a surface. The experiments agree well with the expected scaling.",
Highly Sensitive Photodetector Based on Laser-Generated Graphene with 3d Heterogeneous Multiscale Porous Structures,"Pilgyu Kang, Shirin Movaghgharnezhad, Minsu Kim, Seung Min Lee, Heeyoung Jeong, Hyojin Kim, Byoung Gak Kim",Available at SSRN 4374227,"Description Graphene holds great promise in optoelectronics because of its high broadband light absorption across a wide range of wavelengths. Despite low optical absorption, various techniques have been devised to address this challenge. This study presents a new highly sensitive, broadband photodetector based on three-dimensional (3D) porous graphene derived from fluorinated polyimide (fPI-3DPG). This material is produced via a laser photothermal process and features micro-and nanopore structures that increase the light absorbing area and support optically resonant structures. The resulting fPI-3DPG photodetectors display high photoresponsibility of 4.4 mA W 1 in the visible light range, an ultrahigh signal-to-noise ratio of~ 208, and a noise equivalent power of 0.54× 10− 11 W Hz− 1/2. These photodetectors are also mechanically durable, surviving 10,000 cycles of bending and twisting. The laser photothermal method used in this study enables fast, cost effective production of wearable and flexible optical sensors for imaging and spectroscopy applications, making this 3D graphene a promising functional material for sensing technologies.","Graphene holds great promise in optoelectronics because of its high broadband light absorption across a wide range of wavelengths. Despite low optical absorption, various techniques have been devised to address this challenge. This study presents a new highly sensitive, broadband photodetector based on three-dimensional (3D) porous graphene derived from fluorinated polyimide (fPI-3DPG). This material is produced via a laser photothermal process and features micro-and nanopore structures that increase the light absorbing area and support optically resonant structures. The resulting fPI-3DPG photodetectors display high photoresponsibility of 4.4 mA W 1 in the visible light range, an ultrahigh signal-to-noise ratio of~ 208, and a noise equivalent power of 0.54× 10− 11 W Hz− 1/2. These photodetectors are also mechanically durable, surviving 10,000 cycles of bending and twisting. The laser photothermal method used in this study enables fast, cost effective production of wearable and flexible optical sensors for imaging and spectroscopy applications, making this 3D graphene a promising functional material for sensing technologies.",
Scaling Law for Driven Coalescence of Droplets Spreading on a Substrate,"Pilgyu Kang, Shahab Shojaei-Zadeh, Christine Appleby, Shelley L Anna","We investigate the dynamics of spreading and merging of droplets on a surface both theoretically and experimentally. We developed the Tanner’s law for ‘driven’spreading of a droplet supplied at a constant inflow rate. We also developed a new model that predicts the time-dependent variation of the meniscus bridge diameter and height dimensions during coalescence of two droplets supplied at a constant-inflow-rate using a modified Tanner’s law argument for a spreading droplet filling at a constant flow rate. To demonstrate that the scaling behavior of driven spreading and coalescence is consistent with the models, we presented the results on measurements of the diameter and height of the growing meniscus bridge between the droplets, comparing the measurements with theoretical predictions in this letter. The experimental results exhibited that the scaling behavior of driven spreading in both the capillary and gravity regime, and driven coalescence is consistent with the models we presented in the letter.","Scholar articles Scaling Law for Driven Coalescence of Droplets Spreading on a SubstrateP Kang, S Shojaei-Zadeh, C Appleby, SL AnnaRelated articles ","We investigate the dynamics of spreading and merging of droplets on a surface both theoretically and experimentally. We developed the Tanner’s law for ‘driven’spreading of a droplet supplied at a constant inflow rate. We also developed a new model that predicts the time-dependent variation of the meniscus bridge diameter and height dimensions during coalescence of two droplets supplied at a constant-inflow-rate using a modified Tanner’s law argument for a spreading droplet filling at a constant flow rate. To demonstrate that the scaling behavior of driven spreading and coalescence is consistent with the models, we presented the results on measurements of the diameter and height of the growing meniscus bridge between the droplets, comparing the measurements with theoretical predictions in this letter. The experimental results exhibited that the scaling behavior of driven spreading in both the capillary and gravity regime, and driven coalescence is consistent with the models we presented in the letter.",
